ob1=OBI(cluster=1244)
ob2=OBI(cluster=1244)
ob2.rs0.set master=ob1.rs0
ob1.reboot
ob2.reboot
ob1.mysql set global ob_read_consistency=4
ob1.create_client
create table t1(a int primary key,b int);
insert into t1 values(1,1),(2,2),(0,0),(-1,-1);
ob1.mysql update __all_cluster set cluster_flow_percent=0 where cluster_id=1
ob1.mysql update __all_cluster set cluster_flow_percent=100 where cluster_id=2
ob2.ups0.stop
ob2.ups1.stop
replace into t1 values(-2,-2),(3,3);
select * from t1;
a	b
-2	-2
-1	-1
0	0
1	1
2	2
3	3
ob2.ups1.start
ob2.ups0.start
ob1.switch_cluster ob2
insert into t1 values(-3,3);
delete from t1 where a=3;
select * from t1;
a	b
-3	3
-2	-2
-1	-1
0	0
1	1
2	2
