ob1=OBI(cluster=1244)
ob2=OBI(cluster=1244)
ob2.rs0.set master=ob1.rs0
ob1.reboot
ob2.reboot
ob1.prepare s
ob1.create_client
create table t1(c1 int primary key,c2 int);
insert into t1 values(1,1),(2,2),(3,3),(4,4);
select * from t1;
c1	c2
1	1
2	2
3	3
4	4
ob2.restart
ob1.switch_cluster ob2
create table t2(a int primary key,b int);
insert into t2 values(-1,-1),(-2,-2),(0,0);
select * from t2;
a	b
-2	-2
-1	-1
0	0
select * from t1;
c1	c2
1	1
2	2
3	3
4	4
ob1.restart
insert into t1 values(5,1),(6,2),(7,3),(8,4);
select * from t1;
c1	c2
1	1
2	2
3	3
4	4
5	1
6	2
7	3
8	4
drop table t2;
ob2.switch_cluster ob1
ob2.restart
delete from t1 where c1=2;
select * from t1;
c1	c2
1	1
3	3
4	4
5	1
6	2
7	3
8	4
drop table t1;
