ob1=OBI(cluster=1244)
ob2=OBI(cluster=1244)
ob2.rs0.set master=ob1.rs0
ob1.reboot
ob2.reboot
ob1.prepare m
ob1.create_client
create table t1(a int primary key, b varchar);
create table t2(a int primary key, b int);
insert into t1 values(1,'a'),(2,'b'),(3,'c');
insert into t2 values(1,1),(2,2),(3,3);
select * from t1;
a	b
1	a
2	b
3	c
select * from t2;
a	b
1	1
2	2
3	3
ob1.change_ups_master $a
ob1.$a.force_stop
ob1.$a.start
ob1.$b.force_stop
ob1.$b.start
create table t3(a int primary key,b int);
insert into t3 values(1,1),(2,2);
update t1 set b='d' where a='1';
select * from t1;
a	b
1	d
2	b
3	c
drop table t2;
ob1.change_ups_master $a
select * from t1;
a	b
1	d
2	b
3	c
select * from t3;
a	b
1	1
2	2
