ob1=OBI(cluster=1233,app_name=collect, schema_file=./collect.schema, local_sstable_dir=~/sstable);
ob1.cs2.set status=disable;
ob1.rs0.set extra_config=tablet_replicas_num=2,enable_balance=False;
ob1.reboot;
ob1.source include/merge.inc;
ob1.source include/migrate.inc;
ob1.create_client;
ob1.prepare;
ob1.start_check;
create table t1(a int primary key,b int);
create table t2(a int primary key,b int);
insert into t1 values(1,1),(2,2),(3,3),(4,4),(5,5);
select * from t1;
a	b
1	1
2	2
3	3
4	4
5	5
select * from t2;
a	b
ob1.$master.block_net $slave;
update t1 set b=-1 where a=10;
update t1 set b=-1 where a=9;
update t1 set b=-1 where a=8;
update t1 set b=-1 where a=7;
update t1 set b=-1 where a=6;
update t1 set b=-1 where a=5;
update t1 set b=-1 where a=4;
update t1 set b=-1 where a=3;
update t1 set b=-1 where a=2;
update t1 set b=-1 where a=1;
ob1.$master.clean_net $slave;
ob1.stop_check;
ob1.$master.stop;
select * from t1;
a	b
1	-1
2	-1
3	-1
4	-1
5	-1
ob1.$master.nstart;
ob1.rs0.block_net $master;
ob1.$master.block_net rs0;
ob1.rs0.clean_net $master;
ob1.$master.clean_net rs0;
rs select new master ups success
ob1.start_check;
drop table t2;
update t1 set b=10 where a=4;
select * from t1;
a	b
1	-1
2	-1
3	-1
4	10
5	-1
ob1.mysql alter system set tablet_replicas_num=3 server_type=rootserver;
ob1.cs2.set status=enable;
ob1.cs2.start;
ob1.cs0.block_net cs2;
ob1.cs1.block_net cs2;
ob1.cs0.clean_net cs2;
ob1.cs1.clean_net cs2;
ob1.check_cs_sstable 609;
ob1.major_freeze;
ob1.cs1.block_net $master;
ob1.cs1.clean_net $master;
ob1.check_cs_version 2;
ob1.ms0.block_net cs0;
ob1.ms1.block_net cs0;
ob1.ms2.block_net cs0;
ob1.ms0.clean_net cs0;
ob1.ms1.clean_net cs0;
ob1.ms2.clean_net cs0;
ob1.stop_check;
