ob1=OBI(cluster=1211);
ob1.reboot;
ob1.mysql set global ob_read_consistency=3;
ob1.mysql_p show variables like 'ob_read_consistency';
variable_name	value
ob_read_consistency	3
ob1.mysql_p select name,value from __all_sys_config_stat where name = 'read_master_master_ups_percent' or name = 'read_slave_master_ups_percent';
name	value
read_master_master_ups_percent	50
read_slave_master_ups_percent	50
ob1.$m_ups.status;
master
ob1.$s_ups.status;
sync
ob1.mysql drop table if exists t1;
ob1.mysql create table t1(c1 int primary key, c2 int);
ob1.connect conn1;
ob1.connect conn2;
case1 repeat read
set autocommit=0;
insert into t1 values(1,1);
select * from t1;
c1	c2
select * from t1;
c1	c2
select * from t1;
c1	c2
select * from t1;
c1	c2
select * from t1;
c1	c2
select * from t1;
c1	c2
select * from t1;
c1	c2
select * from t1;
c1	c2
select * from t1;
c1	c2
select * from t1;
c1	c2
select * from t1 where c1=1;
c1	c2
select * from t1 where c1=1;
c1	c2
select * from t1 where c1=1;
c1	c2
select * from t1 where c1=1;
c1	c2
select * from t1 where c1=1;
c1	c2
select * from t1 where c1=1;
c1	c2
select * from t1 where c1=1;
c1	c2
select * from t1 where c1=1;
c1	c2
select * from t1 where c1=1;
c1	c2
select * from t1 where c1=1;
c1	c2
select * from t1 where c1=2;
c1	c2
select * from t1 where c1=2;
c1	c2
select * from t1 where c1=2;
c1	c2
select * from t1 where c1=2;
c1	c2
select * from t1 where c1=2;
c1	c2
select * from t1 where c1=2;
c1	c2
select * from t1 where c1=2;
c1	c2
select * from t1 where c1=2;
c1	c2
select * from t1 where c1=2;
c1	c2
select * from t1 where c1=2;
c1	c2
insert into t1 values(2,2);
insert into t1 values(3,3);
replace into t1 values(4,4);
delete from t1 where c1=3;
update t1 set c2=0 where c1=4;
select * from t1;
c1	c2
2	2
4	0
select * from t1;
c1	c2
2	2
4	0
select * from t1;
c1	c2
2	2
4	0
select * from t1;
c1	c2
2	2
4	0
select * from t1;
c1	c2
2	2
4	0
select * from t1;
c1	c2
2	2
4	0
select * from t1;
c1	c2
2	2
4	0
select * from t1;
c1	c2
2	2
4	0
select * from t1;
c1	c2
2	2
4	0
select * from t1;
c1	c2
2	2
4	0
select * from t1 where c1=1;
c1	c2
select * from t1 where c1=1;
c1	c2
select * from t1 where c1=1;
c1	c2
select * from t1 where c1=1;
c1	c2
select * from t1 where c1=1;
c1	c2
select * from t1 where c1=1;
c1	c2
select * from t1 where c1=1;
c1	c2
select * from t1 where c1=1;
c1	c2
select * from t1 where c1=1;
c1	c2
select * from t1 where c1=1;
c1	c2
select * from t1 where c1=2;
c1	c2
2	2
select * from t1 where c1=2;
c1	c2
2	2
select * from t1 where c1=2;
c1	c2
2	2
select * from t1 where c1=2;
c1	c2
2	2
select * from t1 where c1=2;
c1	c2
2	2
select * from t1 where c1=2;
c1	c2
2	2
select * from t1 where c1=2;
c1	c2
2	2
select * from t1 where c1=2;
c1	c2
2	2
select * from t1 where c1=2;
c1	c2
2	2
select * from t1 where c1=2;
c1	c2
2	2
select * from t1 where c1=3;
c1	c2
select * from t1 where c1=3;
c1	c2
select * from t1 where c1=3;
c1	c2
select * from t1 where c1=3;
c1	c2
select * from t1 where c1=3;
c1	c2
select * from t1 where c1=3;
c1	c2
select * from t1 where c1=3;
c1	c2
select * from t1 where c1=3;
c1	c2
select * from t1 where c1=3;
c1	c2
select * from t1 where c1=3;
c1	c2
select * from t1 where c1=4;
c1	c2
4	0
select * from t1 where c1=4;
c1	c2
4	0
select * from t1 where c1=4;
c1	c2
4	0
select * from t1 where c1=4;
c1	c2
4	0
select * from t1 where c1=4;
c1	c2
4	0
select * from t1 where c1=4;
c1	c2
4	0
select * from t1 where c1=4;
c1	c2
4	0
select * from t1 where c1=4;
c1	c2
4	0
select * from t1 where c1=4;
c1	c2
4	0
select * from t1 where c1=4;
c1	c2
4	0
commit;
commit;
select * from t1;
c1	c2
1	1
2	2
4	0
select * from t1;
c1	c2
1	1
2	2
4	0
select * from t1;
c1	c2
1	1
2	2
4	0
select * from t1;
c1	c2
1	1
2	2
4	0
select * from t1;
c1	c2
1	1
2	2
4	0
select * from t1;
c1	c2
1	1
2	2
4	0
select * from t1;
c1	c2
1	1
2	2
4	0
select * from t1;
c1	c2
1	1
2	2
4	0
select * from t1;
c1	c2
1	1
2	2
4	0
select * from t1;
c1	c2
1	1
2	2
4	0
select * from t1 where c1=1;
c1	c2
1	1
select * from t1 where c1=1;
c1	c2
1	1
select * from t1 where c1=1;
c1	c2
1	1
select * from t1 where c1=1;
c1	c2
1	1
select * from t1 where c1=1;
c1	c2
1	1
select * from t1 where c1=1;
c1	c2
1	1
select * from t1 where c1=1;
c1	c2
1	1
select * from t1 where c1=1;
c1	c2
1	1
select * from t1 where c1=1;
c1	c2
1	1
select * from t1 where c1=1;
c1	c2
1	1
select * from t1 where c1=2;
c1	c2
2	2
select * from t1 where c1=2;
c1	c2
2	2
select * from t1 where c1=2;
c1	c2
2	2
select * from t1 where c1=2;
c1	c2
2	2
select * from t1 where c1=2;
c1	c2
2	2
select * from t1 where c1=2;
c1	c2
2	2
select * from t1 where c1=2;
c1	c2
2	2
select * from t1 where c1=2;
c1	c2
2	2
select * from t1 where c1=2;
c1	c2
2	2
select * from t1 where c1=2;
c1	c2
2	2
select * from t1 where c1=3;
c1	c2
select * from t1 where c1=3;
c1	c2
select * from t1 where c1=3;
c1	c2
select * from t1 where c1=3;
c1	c2
select * from t1 where c1=3;
c1	c2
select * from t1 where c1=3;
c1	c2
select * from t1 where c1=3;
c1	c2
select * from t1 where c1=3;
c1	c2
select * from t1 where c1=3;
c1	c2
select * from t1 where c1=3;
c1	c2
select * from t1 where c1=4;
c1	c2
4	0
select * from t1 where c1=4;
c1	c2
4	0
select * from t1 where c1=4;
c1	c2
4	0
select * from t1 where c1=4;
c1	c2
4	0
select * from t1 where c1=4;
c1	c2
4	0
select * from t1 where c1=4;
c1	c2
4	0
select * from t1 where c1=4;
c1	c2
4	0
select * from t1 where c1=4;
c1	c2
4	0
select * from t1 where c1=4;
c1	c2
4	0
select * from t1 where c1=4;
c1	c2
4	0
commit;
case 2 trx autom
set autocommit=0;
select * from t1 where c1=1;
c1	c2
1	1
update t1 set c2=0    where c1=1;
update t1 set c2=c2+1 where c1=1;
update t1 set c2=c2+1 where c1=1;
update t1 set c2=c2+1 where c1=1;
set autocommit=1;
select * from t1 where c1=1;
c1	c2
1	1
select * from t1 where c1=1;
c1	c2
1	1
select * from t1 where c1=1;
c1	c2
1	1
update t1 set c2=c2+1 where c1=1;
update t1 set c2=c2+1 where c1=1;
update t1 set c2=c2+1 where c1=1;
select * from t1 where c1=1;
c1	c2
1	1
select * from t1 where c1=1;
c1	c2
1	1
select * from t1 where c1=1;
c1	c2
1	1
commit;
select * from t1 where c1=1;
c1	c2
1	6
select * from t1 where c1=1;
c1	c2
1	6
select * from t1 where c1=1;
c1	c2
1	6
case 3 trx rollback
set autocommit=0;
update t1 set c2=c2-1 where c1=1;
update t1 set c2=c2-1 where c1=1;
update t1 set c2=c2-1 where c1=1;
set autocommit=1;
update t1 set c2=0 where c1=1;
ERROR HY000: Exclusive lock conflict 'int:1' for key 'PRIMARY'
select * from t1 where c1=1;
c1	c2
1	6
select * from t1 where c1=1;
c1	c2
1	6
select * from t1 where c1=1;
c1	c2
1	6
update t1 set c2=c2-1 where c1=1;
update t1 set c2=c2-1 where c1=1;
update t1 set c2=c2-1 where c1=1;
rollback;
select * from t1 where c1=1;
c1	c2
1	6
update t1 set c2=0 where c1=1;
select * from t1 where c1=1;
c1	c2
1	0
select * from t1 where c1=1;
c1	c2
1	0
case 4  some query in trx
replace into t1 values(1,1);
update t1 set c2=-1 where c1=1;
insert into t1 values(1,1);
ERROR 23000: Duplicate entry ' <3001.16>=int:1' for key 'PRIMARY'
insert into t1 values(10,10),(10,10);
ERROR 23000: Duplicate entry 'int:10' for key 'PRIMARY'
update t1 set c2=c2-1 where c1=1;
commit;
select * from t1 where c1=1;
c1	c2
1	-2
replace into t1 values(2,2);
update t1 set c2=-1 where c1=2;
delete from t1 where c1=20;
update t1 set c2=0 where c1=20;
update t1 set c2=c2-1 where c1=2;
commit;
select * from t1 where c1=2;
c1	c2
2	-2
select * from t1 where c1=20;
c1	c2
set autocommit=0;
replace into t1 values(4,4);
replace into t1 values(3,3);
update t1 set c2=-1 where c1=3;
replace into t1 values(4,4);
ERROR HY000: Exclusive lock conflict 'int:4' for key 'PRIMARY'
insert into t1 values(4,4);
ERROR HY000: Exclusive lock conflict 'int:4' for key 'PRIMARY'
update t1 set c2=c2-1 where c1=3;
commit;
commit;
set autocommit=1;
select * from t1;
c1	c2
1	-2
2	-2
3	-2
4	4
select * from t1 where c1=4;
c1	c2
4	4
select * from t1 where c1=3;
c1	c2
3	-2
case 5 trx idle timeout
set session ob_tx_timeout=10000000;
insert into t1 values(5,5);
insert into t1 values(6,6);
ERROR 25S03: transaction is rolled back
commit;
insert into t1 values(5,5);
commit;
ERROR UNKNOWN: failed to start a transaction
insert into t1 values(5,5);
rollback;
select * from t1 where c1=5;
c1	c2
select * from t1 where c1=6;
c1	c2
case 6 read uncommit
insert into t1 values(7,7);
select * from t1 ;
c1	c2
1	-2
2	-2
3	-2
4	4
select * from t1 where c1=7;
c1	c2
delete from t1 where c1=7;
select * from t1 ;
c1	c2
1	-2
2	-2
3	-2
4	4
select * from t1 where c1=7;
c1	c2
insert into t1 values(7,6);
select * from t1 ;
c1	c2
1	-2
2	-2
3	-2
4	4
select * from t1 where c1=7;
c1	c2
insert into t1 values(7,1);
ERROR 23000: Duplicate entry ' <3001.16>=int:7' for key 'PRIMARY'
select * from t1 ;
c1	c2
1	-2
2	-2
3	-2
4	4
select * from t1 where c1=7;
c1	c2
replace into t1 values(7,0);
select * from t1 ;
c1	c2
1	-2
2	-2
3	-2
4	4
select * from t1 where c1=7;
c1	c2
replace into t1 values(7,2);
select * from t1 where c1=7;
c1	c2
select * from t1 ;
c1	c2
1	-2
2	-2
3	-2
4	4
update t1 set c2=-1 where c1=7;
select * from t1 ;
c1	c2
1	-2
2	-2
3	-2
4	4
select * from t1 where c1=7;
c1	c2
update t1 set c2=c2*2 where c1=7;
select * from t1 ;
c1	c2
1	-2
2	-2
3	-2
4	4
select * from t1 where c1=7;
c1	c2
commit;
case 7 switch ups
set session ob_tx_timeout=100000000;
insert into t1 values(8,8);
update t1 set c2=0 where c1=8;
delete from t1 where c1=1;
ob1.switch_ups;
insert into t1 values(9,9);
ERROR 25S03: transaction is rolled back
commit;
ob1.$m_ups.status;
sync
ob1.$s_ups.status;
master
select * from t1;
c1	c2
1	-2
2	-2
3	-2
4	4
7	-2
select * from t1 where c1=8;
c1	c2
select * from t1 where c1=9;
c1	c2
select * from t1 where c1=1;
c1	c2
1	-2
insert into t1 values(8,8);
update t1 set c2=0 where c1=8;
delete from t1 where c1=1;
ob1.switch_ups;
commit;
ERROR UNKNOWN: failed to start a transaction
ob1.$m_ups.status;
master
ob1.$s_ups.status;
sync
select * from t1;
c1	c2
1	-2
2	-2
3	-2
4	4
7	-2
select * from t1 where c1=8;
c1	c2
select * from t1 where c1=9;
c1	c2
select * from t1 where c1=1;
c1	c2
1	-2
insert into t1 values(8,8);
update t1 set c2=0 where c1=8;
delete from t1 where c1=1;
ob1.switch_ups;
rollback;
select * from t1;
c1	c2
1	-2
2	-2
3	-2
4	4
7	-2
select * from t1 where c1=8;
c1	c2
select * from t1 where c1=9;
c1	c2
select * from t1 where c1=1;
c1	c2
1	-2
case 8 select in trx must send to master ups
insert into t1 values(8,8);
update t1 set c2=0 where c1=8;
delete from t1 where c1=1;
select * from t1;
c1	c2
1	-2
2	-2
3	-2
4	4
7	-2
select * from t1;
c1	c2
1	-2
2	-2
3	-2
4	4
7	-2
select * from t1;
c1	c2
1	-2
2	-2
3	-2
4	4
7	-2
select * from t1;
c1	c2
1	-2
2	-2
3	-2
4	4
7	-2
select * from t1;
c1	c2
1	-2
2	-2
3	-2
4	4
7	-2
select * from t1;
c1	c2
1	-2
2	-2
3	-2
4	4
7	-2
select * from t1;
c1	c2
1	-2
2	-2
3	-2
4	4
7	-2
select * from t1;
c1	c2
1	-2
2	-2
3	-2
4	4
7	-2
select * from t1;
c1	c2
1	-2
2	-2
3	-2
4	4
7	-2
select * from t1;
c1	c2
1	-2
2	-2
3	-2
4	4
7	-2
select * from t1;
c1	c2
1	-2
2	-2
3	-2
4	4
7	-2
select * from t1;
c1	c2
1	-2
2	-2
3	-2
4	4
7	-2
select * from t1;
c1	c2
1	-2
2	-2
3	-2
4	4
7	-2
select * from t1;
c1	c2
1	-2
2	-2
3	-2
4	4
7	-2
select * from t1;
c1	c2
1	-2
2	-2
3	-2
4	4
7	-2
select * from t1;
c1	c2
1	-2
2	-2
3	-2
4	4
7	-2
select * from t1;
c1	c2
1	-2
2	-2
3	-2
4	4
7	-2
select * from t1;
c1	c2
1	-2
2	-2
3	-2
4	4
7	-2
select * from t1;
c1	c2
1	-2
2	-2
3	-2
4	4
7	-2
select * from t1;
c1	c2
1	-2
2	-2
3	-2
4	4
7	-2
select * from t1;
c1	c2
1	-2
2	-2
3	-2
4	4
7	-2
select * from t1;
c1	c2
1	-2
2	-2
3	-2
4	4
7	-2
select * from t1;
c1	c2
1	-2
2	-2
3	-2
4	4
7	-2
select * from t1;
c1	c2
1	-2
2	-2
3	-2
4	4
7	-2
select * from t1;
c1	c2
1	-2
2	-2
3	-2
4	4
7	-2
select * from t1;
c1	c2
1	-2
2	-2
3	-2
4	4
7	-2
select * from t1;
c1	c2
1	-2
2	-2
3	-2
4	4
7	-2
select * from t1;
c1	c2
1	-2
2	-2
3	-2
4	4
7	-2
select * from t1;
c1	c2
1	-2
2	-2
3	-2
4	4
7	-2
select * from t1;
c1	c2
1	-2
2	-2
3	-2
4	4
7	-2
select * from t1;
c1	c2
1	-2
2	-2
3	-2
4	4
7	-2
select * from t1;
c1	c2
1	-2
2	-2
3	-2
4	4
7	-2
select * from t1;
c1	c2
1	-2
2	-2
3	-2
4	4
7	-2
select * from t1;
c1	c2
1	-2
2	-2
3	-2
4	4
7	-2
select * from t1;
c1	c2
1	-2
2	-2
3	-2
4	4
7	-2
select * from t1;
c1	c2
1	-2
2	-2
3	-2
4	4
7	-2
select * from t1;
c1	c2
1	-2
2	-2
3	-2
4	4
7	-2
select * from t1;
c1	c2
1	-2
2	-2
3	-2
4	4
7	-2
select * from t1;
c1	c2
1	-2
2	-2
3	-2
4	4
7	-2
select * from t1;
c1	c2
1	-2
2	-2
3	-2
4	4
7	-2
select * from t1;
c1	c2
1	-2
2	-2
3	-2
4	4
7	-2
select * from t1;
c1	c2
1	-2
2	-2
3	-2
4	4
7	-2
select * from t1;
c1	c2
1	-2
2	-2
3	-2
4	4
7	-2
select * from t1;
c1	c2
1	-2
2	-2
3	-2
4	4
7	-2
select * from t1;
c1	c2
1	-2
2	-2
3	-2
4	4
7	-2
select * from t1;
c1	c2
1	-2
2	-2
3	-2
4	4
7	-2
select * from t1;
c1	c2
1	-2
2	-2
3	-2
4	4
7	-2
select * from t1;
c1	c2
1	-2
2	-2
3	-2
4	4
7	-2
select * from t1;
c1	c2
1	-2
2	-2
3	-2
4	4
7	-2
select * from t1;
c1	c2
1	-2
2	-2
3	-2
4	4
7	-2
select * from t1;
c1	c2
1	-2
2	-2
3	-2
4	4
7	-2
select * from t1;
c1	c2
1	-2
2	-2
3	-2
4	4
7	-2
select * from t1;
c1	c2
1	-2
2	-2
3	-2
4	4
7	-2
select * from t1;
c1	c2
1	-2
2	-2
3	-2
4	4
7	-2
select * from t1;
c1	c2
1	-2
2	-2
3	-2
4	4
7	-2
select * from t1;
c1	c2
1	-2
2	-2
3	-2
4	4
7	-2
select * from t1;
c1	c2
1	-2
2	-2
3	-2
4	4
7	-2
select * from t1;
c1	c2
1	-2
2	-2
3	-2
4	4
7	-2
select * from t1;
c1	c2
1	-2
2	-2
3	-2
4	4
7	-2
select * from t1;
c1	c2
1	-2
2	-2
3	-2
4	4
7	-2
select * from t1;
c1	c2
1	-2
2	-2
3	-2
4	4
7	-2
select * from t1;
c1	c2
1	-2
2	-2
3	-2
4	4
7	-2
select * from t1;
c1	c2
1	-2
2	-2
3	-2
4	4
7	-2
select * from t1;
c1	c2
1	-2
2	-2
3	-2
4	4
7	-2
select * from t1;
c1	c2
1	-2
2	-2
3	-2
4	4
7	-2
select * from t1;
c1	c2
1	-2
2	-2
3	-2
4	4
7	-2
select * from t1;
c1	c2
1	-2
2	-2
3	-2
4	4
7	-2
select * from t1;
c1	c2
1	-2
2	-2
3	-2
4	4
7	-2
select * from t1;
c1	c2
1	-2
2	-2
3	-2
4	4
7	-2
select * from t1;
c1	c2
1	-2
2	-2
3	-2
4	4
7	-2
select * from t1;
c1	c2
1	-2
2	-2
3	-2
4	4
7	-2
select * from t1;
c1	c2
1	-2
2	-2
3	-2
4	4
7	-2
select * from t1;
c1	c2
1	-2
2	-2
3	-2
4	4
7	-2
select * from t1;
c1	c2
1	-2
2	-2
3	-2
4	4
7	-2
select * from t1;
c1	c2
1	-2
2	-2
3	-2
4	4
7	-2
select * from t1;
c1	c2
1	-2
2	-2
3	-2
4	4
7	-2
select * from t1;
c1	c2
1	-2
2	-2
3	-2
4	4
7	-2
select * from t1;
c1	c2
1	-2
2	-2
3	-2
4	4
7	-2
select * from t1;
c1	c2
1	-2
2	-2
3	-2
4	4
7	-2
select * from t1;
c1	c2
1	-2
2	-2
3	-2
4	4
7	-2
select * from t1;
c1	c2
1	-2
2	-2
3	-2
4	4
7	-2
select * from t1;
c1	c2
1	-2
2	-2
3	-2
4	4
7	-2
select * from t1;
c1	c2
1	-2
2	-2
3	-2
4	4
7	-2
select * from t1;
c1	c2
1	-2
2	-2
3	-2
4	4
7	-2
select * from t1;
c1	c2
1	-2
2	-2
3	-2
4	4
7	-2
select * from t1;
c1	c2
1	-2
2	-2
3	-2
4	4
7	-2
select * from t1;
c1	c2
1	-2
2	-2
3	-2
4	4
7	-2
select * from t1;
c1	c2
1	-2
2	-2
3	-2
4	4
7	-2
select * from t1;
c1	c2
1	-2
2	-2
3	-2
4	4
7	-2
select * from t1;
c1	c2
1	-2
2	-2
3	-2
4	4
7	-2
select * from t1;
c1	c2
1	-2
2	-2
3	-2
4	4
7	-2
select * from t1;
c1	c2
1	-2
2	-2
3	-2
4	4
7	-2
select * from t1;
c1	c2
1	-2
2	-2
3	-2
4	4
7	-2
select * from t1;
c1	c2
1	-2
2	-2
3	-2
4	4
7	-2
select * from t1;
c1	c2
1	-2
2	-2
3	-2
4	4
7	-2
select * from t1;
c1	c2
1	-2
2	-2
3	-2
4	4
7	-2
select * from t1;
c1	c2
1	-2
2	-2
3	-2
4	4
7	-2
select * from t1;
c1	c2
1	-2
2	-2
3	-2
4	4
7	-2
select * from t1;
c1	c2
1	-2
2	-2
3	-2
4	4
7	-2
select * from t1;
c1	c2
1	-2
2	-2
3	-2
4	4
7	-2
select * from t1 where c1=1;
c1	c2
1	-2
select * from t1 where c1=1;
c1	c2
1	-2
select * from t1 where c1=1;
c1	c2
1	-2
select * from t1 where c1=1;
c1	c2
1	-2
select * from t1 where c1=1;
c1	c2
1	-2
select * from t1 where c1=1;
c1	c2
1	-2
select * from t1 where c1=1;
c1	c2
1	-2
select * from t1 where c1=1;
c1	c2
1	-2
select * from t1 where c1=1;
c1	c2
1	-2
select * from t1 where c1=1;
c1	c2
1	-2
select * from t1 where c1=1;
c1	c2
1	-2
select * from t1 where c1=1;
c1	c2
1	-2
select * from t1 where c1=1;
c1	c2
1	-2
select * from t1 where c1=1;
c1	c2
1	-2
select * from t1 where c1=1;
c1	c2
1	-2
select * from t1 where c1=1;
c1	c2
1	-2
select * from t1 where c1=1;
c1	c2
1	-2
select * from t1 where c1=1;
c1	c2
1	-2
select * from t1 where c1=1;
c1	c2
1	-2
select * from t1 where c1=1;
c1	c2
1	-2
select * from t1 where c1=1;
c1	c2
1	-2
select * from t1 where c1=1;
c1	c2
1	-2
select * from t1 where c1=1;
c1	c2
1	-2
select * from t1 where c1=1;
c1	c2
1	-2
select * from t1 where c1=1;
c1	c2
1	-2
select * from t1 where c1=1;
c1	c2
1	-2
select * from t1 where c1=1;
c1	c2
1	-2
select * from t1 where c1=1;
c1	c2
1	-2
select * from t1 where c1=1;
c1	c2
1	-2
select * from t1 where c1=1;
c1	c2
1	-2
select * from t1 where c1=1;
c1	c2
1	-2
select * from t1 where c1=1;
c1	c2
1	-2
select * from t1 where c1=1;
c1	c2
1	-2
select * from t1 where c1=1;
c1	c2
1	-2
select * from t1 where c1=1;
c1	c2
1	-2
select * from t1 where c1=1;
c1	c2
1	-2
select * from t1 where c1=1;
c1	c2
1	-2
select * from t1 where c1=1;
c1	c2
1	-2
select * from t1 where c1=1;
c1	c2
1	-2
select * from t1 where c1=1;
c1	c2
1	-2
select * from t1 where c1=1;
c1	c2
1	-2
select * from t1 where c1=1;
c1	c2
1	-2
select * from t1 where c1=1;
c1	c2
1	-2
select * from t1 where c1=1;
c1	c2
1	-2
select * from t1 where c1=1;
c1	c2
1	-2
select * from t1 where c1=1;
c1	c2
1	-2
select * from t1 where c1=1;
c1	c2
1	-2
select * from t1 where c1=1;
c1	c2
1	-2
select * from t1 where c1=1;
c1	c2
1	-2
select * from t1 where c1=1;
c1	c2
1	-2
select * from t1 where c1=1;
c1	c2
1	-2
select * from t1 where c1=1;
c1	c2
1	-2
select * from t1 where c1=1;
c1	c2
1	-2
select * from t1 where c1=1;
c1	c2
1	-2
select * from t1 where c1=1;
c1	c2
1	-2
select * from t1 where c1=1;
c1	c2
1	-2
select * from t1 where c1=1;
c1	c2
1	-2
select * from t1 where c1=1;
c1	c2
1	-2
select * from t1 where c1=1;
c1	c2
1	-2
select * from t1 where c1=1;
c1	c2
1	-2
select * from t1 where c1=1;
c1	c2
1	-2
select * from t1 where c1=1;
c1	c2
1	-2
select * from t1 where c1=1;
c1	c2
1	-2
select * from t1 where c1=1;
c1	c2
1	-2
select * from t1 where c1=1;
c1	c2
1	-2
select * from t1 where c1=1;
c1	c2
1	-2
select * from t1 where c1=1;
c1	c2
1	-2
select * from t1 where c1=1;
c1	c2
1	-2
select * from t1 where c1=1;
c1	c2
1	-2
select * from t1 where c1=1;
c1	c2
1	-2
select * from t1 where c1=1;
c1	c2
1	-2
select * from t1 where c1=1;
c1	c2
1	-2
select * from t1 where c1=1;
c1	c2
1	-2
select * from t1 where c1=1;
c1	c2
1	-2
select * from t1 where c1=1;
c1	c2
1	-2
select * from t1 where c1=1;
c1	c2
1	-2
select * from t1 where c1=1;
c1	c2
1	-2
select * from t1 where c1=1;
c1	c2
1	-2
select * from t1 where c1=1;
c1	c2
1	-2
select * from t1 where c1=1;
c1	c2
1	-2
select * from t1 where c1=1;
c1	c2
1	-2
select * from t1 where c1=1;
c1	c2
1	-2
select * from t1 where c1=1;
c1	c2
1	-2
select * from t1 where c1=1;
c1	c2
1	-2
select * from t1 where c1=1;
c1	c2
1	-2
select * from t1 where c1=1;
c1	c2
1	-2
select * from t1 where c1=1;
c1	c2
1	-2
select * from t1 where c1=1;
c1	c2
1	-2
select * from t1 where c1=1;
c1	c2
1	-2
select * from t1 where c1=1;
c1	c2
1	-2
select * from t1 where c1=1;
c1	c2
1	-2
select * from t1 where c1=1;
c1	c2
1	-2
select * from t1 where c1=1;
c1	c2
1	-2
select * from t1 where c1=1;
c1	c2
1	-2
select * from t1 where c1=1;
c1	c2
1	-2
select * from t1 where c1=1;
c1	c2
1	-2
select * from t1 where c1=1;
c1	c2
1	-2
select * from t1 where c1=1;
c1	c2
1	-2
select * from t1 where c1=1;
c1	c2
1	-2
select * from t1 where c1=1;
c1	c2
1	-2
rollback;
bug!!! slave ups should not have received get request
bug!!! slave ups should not have received scan request
case 9 omit.
case 10 first query failed in trx
insert into t1 values(1,1);
ERROR 23000: Duplicate entry ' <3001.16>=int:1' for key 'PRIMARY'
update t1 set c2=100 where c1=1;
delete from t1 where c1=8;
update t1 set c2=100 where c1=2;
commit;
select * from t1;
c1	c2
1	100
2	100
3	-2
4	4
7	-2
select * from t1 where c1=1;
c1	c2
1	100
select * from t1 where c1=2;
c1	c2
2	100
select * from t1 where c1=8;
c1	c2
update t1 set c2=100 where c1=70;
update t1 set c2=1000 where c1=1;
commit;
select * from t1;
c1	c2
1	1000
2	100
3	-2
4	4
7	-2
select * from t1 where c1=1;
c1	c2
1	1000
select * from t1 where c1=70;
c1	c2
delete from t1 where c1=80;
update t1 set c2=1000 where c1=1;
commit;
select * from t1;
c1	c2
1	1000
2	100
3	-2
4	4
7	-2
select * from t1 where c1=1;
c1	c2
1	1000
select * from t1 where c1=80;
c1	c2
insert into t1 values(10,9),(10,9);
ERROR 23000: Duplicate entry 'int:10' for key 'PRIMARY'
update t1 set c2=10000 where c1=1;
commit;
select * from t1;
c1	c2
1	10000
2	100
3	-2
4	4
7	-2
select * from t1 where c1=10;
c1	c2
select * from t1 where c1=1;
c1	c2
1	10000
set autocommit=0;
insert into t1 values(10,10);
insert into t1 values(20,20);
insert into t1 values(10,10);
ERROR HY000: Exclusive lock conflict 'int:10' for key 'PRIMARY'
insert into t1  values(11,11);
commit;
replace into t1 values(20,20);
ERROR HY000: Exclusive lock conflict 'int:20' for key 'PRIMARY'
insert into t1  values(21,21);
rollback;
set autocommit=1;
select * from t1;
c1	c2
1	10000
2	100
3	-2
4	4
7	-2
11	11
select * from t1 where c1=11;
c1	c2
11	11
select * from t1 where c1=10;
c1	c2
select * from t1 where c1=20;
c1	c2
select * from t1 where c1=21;
c1	c2
ob1.$m_ups.status;
sync
ob1.$s_ups.status;
master
