ob1=OBI(cluster=1211);
ob1.reboot;
ob1.mysql set global ob_read_consistency=3;
ob1.mysql_p show variables like 'ob_read_consistency';
variable_name	value
ob_read_consistency	3
ob1.mysql_p select name,value from __all_sys_config_stat where name = 'read_master_master_ups_percent' or name = 'read_slave_master_ups_percent';
name	value
read_master_master_ups_percent	50
read_slave_master_ups_percent	50
ob1.$m_ups.status;
master
ob1.$s_ups.status;
sync
ob1.create_client;
create table t1(c1 int primary key, c2 int);
insert into t1 values(0,0);
case 1 mix when
ob1.connect conn1;
ob1.connect conn2;
set autocommit=0;
insert into t1 values(3,3);
replace into t1 values(4,4);
update t1 set c2=c2+1 where c1=0 when row_count(insert into t1 values(1,1))=1;
update t1 set c2=c2+1 where c1=0 when row_count(insert into t1 values(1,1))=1;
ERROR 23000: Duplicate entry ' <3001.16>=int:1' for key 'PRIMARY'
update t1 set c2=c2+1 where c1=0 when row_count(update t1 set c2=0 where c1=2)=1;
ERROR HY000: Number 1 When filter failed, ret=-5064, func 1: ROW_COUNT()=0
update t1 set c2=c2+1 where c1=0 when row_count(delete from t1  where c1=2)=1;
ERROR HY000: Number 1 When filter failed, ret=-5064, func 1: ROW_COUNT()=0
update t1 set c2=c2+1 where c1=0 when row_count(insert into t1 values(3,3))=1;
ERROR HY000: Exclusive lock conflict 'int:3' for key 'PRIMARY'
update t1 set c2=c2+1 where c1=0 when row_count(replace into t1 values(4,4))=1;
ERROR HY000: Exclusive lock conflict 'int:4' for key 'PRIMARY'
select * from t1;
c1	c2
0	1
1	1
select * from t1 where c1=1;
c1	c2
1	1
select * from t1 where c1=2;
c1	c2
select * from t1 where c1=3;
c1	c2
select * from t1 where c1=4;
c1	c2
select * from t1;
c1	c2
0	1
1	1
select * from t1 where c1=1;
c1	c2
1	1
select * from t1 where c1=2;
c1	c2
select * from t1 where c1=3;
c1	c2
select * from t1 where c1=4;
c1	c2
select * from t1;
c1	c2
0	1
1	1
select * from t1 where c1=1;
c1	c2
1	1
select * from t1 where c1=2;
c1	c2
select * from t1 where c1=3;
c1	c2
select * from t1 where c1=4;
c1	c2
select * from t1;
c1	c2
0	1
1	1
select * from t1 where c1=1;
c1	c2
1	1
select * from t1 where c1=2;
c1	c2
select * from t1 where c1=3;
c1	c2
select * from t1 where c1=4;
c1	c2
select * from t1;
c1	c2
0	1
1	1
select * from t1 where c1=1;
c1	c2
1	1
select * from t1 where c1=2;
c1	c2
select * from t1 where c1=3;
c1	c2
select * from t1 where c1=4;
c1	c2
select * from t1;
c1	c2
0	1
1	1
select * from t1 where c1=1;
c1	c2
1	1
select * from t1 where c1=2;
c1	c2
select * from t1 where c1=3;
c1	c2
select * from t1 where c1=4;
c1	c2
select * from t1;
c1	c2
0	1
1	1
select * from t1 where c1=1;
c1	c2
1	1
select * from t1 where c1=2;
c1	c2
select * from t1 where c1=3;
c1	c2
select * from t1 where c1=4;
c1	c2
select * from t1;
c1	c2
0	1
1	1
select * from t1 where c1=1;
c1	c2
1	1
select * from t1 where c1=2;
c1	c2
select * from t1 where c1=3;
c1	c2
select * from t1 where c1=4;
c1	c2
select * from t1;
c1	c2
0	1
1	1
select * from t1 where c1=1;
c1	c2
1	1
select * from t1 where c1=2;
c1	c2
select * from t1 where c1=3;
c1	c2
select * from t1 where c1=4;
c1	c2
select * from t1;
c1	c2
0	1
1	1
select * from t1 where c1=1;
c1	c2
1	1
select * from t1 where c1=2;
c1	c2
select * from t1 where c1=3;
c1	c2
select * from t1 where c1=4;
c1	c2
select * from t1;
c1	c2
0	1
1	1
select * from t1 where c1=1;
c1	c2
1	1
select * from t1 where c1=2;
c1	c2
select * from t1 where c1=3;
c1	c2
select * from t1 where c1=4;
c1	c2
select * from t1;
c1	c2
0	1
1	1
select * from t1 where c1=1;
c1	c2
1	1
select * from t1 where c1=2;
c1	c2
select * from t1 where c1=3;
c1	c2
select * from t1 where c1=4;
c1	c2
select * from t1;
c1	c2
0	1
1	1
select * from t1 where c1=1;
c1	c2
1	1
select * from t1 where c1=2;
c1	c2
select * from t1 where c1=3;
c1	c2
select * from t1 where c1=4;
c1	c2
select * from t1;
c1	c2
0	1
1	1
select * from t1 where c1=1;
c1	c2
1	1
select * from t1 where c1=2;
c1	c2
select * from t1 where c1=3;
c1	c2
select * from t1 where c1=4;
c1	c2
select * from t1;
c1	c2
0	1
1	1
select * from t1 where c1=1;
c1	c2
1	1
select * from t1 where c1=2;
c1	c2
select * from t1 where c1=3;
c1	c2
select * from t1 where c1=4;
c1	c2
select * from t1;
c1	c2
0	1
1	1
select * from t1 where c1=1;
c1	c2
1	1
select * from t1 where c1=2;
c1	c2
select * from t1 where c1=3;
c1	c2
select * from t1 where c1=4;
c1	c2
select * from t1;
c1	c2
0	1
1	1
select * from t1 where c1=1;
c1	c2
1	1
select * from t1 where c1=2;
c1	c2
select * from t1 where c1=3;
c1	c2
select * from t1 where c1=4;
c1	c2
select * from t1;
c1	c2
0	1
1	1
select * from t1 where c1=1;
c1	c2
1	1
select * from t1 where c1=2;
c1	c2
select * from t1 where c1=3;
c1	c2
select * from t1 where c1=4;
c1	c2
select * from t1;
c1	c2
0	1
1	1
select * from t1 where c1=1;
c1	c2
1	1
select * from t1 where c1=2;
c1	c2
select * from t1 where c1=3;
c1	c2
select * from t1 where c1=4;
c1	c2
select * from t1;
c1	c2
0	1
1	1
select * from t1 where c1=1;
c1	c2
1	1
select * from t1 where c1=2;
c1	c2
select * from t1 where c1=3;
c1	c2
select * from t1 where c1=4;
c1	c2
select * from t1;
c1	c2
0	1
1	1
select * from t1 where c1=1;
c1	c2
1	1
select * from t1 where c1=2;
c1	c2
select * from t1 where c1=3;
c1	c2
select * from t1 where c1=4;
c1	c2
select * from t1;
c1	c2
0	1
1	1
select * from t1 where c1=1;
c1	c2
1	1
select * from t1 where c1=2;
c1	c2
select * from t1 where c1=3;
c1	c2
select * from t1 where c1=4;
c1	c2
select * from t1;
c1	c2
0	1
1	1
select * from t1 where c1=1;
c1	c2
1	1
select * from t1 where c1=2;
c1	c2
select * from t1 where c1=3;
c1	c2
select * from t1 where c1=4;
c1	c2
select * from t1;
c1	c2
0	1
1	1
select * from t1 where c1=1;
c1	c2
1	1
select * from t1 where c1=2;
c1	c2
select * from t1 where c1=3;
c1	c2
select * from t1 where c1=4;
c1	c2
select * from t1;
c1	c2
0	1
1	1
select * from t1 where c1=1;
c1	c2
1	1
select * from t1 where c1=2;
c1	c2
select * from t1 where c1=3;
c1	c2
select * from t1 where c1=4;
c1	c2
select * from t1;
c1	c2
0	1
1	1
select * from t1 where c1=1;
c1	c2
1	1
select * from t1 where c1=2;
c1	c2
select * from t1 where c1=3;
c1	c2
select * from t1 where c1=4;
c1	c2
select * from t1;
c1	c2
0	1
1	1
select * from t1 where c1=1;
c1	c2
1	1
select * from t1 where c1=2;
c1	c2
select * from t1 where c1=3;
c1	c2
select * from t1 where c1=4;
c1	c2
select * from t1;
c1	c2
0	1
1	1
select * from t1 where c1=1;
c1	c2
1	1
select * from t1 where c1=2;
c1	c2
select * from t1 where c1=3;
c1	c2
select * from t1 where c1=4;
c1	c2
select * from t1;
c1	c2
0	1
1	1
select * from t1 where c1=1;
c1	c2
1	1
select * from t1 where c1=2;
c1	c2
select * from t1 where c1=3;
c1	c2
select * from t1 where c1=4;
c1	c2
select * from t1;
c1	c2
0	1
1	1
select * from t1 where c1=1;
c1	c2
1	1
select * from t1 where c1=2;
c1	c2
select * from t1 where c1=3;
c1	c2
select * from t1 where c1=4;
c1	c2
select * from t1;
c1	c2
0	1
1	1
select * from t1 where c1=1;
c1	c2
1	1
select * from t1 where c1=2;
c1	c2
select * from t1 where c1=3;
c1	c2
select * from t1 where c1=4;
c1	c2
select * from t1;
c1	c2
0	1
1	1
select * from t1 where c1=1;
c1	c2
1	1
select * from t1 where c1=2;
c1	c2
select * from t1 where c1=3;
c1	c2
select * from t1 where c1=4;
c1	c2
select * from t1;
c1	c2
0	1
1	1
select * from t1 where c1=1;
c1	c2
1	1
select * from t1 where c1=2;
c1	c2
select * from t1 where c1=3;
c1	c2
select * from t1 where c1=4;
c1	c2
select * from t1;
c1	c2
0	1
1	1
select * from t1 where c1=1;
c1	c2
1	1
select * from t1 where c1=2;
c1	c2
select * from t1 where c1=3;
c1	c2
select * from t1 where c1=4;
c1	c2
select * from t1;
c1	c2
0	1
1	1
select * from t1 where c1=1;
c1	c2
1	1
select * from t1 where c1=2;
c1	c2
select * from t1 where c1=3;
c1	c2
select * from t1 where c1=4;
c1	c2
select * from t1;
c1	c2
0	1
1	1
select * from t1 where c1=1;
c1	c2
1	1
select * from t1 where c1=2;
c1	c2
select * from t1 where c1=3;
c1	c2
select * from t1 where c1=4;
c1	c2
select * from t1;
c1	c2
0	1
1	1
select * from t1 where c1=1;
c1	c2
1	1
select * from t1 where c1=2;
c1	c2
select * from t1 where c1=3;
c1	c2
select * from t1 where c1=4;
c1	c2
select * from t1;
c1	c2
0	1
1	1
select * from t1 where c1=1;
c1	c2
1	1
select * from t1 where c1=2;
c1	c2
select * from t1 where c1=3;
c1	c2
select * from t1 where c1=4;
c1	c2
select * from t1;
c1	c2
0	1
1	1
select * from t1 where c1=1;
c1	c2
1	1
select * from t1 where c1=2;
c1	c2
select * from t1 where c1=3;
c1	c2
select * from t1 where c1=4;
c1	c2
select * from t1;
c1	c2
0	1
1	1
select * from t1 where c1=1;
c1	c2
1	1
select * from t1 where c1=2;
c1	c2
select * from t1 where c1=3;
c1	c2
select * from t1 where c1=4;
c1	c2
select * from t1;
c1	c2
0	1
1	1
select * from t1 where c1=1;
c1	c2
1	1
select * from t1 where c1=2;
c1	c2
select * from t1 where c1=3;
c1	c2
select * from t1 where c1=4;
c1	c2
select * from t1;
c1	c2
0	1
1	1
select * from t1 where c1=1;
c1	c2
1	1
select * from t1 where c1=2;
c1	c2
select * from t1 where c1=3;
c1	c2
select * from t1 where c1=4;
c1	c2
select * from t1;
c1	c2
0	1
1	1
select * from t1 where c1=1;
c1	c2
1	1
select * from t1 where c1=2;
c1	c2
select * from t1 where c1=3;
c1	c2
select * from t1 where c1=4;
c1	c2
select * from t1;
c1	c2
0	1
1	1
select * from t1 where c1=1;
c1	c2
1	1
select * from t1 where c1=2;
c1	c2
select * from t1 where c1=3;
c1	c2
select * from t1 where c1=4;
c1	c2
select * from t1;
c1	c2
0	1
1	1
select * from t1 where c1=1;
c1	c2
1	1
select * from t1 where c1=2;
c1	c2
select * from t1 where c1=3;
c1	c2
select * from t1 where c1=4;
c1	c2
select * from t1;
c1	c2
0	1
1	1
select * from t1 where c1=1;
c1	c2
1	1
select * from t1 where c1=2;
c1	c2
select * from t1 where c1=3;
c1	c2
select * from t1 where c1=4;
c1	c2
select * from t1;
c1	c2
0	1
1	1
select * from t1 where c1=1;
c1	c2
1	1
select * from t1 where c1=2;
c1	c2
select * from t1 where c1=3;
c1	c2
select * from t1 where c1=4;
c1	c2
select * from t1;
c1	c2
0	1
1	1
select * from t1 where c1=1;
c1	c2
1	1
select * from t1 where c1=2;
c1	c2
select * from t1 where c1=3;
c1	c2
select * from t1 where c1=4;
c1	c2
select * from t1;
c1	c2
0	1
1	1
select * from t1 where c1=1;
c1	c2
1	1
select * from t1 where c1=2;
c1	c2
select * from t1 where c1=3;
c1	c2
select * from t1 where c1=4;
c1	c2
select * from t1;
c1	c2
0	1
1	1
select * from t1 where c1=1;
c1	c2
1	1
select * from t1 where c1=2;
c1	c2
select * from t1 where c1=3;
c1	c2
select * from t1 where c1=4;
c1	c2
select * from t1;
c1	c2
0	1
1	1
select * from t1 where c1=1;
c1	c2
1	1
select * from t1 where c1=2;
c1	c2
select * from t1 where c1=3;
c1	c2
select * from t1 where c1=4;
c1	c2
select * from t1;
c1	c2
0	1
1	1
select * from t1 where c1=1;
c1	c2
1	1
select * from t1 where c1=2;
c1	c2
select * from t1 where c1=3;
c1	c2
select * from t1 where c1=4;
c1	c2
select * from t1;
c1	c2
0	1
1	1
select * from t1 where c1=1;
c1	c2
1	1
select * from t1 where c1=2;
c1	c2
select * from t1 where c1=3;
c1	c2
select * from t1 where c1=4;
c1	c2
select * from t1;
c1	c2
0	1
1	1
select * from t1 where c1=1;
c1	c2
1	1
select * from t1 where c1=2;
c1	c2
select * from t1 where c1=3;
c1	c2
select * from t1 where c1=4;
c1	c2
select * from t1;
c1	c2
0	1
1	1
select * from t1 where c1=1;
c1	c2
1	1
select * from t1 where c1=2;
c1	c2
select * from t1 where c1=3;
c1	c2
select * from t1 where c1=4;
c1	c2
select * from t1;
c1	c2
0	1
1	1
select * from t1 where c1=1;
c1	c2
1	1
select * from t1 where c1=2;
c1	c2
select * from t1 where c1=3;
c1	c2
select * from t1 where c1=4;
c1	c2
select * from t1;
c1	c2
0	1
1	1
select * from t1 where c1=1;
c1	c2
1	1
select * from t1 where c1=2;
c1	c2
select * from t1 where c1=3;
c1	c2
select * from t1 where c1=4;
c1	c2
select * from t1;
c1	c2
0	1
1	1
select * from t1 where c1=1;
c1	c2
1	1
select * from t1 where c1=2;
c1	c2
select * from t1 where c1=3;
c1	c2
select * from t1 where c1=4;
c1	c2
select * from t1;
c1	c2
0	1
1	1
select * from t1 where c1=1;
c1	c2
1	1
select * from t1 where c1=2;
c1	c2
select * from t1 where c1=3;
c1	c2
select * from t1 where c1=4;
c1	c2
select * from t1;
c1	c2
0	1
1	1
select * from t1 where c1=1;
c1	c2
1	1
select * from t1 where c1=2;
c1	c2
select * from t1 where c1=3;
c1	c2
select * from t1 where c1=4;
c1	c2
select * from t1;
c1	c2
0	1
1	1
select * from t1 where c1=1;
c1	c2
1	1
select * from t1 where c1=2;
c1	c2
select * from t1 where c1=3;
c1	c2
select * from t1 where c1=4;
c1	c2
select * from t1;
c1	c2
0	1
1	1
select * from t1 where c1=1;
c1	c2
1	1
select * from t1 where c1=2;
c1	c2
select * from t1 where c1=3;
c1	c2
select * from t1 where c1=4;
c1	c2
select * from t1;
c1	c2
0	1
1	1
select * from t1 where c1=1;
c1	c2
1	1
select * from t1 where c1=2;
c1	c2
select * from t1 where c1=3;
c1	c2
select * from t1 where c1=4;
c1	c2
select * from t1;
c1	c2
0	1
1	1
select * from t1 where c1=1;
c1	c2
1	1
select * from t1 where c1=2;
c1	c2
select * from t1 where c1=3;
c1	c2
select * from t1 where c1=4;
c1	c2
select * from t1;
c1	c2
0	1
1	1
select * from t1 where c1=1;
c1	c2
1	1
select * from t1 where c1=2;
c1	c2
select * from t1 where c1=3;
c1	c2
select * from t1 where c1=4;
c1	c2
select * from t1;
c1	c2
0	1
1	1
select * from t1 where c1=1;
c1	c2
1	1
select * from t1 where c1=2;
c1	c2
select * from t1 where c1=3;
c1	c2
select * from t1 where c1=4;
c1	c2
select * from t1;
c1	c2
0	1
1	1
select * from t1 where c1=1;
c1	c2
1	1
select * from t1 where c1=2;
c1	c2
select * from t1 where c1=3;
c1	c2
select * from t1 where c1=4;
c1	c2
select * from t1;
c1	c2
0	1
1	1
select * from t1 where c1=1;
c1	c2
1	1
select * from t1 where c1=2;
c1	c2
select * from t1 where c1=3;
c1	c2
select * from t1 where c1=4;
c1	c2
select * from t1;
c1	c2
0	1
1	1
select * from t1 where c1=1;
c1	c2
1	1
select * from t1 where c1=2;
c1	c2
select * from t1 where c1=3;
c1	c2
select * from t1 where c1=4;
c1	c2
select * from t1;
c1	c2
0	1
1	1
select * from t1 where c1=1;
c1	c2
1	1
select * from t1 where c1=2;
c1	c2
select * from t1 where c1=3;
c1	c2
select * from t1 where c1=4;
c1	c2
select * from t1;
c1	c2
0	1
1	1
select * from t1 where c1=1;
c1	c2
1	1
select * from t1 where c1=2;
c1	c2
select * from t1 where c1=3;
c1	c2
select * from t1 where c1=4;
c1	c2
select * from t1;
c1	c2
0	1
1	1
select * from t1 where c1=1;
c1	c2
1	1
select * from t1 where c1=2;
c1	c2
select * from t1 where c1=3;
c1	c2
select * from t1 where c1=4;
c1	c2
select * from t1;
c1	c2
0	1
1	1
select * from t1 where c1=1;
c1	c2
1	1
select * from t1 where c1=2;
c1	c2
select * from t1 where c1=3;
c1	c2
select * from t1 where c1=4;
c1	c2
select * from t1;
c1	c2
0	1
1	1
select * from t1 where c1=1;
c1	c2
1	1
select * from t1 where c1=2;
c1	c2
select * from t1 where c1=3;
c1	c2
select * from t1 where c1=4;
c1	c2
select * from t1;
c1	c2
0	1
1	1
select * from t1 where c1=1;
c1	c2
1	1
select * from t1 where c1=2;
c1	c2
select * from t1 where c1=3;
c1	c2
select * from t1 where c1=4;
c1	c2
select * from t1;
c1	c2
0	1
1	1
select * from t1 where c1=1;
c1	c2
1	1
select * from t1 where c1=2;
c1	c2
select * from t1 where c1=3;
c1	c2
select * from t1 where c1=4;
c1	c2
select * from t1;
c1	c2
0	1
1	1
select * from t1 where c1=1;
c1	c2
1	1
select * from t1 where c1=2;
c1	c2
select * from t1 where c1=3;
c1	c2
select * from t1 where c1=4;
c1	c2
select * from t1;
c1	c2
0	1
1	1
select * from t1 where c1=1;
c1	c2
1	1
select * from t1 where c1=2;
c1	c2
select * from t1 where c1=3;
c1	c2
select * from t1 where c1=4;
c1	c2
select * from t1;
c1	c2
0	1
1	1
select * from t1 where c1=1;
c1	c2
1	1
select * from t1 where c1=2;
c1	c2
select * from t1 where c1=3;
c1	c2
select * from t1 where c1=4;
c1	c2
select * from t1;
c1	c2
0	1
1	1
select * from t1 where c1=1;
c1	c2
1	1
select * from t1 where c1=2;
c1	c2
select * from t1 where c1=3;
c1	c2
select * from t1 where c1=4;
c1	c2
select * from t1;
c1	c2
0	1
1	1
select * from t1 where c1=1;
c1	c2
1	1
select * from t1 where c1=2;
c1	c2
select * from t1 where c1=3;
c1	c2
select * from t1 where c1=4;
c1	c2
select * from t1;
c1	c2
0	1
1	1
select * from t1 where c1=1;
c1	c2
1	1
select * from t1 where c1=2;
c1	c2
select * from t1 where c1=3;
c1	c2
select * from t1 where c1=4;
c1	c2
select * from t1;
c1	c2
0	1
1	1
select * from t1 where c1=1;
c1	c2
1	1
select * from t1 where c1=2;
c1	c2
select * from t1 where c1=3;
c1	c2
select * from t1 where c1=4;
c1	c2
select * from t1;
c1	c2
0	1
1	1
select * from t1 where c1=1;
c1	c2
1	1
select * from t1 where c1=2;
c1	c2
select * from t1 where c1=3;
c1	c2
select * from t1 where c1=4;
c1	c2
select * from t1;
c1	c2
0	1
1	1
select * from t1 where c1=1;
c1	c2
1	1
select * from t1 where c1=2;
c1	c2
select * from t1 where c1=3;
c1	c2
select * from t1 where c1=4;
c1	c2
select * from t1;
c1	c2
0	1
1	1
select * from t1 where c1=1;
c1	c2
1	1
select * from t1 where c1=2;
c1	c2
select * from t1 where c1=3;
c1	c2
select * from t1 where c1=4;
c1	c2
select * from t1;
c1	c2
0	1
1	1
select * from t1 where c1=1;
c1	c2
1	1
select * from t1 where c1=2;
c1	c2
select * from t1 where c1=3;
c1	c2
select * from t1 where c1=4;
c1	c2
select * from t1;
c1	c2
0	1
1	1
select * from t1 where c1=1;
c1	c2
1	1
select * from t1 where c1=2;
c1	c2
select * from t1 where c1=3;
c1	c2
select * from t1 where c1=4;
c1	c2
select * from t1;
c1	c2
0	1
1	1
select * from t1 where c1=1;
c1	c2
1	1
select * from t1 where c1=2;
c1	c2
select * from t1 where c1=3;
c1	c2
select * from t1 where c1=4;
c1	c2
select * from t1;
c1	c2
0	1
1	1
select * from t1 where c1=1;
c1	c2
1	1
select * from t1 where c1=2;
c1	c2
select * from t1 where c1=3;
c1	c2
select * from t1 where c1=4;
c1	c2
select * from t1;
c1	c2
0	1
1	1
select * from t1 where c1=1;
c1	c2
1	1
select * from t1 where c1=2;
c1	c2
select * from t1 where c1=3;
c1	c2
select * from t1 where c1=4;
c1	c2
select * from t1;
c1	c2
0	1
1	1
select * from t1 where c1=1;
c1	c2
1	1
select * from t1 where c1=2;
c1	c2
select * from t1 where c1=3;
c1	c2
select * from t1 where c1=4;
c1	c2
select * from t1;
c1	c2
0	1
1	1
select * from t1 where c1=1;
c1	c2
1	1
select * from t1 where c1=2;
c1	c2
select * from t1 where c1=3;
c1	c2
select * from t1 where c1=4;
c1	c2
select * from t1;
c1	c2
0	1
1	1
select * from t1 where c1=1;
c1	c2
1	1
select * from t1 where c1=2;
c1	c2
select * from t1 where c1=3;
c1	c2
select * from t1 where c1=4;
c1	c2
select * from t1;
c1	c2
0	1
1	1
select * from t1 where c1=1;
c1	c2
1	1
select * from t1 where c1=2;
c1	c2
select * from t1 where c1=3;
c1	c2
select * from t1 where c1=4;
c1	c2
select * from t1;
c1	c2
0	1
1	1
select * from t1 where c1=1;
c1	c2
1	1
select * from t1 where c1=2;
c1	c2
select * from t1 where c1=3;
c1	c2
select * from t1 where c1=4;
c1	c2
select * from t1;
c1	c2
0	1
1	1
select * from t1 where c1=1;
c1	c2
1	1
select * from t1 where c1=2;
c1	c2
select * from t1 where c1=3;
c1	c2
select * from t1 where c1=4;
c1	c2
select * from t1;
c1	c2
0	1
1	1
select * from t1 where c1=1;
c1	c2
1	1
select * from t1 where c1=2;
c1	c2
select * from t1 where c1=3;
c1	c2
select * from t1 where c1=4;
c1	c2
select * from t1;
c1	c2
0	1
1	1
select * from t1 where c1=1;
c1	c2
1	1
select * from t1 where c1=2;
c1	c2
select * from t1 where c1=3;
c1	c2
select * from t1 where c1=4;
c1	c2
select * from t1;
c1	c2
0	1
1	1
select * from t1 where c1=1;
c1	c2
1	1
select * from t1 where c1=2;
c1	c2
select * from t1 where c1=3;
c1	c2
select * from t1 where c1=4;
c1	c2
rollback;
insert into t1 values(3,3);
replace into t1 values(4,4);
update t1 set c2=c2+1 where c1=0 when row_count(insert into t1 values(1,1) when row_count(update t1 set c2=0 where c1=1)=1)=1;
ERROR 23000: Duplicate entry ' <3001.16>=int:1' for key 'PRIMARY'
update t1 set c2=c2+1 where c1=0 when row_count(update t1 set c2=0 where c1=2 when row_count(update t1 set c2=0 where c1=1)=1)=1;
ERROR HY000: Number 2 When filter failed, ret=-5064, func 1: ROW_COUNT()=0
update t1 set c2=c2+1 where c1=0 when row_count(delete from t1  where c1=2 when row_count(update t1 set c2=0 where c1=1)=1)=1;
ERROR HY000: Number 2 When filter failed, ret=-5064, func 1: ROW_COUNT()=0
update t1 set c2=c2+1 where c1=0 when row_count(insert into t1 values(3,3) when row_count(update t1 set c2=0 where c1=1)=1)=1;
ERROR HY000: Exclusive lock conflict 'int:3' for key 'PRIMARY'
update t1 set c2=c2+1 where c1=0 when row_count(replace into t1 values(4,4) when row_count(update t1 set c2=0 where c1=1)=1)=1;
ERROR HY000: Exclusive lock conflict 'int:4' for key 'PRIMARY'
select * from t1;
c1	c2
0	1
1	1
select * from t1 where c1=1;
c1	c2
1	1
select * from t1 where c1=2;
c1	c2
select * from t1 where c1=3;
c1	c2
select * from t1 where c1=4;
c1	c2
select * from t1;
c1	c2
0	1
1	1
select * from t1 where c1=1;
c1	c2
1	1
select * from t1 where c1=2;
c1	c2
select * from t1 where c1=3;
c1	c2
select * from t1 where c1=4;
c1	c2
select * from t1;
c1	c2
0	1
1	1
select * from t1 where c1=1;
c1	c2
1	1
select * from t1 where c1=2;
c1	c2
select * from t1 where c1=3;
c1	c2
select * from t1 where c1=4;
c1	c2
select * from t1;
c1	c2
0	1
1	1
select * from t1 where c1=1;
c1	c2
1	1
select * from t1 where c1=2;
c1	c2
select * from t1 where c1=3;
c1	c2
select * from t1 where c1=4;
c1	c2
select * from t1;
c1	c2
0	1
1	1
select * from t1 where c1=1;
c1	c2
1	1
select * from t1 where c1=2;
c1	c2
select * from t1 where c1=3;
c1	c2
select * from t1 where c1=4;
c1	c2
select * from t1;
c1	c2
0	1
1	1
select * from t1 where c1=1;
c1	c2
1	1
select * from t1 where c1=2;
c1	c2
select * from t1 where c1=3;
c1	c2
select * from t1 where c1=4;
c1	c2
select * from t1;
c1	c2
0	1
1	1
select * from t1 where c1=1;
c1	c2
1	1
select * from t1 where c1=2;
c1	c2
select * from t1 where c1=3;
c1	c2
select * from t1 where c1=4;
c1	c2
select * from t1;
c1	c2
0	1
1	1
select * from t1 where c1=1;
c1	c2
1	1
select * from t1 where c1=2;
c1	c2
select * from t1 where c1=3;
c1	c2
select * from t1 where c1=4;
c1	c2
select * from t1;
c1	c2
0	1
1	1
select * from t1 where c1=1;
c1	c2
1	1
select * from t1 where c1=2;
c1	c2
select * from t1 where c1=3;
c1	c2
select * from t1 where c1=4;
c1	c2
select * from t1;
c1	c2
0	1
1	1
select * from t1 where c1=1;
c1	c2
1	1
select * from t1 where c1=2;
c1	c2
select * from t1 where c1=3;
c1	c2
select * from t1 where c1=4;
c1	c2
select * from t1;
c1	c2
0	1
1	1
select * from t1 where c1=1;
c1	c2
1	1
select * from t1 where c1=2;
c1	c2
select * from t1 where c1=3;
c1	c2
select * from t1 where c1=4;
c1	c2
select * from t1;
c1	c2
0	1
1	1
select * from t1 where c1=1;
c1	c2
1	1
select * from t1 where c1=2;
c1	c2
select * from t1 where c1=3;
c1	c2
select * from t1 where c1=4;
c1	c2
select * from t1;
c1	c2
0	1
1	1
select * from t1 where c1=1;
c1	c2
1	1
select * from t1 where c1=2;
c1	c2
select * from t1 where c1=3;
c1	c2
select * from t1 where c1=4;
c1	c2
select * from t1;
c1	c2
0	1
1	1
select * from t1 where c1=1;
c1	c2
1	1
select * from t1 where c1=2;
c1	c2
select * from t1 where c1=3;
c1	c2
select * from t1 where c1=4;
c1	c2
select * from t1;
c1	c2
0	1
1	1
select * from t1 where c1=1;
c1	c2
1	1
select * from t1 where c1=2;
c1	c2
select * from t1 where c1=3;
c1	c2
select * from t1 where c1=4;
c1	c2
select * from t1;
c1	c2
0	1
1	1
select * from t1 where c1=1;
c1	c2
1	1
select * from t1 where c1=2;
c1	c2
select * from t1 where c1=3;
c1	c2
select * from t1 where c1=4;
c1	c2
select * from t1;
c1	c2
0	1
1	1
select * from t1 where c1=1;
c1	c2
1	1
select * from t1 where c1=2;
c1	c2
select * from t1 where c1=3;
c1	c2
select * from t1 where c1=4;
c1	c2
select * from t1;
c1	c2
0	1
1	1
select * from t1 where c1=1;
c1	c2
1	1
select * from t1 where c1=2;
c1	c2
select * from t1 where c1=3;
c1	c2
select * from t1 where c1=4;
c1	c2
select * from t1;
c1	c2
0	1
1	1
select * from t1 where c1=1;
c1	c2
1	1
select * from t1 where c1=2;
c1	c2
select * from t1 where c1=3;
c1	c2
select * from t1 where c1=4;
c1	c2
select * from t1;
c1	c2
0	1
1	1
select * from t1 where c1=1;
c1	c2
1	1
select * from t1 where c1=2;
c1	c2
select * from t1 where c1=3;
c1	c2
select * from t1 where c1=4;
c1	c2
select * from t1;
c1	c2
0	1
1	1
select * from t1 where c1=1;
c1	c2
1	1
select * from t1 where c1=2;
c1	c2
select * from t1 where c1=3;
c1	c2
select * from t1 where c1=4;
c1	c2
select * from t1;
c1	c2
0	1
1	1
select * from t1 where c1=1;
c1	c2
1	1
select * from t1 where c1=2;
c1	c2
select * from t1 where c1=3;
c1	c2
select * from t1 where c1=4;
c1	c2
select * from t1;
c1	c2
0	1
1	1
select * from t1 where c1=1;
c1	c2
1	1
select * from t1 where c1=2;
c1	c2
select * from t1 where c1=3;
c1	c2
select * from t1 where c1=4;
c1	c2
select * from t1;
c1	c2
0	1
1	1
select * from t1 where c1=1;
c1	c2
1	1
select * from t1 where c1=2;
c1	c2
select * from t1 where c1=3;
c1	c2
select * from t1 where c1=4;
c1	c2
select * from t1;
c1	c2
0	1
1	1
select * from t1 where c1=1;
c1	c2
1	1
select * from t1 where c1=2;
c1	c2
select * from t1 where c1=3;
c1	c2
select * from t1 where c1=4;
c1	c2
select * from t1;
c1	c2
0	1
1	1
select * from t1 where c1=1;
c1	c2
1	1
select * from t1 where c1=2;
c1	c2
select * from t1 where c1=3;
c1	c2
select * from t1 where c1=4;
c1	c2
select * from t1;
c1	c2
0	1
1	1
select * from t1 where c1=1;
c1	c2
1	1
select * from t1 where c1=2;
c1	c2
select * from t1 where c1=3;
c1	c2
select * from t1 where c1=4;
c1	c2
select * from t1;
c1	c2
0	1
1	1
select * from t1 where c1=1;
c1	c2
1	1
select * from t1 where c1=2;
c1	c2
select * from t1 where c1=3;
c1	c2
select * from t1 where c1=4;
c1	c2
select * from t1;
c1	c2
0	1
1	1
select * from t1 where c1=1;
c1	c2
1	1
select * from t1 where c1=2;
c1	c2
select * from t1 where c1=3;
c1	c2
select * from t1 where c1=4;
c1	c2
select * from t1;
c1	c2
0	1
1	1
select * from t1 where c1=1;
c1	c2
1	1
select * from t1 where c1=2;
c1	c2
select * from t1 where c1=3;
c1	c2
select * from t1 where c1=4;
c1	c2
select * from t1;
c1	c2
0	1
1	1
select * from t1 where c1=1;
c1	c2
1	1
select * from t1 where c1=2;
c1	c2
select * from t1 where c1=3;
c1	c2
select * from t1 where c1=4;
c1	c2
select * from t1;
c1	c2
0	1
1	1
select * from t1 where c1=1;
c1	c2
1	1
select * from t1 where c1=2;
c1	c2
select * from t1 where c1=3;
c1	c2
select * from t1 where c1=4;
c1	c2
select * from t1;
c1	c2
0	1
1	1
select * from t1 where c1=1;
c1	c2
1	1
select * from t1 where c1=2;
c1	c2
select * from t1 where c1=3;
c1	c2
select * from t1 where c1=4;
c1	c2
select * from t1;
c1	c2
0	1
1	1
select * from t1 where c1=1;
c1	c2
1	1
select * from t1 where c1=2;
c1	c2
select * from t1 where c1=3;
c1	c2
select * from t1 where c1=4;
c1	c2
select * from t1;
c1	c2
0	1
1	1
select * from t1 where c1=1;
c1	c2
1	1
select * from t1 where c1=2;
c1	c2
select * from t1 where c1=3;
c1	c2
select * from t1 where c1=4;
c1	c2
select * from t1;
c1	c2
0	1
1	1
select * from t1 where c1=1;
c1	c2
1	1
select * from t1 where c1=2;
c1	c2
select * from t1 where c1=3;
c1	c2
select * from t1 where c1=4;
c1	c2
select * from t1;
c1	c2
0	1
1	1
select * from t1 where c1=1;
c1	c2
1	1
select * from t1 where c1=2;
c1	c2
select * from t1 where c1=3;
c1	c2
select * from t1 where c1=4;
c1	c2
select * from t1;
c1	c2
0	1
1	1
select * from t1 where c1=1;
c1	c2
1	1
select * from t1 where c1=2;
c1	c2
select * from t1 where c1=3;
c1	c2
select * from t1 where c1=4;
c1	c2
select * from t1;
c1	c2
0	1
1	1
select * from t1 where c1=1;
c1	c2
1	1
select * from t1 where c1=2;
c1	c2
select * from t1 where c1=3;
c1	c2
select * from t1 where c1=4;
c1	c2
select * from t1;
c1	c2
0	1
1	1
select * from t1 where c1=1;
c1	c2
1	1
select * from t1 where c1=2;
c1	c2
select * from t1 where c1=3;
c1	c2
select * from t1 where c1=4;
c1	c2
select * from t1;
c1	c2
0	1
1	1
select * from t1 where c1=1;
c1	c2
1	1
select * from t1 where c1=2;
c1	c2
select * from t1 where c1=3;
c1	c2
select * from t1 where c1=4;
c1	c2
select * from t1;
c1	c2
0	1
1	1
select * from t1 where c1=1;
c1	c2
1	1
select * from t1 where c1=2;
c1	c2
select * from t1 where c1=3;
c1	c2
select * from t1 where c1=4;
c1	c2
select * from t1;
c1	c2
0	1
1	1
select * from t1 where c1=1;
c1	c2
1	1
select * from t1 where c1=2;
c1	c2
select * from t1 where c1=3;
c1	c2
select * from t1 where c1=4;
c1	c2
select * from t1;
c1	c2
0	1
1	1
select * from t1 where c1=1;
c1	c2
1	1
select * from t1 where c1=2;
c1	c2
select * from t1 where c1=3;
c1	c2
select * from t1 where c1=4;
c1	c2
select * from t1;
c1	c2
0	1
1	1
select * from t1 where c1=1;
c1	c2
1	1
select * from t1 where c1=2;
c1	c2
select * from t1 where c1=3;
c1	c2
select * from t1 where c1=4;
c1	c2
select * from t1;
c1	c2
0	1
1	1
select * from t1 where c1=1;
c1	c2
1	1
select * from t1 where c1=2;
c1	c2
select * from t1 where c1=3;
c1	c2
select * from t1 where c1=4;
c1	c2
select * from t1;
c1	c2
0	1
1	1
select * from t1 where c1=1;
c1	c2
1	1
select * from t1 where c1=2;
c1	c2
select * from t1 where c1=3;
c1	c2
select * from t1 where c1=4;
c1	c2
select * from t1;
c1	c2
0	1
1	1
select * from t1 where c1=1;
c1	c2
1	1
select * from t1 where c1=2;
c1	c2
select * from t1 where c1=3;
c1	c2
select * from t1 where c1=4;
c1	c2
select * from t1;
c1	c2
0	1
1	1
select * from t1 where c1=1;
c1	c2
1	1
select * from t1 where c1=2;
c1	c2
select * from t1 where c1=3;
c1	c2
select * from t1 where c1=4;
c1	c2
select * from t1;
c1	c2
0	1
1	1
select * from t1 where c1=1;
c1	c2
1	1
select * from t1 where c1=2;
c1	c2
select * from t1 where c1=3;
c1	c2
select * from t1 where c1=4;
c1	c2
select * from t1;
c1	c2
0	1
1	1
select * from t1 where c1=1;
c1	c2
1	1
select * from t1 where c1=2;
c1	c2
select * from t1 where c1=3;
c1	c2
select * from t1 where c1=4;
c1	c2
select * from t1;
c1	c2
0	1
1	1
select * from t1 where c1=1;
c1	c2
1	1
select * from t1 where c1=2;
c1	c2
select * from t1 where c1=3;
c1	c2
select * from t1 where c1=4;
c1	c2
select * from t1;
c1	c2
0	1
1	1
select * from t1 where c1=1;
c1	c2
1	1
select * from t1 where c1=2;
c1	c2
select * from t1 where c1=3;
c1	c2
select * from t1 where c1=4;
c1	c2
select * from t1;
c1	c2
0	1
1	1
select * from t1 where c1=1;
c1	c2
1	1
select * from t1 where c1=2;
c1	c2
select * from t1 where c1=3;
c1	c2
select * from t1 where c1=4;
c1	c2
select * from t1;
c1	c2
0	1
1	1
select * from t1 where c1=1;
c1	c2
1	1
select * from t1 where c1=2;
c1	c2
select * from t1 where c1=3;
c1	c2
select * from t1 where c1=4;
c1	c2
select * from t1;
c1	c2
0	1
1	1
select * from t1 where c1=1;
c1	c2
1	1
select * from t1 where c1=2;
c1	c2
select * from t1 where c1=3;
c1	c2
select * from t1 where c1=4;
c1	c2
select * from t1;
c1	c2
0	1
1	1
select * from t1 where c1=1;
c1	c2
1	1
select * from t1 where c1=2;
c1	c2
select * from t1 where c1=3;
c1	c2
select * from t1 where c1=4;
c1	c2
select * from t1;
c1	c2
0	1
1	1
select * from t1 where c1=1;
c1	c2
1	1
select * from t1 where c1=2;
c1	c2
select * from t1 where c1=3;
c1	c2
select * from t1 where c1=4;
c1	c2
select * from t1;
c1	c2
0	1
1	1
select * from t1 where c1=1;
c1	c2
1	1
select * from t1 where c1=2;
c1	c2
select * from t1 where c1=3;
c1	c2
select * from t1 where c1=4;
c1	c2
select * from t1;
c1	c2
0	1
1	1
select * from t1 where c1=1;
c1	c2
1	1
select * from t1 where c1=2;
c1	c2
select * from t1 where c1=3;
c1	c2
select * from t1 where c1=4;
c1	c2
select * from t1;
c1	c2
0	1
1	1
select * from t1 where c1=1;
c1	c2
1	1
select * from t1 where c1=2;
c1	c2
select * from t1 where c1=3;
c1	c2
select * from t1 where c1=4;
c1	c2
select * from t1;
c1	c2
0	1
1	1
select * from t1 where c1=1;
c1	c2
1	1
select * from t1 where c1=2;
c1	c2
select * from t1 where c1=3;
c1	c2
select * from t1 where c1=4;
c1	c2
select * from t1;
c1	c2
0	1
1	1
select * from t1 where c1=1;
c1	c2
1	1
select * from t1 where c1=2;
c1	c2
select * from t1 where c1=3;
c1	c2
select * from t1 where c1=4;
c1	c2
select * from t1;
c1	c2
0	1
1	1
select * from t1 where c1=1;
c1	c2
1	1
select * from t1 where c1=2;
c1	c2
select * from t1 where c1=3;
c1	c2
select * from t1 where c1=4;
c1	c2
select * from t1;
c1	c2
0	1
1	1
select * from t1 where c1=1;
c1	c2
1	1
select * from t1 where c1=2;
c1	c2
select * from t1 where c1=3;
c1	c2
select * from t1 where c1=4;
c1	c2
select * from t1;
c1	c2
0	1
1	1
select * from t1 where c1=1;
c1	c2
1	1
select * from t1 where c1=2;
c1	c2
select * from t1 where c1=3;
c1	c2
select * from t1 where c1=4;
c1	c2
select * from t1;
c1	c2
0	1
1	1
select * from t1 where c1=1;
c1	c2
1	1
select * from t1 where c1=2;
c1	c2
select * from t1 where c1=3;
c1	c2
select * from t1 where c1=4;
c1	c2
select * from t1;
c1	c2
0	1
1	1
select * from t1 where c1=1;
c1	c2
1	1
select * from t1 where c1=2;
c1	c2
select * from t1 where c1=3;
c1	c2
select * from t1 where c1=4;
c1	c2
select * from t1;
c1	c2
0	1
1	1
select * from t1 where c1=1;
c1	c2
1	1
select * from t1 where c1=2;
c1	c2
select * from t1 where c1=3;
c1	c2
select * from t1 where c1=4;
c1	c2
select * from t1;
c1	c2
0	1
1	1
select * from t1 where c1=1;
c1	c2
1	1
select * from t1 where c1=2;
c1	c2
select * from t1 where c1=3;
c1	c2
select * from t1 where c1=4;
c1	c2
select * from t1;
c1	c2
0	1
1	1
select * from t1 where c1=1;
c1	c2
1	1
select * from t1 where c1=2;
c1	c2
select * from t1 where c1=3;
c1	c2
select * from t1 where c1=4;
c1	c2
select * from t1;
c1	c2
0	1
1	1
select * from t1 where c1=1;
c1	c2
1	1
select * from t1 where c1=2;
c1	c2
select * from t1 where c1=3;
c1	c2
select * from t1 where c1=4;
c1	c2
select * from t1;
c1	c2
0	1
1	1
select * from t1 where c1=1;
c1	c2
1	1
select * from t1 where c1=2;
c1	c2
select * from t1 where c1=3;
c1	c2
select * from t1 where c1=4;
c1	c2
select * from t1;
c1	c2
0	1
1	1
select * from t1 where c1=1;
c1	c2
1	1
select * from t1 where c1=2;
c1	c2
select * from t1 where c1=3;
c1	c2
select * from t1 where c1=4;
c1	c2
select * from t1;
c1	c2
0	1
1	1
select * from t1 where c1=1;
c1	c2
1	1
select * from t1 where c1=2;
c1	c2
select * from t1 where c1=3;
c1	c2
select * from t1 where c1=4;
c1	c2
select * from t1;
c1	c2
0	1
1	1
select * from t1 where c1=1;
c1	c2
1	1
select * from t1 where c1=2;
c1	c2
select * from t1 where c1=3;
c1	c2
select * from t1 where c1=4;
c1	c2
select * from t1;
c1	c2
0	1
1	1
select * from t1 where c1=1;
c1	c2
1	1
select * from t1 where c1=2;
c1	c2
select * from t1 where c1=3;
c1	c2
select * from t1 where c1=4;
c1	c2
select * from t1;
c1	c2
0	1
1	1
select * from t1 where c1=1;
c1	c2
1	1
select * from t1 where c1=2;
c1	c2
select * from t1 where c1=3;
c1	c2
select * from t1 where c1=4;
c1	c2
select * from t1;
c1	c2
0	1
1	1
select * from t1 where c1=1;
c1	c2
1	1
select * from t1 where c1=2;
c1	c2
select * from t1 where c1=3;
c1	c2
select * from t1 where c1=4;
c1	c2
select * from t1;
c1	c2
0	1
1	1
select * from t1 where c1=1;
c1	c2
1	1
select * from t1 where c1=2;
c1	c2
select * from t1 where c1=3;
c1	c2
select * from t1 where c1=4;
c1	c2
select * from t1;
c1	c2
0	1
1	1
select * from t1 where c1=1;
c1	c2
1	1
select * from t1 where c1=2;
c1	c2
select * from t1 where c1=3;
c1	c2
select * from t1 where c1=4;
c1	c2
select * from t1;
c1	c2
0	1
1	1
select * from t1 where c1=1;
c1	c2
1	1
select * from t1 where c1=2;
c1	c2
select * from t1 where c1=3;
c1	c2
select * from t1 where c1=4;
c1	c2
select * from t1;
c1	c2
0	1
1	1
select * from t1 where c1=1;
c1	c2
1	1
select * from t1 where c1=2;
c1	c2
select * from t1 where c1=3;
c1	c2
select * from t1 where c1=4;
c1	c2
select * from t1;
c1	c2
0	1
1	1
select * from t1 where c1=1;
c1	c2
1	1
select * from t1 where c1=2;
c1	c2
select * from t1 where c1=3;
c1	c2
select * from t1 where c1=4;
c1	c2
select * from t1;
c1	c2
0	1
1	1
select * from t1 where c1=1;
c1	c2
1	1
select * from t1 where c1=2;
c1	c2
select * from t1 where c1=3;
c1	c2
select * from t1 where c1=4;
c1	c2
select * from t1;
c1	c2
0	1
1	1
select * from t1 where c1=1;
c1	c2
1	1
select * from t1 where c1=2;
c1	c2
select * from t1 where c1=3;
c1	c2
select * from t1 where c1=4;
c1	c2
select * from t1;
c1	c2
0	1
1	1
select * from t1 where c1=1;
c1	c2
1	1
select * from t1 where c1=2;
c1	c2
select * from t1 where c1=3;
c1	c2
select * from t1 where c1=4;
c1	c2
select * from t1;
c1	c2
0	1
1	1
select * from t1 where c1=1;
c1	c2
1	1
select * from t1 where c1=2;
c1	c2
select * from t1 where c1=3;
c1	c2
select * from t1 where c1=4;
c1	c2
select * from t1;
c1	c2
0	1
1	1
select * from t1 where c1=1;
c1	c2
1	1
select * from t1 where c1=2;
c1	c2
select * from t1 where c1=3;
c1	c2
select * from t1 where c1=4;
c1	c2
select * from t1;
c1	c2
0	1
1	1
select * from t1 where c1=1;
c1	c2
1	1
select * from t1 where c1=2;
c1	c2
select * from t1 where c1=3;
c1	c2
select * from t1 where c1=4;
c1	c2
select * from t1;
c1	c2
0	1
1	1
select * from t1 where c1=1;
c1	c2
1	1
select * from t1 where c1=2;
c1	c2
select * from t1 where c1=3;
c1	c2
select * from t1 where c1=4;
c1	c2
select * from t1;
c1	c2
0	1
1	1
select * from t1 where c1=1;
c1	c2
1	1
select * from t1 where c1=2;
c1	c2
select * from t1 where c1=3;
c1	c2
select * from t1 where c1=4;
c1	c2
select * from t1;
c1	c2
0	1
1	1
select * from t1 where c1=1;
c1	c2
1	1
select * from t1 where c1=2;
c1	c2
select * from t1 where c1=3;
c1	c2
select * from t1 where c1=4;
c1	c2
select * from t1;
c1	c2
0	1
1	1
select * from t1 where c1=1;
c1	c2
1	1
select * from t1 where c1=2;
c1	c2
select * from t1 where c1=3;
c1	c2
select * from t1 where c1=4;
c1	c2
select * from t1;
c1	c2
0	1
1	1
select * from t1 where c1=1;
c1	c2
1	1
select * from t1 where c1=2;
c1	c2
select * from t1 where c1=3;
c1	c2
select * from t1 where c1=4;
c1	c2
select * from t1;
c1	c2
0	1
1	1
select * from t1 where c1=1;
c1	c2
1	1
select * from t1 where c1=2;
c1	c2
select * from t1 where c1=3;
c1	c2
select * from t1 where c1=4;
c1	c2
select * from t1;
c1	c2
0	1
1	1
select * from t1 where c1=1;
c1	c2
1	1
select * from t1 where c1=2;
c1	c2
select * from t1 where c1=3;
c1	c2
select * from t1 where c1=4;
c1	c2
select * from t1;
c1	c2
0	1
1	1
select * from t1 where c1=1;
c1	c2
1	1
select * from t1 where c1=2;
c1	c2
select * from t1 where c1=3;
c1	c2
select * from t1 where c1=4;
c1	c2
select * from t1;
c1	c2
0	1
1	1
select * from t1 where c1=1;
c1	c2
1	1
select * from t1 where c1=2;
c1	c2
select * from t1 where c1=3;
c1	c2
select * from t1 where c1=4;
c1	c2
select * from t1;
c1	c2
0	1
1	1
select * from t1 where c1=1;
c1	c2
1	1
select * from t1 where c1=2;
c1	c2
select * from t1 where c1=3;
c1	c2
select * from t1 where c1=4;
c1	c2
rollback;
case 2 compound fail in trx
update t1 set c2=c2+1 where c1=0 when row_count(insert into t1 values(1,1) when row_count(update t1 set c2=c2+1 where c1=1)=1)=1;
ERROR 23000: Duplicate entry ' <3001.16>=int:1' for key 'PRIMARY'
insert into t1 values(2,2);
commit;
select * from t1;
c1	c2
0	1
1	1
2	2
select * from t1 where c1=0;
c1	c2
0	1
select * from t1 where c1=2;
c1	c2
2	2
select * from t1 where c1=1;
c1	c2
1	1
commit;
update t1 set c2=c2+1 where c1=0 when row_count(insert into t1 values(1,1) when row_count(update t1 set c2=c2+1 where c1=1)=1)=1;
ERROR 23000: Duplicate entry ' <3001.16>=int:1' for key 'PRIMARY'
update t1 set c2=-2 where c1=2;
commit;
select * from t1;
c1	c2
0	1
1	1
2	-2
select * from t1 where c1=0;
c1	c2
0	1
select * from t1 where c1=2;
c1	c2
2	-2
select * from t1 where c1=1;
c1	c2
1	1
commit;
update t1 set c2=c2+1 where c1=0 when row_count(insert into t1 values(1,1) when row_count(update t1 set c2=c2+1 where c1=1)=1)=1;
ERROR 23000: Duplicate entry ' <3001.16>=int:1' for key 'PRIMARY'
insert into t1 values(1,1);
ERROR 23000: Duplicate entry ' <3001.16>=int:1' for key 'PRIMARY'
commit;
select * from t1 where c1=1;
c1	c2
1	1
select * from t1 where c1=0;
c1	c2
0	1
select * from t1 where c1=2;
c1	c2
2	-2
commit;
update t1 set c2=c2+1 where c1=0 when row_count(insert into t1 values(1,1) when row_count(update t1 set c2=c2+1 where c1=1)=1)=1;
ERROR 23000: Duplicate entry ' <3001.16>=int:1' for key 'PRIMARY'
update t1 set c2=0 where c1=100;
commit;
select * from t1 where c1=1;
c1	c2
1	1
select * from t1 where c1=0;
c1	c2
0	1
select * from t1 where c1=2;
c1	c2
2	-2
select * from t1 where c1=100;
c1	c2
commit;
update t1 set c2=c2+1 where c1=0 when row_count(insert into t1 values(1,1) when row_count(update t1 set c2=c2+1 where c1=1)=1)=1;
ERROR 23000: Duplicate entry ' <3001.16>=int:1' for key 'PRIMARY'
delete from t1 where c1=100;
commit;
select * from t1 where c1=1;
c1	c2
1	1
select * from t1 where c1=0;
c1	c2
0	1
select * from t1 where c1=2;
c1	c2
2	-2
select * from t1 where c1=100;
c1	c2
commit;
ob1.$m_ups.status;
master
ob1.$s_ups.status;
sync
