ob1=OBI(cluster=1211);
ob1.reboot;
ob1.mysql set global ob_read_consistency=3;
ob1.mysql_p show variables like 'ob_read_consistency';
variable_name	value
ob_read_consistency	3
ob1.mysql_p select name,value from __all_sys_config_stat where name = 'read_master_master_ups_percent' or name = 'read_slave_master_ups_percent';
name	value
read_master_master_ups_percent	50
read_slave_master_ups_percent	50
ob1.$m_ups.status;
master
ob1.$s_ups.status;
sync
ob1.create_client;
drop table if exists t1;
create table t1(c1 int primary key, c2 int);
ob1.connect conn1;
set autocommit=0;
set session ob_tx_timeout=10000000;
ob1.connect conn2;
set autocommit=0;
case 3 free lock man
update t1 set c2=c2+1 where c1=2;
update t1 set c2=c2+1 where c1=2;
commit;
select * from t1 where c1=2;
c1	c2
commit;
update t1 set c2=c2+1 where c1=2;
update t1 set c2=c2+1 where c1=2;
rollback;
commit;
select * from t1 where c1=2;
c1	c2
commit;
update t1 set c2=c2+1 where c1=2;
update t1 set c2=c2+1 where c1=2;
commit;
ERROR UNKNOWN: failed to start a transaction
commit;
select * from t1 where c1=2;
c1	c2
commit;
insert into t1  values(2,2);
replace into t1  values(2,2);
commit;
select * from t1 where c1=2;
c1	c2
2	2
commit;
delete  from t1 where c1=2;
commit;
insert into t1  values(2,2);
replace into t1  values(2,2);
rollback;
commit;
select * from t1 where c1=2;
c1	c2
2	2
commit;
delete  from t1 where c1=2;
commit;
insert into t1  values(2,2);
replace into t1  values(2,2);
commit;
ERROR UNKNOWN: failed to start a transaction
commit;
select * from t1 where c1=2;
c1	c2
2	2
commit;
select * from t1 where c1=2 for update;
c1	c2
2	2
select * from t1 where c1=2 for update;
commit;
ERROR UNKNOWN: failed to start a transaction
c1	c2
2	2
commit;
select * from t1 where c1=2;
c1	c2
2	2
commit;
select * from t1 where c1=2 for update;
c1	c2
2	2
select * from t1 where c1=2 for update;
commit;
c1	c2
2	2
select * from t1 where c1=2;
c1	c2
2	2
commit;
select * from t1 where c1=2 for update;
c1	c2
2	2
select * from t1 where c1=2 for update;
rollback;
c1	c2
2	2
commit;
select * from t1 where c1=2;
c1	c2
2	2
commit;
delete from t1 where c1=2;
delete from t1 where c1=2;
commit;
ERROR UNKNOWN: failed to start a transaction
commit;
select * from t1 where c1=2;
c1	c2
commit;
delete from t1 where c1=2;
delete from t1 where c1=2;
commit;
select * from t1 where c1=2;
c1	c2
commit;
delete from t1 where c1=2;
delete from t1 where c1=2;
rollback;
commit;
select * from t1 where c1=2;
c1	c2
commit;
ob1.$m_ups.status;
master
ob1.$s_ups.status;
sync
