ob1=OBI(cluster=2244,use_vip=1)
ob1.reboot
ob1.create_client
create table t1(a int primary key,b int);
insert into t1 values(1,1),(-1,0),(-2,-2),(10,10);
select * from t1;
a	b
-2	-2
-1	0
1	1
10	10
ob1.migrateHA
update t1 set b=200 where a=-2;
select * from t1;
a	b
-2	200
-1	0
1	1
10	10
drop table t1;
