ob1=OBI(cluster=2244,use_vip=1)
ob1.reboot
ob1.source include/merge.inc
ob1.create_client
ob1.prepare
create table t1(a int primary key,b int);
insert into t1 values(1,1),(-1,0),(-2,-2),(10,10);
select * from t1;
a	b
-2	-2
-1	0
1	1
10	10
ob1.major_freeze
ob1.check_cs_version 2
ob1.rs_admin clean_root_table
ob1.cleanHA
ob1.$a.setfailcount 1
update t1 set b=200 where a=-2;
select * from t1;
a	b
-2	200
-1	0
1	1
10	10
drop table t1;
ob1.major_freeze
ob1.check_cs_version 3
