ob1=OBI(cluster=1244)
ob2=OBI(cluster=1244)
ob2.rs0.set master=ob1.rs0
ob1.reboot
ob2.reboot
ob1.create_client
ob1.prepare
create table t1(c1 int primary key,c2 int);
ob1.start_check
insert into t1 values(1,1),(2,2),(3,3),(4,4);
select * from t1;
c1	c2
1	1
2	2
3	3
4	4
drop table t1;
create table t2(a int primary key,b int);
insert into t2 values (5,1),(6,2),(7,3),(8,4);
update t2 set b=10 where a=6;
select * from t2;
a	b
5	1
6	10
7	3
8	4
ob1.stop_check
