ob1=OBI(cluster=1244)
ob2=OBI(cluster=1244)
ob2.rs0.set master=ob1.rs0
ob1.reboot
ob2.reboot
ob1.mysql create table t1(a int primary key,b int)
ob1.mysql insert into t1 values(1,2),(2,2),(3,3)
ob1.mysql set global ob_read_consistency=3
ob1.rs0.set_obi_role OBI_SLAVE
ob1.create_client
select * from t1;
a	b
1	2
2	2
3	3
ob1.rs0.set_obi_role OBI_MASTER
update t1 set b = 10 where a=1;
select * from t1;
a	b
1	10
2	2
3	3
drop table t1;
