ob1=OBI(cluster=1111);
ob1.reboot;
ob1.mysql set global  ob_charset='utf8';
ob1.set_dsconfig dsConfig=maxActive:8,minIdle:4,connectionProperties:emulateUnsupportedPstmts=false;characterEncoding=utf8;useServerPrepStmts=true;prepStmtCacheSqlLimit=1000;enableQueryTimeouts=true;useLocalSessionState=false;useLocalTransactionState=false;
ob1.create_client;
ob1.connect conn1 fs0 admin admin test;
drop table if exists t1;
create table t1(c1 int primary key, c2 varchar(200));
replace into t1 values(1, '中国');
insert into t1 values(2,'羽兰'),(3,'路飞'),(4,'乔巴');
select * from t1;
c1	c2
1	中国
2	羽兰
3	路飞
4	乔巴
update t1 set c2='山治' where c1=3;
select * from t1;
c1	c2
1	中国
2	羽兰
3	山治
4	乔巴
delete from t1 where c1=4;
select * from t1;
c1	c2
1	中国
2	羽兰
3	山治
ob1.connect conn2 fs0 admin admin test;
ob1.mysql set global  ob_charset='gbk';
select * from t1;
c1	c2
1	涓浗
2	缇藉叞
3	灞辨不
ob1.connect conn3 fs0 admin admin test;
ob1.mysql set global ob_charset='gbk';
drop table if exists t2;
create table t2(c1 int primary key, c2 varchar(200));
replace into t2 values(1, '中国');
insert into t2 values(2,'羽兰'),(3,'路飞'),(4,'乔巴');
select * from t2;
c1	c2
1	涓浗
2	缇藉叞
3	璺
4	涔斿反
update t2 set c2='山治' where c1=3;
select * from t2;
c1	c2
1	涓浗
2	缇藉叞
3	灞辨不
4	涔斿反
delete from t2 where c1=4;
select * from t2;
c1	c2
1	涓浗
2	缇藉叞
3	灞辨不
ob1.connect conn4 fs0 admin admin test;
ob1.mysql set global  ob_charset='utf8';
select * from t2;
c1	c2
1	中国
2	羽兰
3	山治
