ob1=OBI(cluster=1211);
ob1.reboot;
ob1.mysql set global ob_read_consistency=3;
ob1.mysql_p show variables like 'ob_read_consistency';
variable_name	value
ob_read_consistency	3
ob1.mysql_p select name,value from __all_sys_config_stat where name = 'read_master_master_ups_percent' or name = 'read_slave_master_ups_percent';
name	value
read_master_master_ups_percent	50
read_slave_master_ups_percent	50
ob1.$m_ups.status;
master
ob1.$s_ups.status;
sync
ob1.create_client;
create table t1(pk int primary key, c1 int);
ob1.connect conn1;
set autocommit=0;
ob1.connect trouble;
set autocommit=0;
ob1.connect checker;
set autocommit=1;
insert into t1 values(1,1);
insert into t1 values(1,2) when row_count(insert into t1 values(2,2))=1;
ERROR HY000: Exclusive lock conflict 'int:1' for key 'PRIMARY'
commit;
commit;
select * from t1;
pk	c1
1	1
select * from t1;
pk	c1
1	1
select * from t1;
pk	c1
1	1
select * from t1;
pk	c1
1	1
select * from t1;
pk	c1
1	1
select * from t1;
pk	c1
1	1
select * from t1;
pk	c1
1	1
select * from t1;
pk	c1
1	1
select * from t1;
pk	c1
1	1
select * from t1;
pk	c1
1	1
select * from t1;
pk	c1
1	1
select * from t1;
pk	c1
1	1
select * from t1;
pk	c1
1	1
select * from t1;
pk	c1
1	1
select * from t1;
pk	c1
1	1
select * from t1;
pk	c1
1	1
select * from t1;
pk	c1
1	1
select * from t1;
pk	c1
1	1
select * from t1;
pk	c1
1	1
select * from t1;
pk	c1
1	1
delete from t1 where pk=1;
ob1.$m_ups.status;
master
ob1.$s_ups.status;
sync
ob1.$m_ups.exist;
ob1.$s_ups.exist;
ob1.$m_ups.nfind_log "checksum_error";
ob1.$s_ups.nfind_log "checksum_error";
insert into t1 values(1,1);
insert into t1 values(2,2) when row_count(insert into t1 values(1,2))=1;
ERROR HY000: Exclusive lock conflict 'int:1' for key 'PRIMARY'
commit;
commit;
select * from t1;
pk	c1
1	1
select * from t1;
pk	c1
1	1
select * from t1;
pk	c1
1	1
select * from t1;
pk	c1
1	1
select * from t1;
pk	c1
1	1
select * from t1;
pk	c1
1	1
select * from t1;
pk	c1
1	1
select * from t1;
pk	c1
1	1
select * from t1;
pk	c1
1	1
select * from t1;
pk	c1
1	1
select * from t1;
pk	c1
1	1
select * from t1;
pk	c1
1	1
select * from t1;
pk	c1
1	1
select * from t1;
pk	c1
1	1
select * from t1;
pk	c1
1	1
select * from t1;
pk	c1
1	1
select * from t1;
pk	c1
1	1
select * from t1;
pk	c1
1	1
select * from t1;
pk	c1
1	1
select * from t1;
pk	c1
1	1
delete from t1 where pk=1;
ob1.$m_ups.status;
master
ob1.$s_ups.status;
sync
ob1.$m_ups.exist;
ob1.$s_ups.exist;
ob1.$m_ups.nfind_log "checksum_error";
ob1.$s_ups.nfind_log "checksum_error";
insert into t1 values(1,1);
insert into t1 values(2,2) when row_count(insert into t1 values(3,3))>=0;
rollback;
commit;
select * from t1;
pk	c1
1	1
select * from t1;
pk	c1
1	1
select * from t1;
pk	c1
1	1
select * from t1;
pk	c1
1	1
select * from t1;
pk	c1
1	1
select * from t1;
pk	c1
1	1
select * from t1;
pk	c1
1	1
select * from t1;
pk	c1
1	1
select * from t1;
pk	c1
1	1
select * from t1;
pk	c1
1	1
select * from t1;
pk	c1
1	1
select * from t1;
pk	c1
1	1
select * from t1;
pk	c1
1	1
select * from t1;
pk	c1
1	1
select * from t1;
pk	c1
1	1
select * from t1;
pk	c1
1	1
select * from t1;
pk	c1
1	1
select * from t1;
pk	c1
1	1
select * from t1;
pk	c1
1	1
select * from t1;
pk	c1
1	1
delete from t1 where pk=1;
ob1.$m_ups.status;
master
ob1.$s_ups.status;
sync
ob1.$m_ups.exist;
ob1.$s_ups.exist;
ob1.$m_ups.nfind_log "checksum_error";
ob1.$s_ups.nfind_log "checksum_error";
insert into t1 values(1,1);
insert into t1 values(1,2) when row_count(insert into t1 values(2,2))=1;
ERROR HY000: Exclusive lock conflict 'int:1' for key 'PRIMARY'
rollback;
commit;
select * from t1;
pk	c1
1	1
select * from t1;
pk	c1
1	1
select * from t1;
pk	c1
1	1
select * from t1;
pk	c1
1	1
select * from t1;
pk	c1
1	1
select * from t1;
pk	c1
1	1
select * from t1;
pk	c1
1	1
select * from t1;
pk	c1
1	1
select * from t1;
pk	c1
1	1
select * from t1;
pk	c1
1	1
select * from t1;
pk	c1
1	1
select * from t1;
pk	c1
1	1
select * from t1;
pk	c1
1	1
select * from t1;
pk	c1
1	1
select * from t1;
pk	c1
1	1
select * from t1;
pk	c1
1	1
select * from t1;
pk	c1
1	1
select * from t1;
pk	c1
1	1
select * from t1;
pk	c1
1	1
select * from t1;
pk	c1
1	1
delete from t1 where pk=1;
ob1.$m_ups.status;
master
ob1.$s_ups.status;
sync
ob1.$m_ups.exist;
ob1.$s_ups.exist;
ob1.$m_ups.nfind_log "checksum_error";
ob1.$s_ups.nfind_log "checksum_error";
insert into t1 values(1,1);
insert into t1 values(2,2) when row_count(insert into t1 values(1,2))=1;
ERROR HY000: Exclusive lock conflict 'int:1' for key 'PRIMARY'
rollback;
commit;
select * from t1;
pk	c1
1	1
select * from t1;
pk	c1
1	1
select * from t1;
pk	c1
1	1
select * from t1;
pk	c1
1	1
select * from t1;
pk	c1
1	1
select * from t1;
pk	c1
1	1
select * from t1;
pk	c1
1	1
select * from t1;
pk	c1
1	1
select * from t1;
pk	c1
1	1
select * from t1;
pk	c1
1	1
select * from t1;
pk	c1
1	1
select * from t1;
pk	c1
1	1
select * from t1;
pk	c1
1	1
select * from t1;
pk	c1
1	1
select * from t1;
pk	c1
1	1
select * from t1;
pk	c1
1	1
select * from t1;
pk	c1
1	1
select * from t1;
pk	c1
1	1
select * from t1;
pk	c1
1	1
select * from t1;
pk	c1
1	1
delete from t1 where pk=1;
ob1.$m_ups.status;
master
ob1.$s_ups.status;
sync
ob1.$m_ups.exist;
ob1.$s_ups.exist;
ob1.$m_ups.nfind_log "checksum_error";
ob1.$s_ups.nfind_log "checksum_error";
