ob1=OBI(cluster=1211)
ob1.reboot
ob1.mysql set global ob_read_consistency=3
ob1.$m_ups.status;
master
ob1.$s_ups.status;
sync
ob1.create_client
create table t1(pk int primary key, c1 int, c2 int);
insert into t1 values(1,1,1),(2,2,2);
set autocommit = 0;
insert into t1 values (3,3,3) when row_count(insert into t1 values(1,2,2))=1;
ERROR 23000: Duplicate entry ' <3001.16>=int:1' for key 'PRIMARY'
update t1 set c1=3 where pk=1;
commit;
select * from t1;
pk	c1	c2
1	3	1
2	2	2
select * from t1;
pk	c1	c2
1	3	1
2	2	2
select * from t1;
pk	c1	c2
1	3	1
2	2	2
select * from t1;
pk	c1	c2
1	3	1
2	2	2
select * from t1;
pk	c1	c2
1	3	1
2	2	2
select * from t1;
pk	c1	c2
1	3	1
2	2	2
select * from t1;
pk	c1	c2
1	3	1
2	2	2
select * from t1;
pk	c1	c2
1	3	1
2	2	2
select * from t1;
pk	c1	c2
1	3	1
2	2	2
select * from t1;
pk	c1	c2
1	3	1
2	2	2
insert into t1 values (3,3,3) when row_count(insert into t1 values(1,2,2))=1;
ERROR 23000: Duplicate entry ' <3001.16>=int:1' for key 'PRIMARY'
insert into t1 values(1,1,1);
ERROR 23000: Duplicate entry ' <3001.16>=int:1' for key 'PRIMARY'
commit;
select * from t1;
pk	c1	c2
1	3	1
2	2	2
select * from t1;
pk	c1	c2
1	3	1
2	2	2
select * from t1;
pk	c1	c2
1	3	1
2	2	2
select * from t1;
pk	c1	c2
1	3	1
2	2	2
select * from t1;
pk	c1	c2
1	3	1
2	2	2
select * from t1;
pk	c1	c2
1	3	1
2	2	2
select * from t1;
pk	c1	c2
1	3	1
2	2	2
select * from t1;
pk	c1	c2
1	3	1
2	2	2
select * from t1;
pk	c1	c2
1	3	1
2	2	2
select * from t1;
pk	c1	c2
1	3	1
2	2	2
set autocommit = 0;
insert into t1 values (3,3,3) when row_count(insert into t1 values(1,2,2))=1;
ERROR 23000: Duplicate entry ' <3001.16>=int:1' for key 'PRIMARY'
update t1 set c1=3 where pk=2;
commit;
select * from t1;
pk	c1	c2
1	3	1
2	3	2
select * from t1;
pk	c1	c2
1	3	1
2	3	2
select * from t1;
pk	c1	c2
1	3	1
2	3	2
select * from t1;
pk	c1	c2
1	3	1
2	3	2
select * from t1;
pk	c1	c2
1	3	1
2	3	2
select * from t1;
pk	c1	c2
1	3	1
2	3	2
select * from t1;
pk	c1	c2
1	3	1
2	3	2
select * from t1;
pk	c1	c2
1	3	1
2	3	2
select * from t1;
pk	c1	c2
1	3	1
2	3	2
select * from t1;
pk	c1	c2
1	3	1
2	3	2
insert into t1 values (3,3,3) when row_count(insert into t1 values(1,2,2))=1;
ERROR 23000: Duplicate entry ' <3001.16>=int:1' for key 'PRIMARY'
insert into t1 values(2,2,2);
ERROR 23000: Duplicate entry ' <3001.16>=int:2' for key 'PRIMARY'
commit;
select * from t1;
pk	c1	c2
1	3	1
2	3	2
select * from t1;
pk	c1	c2
1	3	1
2	3	2
select * from t1;
pk	c1	c2
1	3	1
2	3	2
select * from t1;
pk	c1	c2
1	3	1
2	3	2
select * from t1;
pk	c1	c2
1	3	1
2	3	2
select * from t1;
pk	c1	c2
1	3	1
2	3	2
select * from t1;
pk	c1	c2
1	3	1
2	3	2
select * from t1;
pk	c1	c2
1	3	1
2	3	2
select * from t1;
pk	c1	c2
1	3	1
2	3	2
select * from t1;
pk	c1	c2
1	3	1
2	3	2
insert into t1 values (3,3,3) when row_count(update t1 set c1=2 where pk=1)=5;
ERROR HY000: Number 1 When filter failed, ret=-5064, func 1: ROW_COUNT()=1
update t1 set c1=4 where pk=1;
commit;
select * from t1;
pk	c1	c2
1	4	1
2	3	2
select * from t1;
pk	c1	c2
1	4	1
2	3	2
select * from t1;
pk	c1	c2
1	4	1
2	3	2
select * from t1;
pk	c1	c2
1	4	1
2	3	2
select * from t1;
pk	c1	c2
1	4	1
2	3	2
select * from t1;
pk	c1	c2
1	4	1
2	3	2
select * from t1;
pk	c1	c2
1	4	1
2	3	2
select * from t1;
pk	c1	c2
1	4	1
2	3	2
select * from t1;
pk	c1	c2
1	4	1
2	3	2
select * from t1;
pk	c1	c2
1	4	1
2	3	2
insert into t1 values (3,3,3) when row_count(update t1 set c1=2 where pk=1)=5;
ERROR HY000: Number 1 When filter failed, ret=-5064, func 1: ROW_COUNT()=1
insert into t1 values(2,2,2);
ERROR 23000: Duplicate entry ' <3001.16>=int:2' for key 'PRIMARY'
commit;
select * from t1;
pk	c1	c2
1	4	1
2	3	2
select * from t1;
pk	c1	c2
1	4	1
2	3	2
select * from t1;
pk	c1	c2
1	4	1
2	3	2
select * from t1;
pk	c1	c2
1	4	1
2	3	2
select * from t1;
pk	c1	c2
1	4	1
2	3	2
select * from t1;
pk	c1	c2
1	4	1
2	3	2
select * from t1;
pk	c1	c2
1	4	1
2	3	2
select * from t1;
pk	c1	c2
1	4	1
2	3	2
select * from t1;
pk	c1	c2
1	4	1
2	3	2
select * from t1;
pk	c1	c2
1	4	1
2	3	2
insert into t1 values (3,3,3) when row_count(update t1 set c1=2 where pk=1)=5;
ERROR HY000: Number 1 When filter failed, ret=-5064, func 1: ROW_COUNT()=1
update t1 set c1=4 where pk=2;
commit;
select * from t1;
pk	c1	c2
1	4	1
2	4	2
select * from t1;
pk	c1	c2
1	4	1
2	4	2
select * from t1;
pk	c1	c2
1	4	1
2	4	2
select * from t1;
pk	c1	c2
1	4	1
2	4	2
select * from t1;
pk	c1	c2
1	4	1
2	4	2
select * from t1;
pk	c1	c2
1	4	1
2	4	2
select * from t1;
pk	c1	c2
1	4	1
2	4	2
select * from t1;
pk	c1	c2
1	4	1
2	4	2
select * from t1;
pk	c1	c2
1	4	1
2	4	2
select * from t1;
pk	c1	c2
1	4	1
2	4	2
insert into t1 values (3,3,3) when row_count(update t1 set c1=2 where pk=1)=5;
ERROR HY000: Number 1 When filter failed, ret=-5064, func 1: ROW_COUNT()=1
insert into t1 values(2,2,2);
ERROR 23000: Duplicate entry ' <3001.16>=int:2' for key 'PRIMARY'
commit;
select * from t1;
pk	c1	c2
1	4	1
2	4	2
select * from t1;
pk	c1	c2
1	4	1
2	4	2
select * from t1;
pk	c1	c2
1	4	1
2	4	2
select * from t1;
pk	c1	c2
1	4	1
2	4	2
select * from t1;
pk	c1	c2
1	4	1
2	4	2
select * from t1;
pk	c1	c2
1	4	1
2	4	2
select * from t1;
pk	c1	c2
1	4	1
2	4	2
select * from t1;
pk	c1	c2
1	4	1
2	4	2
select * from t1;
pk	c1	c2
1	4	1
2	4	2
select * from t1;
pk	c1	c2
1	4	1
2	4	2
insert into t1 values (1,1,1) when row_count(update t1 set c1=3 where pk=1)=1;
ERROR 23000: Duplicate entry ' <3001.16>=int:1' for key 'PRIMARY'
update t1 set c1=5 where pk=1;
commit;
select * from t1;
pk	c1	c2
1	5	1
2	4	2
select * from t1;
pk	c1	c2
1	5	1
2	4	2
select * from t1;
pk	c1	c2
1	5	1
2	4	2
select * from t1;
pk	c1	c2
1	5	1
2	4	2
select * from t1;
pk	c1	c2
1	5	1
2	4	2
select * from t1;
pk	c1	c2
1	5	1
2	4	2
select * from t1;
pk	c1	c2
1	5	1
2	4	2
select * from t1;
pk	c1	c2
1	5	1
2	4	2
select * from t1;
pk	c1	c2
1	5	1
2	4	2
select * from t1;
pk	c1	c2
1	5	1
2	4	2
insert into t1 values (1,1,1) when row_count(update t1 set c1=3 where pk=1)=1;
ERROR 23000: Duplicate entry ' <3001.16>=int:1' for key 'PRIMARY'
insert into t1 values(1,1,1);
ERROR 23000: Duplicate entry ' <3001.16>=int:1' for key 'PRIMARY'
commit;
select * from t1;
pk	c1	c2
1	5	1
2	4	2
select * from t1;
pk	c1	c2
1	5	1
2	4	2
select * from t1;
pk	c1	c2
1	5	1
2	4	2
select * from t1;
pk	c1	c2
1	5	1
2	4	2
select * from t1;
pk	c1	c2
1	5	1
2	4	2
select * from t1;
pk	c1	c2
1	5	1
2	4	2
select * from t1;
pk	c1	c2
1	5	1
2	4	2
select * from t1;
pk	c1	c2
1	5	1
2	4	2
select * from t1;
pk	c1	c2
1	5	1
2	4	2
select * from t1;
pk	c1	c2
1	5	1
2	4	2
insert into t1 values (1,1,1) when row_count(update t1 set c1=3 where pk=1)=1;
ERROR 23000: Duplicate entry ' <3001.16>=int:1' for key 'PRIMARY'
update t1 set c1=5 where pk=2;
commit;
select * from t1;
pk	c1	c2
1	5	1
2	5	2
select * from t1;
pk	c1	c2
1	5	1
2	5	2
select * from t1;
pk	c1	c2
1	5	1
2	5	2
select * from t1;
pk	c1	c2
1	5	1
2	5	2
select * from t1;
pk	c1	c2
1	5	1
2	5	2
select * from t1;
pk	c1	c2
1	5	1
2	5	2
select * from t1;
pk	c1	c2
1	5	1
2	5	2
select * from t1;
pk	c1	c2
1	5	1
2	5	2
select * from t1;
pk	c1	c2
1	5	1
2	5	2
select * from t1;
pk	c1	c2
1	5	1
2	5	2
insert into t1 values (1,1,1) when row_count(update t1 set c1=3 where pk=1)=1;
ERROR 23000: Duplicate entry ' <3001.16>=int:1' for key 'PRIMARY'
insert into t1 values(2,2,2);
ERROR 23000: Duplicate entry ' <3001.16>=int:2' for key 'PRIMARY'
commit;
select * from t1;
pk	c1	c2
1	5	1
2	5	2
select * from t1;
pk	c1	c2
1	5	1
2	5	2
select * from t1;
pk	c1	c2
1	5	1
2	5	2
select * from t1;
pk	c1	c2
1	5	1
2	5	2
select * from t1;
pk	c1	c2
1	5	1
2	5	2
select * from t1;
pk	c1	c2
1	5	1
2	5	2
select * from t1;
pk	c1	c2
1	5	1
2	5	2
select * from t1;
pk	c1	c2
1	5	1
2	5	2
select * from t1;
pk	c1	c2
1	5	1
2	5	2
select * from t1;
pk	c1	c2
1	5	1
2	5	2
insert into t1 values (1,1,1) when row_count(insert into t1 values(3,3,3))=1;
ERROR 23000: Duplicate entry ' <3001.16>=int:1' for key 'PRIMARY'
update t1 set c1=6 where pk=1;
commit;
select * from t1;
pk	c1	c2
1	6	1
2	5	2
select * from t1;
pk	c1	c2
1	6	1
2	5	2
select * from t1;
pk	c1	c2
1	6	1
2	5	2
select * from t1;
pk	c1	c2
1	6	1
2	5	2
select * from t1;
pk	c1	c2
1	6	1
2	5	2
select * from t1;
pk	c1	c2
1	6	1
2	5	2
select * from t1;
pk	c1	c2
1	6	1
2	5	2
select * from t1;
pk	c1	c2
1	6	1
2	5	2
select * from t1;
pk	c1	c2
1	6	1
2	5	2
select * from t1;
pk	c1	c2
1	6	1
2	5	2
insert into t1 values (1,1,1) when row_count(insert into t1 values(3,3,3))=1;
ERROR 23000: Duplicate entry ' <3001.16>=int:1' for key 'PRIMARY'
insert into t1 values(1,1,1);
ERROR 23000: Duplicate entry ' <3001.16>=int:1' for key 'PRIMARY'
commit;
select * from t1;
pk	c1	c2
1	6	1
2	5	2
select * from t1;
pk	c1	c2
1	6	1
2	5	2
select * from t1;
pk	c1	c2
1	6	1
2	5	2
select * from t1;
pk	c1	c2
1	6	1
2	5	2
select * from t1;
pk	c1	c2
1	6	1
2	5	2
select * from t1;
pk	c1	c2
1	6	1
2	5	2
select * from t1;
pk	c1	c2
1	6	1
2	5	2
select * from t1;
pk	c1	c2
1	6	1
2	5	2
select * from t1;
pk	c1	c2
1	6	1
2	5	2
select * from t1;
pk	c1	c2
1	6	1
2	5	2
insert into t1 values (1,1,1) when row_count(update t1 set c1=3 where pk=1)=5;
ERROR HY000: Number 1 When filter failed, ret=-5064, func 1: ROW_COUNT()=1
update t1 set c1=6 where pk=2;
commit;
select * from t1;
pk	c1	c2
1	6	1
2	6	2
select * from t1;
pk	c1	c2
1	6	1
2	6	2
select * from t1;
pk	c1	c2
1	6	1
2	6	2
select * from t1;
pk	c1	c2
1	6	1
2	6	2
select * from t1;
pk	c1	c2
1	6	1
2	6	2
select * from t1;
pk	c1	c2
1	6	1
2	6	2
select * from t1;
pk	c1	c2
1	6	1
2	6	2
select * from t1;
pk	c1	c2
1	6	1
2	6	2
select * from t1;
pk	c1	c2
1	6	1
2	6	2
select * from t1;
pk	c1	c2
1	6	1
2	6	2
insert into t1 values (1,1,1) when row_count(update t1 set c1=3 where pk=1)=5;
ERROR HY000: Number 1 When filter failed, ret=-5064, func 1: ROW_COUNT()=1
insert into t1 values(2,2,2);
ERROR 23000: Duplicate entry ' <3001.16>=int:2' for key 'PRIMARY'
commit;
select * from t1;
pk	c1	c2
1	6	1
2	6	2
select * from t1;
pk	c1	c2
1	6	1
2	6	2
select * from t1;
pk	c1	c2
1	6	1
2	6	2
select * from t1;
pk	c1	c2
1	6	1
2	6	2
select * from t1;
pk	c1	c2
1	6	1
2	6	2
select * from t1;
pk	c1	c2
1	6	1
2	6	2
select * from t1;
pk	c1	c2
1	6	1
2	6	2
select * from t1;
pk	c1	c2
1	6	1
2	6	2
select * from t1;
pk	c1	c2
1	6	1
2	6	2
select * from t1;
pk	c1	c2
1	6	1
2	6	2
set autocommit = 1;
delete from t1 where pk=3;
delete from t1 where pk=4;
delete from t1 where pk=5;
replace into t1 values(1,1,1),(2,2,2);
set autocommit = 0;
set autocommit = 0;
insert into t1 values (3,3,3) when row_count(insert into t1 values(1,2,2))=1;
ERROR 23000: Duplicate entry ' <3001.16>=int:1' for key 'PRIMARY'
update t1 set c1=3 where pk=1;
rollback;
select * from t1;
pk	c1	c2
1	1	1
2	2	2
select * from t1;
pk	c1	c2
1	1	1
2	2	2
select * from t1;
pk	c1	c2
1	1	1
2	2	2
select * from t1;
pk	c1	c2
1	1	1
2	2	2
select * from t1;
pk	c1	c2
1	1	1
2	2	2
select * from t1;
pk	c1	c2
1	1	1
2	2	2
select * from t1;
pk	c1	c2
1	1	1
2	2	2
select * from t1;
pk	c1	c2
1	1	1
2	2	2
select * from t1;
pk	c1	c2
1	1	1
2	2	2
select * from t1;
pk	c1	c2
1	1	1
2	2	2
insert into t1 values (3,3,3) when row_count(insert into t1 values(1,2,2))=1;
ERROR 23000: Duplicate entry ' <3001.16>=int:1' for key 'PRIMARY'
insert into t1 values(1,1,1);
ERROR 23000: Duplicate entry ' <3001.16>=int:1' for key 'PRIMARY'
rollback;
select * from t1;
pk	c1	c2
1	1	1
2	2	2
select * from t1;
pk	c1	c2
1	1	1
2	2	2
select * from t1;
pk	c1	c2
1	1	1
2	2	2
select * from t1;
pk	c1	c2
1	1	1
2	2	2
select * from t1;
pk	c1	c2
1	1	1
2	2	2
select * from t1;
pk	c1	c2
1	1	1
2	2	2
select * from t1;
pk	c1	c2
1	1	1
2	2	2
select * from t1;
pk	c1	c2
1	1	1
2	2	2
select * from t1;
pk	c1	c2
1	1	1
2	2	2
select * from t1;
pk	c1	c2
1	1	1
2	2	2
set autocommit = 0;
insert into t1 values (3,3,3) when row_count(insert into t1 values(1,2,2))=1;
ERROR 23000: Duplicate entry ' <3001.16>=int:1' for key 'PRIMARY'
update t1 set c1=3 where pk=2;
rollback;
select * from t1;
pk	c1	c2
1	1	1
2	2	2
select * from t1;
pk	c1	c2
1	1	1
2	2	2
select * from t1;
pk	c1	c2
1	1	1
2	2	2
select * from t1;
pk	c1	c2
1	1	1
2	2	2
select * from t1;
pk	c1	c2
1	1	1
2	2	2
select * from t1;
pk	c1	c2
1	1	1
2	2	2
select * from t1;
pk	c1	c2
1	1	1
2	2	2
select * from t1;
pk	c1	c2
1	1	1
2	2	2
select * from t1;
pk	c1	c2
1	1	1
2	2	2
select * from t1;
pk	c1	c2
1	1	1
2	2	2
insert into t1 values (3,3,3) when row_count(insert into t1 values(1,2,2))=1;
ERROR 23000: Duplicate entry ' <3001.16>=int:1' for key 'PRIMARY'
insert into t1 values(2,2,2);
ERROR 23000: Duplicate entry ' <3001.16>=int:2' for key 'PRIMARY'
rollback;
select * from t1;
pk	c1	c2
1	1	1
2	2	2
select * from t1;
pk	c1	c2
1	1	1
2	2	2
select * from t1;
pk	c1	c2
1	1	1
2	2	2
select * from t1;
pk	c1	c2
1	1	1
2	2	2
select * from t1;
pk	c1	c2
1	1	1
2	2	2
select * from t1;
pk	c1	c2
1	1	1
2	2	2
select * from t1;
pk	c1	c2
1	1	1
2	2	2
select * from t1;
pk	c1	c2
1	1	1
2	2	2
select * from t1;
pk	c1	c2
1	1	1
2	2	2
select * from t1;
pk	c1	c2
1	1	1
2	2	2
insert into t1 values (3,3,3) when row_count(update t1 set c1=2 where pk=1)=5;
ERROR HY000: Number 1 When filter failed, ret=-5064, func 1: ROW_COUNT()=1
update t1 set c1=4 where pk=1;
rollback;
select * from t1;
pk	c1	c2
1	1	1
2	2	2
select * from t1;
pk	c1	c2
1	1	1
2	2	2
select * from t1;
pk	c1	c2
1	1	1
2	2	2
select * from t1;
pk	c1	c2
1	1	1
2	2	2
select * from t1;
pk	c1	c2
1	1	1
2	2	2
select * from t1;
pk	c1	c2
1	1	1
2	2	2
select * from t1;
pk	c1	c2
1	1	1
2	2	2
select * from t1;
pk	c1	c2
1	1	1
2	2	2
select * from t1;
pk	c1	c2
1	1	1
2	2	2
select * from t1;
pk	c1	c2
1	1	1
2	2	2
insert into t1 values (3,3,3) when row_count(update t1 set c1=2 where pk=1)=5;
ERROR HY000: Number 1 When filter failed, ret=-5064, func 1: ROW_COUNT()=1
insert into t1 values(2,2,2);
ERROR 23000: Duplicate entry ' <3001.16>=int:2' for key 'PRIMARY'
rollback;
select * from t1;
pk	c1	c2
1	1	1
2	2	2
select * from t1;
pk	c1	c2
1	1	1
2	2	2
select * from t1;
pk	c1	c2
1	1	1
2	2	2
select * from t1;
pk	c1	c2
1	1	1
2	2	2
select * from t1;
pk	c1	c2
1	1	1
2	2	2
select * from t1;
pk	c1	c2
1	1	1
2	2	2
select * from t1;
pk	c1	c2
1	1	1
2	2	2
select * from t1;
pk	c1	c2
1	1	1
2	2	2
select * from t1;
pk	c1	c2
1	1	1
2	2	2
select * from t1;
pk	c1	c2
1	1	1
2	2	2
insert into t1 values (3,3,3) when row_count(update t1 set c1=2 where pk=1)=5;
ERROR HY000: Number 1 When filter failed, ret=-5064, func 1: ROW_COUNT()=1
update t1 set c1=4 where pk=2;
rollback;
select * from t1;
pk	c1	c2
1	1	1
2	2	2
select * from t1;
pk	c1	c2
1	1	1
2	2	2
select * from t1;
pk	c1	c2
1	1	1
2	2	2
select * from t1;
pk	c1	c2
1	1	1
2	2	2
select * from t1;
pk	c1	c2
1	1	1
2	2	2
select * from t1;
pk	c1	c2
1	1	1
2	2	2
select * from t1;
pk	c1	c2
1	1	1
2	2	2
select * from t1;
pk	c1	c2
1	1	1
2	2	2
select * from t1;
pk	c1	c2
1	1	1
2	2	2
select * from t1;
pk	c1	c2
1	1	1
2	2	2
insert into t1 values (3,3,3) when row_count(update t1 set c1=2 where pk=1)=5;
ERROR HY000: Number 1 When filter failed, ret=-5064, func 1: ROW_COUNT()=1
insert into t1 values(2,2,2);
ERROR 23000: Duplicate entry ' <3001.16>=int:2' for key 'PRIMARY'
rollback;
select * from t1;
pk	c1	c2
1	1	1
2	2	2
select * from t1;
pk	c1	c2
1	1	1
2	2	2
select * from t1;
pk	c1	c2
1	1	1
2	2	2
select * from t1;
pk	c1	c2
1	1	1
2	2	2
select * from t1;
pk	c1	c2
1	1	1
2	2	2
select * from t1;
pk	c1	c2
1	1	1
2	2	2
select * from t1;
pk	c1	c2
1	1	1
2	2	2
select * from t1;
pk	c1	c2
1	1	1
2	2	2
select * from t1;
pk	c1	c2
1	1	1
2	2	2
select * from t1;
pk	c1	c2
1	1	1
2	2	2
insert into t1 values (1,1,1) when row_count(update t1 set c1=3 where pk=1)=1;
ERROR 23000: Duplicate entry ' <3001.16>=int:1' for key 'PRIMARY'
update t1 set c1=5 where pk=1;
rollback;
select * from t1;
pk	c1	c2
1	1	1
2	2	2
select * from t1;
pk	c1	c2
1	1	1
2	2	2
select * from t1;
pk	c1	c2
1	1	1
2	2	2
select * from t1;
pk	c1	c2
1	1	1
2	2	2
select * from t1;
pk	c1	c2
1	1	1
2	2	2
select * from t1;
pk	c1	c2
1	1	1
2	2	2
select * from t1;
pk	c1	c2
1	1	1
2	2	2
select * from t1;
pk	c1	c2
1	1	1
2	2	2
select * from t1;
pk	c1	c2
1	1	1
2	2	2
select * from t1;
pk	c1	c2
1	1	1
2	2	2
insert into t1 values (1,1,1) when row_count(update t1 set c1=3 where pk=1)=1;
ERROR 23000: Duplicate entry ' <3001.16>=int:1' for key 'PRIMARY'
insert into t1 values(1,1,1);
ERROR 23000: Duplicate entry ' <3001.16>=int:1' for key 'PRIMARY'
rollback;
select * from t1;
pk	c1	c2
1	1	1
2	2	2
select * from t1;
pk	c1	c2
1	1	1
2	2	2
select * from t1;
pk	c1	c2
1	1	1
2	2	2
select * from t1;
pk	c1	c2
1	1	1
2	2	2
select * from t1;
pk	c1	c2
1	1	1
2	2	2
select * from t1;
pk	c1	c2
1	1	1
2	2	2
select * from t1;
pk	c1	c2
1	1	1
2	2	2
select * from t1;
pk	c1	c2
1	1	1
2	2	2
select * from t1;
pk	c1	c2
1	1	1
2	2	2
select * from t1;
pk	c1	c2
1	1	1
2	2	2
insert into t1 values (1,1,1) when row_count(update t1 set c1=3 where pk=1)=1;
ERROR 23000: Duplicate entry ' <3001.16>=int:1' for key 'PRIMARY'
update t1 set c1=5 where pk=2;
rollback;
select * from t1;
pk	c1	c2
1	1	1
2	2	2
select * from t1;
pk	c1	c2
1	1	1
2	2	2
select * from t1;
pk	c1	c2
1	1	1
2	2	2
select * from t1;
pk	c1	c2
1	1	1
2	2	2
select * from t1;
pk	c1	c2
1	1	1
2	2	2
select * from t1;
pk	c1	c2
1	1	1
2	2	2
select * from t1;
pk	c1	c2
1	1	1
2	2	2
select * from t1;
pk	c1	c2
1	1	1
2	2	2
select * from t1;
pk	c1	c2
1	1	1
2	2	2
select * from t1;
pk	c1	c2
1	1	1
2	2	2
insert into t1 values (1,1,1) when row_count(update t1 set c1=3 where pk=1)=1;
ERROR 23000: Duplicate entry ' <3001.16>=int:1' for key 'PRIMARY'
insert into t1 values(2,2,2);
ERROR 23000: Duplicate entry ' <3001.16>=int:2' for key 'PRIMARY'
rollback;
select * from t1;
pk	c1	c2
1	1	1
2	2	2
select * from t1;
pk	c1	c2
1	1	1
2	2	2
select * from t1;
pk	c1	c2
1	1	1
2	2	2
select * from t1;
pk	c1	c2
1	1	1
2	2	2
select * from t1;
pk	c1	c2
1	1	1
2	2	2
select * from t1;
pk	c1	c2
1	1	1
2	2	2
select * from t1;
pk	c1	c2
1	1	1
2	2	2
select * from t1;
pk	c1	c2
1	1	1
2	2	2
select * from t1;
pk	c1	c2
1	1	1
2	2	2
select * from t1;
pk	c1	c2
1	1	1
2	2	2
insert into t1 values (1,1,1) when row_count(update t1 set c1=3 where pk=1)=5;
ERROR HY000: Number 1 When filter failed, ret=-5064, func 1: ROW_COUNT()=1
update t1 set c1=6 where pk=1;
rollback;
select * from t1;
pk	c1	c2
1	1	1
2	2	2
select * from t1;
pk	c1	c2
1	1	1
2	2	2
select * from t1;
pk	c1	c2
1	1	1
2	2	2
select * from t1;
pk	c1	c2
1	1	1
2	2	2
select * from t1;
pk	c1	c2
1	1	1
2	2	2
select * from t1;
pk	c1	c2
1	1	1
2	2	2
select * from t1;
pk	c1	c2
1	1	1
2	2	2
select * from t1;
pk	c1	c2
1	1	1
2	2	2
select * from t1;
pk	c1	c2
1	1	1
2	2	2
select * from t1;
pk	c1	c2
1	1	1
2	2	2
insert into t1 values (1,1,1) when row_count(update t1 set c1=3 where pk=1)=5;
ERROR HY000: Number 1 When filter failed, ret=-5064, func 1: ROW_COUNT()=1
insert into t1 values(1,1,1);
ERROR 23000: Duplicate entry ' <3001.16>=int:1' for key 'PRIMARY'
rollback;
select * from t1;
pk	c1	c2
1	1	1
2	2	2
select * from t1;
pk	c1	c2
1	1	1
2	2	2
select * from t1;
pk	c1	c2
1	1	1
2	2	2
select * from t1;
pk	c1	c2
1	1	1
2	2	2
select * from t1;
pk	c1	c2
1	1	1
2	2	2
select * from t1;
pk	c1	c2
1	1	1
2	2	2
select * from t1;
pk	c1	c2
1	1	1
2	2	2
select * from t1;
pk	c1	c2
1	1	1
2	2	2
select * from t1;
pk	c1	c2
1	1	1
2	2	2
select * from t1;
pk	c1	c2
1	1	1
2	2	2
insert into t1 values (1,1,1) when row_count(update t1 set c1=3 where pk=1)=5;
ERROR HY000: Number 1 When filter failed, ret=-5064, func 1: ROW_COUNT()=1
update t1 set c1=6 where pk=2;
rollback;
select * from t1;
pk	c1	c2
1	1	1
2	2	2
select * from t1;
pk	c1	c2
1	1	1
2	2	2
select * from t1;
pk	c1	c2
1	1	1
2	2	2
select * from t1;
pk	c1	c2
1	1	1
2	2	2
select * from t1;
pk	c1	c2
1	1	1
2	2	2
select * from t1;
pk	c1	c2
1	1	1
2	2	2
select * from t1;
pk	c1	c2
1	1	1
2	2	2
select * from t1;
pk	c1	c2
1	1	1
2	2	2
select * from t1;
pk	c1	c2
1	1	1
2	2	2
select * from t1;
pk	c1	c2
1	1	1
2	2	2
insert into t1 values (1,1,1) when row_count(update t1 set c1=3 where pk=1)=5;
ERROR HY000: Number 1 When filter failed, ret=-5064, func 1: ROW_COUNT()=1
insert into t1 values(2,2,2);
ERROR 23000: Duplicate entry ' <3001.16>=int:2' for key 'PRIMARY'
rollback;
select * from t1;
pk	c1	c2
1	1	1
2	2	2
select * from t1;
pk	c1	c2
1	1	1
2	2	2
select * from t1;
pk	c1	c2
1	1	1
2	2	2
select * from t1;
pk	c1	c2
1	1	1
2	2	2
select * from t1;
pk	c1	c2
1	1	1
2	2	2
select * from t1;
pk	c1	c2
1	1	1
2	2	2
select * from t1;
pk	c1	c2
1	1	1
2	2	2
select * from t1;
pk	c1	c2
1	1	1
2	2	2
select * from t1;
pk	c1	c2
1	1	1
2	2	2
select * from t1;
pk	c1	c2
1	1	1
2	2	2
ob1.$m_ups.exist;
ob1.$s_ups.exist;
ob1.$m_ups.status;
master
ob1.$s_ups.status;
sync
ob1.$m_ups.nfind_log "table_mgr->check_checksum";
