drop table if exists test1,test2;
create table test1(c1 int,c2 varchar(20),c3 decimal(10,5),c4 int,primary key(c1));
replace into test1 values(1,'a',1,1),(2,'b',2,2),(3,'c',3,3),(4,'d',4,4);
create index idx1 on test1(c1);
create index idx2 on test1(c2);
create index idx3 on test1(c3);
create table test2(c1 int,c2 decimal(10,5),c3 varchar(20),c4 int,c5 int,c6 int,c7 decimal(10,5),c8 varchar(20),primary key(c1,c2,c3));
replace into test2 values(1,1.11,'a',1,1,1,1,1),(2,2.22,'b',2,2,2,2,2),(3,3.33,'c',3,3,3,3,3),(4,4.44,'b',4,4,4,4,4);
create index idx2 on test2(c5) storing(c6,c4);
create index idx3 on test2(c2,c3) storing(c4,c5);
merge
[major_freeze] err=0
__3001__idx__idx1
__3001__idx__idx2
__3001__idx__idx3
__3005__idx__idx2
__3005__idx__idx3
show index on test1;
index_name	status
__3001__idx__idx1	1
__3001__idx__idx2	1
__3001__idx__idx3	1
show index on test2;
index_name	status
__3005__idx__idx2	1
__3005__idx__idx3	1
replace into test1 values(1,'a',1,1),(2,'b',2,2),(3,'c',3,3),(4,'d',4,4);
delete from test1  where c1 > 100;
select * from __3001__idx__idx1;
c1	ob_virtual_col
1	NULL
2	NULL
3	NULL
4	NULL
select * from __3001__idx__idx2;
c1	c2	ob_virtual_col
1	a	NULL
2	b	NULL
3	c	NULL
4	d	NULL
select * from __3001__idx__idx3;
c1	c3	ob_virtual_col
1	1.00000	NULL
2	2.00000	NULL
3	3.00000	NULL
4	4.00000	NULL
replace into test1 values(1,'a',1,1),(2,'b',2,2),(3,'c',3,3),(4,'d',4,4);
delete from test1  where c1 = 1;
select * from __3001__idx__idx1;
c1	ob_virtual_col
2	NULL
3	NULL
4	NULL
select * from __3001__idx__idx2;
c1	c2	ob_virtual_col
2	b	NULL
3	c	NULL
4	d	NULL
select * from __3001__idx__idx3;
c1	c3	ob_virtual_col
2	2.00000	NULL
3	3.00000	NULL
4	4.00000	NULL
replace into test1 values(1,'a',1,1),(2,'b',2,2),(3,'c',3,3),(4,'d',4,4);
delete from test1  where c1 > 1;
select * from __3001__idx__idx1;
c1	ob_virtual_col
1	NULL
select * from __3001__idx__idx2;
c1	c2	ob_virtual_col
1	a	NULL
select * from __3001__idx__idx3;
c1	c3	ob_virtual_col
1	1.00000	NULL
replace into test1 values(1,'a',1,1),(2,'b',2,2),(3,'c',3,3),(4,'d',4,4);
delete from test1  where c1 = 1 OR c1 = 2 OR c1 = 3 OR c1 = 4 OR c1 = 5;
select * from __3001__idx__idx1;
c1	ob_virtual_col
select * from __3001__idx__idx2;
c1	c2	ob_virtual_col
select * from __3001__idx__idx3;
c1	c3	ob_virtual_col
replace into test1 values(1,'a',1,1),(2,'b',2,2),(3,'c',3,3),(4,'d',4,4);
delete from test1  where c1 = 1 and c1 = 1 and c1 = 1 and c1 = 1 and c1 = 1;
ERROR HY000: Failed to add column desc, err=-145
select * from __3001__idx__idx1;
c1	ob_virtual_col
1	NULL
2	NULL
3	NULL
4	NULL
select * from __3001__idx__idx2;
c1	c2	ob_virtual_col
1	a	NULL
2	b	NULL
3	c	NULL
4	d	NULL
select * from __3001__idx__idx3;
c1	c3	ob_virtual_col
1	1.00000	NULL
2	2.00000	NULL
3	3.00000	NULL
4	4.00000	NULL
replace into test1 values(1,'a',1,1),(2,'b',2,2),(3,'c',3,3),(4,'d',4,4);
delete from test1  where c1 = 1 and c1 = 2 and c1 = 3 and c1 = 4 and c1 = 5;
ERROR HY000: Failed to add column desc, err=-145
select * from __3001__idx__idx1;
c1	ob_virtual_col
1	NULL
2	NULL
3	NULL
4	NULL
select * from __3001__idx__idx2;
c1	c2	ob_virtual_col
1	a	NULL
2	b	NULL
3	c	NULL
4	d	NULL
select * from __3001__idx__idx3;
c1	c3	ob_virtual_col
1	1.00000	NULL
2	2.00000	NULL
3	3.00000	NULL
4	4.00000	NULL
replace into test1 values(1,'a',1,1),(2,'b',2,2),(3,'c',3,3),(4,'d',4,4);
delete from test1  where c1 = 1 or c1 = 2 and c1 = 3 or c1 = 4 and c1 = 5;
select * from __3001__idx__idx1;
c1	ob_virtual_col
2	NULL
3	NULL
4	NULL
select * from __3001__idx__idx2;
c1	c2	ob_virtual_col
2	b	NULL
3	c	NULL
4	d	NULL
select * from __3001__idx__idx3;
c1	c3	ob_virtual_col
2	2.00000	NULL
3	3.00000	NULL
4	4.00000	NULL
replace into test1 values(1,'a',1,1),(2,'b',2,2),(3,'c',3,3),(4,'d',4,4);
delete from test1  where c1 between 1 and 1;
select * from __3001__idx__idx1;
c1	ob_virtual_col
2	NULL
3	NULL
4	NULL
select * from __3001__idx__idx2;
c1	c2	ob_virtual_col
2	b	NULL
3	c	NULL
4	d	NULL
select * from __3001__idx__idx3;
c1	c3	ob_virtual_col
2	2.00000	NULL
3	3.00000	NULL
4	4.00000	NULL
replace into test1 values(1,'a',1,1),(2,'b',2,2),(3,'c',3,3),(4,'d',4,4);
delete from test1  where c1 between 3 and 4;
select * from __3001__idx__idx1;
c1	ob_virtual_col
1	NULL
2	NULL
select * from __3001__idx__idx2;
c1	c2	ob_virtual_col
1	a	NULL
2	b	NULL
select * from __3001__idx__idx3;
c1	c3	ob_virtual_col
1	1.00000	NULL
2	2.00000	NULL
replace into test1 values(1,'a',1,1),(2,'b',2,2),(3,'c',3,3),(4,'d',4,4);
delete from test1  where c1 IN (10,11,12,13,14,15);
select * from __3001__idx__idx1;
c1	ob_virtual_col
1	NULL
2	NULL
3	NULL
4	NULL
select * from __3001__idx__idx2;
c1	c2	ob_virtual_col
1	a	NULL
2	b	NULL
3	c	NULL
4	d	NULL
select * from __3001__idx__idx3;
c1	c3	ob_virtual_col
1	1.00000	NULL
2	2.00000	NULL
3	3.00000	NULL
4	4.00000	NULL
replace into test1 values(1,'a',1,1),(2,'b',2,2),(3,'c',3,3),(4,'d',4,4);
delete from test1  where c1 IN (1);
select * from __3001__idx__idx1;
c1	ob_virtual_col
2	NULL
3	NULL
4	NULL
select * from __3001__idx__idx2;
c1	c2	ob_virtual_col
2	b	NULL
3	c	NULL
4	d	NULL
select * from __3001__idx__idx3;
c1	c3	ob_virtual_col
2	2.00000	NULL
3	3.00000	NULL
4	4.00000	NULL
replace into test1 values(1,'a',1,1),(2,'b',2,2),(3,'c',3,3),(4,'d',4,4);
delete from test1  where c1 IN (2);
select * from __3001__idx__idx1;
c1	ob_virtual_col
1	NULL
3	NULL
4	NULL
select * from __3001__idx__idx2;
c1	c2	ob_virtual_col
1	a	NULL
3	c	NULL
4	d	NULL
select * from __3001__idx__idx3;
c1	c3	ob_virtual_col
1	1.00000	NULL
3	3.00000	NULL
4	4.00000	NULL
replace into test1 values(1,'a',1,1),(2,'b',2,2),(3,'c',3,3),(4,'d',4,4);
delete from test1  where c1 IN (1,2,3,4,5,6,7,8,9,10);
select * from __3001__idx__idx1;
c1	ob_virtual_col
select * from __3001__idx__idx2;
c1	c2	ob_virtual_col
select * from __3001__idx__idx3;
c1	c3	ob_virtual_col
replace into test1 values(1,'a',1,1),(2,'b',2,2),(3,'c',3,3),(4,'d',4,4);
delete from test1  where c1 * 2 + 1 > 3;
select * from __3001__idx__idx1;
c1	ob_virtual_col
1	NULL
select * from __3001__idx__idx2;
c1	c2	ob_virtual_col
1	a	NULL
select * from __3001__idx__idx3;
c1	c3	ob_virtual_col
1	1.00000	NULL
replace into test1 values(1,'a',1,1),(2,'b',2,2),(3,'c',3,3),(4,'d',4,4);
delete from test1  where c1 / 2 - 1 > 1;
select * from __3001__idx__idx1;
c1	ob_virtual_col
1	NULL
2	NULL
3	NULL
4	NULL
select * from __3001__idx__idx2;
c1	c2	ob_virtual_col
1	a	NULL
2	b	NULL
3	c	NULL
4	d	NULL
select * from __3001__idx__idx3;
c1	c3	ob_virtual_col
1	1.00000	NULL
2	2.00000	NULL
3	3.00000	NULL
4	4.00000	NULL
replace into test1 values(1,'a',1,1),(2,'b',2,2),(3,'c',3,3),(4,'d',4,4);
delete from test1  where c1 * 2 / 3 * 5 % 4 + 1 > 8;
select * from __3001__idx__idx1;
c1	ob_virtual_col
1	NULL
2	NULL
3	NULL
4	NULL
select * from __3001__idx__idx2;
c1	c2	ob_virtual_col
1	a	NULL
2	b	NULL
3	c	NULL
4	d	NULL
select * from __3001__idx__idx3;
c1	c3	ob_virtual_col
1	1.00000	NULL
2	2.00000	NULL
3	3.00000	NULL
4	4.00000	NULL
replace into test1 values(1,'a',1,1),(2,'b',2,2),(3,'c',3,3),(4,'d',4,4);
delete from test1  where (c1 * 2 / 3 * 5) MOD 3 + 1 > 8;
select * from __3001__idx__idx1;
c1	ob_virtual_col
1	NULL
2	NULL
3	NULL
4	NULL
select * from __3001__idx__idx2;
c1	c2	ob_virtual_col
1	a	NULL
2	b	NULL
3	c	NULL
4	d	NULL
select * from __3001__idx__idx3;
c1	c3	ob_virtual_col
1	1.00000	NULL
2	2.00000	NULL
3	3.00000	NULL
4	4.00000	NULL
replace into test1 values(1,'a',1,1),(2,'b',2,2),(3,'c',3,3),(4,'d',4,4);
replace into test1 values(1,'a',1,1),(2,'b',2,2),(3,'c',3,3),(4,'d',4,4);
delete from test1   where c3 > 100;
select * from __3001__idx__idx1;
c1	ob_virtual_col
1	NULL
2	NULL
3	NULL
4	NULL
select * from __3001__idx__idx2;
c1	c2	ob_virtual_col
1	a	NULL
2	b	NULL
3	c	NULL
4	d	NULL
select * from __3001__idx__idx3;
c1	c3	ob_virtual_col
1	1.00000	NULL
2	2.00000	NULL
3	3.00000	NULL
4	4.00000	NULL
replace into test1 values(1,'a',1,1),(2,'b',2,2),(3,'c',3,3),(4,'d',4,4);
delete from test1  where c3 = 1;
select * from __3001__idx__idx1;
c1	ob_virtual_col
2	NULL
3	NULL
4	NULL
select * from __3001__idx__idx2;
c1	c2	ob_virtual_col
2	b	NULL
3	c	NULL
4	d	NULL
select * from __3001__idx__idx3;
c1	c3	ob_virtual_col
2	2.00000	NULL
3	3.00000	NULL
4	4.00000	NULL
replace into test1 values(1,'a',1,1),(2,'b',2,2),(3,'c',3,3),(4,'d',4,4);
delete from test1  where c3 > 1;
select * from __3001__idx__idx1;
c1	ob_virtual_col
1	NULL
select * from __3001__idx__idx2;
c1	c2	ob_virtual_col
1	a	NULL
select * from __3001__idx__idx3;
c1	c3	ob_virtual_col
1	1.00000	NULL
replace into test1 values(1,'a',1,1),(2,'b',2,2),(3,'c',3,3),(4,'d',4,4);
delete from test1  where c3 = 1 OR c3 = 2 OR c3 = 3 OR c3 = 4 OR c3 = 5;
select * from __3001__idx__idx1;
c1	ob_virtual_col
select * from __3001__idx__idx2;
c1	c2	ob_virtual_col
select * from __3001__idx__idx3;
c1	c3	ob_virtual_col
replace into test1 values(1,'a',1,1),(2,'b',2,2),(3,'c',3,3),(4,'d',4,4);
delete from test1  where c3 = 1 and c3 = 1 and c3 = 1 and c3 = 1 and c3 = 1;
select * from __3001__idx__idx1;
c1	ob_virtual_col
2	NULL
3	NULL
4	NULL
select * from __3001__idx__idx2;
c1	c2	ob_virtual_col
2	b	NULL
3	c	NULL
4	d	NULL
select * from __3001__idx__idx3;
c1	c3	ob_virtual_col
2	2.00000	NULL
3	3.00000	NULL
4	4.00000	NULL
replace into test1 values(1,'a',1,1),(2,'b',2,2),(3,'c',3,3),(4,'d',4,4);
delete from test1  where c3 = 1 and c3 = 2 and c3 = 3 and c3 = 4 and c3 = 5;
select * from __3001__idx__idx1;
c1	ob_virtual_col
1	NULL
2	NULL
3	NULL
4	NULL
select * from __3001__idx__idx2;
c1	c2	ob_virtual_col
1	a	NULL
2	b	NULL
3	c	NULL
4	d	NULL
select * from __3001__idx__idx3;
c1	c3	ob_virtual_col
1	1.00000	NULL
2	2.00000	NULL
3	3.00000	NULL
4	4.00000	NULL
replace into test1 values(1,'a',1,1),(2,'b',2,2),(3,'c',3,3),(4,'d',4,4);
delete from test1  where c3 = 1 or c3 = 2 and c3 = 3 or c3 = 4 and c3 = 5;
select * from __3001__idx__idx1;
c1	ob_virtual_col
2	NULL
3	NULL
4	NULL
select * from __3001__idx__idx2;
c1	c2	ob_virtual_col
2	b	NULL
3	c	NULL
4	d	NULL
select * from __3001__idx__idx3;
c1	c3	ob_virtual_col
2	2.00000	NULL
3	3.00000	NULL
4	4.00000	NULL
replace into test1 values(1,'a',1,1),(2,'b',2,2),(3,'c',3,3),(4,'d',4,4);
delete from test1  where c3 between 1 and 1;
select * from __3001__idx__idx1;
c1	ob_virtual_col
2	NULL
3	NULL
4	NULL
select * from __3001__idx__idx2;
c1	c2	ob_virtual_col
2	b	NULL
3	c	NULL
4	d	NULL
select * from __3001__idx__idx3;
c1	c3	ob_virtual_col
2	2.00000	NULL
3	3.00000	NULL
4	4.00000	NULL
replace into test1 values(1,'a',1,1),(2,'b',2,2),(3,'c',3,3),(4,'d',4,4);
delete from test1  where c3 between 3 and 4;
select * from __3001__idx__idx1;
c1	ob_virtual_col
1	NULL
2	NULL
select * from __3001__idx__idx2;
c1	c2	ob_virtual_col
1	a	NULL
2	b	NULL
select * from __3001__idx__idx3;
c1	c3	ob_virtual_col
1	1.00000	NULL
2	2.00000	NULL
replace into test1 values(1,'a',1,1),(2,'b',2,2),(3,'c',3,3),(4,'d',4,4);
delete from test1  where c3 IN (10,11,12,13,14,15);
select * from __3001__idx__idx1;
c1	ob_virtual_col
1	NULL
2	NULL
3	NULL
4	NULL
select * from __3001__idx__idx2;
c1	c2	ob_virtual_col
1	a	NULL
2	b	NULL
3	c	NULL
4	d	NULL
select * from __3001__idx__idx3;
c1	c3	ob_virtual_col
1	1.00000	NULL
2	2.00000	NULL
3	3.00000	NULL
4	4.00000	NULL
replace into test1 values(1,'a',1,1),(2,'b',2,2),(3,'c',3,3),(4,'d',4,4);
delete from test1  where c3 IN (1);
select * from __3001__idx__idx1;
c1	ob_virtual_col
2	NULL
3	NULL
4	NULL
select * from __3001__idx__idx2;
c1	c2	ob_virtual_col
2	b	NULL
3	c	NULL
4	d	NULL
select * from __3001__idx__idx3;
c1	c3	ob_virtual_col
2	2.00000	NULL
3	3.00000	NULL
4	4.00000	NULL
replace into test1 values(1,'a',1,1),(2,'b',2,2),(3,'c',3,3),(4,'d',4,4);
delete from test1  where c3 IN (2);
select * from __3001__idx__idx1;
c1	ob_virtual_col
1	NULL
3	NULL
4	NULL
select * from __3001__idx__idx2;
c1	c2	ob_virtual_col
1	a	NULL
3	c	NULL
4	d	NULL
select * from __3001__idx__idx3;
c1	c3	ob_virtual_col
1	1.00000	NULL
3	3.00000	NULL
4	4.00000	NULL
replace into test1 values(1,'a',1,1),(2,'b',2,2),(3,'c',3,3),(4,'d',4,4);
delete from test1  where c3 IN (1,2,3,4,5,6,7,8,9,10);
select * from __3001__idx__idx1;
c1	ob_virtual_col
select * from __3001__idx__idx2;
c1	c2	ob_virtual_col
select * from __3001__idx__idx3;
c1	c3	ob_virtual_col
replace into test1 values(1,'a',1,1),(2,'b',2,2),(3,'c',3,3),(4,'d',4,4);
delete from test1  where c3 * 2 + 1 > 3;
select * from __3001__idx__idx1;
c1	ob_virtual_col
1	NULL
select * from __3001__idx__idx2;
c1	c2	ob_virtual_col
1	a	NULL
select * from __3001__idx__idx3;
c1	c3	ob_virtual_col
1	1.00000	NULL
replace into test1 values(1,'a',1,1),(2,'b',2,2),(3,'c',3,3),(4,'d',4,4);
delete from test1  where c3 / 2 - 1 > 1;
select * from __3001__idx__idx1;
c1	ob_virtual_col
1	NULL
2	NULL
3	NULL
4	NULL
select * from __3001__idx__idx2;
c1	c2	ob_virtual_col
1	a	NULL
2	b	NULL
3	c	NULL
4	d	NULL
select * from __3001__idx__idx3;
c1	c3	ob_virtual_col
1	1.00000	NULL
2	2.00000	NULL
3	3.00000	NULL
4	4.00000	NULL
replace into test1 values(1,'a',1,1),(2,'b',2,2),(3,'c',3,3),(4,'d',4,4);
delete from test1  where c3 * 2 / 3 * 5 % 4 + 1 > 8;
select * from __3001__idx__idx1;
c1	ob_virtual_col
1	NULL
2	NULL
3	NULL
4	NULL
select * from __3001__idx__idx2;
c1	c2	ob_virtual_col
1	a	NULL
2	b	NULL
3	c	NULL
4	d	NULL
select * from __3001__idx__idx3;
c1	c3	ob_virtual_col
1	1.00000	NULL
2	2.00000	NULL
3	3.00000	NULL
4	4.00000	NULL
replace into test1 values(1,'a',1,1),(2,'b',2,2),(3,'c',3,3),(4,'d',4,4);
delete from test1  where (c3 * 2 / 3 * 5) MOD 3 + 1 > 8;
select * from __3001__idx__idx1;
c1	ob_virtual_col
1	NULL
2	NULL
3	NULL
4	NULL
select * from __3001__idx__idx2;
c1	c2	ob_virtual_col
1	a	NULL
2	b	NULL
3	c	NULL
4	d	NULL
select * from __3001__idx__idx3;
c1	c3	ob_virtual_col
1	1.00000	NULL
2	2.00000	NULL
3	3.00000	NULL
4	4.00000	NULL
replace into test1 values(1,'a',1,1),(2,'b',2,2),(3,'c',3,3),(4,'d',4,4);
delete from test1  where c1 = 1 OR c2 = '2' OR c3 = 3 OR c4 = 4 OR c2 = '5';
select * from __3001__idx__idx1;
c1	ob_virtual_col
2	NULL
select * from __3001__idx__idx2;
c1	c2	ob_virtual_col
2	b	NULL
select * from __3001__idx__idx3;
c1	c3	ob_virtual_col
2	2.00000	NULL
replace into test1 values(1,'a',1,1),(2,'b',2,2),(3,'c',3,3),(4,'d',4,4);
delete from test1  where c1 = 1 and c2 = 'b' and c3 = 3 and c4 = 1 and c5 = 1;
ERROR 42S22: Unkown column name c5
select * from __3001__idx__idx1;
c1	ob_virtual_col
1	NULL
2	NULL
3	NULL
4	NULL
select * from __3001__idx__idx2;
c1	c2	ob_virtual_col
1	a	NULL
2	b	NULL
3	c	NULL
4	d	NULL
select * from __3001__idx__idx3;
c1	c3	ob_virtual_col
1	1.00000	NULL
2	2.00000	NULL
3	3.00000	NULL
4	4.00000	NULL
replace into test1 values(1,'a',1,1),(2,'b',2,2),(3,'c',3,3),(4,'d',4,4);
delete from test1  where c1 = 1 and c2 = 'a' and c3 = 1 and c4 = 1;
select * from __3001__idx__idx1;
c1	ob_virtual_col
2	NULL
3	NULL
4	NULL
select * from __3001__idx__idx2;
c1	c2	ob_virtual_col
2	b	NULL
3	c	NULL
4	d	NULL
select * from __3001__idx__idx3;
c1	c3	ob_virtual_col
2	2.00000	NULL
3	3.00000	NULL
4	4.00000	NULL
replace into test1 values(1,'a',1,1),(2,'b',2,2),(3,'c',3,3),(4,'d',4,4);
delete from test1  where c2 = 'a' and c3 = 1 and c4 = 1;
select * from __3001__idx__idx1;
c1	ob_virtual_col
2	NULL
3	NULL
4	NULL
select * from __3001__idx__idx2;
c1	c2	ob_virtual_col
2	b	NULL
3	c	NULL
4	d	NULL
select * from __3001__idx__idx3;
c1	c3	ob_virtual_col
2	2.00000	NULL
3	3.00000	NULL
4	4.00000	NULL
replace into test1 values(1,'a',1,1),(2,'b',2,2),(3,'c',3,3),(4,'d',4,4);
delete from test1  where c1 = 1 or c2 = 'b' and c4 = 3 or c2 = 'd' and c2 = 'e';
select * from __3001__idx__idx1;
c1	ob_virtual_col
2	NULL
3	NULL
4	NULL
select * from __3001__idx__idx2;
c1	c2	ob_virtual_col
2	b	NULL
3	c	NULL
4	d	NULL
select * from __3001__idx__idx3;
c1	c3	ob_virtual_col
2	2.00000	NULL
3	3.00000	NULL
4	4.00000	NULL
replace into test1 values(1,'a',1,1),(2,'b',2,2),(3,'c',3,3),(4,'d',4,4);
delete from test1  where c3 between 1 and 4 and c4 between 3 and 4;
select * from __3001__idx__idx1;
c1	ob_virtual_col
1	NULL
2	NULL
select * from __3001__idx__idx2;
c1	c2	ob_virtual_col
1	a	NULL
2	b	NULL
select * from __3001__idx__idx3;
c1	c3	ob_virtual_col
1	1.00000	NULL
2	2.00000	NULL
replace into test1 values(1,'a',1,1),(2,'b',2,2),(3,'c',3,3),(4,'d',4,4);
delete from test1  where c2 * 2 + c3 > 3;
select * from __3001__idx__idx1;
c1	ob_virtual_col
1	NULL
2	NULL
3	NULL
select * from __3001__idx__idx2;
c1	c2	ob_virtual_col
1	a	NULL
2	b	NULL
3	c	NULL
select * from __3001__idx__idx3;
c1	c3	ob_virtual_col
1	1.00000	NULL
2	2.00000	NULL
3	3.00000	NULL
replace into test1 values(1,'a',1,1),(2,'b',2,2),(3,'c',3,3),(4,'d',4,4);
delete from test1  where c2 * c3 - 1 > 1;
ERROR HY000: OB-153: VARCHAR cast to DECIMAL error
select * from __3001__idx__idx1;
c1	ob_virtual_col
1	NULL
2	NULL
3	NULL
4	NULL
select * from __3001__idx__idx2;
c1	c2	ob_virtual_col
1	a	NULL
2	b	NULL
3	c	NULL
4	d	NULL
select * from __3001__idx__idx3;
c1	c3	ob_virtual_col
1	1.00000	NULL
2	2.00000	NULL
3	3.00000	NULL
4	4.00000	NULL
replace into test1 values(1,'a',1,1),(2,'b',2,2),(3,'c',3,3),(4,'d',4,4);
delete from test1  where c2 * 2 / c3 * 5 % c3 + 1 > 8;
select * from __3001__idx__idx1;
c1	ob_virtual_col
1	NULL
2	NULL
3	NULL
4	NULL
select * from __3001__idx__idx2;
c1	c2	ob_virtual_col
1	a	NULL
2	b	NULL
3	c	NULL
4	d	NULL
select * from __3001__idx__idx3;
c1	c3	ob_virtual_col
1	1.00000	NULL
2	2.00000	NULL
3	3.00000	NULL
4	4.00000	NULL
replace into test1 values(1,'a',1,1),(2,'b',2,2),(3,'c',3,3),(4,'d',4,4);
delete from test1  where (c2 * 2 / 3 * 5) MOD c1 + 1 > 8;
select * from __3001__idx__idx1;
c1	ob_virtual_col
1	NULL
2	NULL
3	NULL
4	NULL
select * from __3001__idx__idx2;
c1	c2	ob_virtual_col
1	a	NULL
2	b	NULL
3	c	NULL
4	d	NULL
select * from __3001__idx__idx3;
c1	c3	ob_virtual_col
1	1.00000	NULL
2	2.00000	NULL
3	3.00000	NULL
4	4.00000	NULL
replace into test1 values(1,'a',1,1),(2,'b',2,2),(3,'c',3,3),(4,'d',4,4);
update test2 set c7=11.11,c8='abcd' where c1 = 1 and c2 = 1.11 and c3 = 'a';
delete from test2 where c1 > 0;
replace into test2 values(1,1.11,'a',1,1,1,1,1),(2,2.22,'b',2,2,2,2,2),(3,3.33,'c',3,3,3,3,3),(4,4.44,'b',4,4,4,4,4);
update test2 set c7=11.11,c8='abcd' where c1 > 1 and c2 > 1 and c3 > 'a';
select * from __3005__idx__idx2;
c1	c2	c3	c4	c5	c6
1	1.11000	a	1	1	1
2	2.22000	b	2	2	2
3	3.33000	c	3	3	3
4	4.44000	b	4	4	4
select * from __3005__idx__idx3;
c1	c2	c3	c4	c5
1	1.11000	a	1	1
2	2.22000	b	2	2
3	3.33000	c	3	3
4	4.44000	b	4	4
delete from test2 where c1 > 0;
replace into test2 values(1,1.11,'a',1,1,1,1,1),(2,2.22,'b',2,2,2,2,2),(3,3.33,'c',3,3,3,3,3),(4,4.44,'b',4,4,4,4,4);
update test2 set c7=11.11,c8='abcd' where c1 > 1;
select * from __3005__idx__idx2;
c1	c2	c3	c4	c5	c6
1	1.11000	a	1	1	1
2	2.22000	b	2	2	2
3	3.33000	c	3	3	3
4	4.44000	b	4	4	4
select * from __3005__idx__idx3;
c1	c2	c3	c4	c5
1	1.11000	a	1	1
2	2.22000	b	2	2
3	3.33000	c	3	3
4	4.44000	b	4	4
update test2 set c7=11.11,c8='abcd' where c1 > 0;
select * from __3005__idx__idx2;
c1	c2	c3	c4	c5	c6
1	1.11000	a	1	1	1
2	2.22000	b	2	2	2
3	3.33000	c	3	3	3
4	4.44000	b	4	4	4
select * from __3005__idx__idx3;
c1	c2	c3	c4	c5
1	1.11000	a	1	1
2	2.22000	b	2	2
3	3.33000	c	3	3
4	4.44000	b	4	4
delete from test2 where c1 > 0;
replace into test2 values(1,1.11,'a',1,1,1,1,1),(2,2.22,'b',2,2,2,2,2),(3,3.33,'c',3,3,3,3,3),(4,4.44,'b',4,4,4,4,4);
update test2 set c7=11.11,c8='abcd' where c2 > 1;
select * from __3005__idx__idx2;
c1	c2	c3	c4	c5	c6
1	1.11000	a	1	1	1
2	2.22000	b	2	2	2
3	3.33000	c	3	3	3
4	4.44000	b	4	4	4
select * from __3005__idx__idx3;
c1	c2	c3	c4	c5
1	1.11000	a	1	1
2	2.22000	b	2	2
3	3.33000	c	3	3
4	4.44000	b	4	4
delete from test2 where c1 > 0;
replace into test2 values(1,1.11,'a',1,1,1,1,1),(2,2.22,'b',2,2,2,2,2),(3,3.33,'c',3,3,3,3,3),(4,4.44,'b',4,4,4,4,4);
update test2 set c7=11.11,c8='abcd' where c3 > 'a';
select * from __3005__idx__idx2;
c1	c2	c3	c4	c5	c6
1	1.11000	a	1	1	1
2	2.22000	b	2	2	2
3	3.33000	c	3	3	3
4	4.44000	b	4	4	4
select * from __3005__idx__idx3;
c1	c2	c3	c4	c5
1	1.11000	a	1	1
2	2.22000	b	2	2
3	3.33000	c	3	3
4	4.44000	b	4	4
delete from test2 where c1 > 0;
replace into test2 values(1,1.11,'a',1,1,1,1,1),(2,2.22,'b',2,2,2,2,2),(3,3.33,'c',3,3,3,3,3),(4,4.44,'b',4,4,4,4,4);
update test2 set c7=11.11,c8='abcd' where c1 = 1 OR c2 = 2 OR c3 = 'a';
select * from __3005__idx__idx2;
c1	c2	c3	c4	c5	c6
1	1.11000	a	1	1	1
2	2.22000	b	2	2	2
3	3.33000	c	3	3	3
4	4.44000	b	4	4	4
select * from __3005__idx__idx3;
c1	c2	c3	c4	c5
1	1.11000	a	1	1
2	2.22000	b	2	2
3	3.33000	c	3	3
4	4.44000	b	4	4
delete from test2 where c1 > 0;
replace into test2 values(1,1.11,'a',1,1,1,1,1),(2,2.22,'b',2,2,2,2,2),(3,3.33,'c',3,3,3,3,3),(4,4.44,'b',4,4,4,4,4);
update test2 set c7=11.11,c8='abcd' where c1 = 1 and c2 = 1 and c3 = 'b';
select * from __3005__idx__idx2;
c1	c2	c3	c4	c5	c6
1	1.11000	a	1	1	1
2	2.22000	b	2	2	2
3	3.33000	c	3	3	3
4	4.44000	b	4	4	4
select * from __3005__idx__idx3;
c1	c2	c3	c4	c5
1	1.11000	a	1	1
2	2.22000	b	2	2
3	3.33000	c	3	3
4	4.44000	b	4	4
delete from test2 where c1 > 0;
replace into test2 values(1,1.11,'a',1,1,1,1,1),(2,2.22,'b',2,2,2,2,2),(3,3.33,'c',3,3,3,3,3),(4,4.44,'b',4,4,4,4,4);
update test2 set c7=11.11,c8='abcd' where c1 = 1 and c2 = 2 and c3 = 'c';
select * from __3005__idx__idx2;
c1	c2	c3	c4	c5	c6
1	1.11000	a	1	1	1
2	2.22000	b	2	2	2
3	3.33000	c	3	3	3
4	4.44000	b	4	4	4
select * from __3005__idx__idx3;
c1	c2	c3	c4	c5
1	1.11000	a	1	1
2	2.22000	b	2	2
3	3.33000	c	3	3
4	4.44000	b	4	4
delete from test2 where c1 > 0;
replace into test2 values(1,1.11,'a',1,1,1,1,1),(2,2.22,'b',2,2,2,2,2),(3,3.33,'c',3,3,3,3,3),(4,4.44,'b',4,4,4,4,4);
update test2 set c7=11.11,c8='abcd' where c1 = 1 or c2 = 2 and c3 = 'd';
select * from __3005__idx__idx2;
c1	c2	c3	c4	c5	c6
1	1.11000	a	1	1	1
2	2.22000	b	2	2	2
3	3.33000	c	3	3	3
4	4.44000	b	4	4	4
select * from __3005__idx__idx3;
c1	c2	c3	c4	c5
1	1.11000	a	1	1
2	2.22000	b	2	2
3	3.33000	c	3	3
4	4.44000	b	4	4
delete from test2 where c1 > 0;
replace into test2 values(1,1.11,'a',1,1,1,1,1),(2,2.22,'b',2,2,2,2,2),(3,3.33,'c',3,3,3,3,3),(4,4.44,'b',4,4,4,4,4);
update test2 set c7=11.11,c8='abcd' where c1 between 1 and 1;
select * from __3005__idx__idx2;
c1	c2	c3	c4	c5	c6
1	1.11000	a	1	1	1
2	2.22000	b	2	2	2
3	3.33000	c	3	3	3
4	4.44000	b	4	4	4
select * from __3005__idx__idx3;
c1	c2	c3	c4	c5
1	1.11000	a	1	1
2	2.22000	b	2	2
3	3.33000	c	3	3
4	4.44000	b	4	4
delete from test2 where c1 > 0;
replace into test2 values(1,1.11,'a',1,1,1,1,1),(2,2.22,'b',2,2,2,2,2),(3,3.33,'c',3,3,3,3,3),(4,4.44,'b',4,4,4,4,4);
update test2 set c7=11.11,c8='abcd' where c2 between 3 and 4;
select * from __3005__idx__idx2;
c1	c2	c3	c4	c5	c6
1	1.11000	a	1	1	1
2	2.22000	b	2	2	2
3	3.33000	c	3	3	3
4	4.44000	b	4	4	4
select * from __3005__idx__idx3;
c1	c2	c3	c4	c5
1	1.11000	a	1	1
2	2.22000	b	2	2
3	3.33000	c	3	3
4	4.44000	b	4	4
delete from test2 where c1 > 0;
replace into test2 values(1,1.11,'a',1,1,1,1,1),(2,2.22,'b',2,2,2,2,2),(3,3.33,'c',3,3,3,3,3),(4,4.44,'b',4,4,4,4,4);
update test2 set c7=11.11,c8='abcd' where c3 between 'a' and 'd';
select * from __3005__idx__idx2;
c1	c2	c3	c4	c5	c6
1	1.11000	a	1	1	1
2	2.22000	b	2	2	2
3	3.33000	c	3	3	3
4	4.44000	b	4	4	4
select * from __3005__idx__idx3;
c1	c2	c3	c4	c5
1	1.11000	a	1	1
2	2.22000	b	2	2
3	3.33000	c	3	3
4	4.44000	b	4	4
delete from test2 where c1 > 0;
replace into test2 values(1,1.11,'a',1,1,1,1,1),(2,2.22,'b',2,2,2,2,2),(3,3.33,'c',3,3,3,3,3),(4,4.44,'b',4,4,4,4,4);
update test2 set c7=11.11,c8='abcd' where c1 IN (10,11,12,13,14,15);
select * from __3005__idx__idx2;
c1	c2	c3	c4	c5	c6
1	1.11000	a	1	1	1
2	2.22000	b	2	2	2
3	3.33000	c	3	3	3
4	4.44000	b	4	4	4
select * from __3005__idx__idx3;
c1	c2	c3	c4	c5
1	1.11000	a	1	1
2	2.22000	b	2	2
3	3.33000	c	3	3
4	4.44000	b	4	4
delete from test2 where c1 > 0;
replace into test2 values(1,1.11,'a',1,1,1,1,1),(2,2.22,'b',2,2,2,2,2),(3,3.33,'c',3,3,3,3,3),(4,4.44,'b',4,4,4,4,4);
update test2 set c7=11.11,c8='abcd' where c2 IN (1);
select * from __3005__idx__idx2;
c1	c2	c3	c4	c5	c6
1	1.11000	a	1	1	1
2	2.22000	b	2	2	2
3	3.33000	c	3	3	3
4	4.44000	b	4	4	4
select * from __3005__idx__idx3;
c1	c2	c3	c4	c5
1	1.11000	a	1	1
2	2.22000	b	2	2
3	3.33000	c	3	3
4	4.44000	b	4	4
delete from test2 where c1 > 0;
replace into test2 values(1,1.11,'a',1,1,1,1,1),(2,2.22,'b',2,2,2,2,2),(3,3.33,'c',3,3,3,3,3),(4,4.44,'b',4,4,4,4,4);
update test2 set c7=11.11,c8='abcd' where c3 IN ('a');
select * from __3005__idx__idx2;
c1	c2	c3	c4	c5	c6
1	1.11000	a	1	1	1
2	2.22000	b	2	2	2
3	3.33000	c	3	3	3
4	4.44000	b	4	4	4
select * from __3005__idx__idx3;
c1	c2	c3	c4	c5
1	1.11000	a	1	1
2	2.22000	b	2	2
3	3.33000	c	3	3
4	4.44000	b	4	4
delete from test2 where c1 > 0;
replace into test2 values(1,1.11,'a',1,1,1,1,1),(2,2.22,'b',2,2,2,2,2),(3,3.33,'c',3,3,3,3,3),(4,4.44,'b',4,4,4,4,4);
update test2 set c7=11.11,c8='abcd' where c1 IN (1,2,3,4,5,6,7,8,9,10);
select * from __3005__idx__idx2;
c1	c2	c3	c4	c5	c6
1	1.11000	a	1	1	1
2	2.22000	b	2	2	2
3	3.33000	c	3	3	3
4	4.44000	b	4	4	4
select * from __3005__idx__idx3;
c1	c2	c3	c4	c5
1	1.11000	a	1	1
2	2.22000	b	2	2
3	3.33000	c	3	3
4	4.44000	b	4	4
delete from test2 where c1 > 0;
replace into test2 values(1,1.11,'a',1,1,1,1,1),(2,2.22,'b',2,2,2,2,2),(3,3.33,'c',3,3,3,3,3),(4,4.44,'b',4,4,4,4,4);
update test2 set c7=11.11,c8='abcd' where c1 * c2 + 1 > 3;
select * from __3005__idx__idx2;
c1	c2	c3	c4	c5	c6
1	1.11000	a	1	1	1
2	2.22000	b	2	2	2
3	3.33000	c	3	3	3
4	4.44000	b	4	4	4
select * from __3005__idx__idx3;
c1	c2	c3	c4	c5
1	1.11000	a	1	1
2	2.22000	b	2	2
3	3.33000	c	3	3
4	4.44000	b	4	4
delete from test2 where c1 > 0;
replace into test2 values(1,1.11,'a',1,1,1,1,1),(2,2.22,'b',2,2,2,2,2),(3,3.33,'c',3,3,3,3,3),(4,4.44,'b',4,4,4,4,4);
update test2 set c7=11.11,c8='abcd' where c1 / c2 - 1 > 1;
select * from __3005__idx__idx2;
c1	c2	c3	c4	c5	c6
1	1.11000	a	1	1	1
2	2.22000	b	2	2	2
3	3.33000	c	3	3	3
4	4.44000	b	4	4	4
select * from __3005__idx__idx3;
c1	c2	c3	c4	c5
1	1.11000	a	1	1
2	2.22000	b	2	2
3	3.33000	c	3	3
4	4.44000	b	4	4
delete from test2 where c1 > 0;
replace into test2 values(1,1.11,'a',1,1,1,1,1),(2,2.22,'b',2,2,2,2,2),(3,3.33,'c',3,3,3,3,3),(4,4.44,'b',4,4,4,4,4);
update test2 set c7=11.11,c8='abcd' where c1 * 2 / c2 * 5 % 4 + 1 > 8;
select * from __3005__idx__idx2;
c1	c2	c3	c4	c5	c6
1	1.11000	a	1	1	1
2	2.22000	b	2	2	2
3	3.33000	c	3	3	3
4	4.44000	b	4	4	4
select * from __3005__idx__idx3;
c1	c2	c3	c4	c5
1	1.11000	a	1	1
2	2.22000	b	2	2
3	3.33000	c	3	3
4	4.44000	b	4	4
delete from test2 where c1 > 0;
replace into test2 values(1,1.11,'a',1,1,1,1,1),(2,2.22,'b',2,2,2,2,2),(3,3.33,'c',3,3,3,3,3),(4,4.44,'b',4,4,4,4,4);
update test2 set c7=11.11,c8='abcd' where (c1 * 2 / 3 * 5) MOD 3 + 1 > 8;
select * from __3005__idx__idx2;
c1	c2	c3	c4	c5	c6
1	1.11000	a	1	1	1
2	2.22000	b	2	2	2
3	3.33000	c	3	3	3
4	4.44000	b	4	4	4
select * from __3005__idx__idx3;
c1	c2	c3	c4	c5
1	1.11000	a	1	1
2	2.22000	b	2	2
3	3.33000	c	3	3
4	4.44000	b	4	4
delete from test2 where c1 > 0;
replace into test2 values(1,1.11,'a',1,1,1,1,1),(2,2.22,'b',2,2,2,2,2),(3,3.33,'c',3,3,3,3,3),(4,4.44,'b',4,4,4,4,4);
update test2 set c7=11.11,c8='abcd' where c4 > 100;
update test2 set c7=11.11,c8='abcd' where c5 = 1;
delete from test2 where c1 > 0;
replace into test2 values(1,1.11,'a',1,1,1,1,1),(2,2.22,'b',2,2,2,2,2),(3,3.33,'c',3,3,3,3,3),(4,4.44,'b',4,4,4,4,4);
update test2 set c7=11.11,c8='abcd' where c6 > 1;
select * from __3005__idx__idx2;
c1	c2	c3	c4	c5	c6
1	1.11000	a	1	1	1
2	2.22000	b	2	2	2
3	3.33000	c	3	3	3
4	4.44000	b	4	4	4
select * from __3005__idx__idx3;
c1	c2	c3	c4	c5
1	1.11000	a	1	1
2	2.22000	b	2	2
3	3.33000	c	3	3
4	4.44000	b	4	4
delete from test2 where c1 > 0;
replace into test2 values(1,1.11,'a',1,1,1,1,1),(2,2.22,'b',2,2,2,2,2),(3,3.33,'c',3,3,3,3,3),(4,4.44,'b',4,4,4,4,4);
update test2 set c7=11.11,c8='abcd' where c1 = 1 OR c2 = 2 OR c4 = 3 OR c5 = 4 OR c6 = 5;
select * from __3005__idx__idx2;
c1	c2	c3	c4	c5	c6
1	1.11000	a	1	1	1
2	2.22000	b	2	2	2
3	3.33000	c	3	3	3
4	4.44000	b	4	4	4
select * from __3005__idx__idx3;
c1	c2	c3	c4	c5
1	1.11000	a	1	1
2	2.22000	b	2	2
3	3.33000	c	3	3
4	4.44000	b	4	4
delete from test2 where c1 > 0;
replace into test2 values(1,1.11,'a',1,1,1,1,1),(2,2.22,'b',2,2,2,2,2),(3,3.33,'c',3,3,3,3,3),(4,4.44,'b',4,4,4,4,4);
update test2 set c7=11.11,c8='abcd' where c2 = 1 and c3 = 1 and c4 = 1 and c5 = 1 and c6 = 1;
select * from __3005__idx__idx2;
c1	c2	c3	c4	c5	c6
1	1.11000	a	1	1	1
2	2.22000	b	2	2	2
3	3.33000	c	3	3	3
4	4.44000	b	4	4	4
select * from __3005__idx__idx3;
c1	c2	c3	c4	c5
1	1.11000	a	1	1
2	2.22000	b	2	2
3	3.33000	c	3	3
4	4.44000	b	4	4
delete from test2 where c1 > 0;
replace into test2 values(1,1.11,'a',1,1,1,1,1),(2,2.22,'b',2,2,2,2,2),(3,3.33,'c',3,3,3,3,3),(4,4.44,'b',4,4,4,4,4);
update test2 set c7=11.11,c8='abcd' where c1 = 1 and c2 = 2 and c3 = 3 and c4 = 4 and c6 = 5;
select * from __3005__idx__idx2;
c1	c2	c3	c4	c5	c6
1	1.11000	a	1	1	1
2	2.22000	b	2	2	2
3	3.33000	c	3	3	3
4	4.44000	b	4	4	4
select * from __3005__idx__idx3;
c1	c2	c3	c4	c5
1	1.11000	a	1	1
2	2.22000	b	2	2
3	3.33000	c	3	3
4	4.44000	b	4	4
delete from test2 where c1 > 0;
replace into test2 values(1,1.11,'a',1,1,1,1,1),(2,2.22,'b',2,2,2,2,2),(3,3.33,'c',3,3,3,3,3),(4,4.44,'b',4,4,4,4,4);
update test2 set c7=11.11,c8='abcd' where c2 = 1 or c4 = 2 and c5 = 3 or c7 = 4 and c6 = 5;
select * from __3005__idx__idx2;
c1	c2	c3	c4	c5	c6
1	1.11000	a	1	1	1
2	2.22000	b	2	2	2
3	3.33000	c	3	3	3
4	4.44000	b	4	4	4
select * from __3005__idx__idx3;
c1	c2	c3	c4	c5
1	1.11000	a	1	1
2	2.22000	b	2	2
3	3.33000	c	3	3
4	4.44000	b	4	4
delete from test2 where c1 > 0;
replace into test2 values(1,1.11,'a',1,1,1,1,1),(2,2.22,'b',2,2,2,2,2),(3,3.33,'c',3,3,3,3,3),(4,4.44,'b',4,4,4,4,4);
update test2 set c7=11.11,c8='abcd' where c4 between 1 and 1;
select * from __3005__idx__idx2;
c1	c2	c3	c4	c5	c6
1	1.11000	a	1	1	1
2	2.22000	b	2	2	2
3	3.33000	c	3	3	3
4	4.44000	b	4	4	4
select * from __3005__idx__idx3;
c1	c2	c3	c4	c5
1	1.11000	a	1	1
2	2.22000	b	2	2
3	3.33000	c	3	3
4	4.44000	b	4	4
delete from test2 where c1 > 0;
replace into test2 values(1,1.11,'a',1,1,1,1,1),(2,2.22,'b',2,2,2,2,2),(3,3.33,'c',3,3,3,3,3),(4,4.44,'b',4,4,4,4,4);
update test2 set c7=11.11,c8='abcd' where c5 between 3 and 4;
select * from __3005__idx__idx2;
c1	c2	c3	c4	c5	c6
1	1.11000	a	1	1	1
2	2.22000	b	2	2	2
3	3.33000	c	3	3	3
4	4.44000	b	4	4	4
select * from __3005__idx__idx3;
c1	c2	c3	c4	c5
1	1.11000	a	1	1
2	2.22000	b	2	2
3	3.33000	c	3	3
4	4.44000	b	4	4
delete from test2 where c1 > 0;
replace into test2 values(1,1.11,'a',1,1,1,1,1),(2,2.22,'b',2,2,2,2,2),(3,3.33,'c',3,3,3,3,3),(4,4.44,'b',4,4,4,4,4);
update test2 set c7=11.11,c8='abcd' where c6 IN (10,11,12,13,14,15);
select * from __3005__idx__idx2;
c1	c2	c3	c4	c5	c6
1	1.11000	a	1	1	1
2	2.22000	b	2	2	2
3	3.33000	c	3	3	3
4	4.44000	b	4	4	4
select * from __3005__idx__idx3;
c1	c2	c3	c4	c5
1	1.11000	a	1	1
2	2.22000	b	2	2
3	3.33000	c	3	3
4	4.44000	b	4	4
delete from test2 where c1 > 0;
replace into test2 values(1,1.11,'a',1,1,1,1,1),(2,2.22,'b',2,2,2,2,2),(3,3.33,'c',3,3,3,3,3),(4,4.44,'b',4,4,4,4,4);
update test2 set c7=11.11,c8='abcd' where c7 IN (1);
select * from __3005__idx__idx2;
c1	c2	c3	c4	c5	c6
1	1.11000	a	1	1	1
2	2.22000	b	2	2	2
3	3.33000	c	3	3	3
4	4.44000	b	4	4	4
select * from __3005__idx__idx3;
c1	c2	c3	c4	c5
1	1.11000	a	1	1
2	2.22000	b	2	2
3	3.33000	c	3	3
4	4.44000	b	4	4
delete from test2 where c1 > 0;
replace into test2 values(1,1.11,'a',1,1,1,1,1),(2,2.22,'b',2,2,2,2,2),(3,3.33,'c',3,3,3,3,3),(4,4.44,'b',4,4,4,4,4);
update test2 set c7=11.11,c8='abcd' where c8 IN (2);
select * from __3005__idx__idx2;
c1	c2	c3	c4	c5	c6
1	1.11000	a	1	1	1
2	2.22000	b	2	2	2
3	3.33000	c	3	3	3
4	4.44000	b	4	4	4
select * from __3005__idx__idx3;
c1	c2	c3	c4	c5
1	1.11000	a	1	1
2	2.22000	b	2	2
3	3.33000	c	3	3
4	4.44000	b	4	4
delete from test2 where c1 > 0;
replace into test2 values(1,1.11,'a',1,1,1,1,1),(2,2.22,'b',2,2,2,2,2),(3,3.33,'c',3,3,3,3,3),(4,4.44,'b',4,4,4,4,4);
update test2 set c7=11.11,c8='abcd' where c5 IN (1,2,3,4,5,6,7,8,9,10);
select * from __3005__idx__idx2;
c1	c2	c3	c4	c5	c6
1	1.11000	a	1	1	1
2	2.22000	b	2	2	2
3	3.33000	c	3	3	3
4	4.44000	b	4	4	4
select * from __3005__idx__idx3;
c1	c2	c3	c4	c5
1	1.11000	a	1	1
2	2.22000	b	2	2
3	3.33000	c	3	3
4	4.44000	b	4	4
delete from test2 where c1 > 0;
replace into test2 values(1,1.11,'a',1,1,1,1,1),(2,2.22,'b',2,2,2,2,2),(3,3.33,'c',3,3,3,3,3),(4,4.44,'b',4,4,4,4,4);
update test2 set c7=11.11,c8='abcd' where c4 * 2 + 1 > 3;
select * from __3005__idx__idx2;
c1	c2	c3	c4	c5	c6
1	1.11000	a	1	1	1
2	2.22000	b	2	2	2
3	3.33000	c	3	3	3
4	4.44000	b	4	4	4
select * from __3005__idx__idx3;
c1	c2	c3	c4	c5
1	1.11000	a	1	1
2	2.22000	b	2	2
3	3.33000	c	3	3
4	4.44000	b	4	4
delete from test2 where c1 > 0;
replace into test2 values(1,1.11,'a',1,1,1,1,1),(2,2.22,'b',2,2,2,2,2),(3,3.33,'c',3,3,3,3,3),(4,4.44,'b',4,4,4,4,4);
update test2 set c7=11.11,c8='abcd' where c5 / 2 - 1 > 1;
select * from __3005__idx__idx2;
c1	c2	c3	c4	c5	c6
1	1.11000	a	1	1	1
2	2.22000	b	2	2	2
3	3.33000	c	3	3	3
4	4.44000	b	4	4	4
select * from __3005__idx__idx3;
c1	c2	c3	c4	c5
1	1.11000	a	1	1
2	2.22000	b	2	2
3	3.33000	c	3	3
4	4.44000	b	4	4
delete from test2 where c1 > 0;
replace into test2 values(1,1.11,'a',1,1,1,1,1),(2,2.22,'b',2,2,2,2,2),(3,3.33,'c',3,3,3,3,3),(4,4.44,'b',4,4,4,4,4);
update test2 set c7=11.11,c8='abcd' where c7 * 2 / 3 * c6 % 4 + 1 > 8;
select * from __3005__idx__idx2;
c1	c2	c3	c4	c5	c6
1	1.11000	a	1	1	1
2	2.22000	b	2	2	2
3	3.33000	c	3	3	3
4	4.44000	b	4	4	4
select * from __3005__idx__idx3;
c1	c2	c3	c4	c5
1	1.11000	a	1	1
2	2.22000	b	2	2
3	3.33000	c	3	3
4	4.44000	b	4	4
delete from test2 where c1 > 0;
replace into test2 values(1,1.11,'a',1,1,1,1,1),(2,2.22,'b',2,2,2,2,2),(3,3.33,'c',3,3,3,3,3),(4,4.44,'b',4,4,4,4,4);
update test2 set c7=11.11,c8='abcd' where (c8 * c4 / 3 * 5) MOD 3 + 1 > 8;
select * from __3005__idx__idx2;
c1	c2	c3	c4	c5	c6
1	1.11000	a	1	1	1
2	2.22000	b	2	2	2
3	3.33000	c	3	3	3
4	4.44000	b	4	4	4
select * from __3005__idx__idx3;
c1	c2	c3	c4	c5
1	1.11000	a	1	1
2	2.22000	b	2	2
3	3.33000	c	3	3
4	4.44000	b	4	4
