drop table if exists test1,test2;
create table test1(c1 int primary key,c2 int,c3 int,c4 int);
insert into test1 values(1,1,1,1),(2,2,2,2),(3,3,3,3),(4,4,4,4);
create index idx1 on test1(c1);
create index idx2 on test1(c2);
create index idx3 on test1(c3);
create index idx4 on test1(c4);
create table test2(c1 int,c2 int,c3 int,c4 int,c5 int,c6 int,c7 int,c8 int,primary key(c1,c2,c3));
insert into test2 values(1,1,1,1,1,1,1,1),(2,2,2,2,2,2,2,2),(3,3,3,3,3,3,3,3),(4,4,4,4,4,4,4,4);
create index idx1 on test2(c2);
create index idx2 on test2(c5) storing(c6,c4);
create index idx3 on test2(c6,c3) storing(c4,c7);
create index idx4 on test2(c8,c7,c5) storing(c4,c6);
create index idx5 on test2(c5,c4) storing(c6,c7,c8);
alter system set min_major_freeze_interval='5s' server_type=updateserver;
alter system set merge_delay_interval='10s' server_type=chunkserver;
merge
[major_freeze] err=0
show index on test1;
index_name	status
__3001__idx__idx1	1
__3001__idx__idx2	1
__3001__idx__idx3	1
__3001__idx__idx4	1
show index on test2;
index_name	status
__3006__idx__idx1	1
__3006__idx__idx2	1
__3006__idx__idx3	1
__3006__idx__idx4	1
__3006__idx__idx5	1
__3001__idx__idx1
__3001__idx__idx2
__3001__idx__idx3
__3001__idx__idx4
__3006__idx__idx1
__3006__idx__idx2
__3006__idx__idx3
__3006__idx__idx4
__3006__idx__idx5
select * from test1;
c1	c2	c3	c4
1	1	1	1
2	2	2	2
3	3	3	3
4	4	4	4
select  * from __3001__idx__idx1;
c1	ob_virtual_col
1	NULL
2	NULL
3	NULL
4	NULL
select  * from __3001__idx__idx2;
c1	c2	ob_virtual_col
1	1	NULL
2	2	NULL
3	3	NULL
4	4	NULL
select  * from __3001__idx__idx3;
c1	c3	ob_virtual_col
1	1	NULL
2	2	NULL
3	3	NULL
4	4	NULL
select  * from __3001__idx__idx4;
c1	c4	ob_virtual_col
1	1	NULL
2	2	NULL
3	3	NULL
4	4	NULL
delete from test1;
delete from test1 where 1=1;
insert into test1 values(1,1,1,1),(2,2,2,2),(3,3,3,3),(4,4,4,4);
delete from test1 where c1 > 100;
select * from test1;
c1	c2	c3	c4
1	1	1	1
2	2	2	2
3	3	3	3
4	4	4	4
select  * from __3001__idx__idx1;
c1	ob_virtual_col
1	NULL
2	NULL
3	NULL
4	NULL
select  * from __3001__idx__idx2;
c1	c2	ob_virtual_col
1	1	NULL
2	2	NULL
3	3	NULL
4	4	NULL
select  * from __3001__idx__idx3;
c1	c3	ob_virtual_col
1	1	NULL
2	2	NULL
3	3	NULL
4	4	NULL
select  * from __3001__idx__idx4;
c1	c4	ob_virtual_col
1	1	NULL
2	2	NULL
3	3	NULL
4	4	NULL
delete from test1 where c1 = 1;
select * from test1;
c1	c2	c3	c4
2	2	2	2
3	3	3	3
4	4	4	4
select  * from __3001__idx__idx1;
c1	ob_virtual_col
2	NULL
3	NULL
4	NULL
select  * from __3001__idx__idx2;
c1	c2	ob_virtual_col
2	2	NULL
3	3	NULL
4	4	NULL
select  * from __3001__idx__idx3;
c1	c3	ob_virtual_col
2	2	NULL
3	3	NULL
4	4	NULL
select  * from __3001__idx__idx4;
c1	c4	ob_virtual_col
2	2	NULL
3	3	NULL
4	4	NULL
delete from test1 where c1 > 1;
select * from test1;
c1	c2	c3	c4
select  * from __3001__idx__idx1;
c1	ob_virtual_col
select  * from __3001__idx__idx2;
c1	c2	ob_virtual_col
select  * from __3001__idx__idx3;
c1	c3	ob_virtual_col
select  * from __3001__idx__idx4;
c1	c4	ob_virtual_col
insert into test1 values(1,1,1,1),(2,2,2,2),(3,3,3,3),(4,4,4,4);
select * from test1;
c1	c2	c3	c4
1	1	1	1
2	2	2	2
3	3	3	3
4	4	4	4
select  * from __3001__idx__idx1;
c1	ob_virtual_col
1	NULL
2	NULL
3	NULL
4	NULL
select  * from __3001__idx__idx2;
c1	c2	ob_virtual_col
1	1	NULL
2	2	NULL
3	3	NULL
4	4	NULL
select  * from __3001__idx__idx3;
c1	c3	ob_virtual_col
1	1	NULL
2	2	NULL
3	3	NULL
4	4	NULL
select  * from __3001__idx__idx4;
c1	c4	ob_virtual_col
1	1	NULL
2	2	NULL
3	3	NULL
4	4	NULL
delete from test1 where c1 = 1 OR c1 = 2 OR c1 = 3 OR c1 = 4 OR c1 = 5;
select * from test1;
c1	c2	c3	c4
select  * from __3001__idx__idx1;
c1	ob_virtual_col
select  * from __3001__idx__idx2;
c1	c2	ob_virtual_col
select  * from __3001__idx__idx3;
c1	c3	ob_virtual_col
select  * from __3001__idx__idx4;
c1	c4	ob_virtual_col
replace into test1 values(1,1,1,1),(2,2,2,2),(3,3,3,3),(4,4,4,4);
select * from test1;
c1	c2	c3	c4
1	1	1	1
2	2	2	2
3	3	3	3
4	4	4	4
select  * from __3001__idx__idx1;
c1	ob_virtual_col
1	NULL
2	NULL
3	NULL
4	NULL
select  * from __3001__idx__idx2;
c1	c2	ob_virtual_col
1	1	NULL
2	2	NULL
3	3	NULL
4	4	NULL
select  * from __3001__idx__idx3;
c1	c3	ob_virtual_col
1	1	NULL
2	2	NULL
3	3	NULL
4	4	NULL
select  * from __3001__idx__idx4;
c1	c4	ob_virtual_col
1	1	NULL
2	2	NULL
3	3	NULL
4	4	NULL
delete from test1 where c1 = 1 and c1 = 1 and c1 = 1 and c1 = 1 and c1 = 1;
ERROR HY000: Failed to add column desc, err=-145
select * from test1;
c1	c2	c3	c4
1	1	1	1
2	2	2	2
3	3	3	3
4	4	4	4
select  * from __3001__idx__idx1;
c1	ob_virtual_col
1	NULL
2	NULL
3	NULL
4	NULL
select  * from __3001__idx__idx2;
c1	c2	ob_virtual_col
1	1	NULL
2	2	NULL
3	3	NULL
4	4	NULL
select  * from __3001__idx__idx3;
c1	c3	ob_virtual_col
1	1	NULL
2	2	NULL
3	3	NULL
4	4	NULL
select  * from __3001__idx__idx4;
c1	c4	ob_virtual_col
1	1	NULL
2	2	NULL
3	3	NULL
4	4	NULL
delete from test1 where c1 = 1 and c1 = 2 and c1 = 3 and c1 = 4 and c1 = 5;
ERROR HY000: Failed to add column desc, err=-145
select * from test1;
c1	c2	c3	c4
1	1	1	1
2	2	2	2
3	3	3	3
4	4	4	4
select  * from __3001__idx__idx1;
c1	ob_virtual_col
1	NULL
2	NULL
3	NULL
4	NULL
select  * from __3001__idx__idx2;
c1	c2	ob_virtual_col
1	1	NULL
2	2	NULL
3	3	NULL
4	4	NULL
select  * from __3001__idx__idx3;
c1	c3	ob_virtual_col
1	1	NULL
2	2	NULL
3	3	NULL
4	4	NULL
select  * from __3001__idx__idx4;
c1	c4	ob_virtual_col
1	1	NULL
2	2	NULL
3	3	NULL
4	4	NULL
delete from test1 where c1 = 1 or c1 = 2 and c1 = 3 or c1 = 4 and c1 = 5;
select * from test1;
c1	c2	c3	c4
2	2	2	2
3	3	3	3
4	4	4	4
select  * from __3001__idx__idx1;
c1	ob_virtual_col
2	NULL
3	NULL
4	NULL
select  * from __3001__idx__idx2;
c1	c2	ob_virtual_col
2	2	NULL
3	3	NULL
4	4	NULL
select  * from __3001__idx__idx3;
c1	c3	ob_virtual_col
2	2	NULL
3	3	NULL
4	4	NULL
select  * from __3001__idx__idx4;
c1	c4	ob_virtual_col
2	2	NULL
3	3	NULL
4	4	NULL
delete from test1 where c1 between 1 and 1;
select * from test1;
c1	c2	c3	c4
2	2	2	2
3	3	3	3
4	4	4	4
select  * from __3001__idx__idx1;
c1	ob_virtual_col
2	NULL
3	NULL
4	NULL
select  * from __3001__idx__idx2;
c1	c2	ob_virtual_col
2	2	NULL
3	3	NULL
4	4	NULL
select  * from __3001__idx__idx3;
c1	c3	ob_virtual_col
2	2	NULL
3	3	NULL
4	4	NULL
select  * from __3001__idx__idx4;
c1	c4	ob_virtual_col
2	2	NULL
3	3	NULL
4	4	NULL
delete from test1 where c1 between 2 and 2;
select * from test1;
c1	c2	c3	c4
3	3	3	3
4	4	4	4
select  * from __3001__idx__idx1;
c1	ob_virtual_col
3	NULL
4	NULL
select  * from __3001__idx__idx2;
c1	c2	ob_virtual_col
3	3	NULL
4	4	NULL
select  * from __3001__idx__idx3;
c1	c3	ob_virtual_col
3	3	NULL
4	4	NULL
select  * from __3001__idx__idx4;
c1	c4	ob_virtual_col
3	3	NULL
4	4	NULL
delete from test1 where c1 between 3 and 4;
select * from test1;
c1	c2	c3	c4
select  * from __3001__idx__idx1;
c1	ob_virtual_col
select  * from __3001__idx__idx2;
c1	c2	ob_virtual_col
select  * from __3001__idx__idx3;
c1	c3	ob_virtual_col
select  * from __3001__idx__idx4;
c1	c4	ob_virtual_col
replace into test1 values(1,1,1,1),(2,2,2,2),(3,3,3,3),(4,4,4,4);
select * from test1;
c1	c2	c3	c4
1	1	1	1
2	2	2	2
3	3	3	3
4	4	4	4
select  * from __3001__idx__idx1;
c1	ob_virtual_col
1	NULL
2	NULL
3	NULL
4	NULL
select  * from __3001__idx__idx2;
c1	c2	ob_virtual_col
1	1	NULL
2	2	NULL
3	3	NULL
4	4	NULL
select  * from __3001__idx__idx3;
c1	c3	ob_virtual_col
1	1	NULL
2	2	NULL
3	3	NULL
4	4	NULL
select  * from __3001__idx__idx4;
c1	c4	ob_virtual_col
1	1	NULL
2	2	NULL
3	3	NULL
4	4	NULL
delete from test1 where c1 IN (10,11,12,13,14,15);
select * from test1;
c1	c2	c3	c4
1	1	1	1
2	2	2	2
3	3	3	3
4	4	4	4
select  * from __3001__idx__idx1;
c1	ob_virtual_col
1	NULL
2	NULL
3	NULL
4	NULL
select  * from __3001__idx__idx2;
c1	c2	ob_virtual_col
1	1	NULL
2	2	NULL
3	3	NULL
4	4	NULL
select  * from __3001__idx__idx3;
c1	c3	ob_virtual_col
1	1	NULL
2	2	NULL
3	3	NULL
4	4	NULL
select  * from __3001__idx__idx4;
c1	c4	ob_virtual_col
1	1	NULL
2	2	NULL
3	3	NULL
4	4	NULL
replace into test1 values(1,1,1,1),(2,2,2,2),(3,3,3,3),(4,4,4,4);
select * from test1;
c1	c2	c3	c4
1	1	1	1
2	2	2	2
3	3	3	3
4	4	4	4
select  * from __3001__idx__idx1;
c1	ob_virtual_col
1	NULL
2	NULL
3	NULL
4	NULL
select  * from __3001__idx__idx2;
c1	c2	ob_virtual_col
1	1	NULL
2	2	NULL
3	3	NULL
4	4	NULL
select  * from __3001__idx__idx3;
c1	c3	ob_virtual_col
1	1	NULL
2	2	NULL
3	3	NULL
4	4	NULL
select  * from __3001__idx__idx4;
c1	c4	ob_virtual_col
1	1	NULL
2	2	NULL
3	3	NULL
4	4	NULL
delete from test1 where c1 IN (1);
select * from test1;
c1	c2	c3	c4
2	2	2	2
3	3	3	3
4	4	4	4
select  * from __3001__idx__idx1;
c1	ob_virtual_col
2	NULL
3	NULL
4	NULL
select  * from __3001__idx__idx2;
c1	c2	ob_virtual_col
2	2	NULL
3	3	NULL
4	4	NULL
select  * from __3001__idx__idx3;
c1	c3	ob_virtual_col
2	2	NULL
3	3	NULL
4	4	NULL
select  * from __3001__idx__idx4;
c1	c4	ob_virtual_col
2	2	NULL
3	3	NULL
4	4	NULL
replace into test1 values(1,1,1,1),(2,2,2,2),(3,3,3,3),(4,4,4,4);
select * from test1;
c1	c2	c3	c4
1	1	1	1
2	2	2	2
3	3	3	3
4	4	4	4
select  * from __3001__idx__idx1;
c1	ob_virtual_col
1	NULL
2	NULL
3	NULL
4	NULL
select  * from __3001__idx__idx2;
c1	c2	ob_virtual_col
1	1	NULL
2	2	NULL
3	3	NULL
4	4	NULL
select  * from __3001__idx__idx3;
c1	c3	ob_virtual_col
1	1	NULL
2	2	NULL
3	3	NULL
4	4	NULL
select  * from __3001__idx__idx4;
c1	c4	ob_virtual_col
1	1	NULL
2	2	NULL
3	3	NULL
4	4	NULL
delete from test1 where c1 IN (2);
select * from test1;
c1	c2	c3	c4
1	1	1	1
3	3	3	3
4	4	4	4
select  * from __3001__idx__idx1;
c1	ob_virtual_col
1	NULL
3	NULL
4	NULL
select  * from __3001__idx__idx2;
c1	c2	ob_virtual_col
1	1	NULL
3	3	NULL
4	4	NULL
select  * from __3001__idx__idx3;
c1	c3	ob_virtual_col
1	1	NULL
3	3	NULL
4	4	NULL
select  * from __3001__idx__idx4;
c1	c4	ob_virtual_col
1	1	NULL
3	3	NULL
4	4	NULL
replace into test1 values(1,1,1,1),(2,2,2,2),(3,3,3,3),(4,4,4,4);
select * from test1;
c1	c2	c3	c4
1	1	1	1
2	2	2	2
3	3	3	3
4	4	4	4
select  * from __3001__idx__idx1;
c1	ob_virtual_col
1	NULL
2	NULL
3	NULL
4	NULL
select  * from __3001__idx__idx2;
c1	c2	ob_virtual_col
1	1	NULL
2	2	NULL
3	3	NULL
4	4	NULL
select  * from __3001__idx__idx3;
c1	c3	ob_virtual_col
1	1	NULL
2	2	NULL
3	3	NULL
4	4	NULL
select  * from __3001__idx__idx4;
c1	c4	ob_virtual_col
1	1	NULL
2	2	NULL
3	3	NULL
4	4	NULL
delete from test1 where c1 IN (1,2,3,4,5,6,7,8,9,10);
select * from test1;
c1	c2	c3	c4
select  * from __3001__idx__idx1;
c1	ob_virtual_col
select  * from __3001__idx__idx2;
c1	c2	ob_virtual_col
select  * from __3001__idx__idx3;
c1	c3	ob_virtual_col
select  * from __3001__idx__idx4;
c1	c4	ob_virtual_col
replace into test1 values(1,1,1,1),(2,2,2,2),(3,3,3,3),(4,4,4,4);
select * from test1;
c1	c2	c3	c4
1	1	1	1
2	2	2	2
3	3	3	3
4	4	4	4
select  * from __3001__idx__idx1;
c1	ob_virtual_col
1	NULL
2	NULL
3	NULL
4	NULL
select  * from __3001__idx__idx2;
c1	c2	ob_virtual_col
1	1	NULL
2	2	NULL
3	3	NULL
4	4	NULL
select  * from __3001__idx__idx3;
c1	c3	ob_virtual_col
1	1	NULL
2	2	NULL
3	3	NULL
4	4	NULL
select  * from __3001__idx__idx4;
c1	c4	ob_virtual_col
1	1	NULL
2	2	NULL
3	3	NULL
4	4	NULL
delete from test1 where c1 * 2 + 1 > 3;
select * from test1;
c1	c2	c3	c4
1	1	1	1
select  * from __3001__idx__idx1;
c1	ob_virtual_col
1	NULL
select  * from __3001__idx__idx2;
c1	c2	ob_virtual_col
1	1	NULL
select  * from __3001__idx__idx3;
c1	c3	ob_virtual_col
1	1	NULL
select  * from __3001__idx__idx4;
c1	c4	ob_virtual_col
1	1	NULL
replace into test1 values(1,1,1,1),(2,2,2,2),(3,3,3,3),(4,4,4,4);
select * from test1;
c1	c2	c3	c4
1	1	1	1
2	2	2	2
3	3	3	3
4	4	4	4
select  * from __3001__idx__idx1;
c1	ob_virtual_col
1	NULL
2	NULL
3	NULL
4	NULL
select  * from __3001__idx__idx2;
c1	c2	ob_virtual_col
1	1	NULL
2	2	NULL
3	3	NULL
4	4	NULL
select  * from __3001__idx__idx3;
c1	c3	ob_virtual_col
1	1	NULL
2	2	NULL
3	3	NULL
4	4	NULL
select  * from __3001__idx__idx4;
c1	c4	ob_virtual_col
1	1	NULL
2	2	NULL
3	3	NULL
4	4	NULL
delete from test1 where c1 / 2 - 1 > 1;
select * from test1;
c1	c2	c3	c4
1	1	1	1
2	2	2	2
3	3	3	3
4	4	4	4
select  * from __3001__idx__idx1;
c1	ob_virtual_col
1	NULL
2	NULL
3	NULL
4	NULL
select  * from __3001__idx__idx2;
c1	c2	ob_virtual_col
1	1	NULL
2	2	NULL
3	3	NULL
4	4	NULL
select  * from __3001__idx__idx3;
c1	c3	ob_virtual_col
1	1	NULL
2	2	NULL
3	3	NULL
4	4	NULL
select  * from __3001__idx__idx4;
c1	c4	ob_virtual_col
1	1	NULL
2	2	NULL
3	3	NULL
4	4	NULL
delete from test1 where c1 * 2 / 3 * 5 % 4 + 1 > 1;
select * from test1;
c1	c2	c3	c4
1	1	1	1
select  * from __3001__idx__idx1;
c1	ob_virtual_col
1	NULL
select  * from __3001__idx__idx2;
c1	c2	ob_virtual_col
1	1	NULL
select  * from __3001__idx__idx3;
c1	c3	ob_virtual_col
1	1	NULL
select  * from __3001__idx__idx4;
c1	c4	ob_virtual_col
1	1	NULL
replace into test1 values(1,1,1,1),(2,2,2,2),(3,3,3,3),(4,4,4,4);
select * from test1;
c1	c2	c3	c4
1	1	1	1
2	2	2	2
3	3	3	3
4	4	4	4
select  * from __3001__idx__idx1;
c1	ob_virtual_col
1	NULL
2	NULL
3	NULL
4	NULL
select  * from __3001__idx__idx2;
c1	c2	ob_virtual_col
1	1	NULL
2	2	NULL
3	3	NULL
4	4	NULL
select  * from __3001__idx__idx3;
c1	c3	ob_virtual_col
1	1	NULL
2	2	NULL
3	3	NULL
4	4	NULL
select  * from __3001__idx__idx4;
c1	c4	ob_virtual_col
1	1	NULL
2	2	NULL
3	3	NULL
4	4	NULL
delete from test1 where (c1 * 2 / 3 * 5) MOD 3 + 1 > 2;
select * from test1;
c1	c2	c3	c4
1	1	1	1
3	3	3	3
4	4	4	4
select  * from __3001__idx__idx1;
c1	ob_virtual_col
1	NULL
3	NULL
4	NULL
select  * from __3001__idx__idx2;
c1	c2	ob_virtual_col
1	1	NULL
3	3	NULL
4	4	NULL
select  * from __3001__idx__idx3;
c1	c3	ob_virtual_col
1	1	NULL
3	3	NULL
4	4	NULL
select  * from __3001__idx__idx4;
c1	c4	ob_virtual_col
1	1	NULL
3	3	NULL
4	4	NULL
replace into test1 values(1,1,1,1),(2,2,2,2),(3,3,3,3),(4,4,4,4);
select * from test1;
c1	c2	c3	c4
1	1	1	1
2	2	2	2
3	3	3	3
4	4	4	4
select  * from __3001__idx__idx1;
c1	ob_virtual_col
1	NULL
2	NULL
3	NULL
4	NULL
select  * from __3001__idx__idx2;
c1	c2	ob_virtual_col
1	1	NULL
2	2	NULL
3	3	NULL
4	4	NULL
select  * from __3001__idx__idx3;
c1	c3	ob_virtual_col
1	1	NULL
2	2	NULL
3	3	NULL
4	4	NULL
select  * from __3001__idx__idx4;
c1	c4	ob_virtual_col
1	1	NULL
2	2	NULL
3	3	NULL
4	4	NULL
delete from test1 where c2 > 100;
select * from test1;
c1	c2	c3	c4
1	1	1	1
2	2	2	2
3	3	3	3
4	4	4	4
select  * from __3001__idx__idx1;
c1	ob_virtual_col
1	NULL
2	NULL
3	NULL
4	NULL
select  * from __3001__idx__idx2;
c1	c2	ob_virtual_col
1	1	NULL
2	2	NULL
3	3	NULL
4	4	NULL
select  * from __3001__idx__idx3;
c1	c3	ob_virtual_col
1	1	NULL
2	2	NULL
3	3	NULL
4	4	NULL
select  * from __3001__idx__idx4;
c1	c4	ob_virtual_col
1	1	NULL
2	2	NULL
3	3	NULL
4	4	NULL
delete from test1 where c2 = 1;
select * from test1;
c1	c2	c3	c4
2	2	2	2
3	3	3	3
4	4	4	4
select  * from __3001__idx__idx1;
c1	ob_virtual_col
2	NULL
3	NULL
4	NULL
select  * from __3001__idx__idx2;
c1	c2	ob_virtual_col
2	2	NULL
3	3	NULL
4	4	NULL
select  * from __3001__idx__idx3;
c1	c3	ob_virtual_col
2	2	NULL
3	3	NULL
4	4	NULL
select  * from __3001__idx__idx4;
c1	c4	ob_virtual_col
2	2	NULL
3	3	NULL
4	4	NULL
replace into test1 values(1,1,1,1),(2,2,2,2),(3,3,3,3),(4,4,4,4);
select * from test1;
c1	c2	c3	c4
1	1	1	1
2	2	2	2
3	3	3	3
4	4	4	4
select  * from __3001__idx__idx1;
c1	ob_virtual_col
1	NULL
2	NULL
3	NULL
4	NULL
select  * from __3001__idx__idx2;
c1	c2	ob_virtual_col
1	1	NULL
2	2	NULL
3	3	NULL
4	4	NULL
select  * from __3001__idx__idx3;
c1	c3	ob_virtual_col
1	1	NULL
2	2	NULL
3	3	NULL
4	4	NULL
select  * from __3001__idx__idx4;
c1	c4	ob_virtual_col
1	1	NULL
2	2	NULL
3	3	NULL
4	4	NULL
delete from test1 where c2 > 1;
select * from test1;
c1	c2	c3	c4
1	1	1	1
select  * from __3001__idx__idx1;
c1	ob_virtual_col
1	NULL
select  * from __3001__idx__idx2;
c1	c2	ob_virtual_col
1	1	NULL
select  * from __3001__idx__idx3;
c1	c3	ob_virtual_col
1	1	NULL
select  * from __3001__idx__idx4;
c1	c4	ob_virtual_col
1	1	NULL
replace into test1 values(1,1,1,1),(2,2,2,2),(3,3,3,3),(4,4,4,4);
select * from test1;
c1	c2	c3	c4
1	1	1	1
2	2	2	2
3	3	3	3
4	4	4	4
select  * from __3001__idx__idx1;
c1	ob_virtual_col
1	NULL
2	NULL
3	NULL
4	NULL
select  * from __3001__idx__idx2;
c1	c2	ob_virtual_col
1	1	NULL
2	2	NULL
3	3	NULL
4	4	NULL
select  * from __3001__idx__idx3;
c1	c3	ob_virtual_col
1	1	NULL
2	2	NULL
3	3	NULL
4	4	NULL
select  * from __3001__idx__idx4;
c1	c4	ob_virtual_col
1	1	NULL
2	2	NULL
3	3	NULL
4	4	NULL
delete from test1 where c2 = 1 OR c2 = 2 OR c2 = 3 OR c2 = 4 OR c2 = 5;
select * from test1;
c1	c2	c3	c4
select  * from __3001__idx__idx1;
c1	ob_virtual_col
select  * from __3001__idx__idx2;
c1	c2	ob_virtual_col
select  * from __3001__idx__idx3;
c1	c3	ob_virtual_col
select  * from __3001__idx__idx4;
c1	c4	ob_virtual_col
replace into test1 values(1,1,1,1),(2,2,2,2),(3,3,3,3),(4,4,4,4);
select * from test1;
c1	c2	c3	c4
1	1	1	1
2	2	2	2
3	3	3	3
4	4	4	4
select  * from __3001__idx__idx1;
c1	ob_virtual_col
1	NULL
2	NULL
3	NULL
4	NULL
select  * from __3001__idx__idx2;
c1	c2	ob_virtual_col
1	1	NULL
2	2	NULL
3	3	NULL
4	4	NULL
select  * from __3001__idx__idx3;
c1	c3	ob_virtual_col
1	1	NULL
2	2	NULL
3	3	NULL
4	4	NULL
select  * from __3001__idx__idx4;
c1	c4	ob_virtual_col
1	1	NULL
2	2	NULL
3	3	NULL
4	4	NULL
delete from test1 where c2 = 1 and c2 = 1 and c2 = 1 and c2 = 1 and c2 = 1;
select * from test1;
c1	c2	c3	c4
2	2	2	2
3	3	3	3
4	4	4	4
select  * from __3001__idx__idx1;
c1	ob_virtual_col
2	NULL
3	NULL
4	NULL
select  * from __3001__idx__idx2;
c1	c2	ob_virtual_col
2	2	NULL
3	3	NULL
4	4	NULL
select  * from __3001__idx__idx3;
c1	c3	ob_virtual_col
2	2	NULL
3	3	NULL
4	4	NULL
select  * from __3001__idx__idx4;
c1	c4	ob_virtual_col
2	2	NULL
3	3	NULL
4	4	NULL
replace into test1 values(1,1,1,1),(2,2,2,2),(3,3,3,3),(4,4,4,4);
select * from test1;
c1	c2	c3	c4
1	1	1	1
2	2	2	2
3	3	3	3
4	4	4	4
select  * from __3001__idx__idx1;
c1	ob_virtual_col
1	NULL
2	NULL
3	NULL
4	NULL
select  * from __3001__idx__idx2;
c1	c2	ob_virtual_col
1	1	NULL
2	2	NULL
3	3	NULL
4	4	NULL
select  * from __3001__idx__idx3;
c1	c3	ob_virtual_col
1	1	NULL
2	2	NULL
3	3	NULL
4	4	NULL
select  * from __3001__idx__idx4;
c1	c4	ob_virtual_col
1	1	NULL
2	2	NULL
3	3	NULL
4	4	NULL
delete from test1 where c2 = 1 and c2 = 2 and c2 = 3 and c2 = 4 and c2 = 5;
select * from test1;
c1	c2	c3	c4
1	1	1	1
2	2	2	2
3	3	3	3
4	4	4	4
select  * from __3001__idx__idx1;
c1	ob_virtual_col
1	NULL
2	NULL
3	NULL
4	NULL
select  * from __3001__idx__idx2;
c1	c2	ob_virtual_col
1	1	NULL
2	2	NULL
3	3	NULL
4	4	NULL
select  * from __3001__idx__idx3;
c1	c3	ob_virtual_col
1	1	NULL
2	2	NULL
3	3	NULL
4	4	NULL
select  * from __3001__idx__idx4;
c1	c4	ob_virtual_col
1	1	NULL
2	2	NULL
3	3	NULL
4	4	NULL
replace into test1 values(1,1,1,1),(2,2,2,2),(3,3,3,3),(4,4,4,4);
select * from test1;
c1	c2	c3	c4
1	1	1	1
2	2	2	2
3	3	3	3
4	4	4	4
select  * from __3001__idx__idx1;
c1	ob_virtual_col
1	NULL
2	NULL
3	NULL
4	NULL
select  * from __3001__idx__idx2;
c1	c2	ob_virtual_col
1	1	NULL
2	2	NULL
3	3	NULL
4	4	NULL
select  * from __3001__idx__idx3;
c1	c3	ob_virtual_col
1	1	NULL
2	2	NULL
3	3	NULL
4	4	NULL
select  * from __3001__idx__idx4;
c1	c4	ob_virtual_col
1	1	NULL
2	2	NULL
3	3	NULL
4	4	NULL
delete from test1 where c2 = 1 or c2 = 2 and c2 = 3 or c2 = 4 and c2 = 5;
select * from test1;
c1	c2	c3	c4
2	2	2	2
3	3	3	3
4	4	4	4
select  * from __3001__idx__idx1;
c1	ob_virtual_col
2	NULL
3	NULL
4	NULL
select  * from __3001__idx__idx2;
c1	c2	ob_virtual_col
2	2	NULL
3	3	NULL
4	4	NULL
select  * from __3001__idx__idx3;
c1	c3	ob_virtual_col
2	2	NULL
3	3	NULL
4	4	NULL
select  * from __3001__idx__idx4;
c1	c4	ob_virtual_col
2	2	NULL
3	3	NULL
4	4	NULL
replace into test1 values(1,1,1,1),(2,2,2,2),(3,3,3,3),(4,4,4,4);
select * from test1;
c1	c2	c3	c4
1	1	1	1
2	2	2	2
3	3	3	3
4	4	4	4
select  * from __3001__idx__idx1;
c1	ob_virtual_col
1	NULL
2	NULL
3	NULL
4	NULL
select  * from __3001__idx__idx2;
c1	c2	ob_virtual_col
1	1	NULL
2	2	NULL
3	3	NULL
4	4	NULL
select  * from __3001__idx__idx3;
c1	c3	ob_virtual_col
1	1	NULL
2	2	NULL
3	3	NULL
4	4	NULL
select  * from __3001__idx__idx4;
c1	c4	ob_virtual_col
1	1	NULL
2	2	NULL
3	3	NULL
4	4	NULL
delete from test1 where c2 between 1 and 1;
select * from test1;
c1	c2	c3	c4
2	2	2	2
3	3	3	3
4	4	4	4
select  * from __3001__idx__idx1;
c1	ob_virtual_col
2	NULL
3	NULL
4	NULL
select  * from __3001__idx__idx2;
c1	c2	ob_virtual_col
2	2	NULL
3	3	NULL
4	4	NULL
select  * from __3001__idx__idx3;
c1	c3	ob_virtual_col
2	2	NULL
3	3	NULL
4	4	NULL
select  * from __3001__idx__idx4;
c1	c4	ob_virtual_col
2	2	NULL
3	3	NULL
4	4	NULL
replace into test1 values(1,1,1,1),(2,2,2,2),(3,3,3,3),(4,4,4,4);
select * from test1;
c1	c2	c3	c4
1	1	1	1
2	2	2	2
3	3	3	3
4	4	4	4
select  * from __3001__idx__idx1;
c1	ob_virtual_col
1	NULL
2	NULL
3	NULL
4	NULL
select  * from __3001__idx__idx2;
c1	c2	ob_virtual_col
1	1	NULL
2	2	NULL
3	3	NULL
4	4	NULL
select  * from __3001__idx__idx3;
c1	c3	ob_virtual_col
1	1	NULL
2	2	NULL
3	3	NULL
4	4	NULL
select  * from __3001__idx__idx4;
c1	c4	ob_virtual_col
1	1	NULL
2	2	NULL
3	3	NULL
4	4	NULL
delete from test1 where c2 between 3 and 4;
select * from test1;
c1	c2	c3	c4
1	1	1	1
2	2	2	2
select  * from __3001__idx__idx1;
c1	ob_virtual_col
1	NULL
2	NULL
select  * from __3001__idx__idx2;
c1	c2	ob_virtual_col
1	1	NULL
2	2	NULL
select  * from __3001__idx__idx3;
c1	c3	ob_virtual_col
1	1	NULL
2	2	NULL
select  * from __3001__idx__idx4;
c1	c4	ob_virtual_col
1	1	NULL
2	2	NULL
replace into test1 values(1,1,1,1),(2,2,2,2),(3,3,3,3),(4,4,4,4);
select * from test1;
c1	c2	c3	c4
1	1	1	1
2	2	2	2
3	3	3	3
4	4	4	4
select  * from __3001__idx__idx1;
c1	ob_virtual_col
1	NULL
2	NULL
3	NULL
4	NULL
select  * from __3001__idx__idx2;
c1	c2	ob_virtual_col
1	1	NULL
2	2	NULL
3	3	NULL
4	4	NULL
select  * from __3001__idx__idx3;
c1	c3	ob_virtual_col
1	1	NULL
2	2	NULL
3	3	NULL
4	4	NULL
select  * from __3001__idx__idx4;
c1	c4	ob_virtual_col
1	1	NULL
2	2	NULL
3	3	NULL
4	4	NULL
delete from test1 where c2 IN (10,11,12,13,14,15);
select * from test1;
c1	c2	c3	c4
1	1	1	1
2	2	2	2
3	3	3	3
4	4	4	4
select  * from __3001__idx__idx1;
c1	ob_virtual_col
1	NULL
2	NULL
3	NULL
4	NULL
select  * from __3001__idx__idx2;
c1	c2	ob_virtual_col
1	1	NULL
2	2	NULL
3	3	NULL
4	4	NULL
select  * from __3001__idx__idx3;
c1	c3	ob_virtual_col
1	1	NULL
2	2	NULL
3	3	NULL
4	4	NULL
select  * from __3001__idx__idx4;
c1	c4	ob_virtual_col
1	1	NULL
2	2	NULL
3	3	NULL
4	4	NULL
replace into test1 values(1,1,1,1),(2,2,2,2),(3,3,3,3),(4,4,4,4);
select * from test1;
c1	c2	c3	c4
1	1	1	1
2	2	2	2
3	3	3	3
4	4	4	4
select  * from __3001__idx__idx1;
c1	ob_virtual_col
1	NULL
2	NULL
3	NULL
4	NULL
select  * from __3001__idx__idx2;
c1	c2	ob_virtual_col
1	1	NULL
2	2	NULL
3	3	NULL
4	4	NULL
select  * from __3001__idx__idx3;
c1	c3	ob_virtual_col
1	1	NULL
2	2	NULL
3	3	NULL
4	4	NULL
select  * from __3001__idx__idx4;
c1	c4	ob_virtual_col
1	1	NULL
2	2	NULL
3	3	NULL
4	4	NULL
delete from test1 where c2 IN (1);
select * from test1;
c1	c2	c3	c4
2	2	2	2
3	3	3	3
4	4	4	4
select  * from __3001__idx__idx1;
c1	ob_virtual_col
2	NULL
3	NULL
4	NULL
select  * from __3001__idx__idx2;
c1	c2	ob_virtual_col
2	2	NULL
3	3	NULL
4	4	NULL
select  * from __3001__idx__idx3;
c1	c3	ob_virtual_col
2	2	NULL
3	3	NULL
4	4	NULL
select  * from __3001__idx__idx4;
c1	c4	ob_virtual_col
2	2	NULL
3	3	NULL
4	4	NULL
replace into test1 values(1,1,1,1),(2,2,2,2),(3,3,3,3),(4,4,4,4);
select * from test1;
c1	c2	c3	c4
1	1	1	1
2	2	2	2
3	3	3	3
4	4	4	4
select  * from __3001__idx__idx1;
c1	ob_virtual_col
1	NULL
2	NULL
3	NULL
4	NULL
select  * from __3001__idx__idx2;
c1	c2	ob_virtual_col
1	1	NULL
2	2	NULL
3	3	NULL
4	4	NULL
select  * from __3001__idx__idx3;
c1	c3	ob_virtual_col
1	1	NULL
2	2	NULL
3	3	NULL
4	4	NULL
select  * from __3001__idx__idx4;
c1	c4	ob_virtual_col
1	1	NULL
2	2	NULL
3	3	NULL
4	4	NULL
delete from test1 where c2 IN (2);
select * from test1;
c1	c2	c3	c4
1	1	1	1
3	3	3	3
4	4	4	4
select  * from __3001__idx__idx1;
c1	ob_virtual_col
1	NULL
3	NULL
4	NULL
select  * from __3001__idx__idx2;
c1	c2	ob_virtual_col
1	1	NULL
3	3	NULL
4	4	NULL
select  * from __3001__idx__idx3;
c1	c3	ob_virtual_col
1	1	NULL
3	3	NULL
4	4	NULL
select  * from __3001__idx__idx4;
c1	c4	ob_virtual_col
1	1	NULL
3	3	NULL
4	4	NULL
replace into test1 values(1,1,1,1),(2,2,2,2),(3,3,3,3),(4,4,4,4);
select * from test1;
c1	c2	c3	c4
1	1	1	1
2	2	2	2
3	3	3	3
4	4	4	4
select  * from __3001__idx__idx1;
c1	ob_virtual_col
1	NULL
2	NULL
3	NULL
4	NULL
select  * from __3001__idx__idx2;
c1	c2	ob_virtual_col
1	1	NULL
2	2	NULL
3	3	NULL
4	4	NULL
select  * from __3001__idx__idx3;
c1	c3	ob_virtual_col
1	1	NULL
2	2	NULL
3	3	NULL
4	4	NULL
select  * from __3001__idx__idx4;
c1	c4	ob_virtual_col
1	1	NULL
2	2	NULL
3	3	NULL
4	4	NULL
delete from test1 where c2 IN (1,2,3,4,5,6,7,8,9,10);
select * from test1;
c1	c2	c3	c4
select  * from __3001__idx__idx1;
c1	ob_virtual_col
select  * from __3001__idx__idx2;
c1	c2	ob_virtual_col
select  * from __3001__idx__idx3;
c1	c3	ob_virtual_col
select  * from __3001__idx__idx4;
c1	c4	ob_virtual_col
replace into test1 values(1,1,1,1),(2,2,2,2),(3,3,3,3),(4,4,4,4);
select * from test1;
c1	c2	c3	c4
1	1	1	1
2	2	2	2
3	3	3	3
4	4	4	4
select  * from __3001__idx__idx1;
c1	ob_virtual_col
1	NULL
2	NULL
3	NULL
4	NULL
select  * from __3001__idx__idx2;
c1	c2	ob_virtual_col
1	1	NULL
2	2	NULL
3	3	NULL
4	4	NULL
select  * from __3001__idx__idx3;
c1	c3	ob_virtual_col
1	1	NULL
2	2	NULL
3	3	NULL
4	4	NULL
select  * from __3001__idx__idx4;
c1	c4	ob_virtual_col
1	1	NULL
2	2	NULL
3	3	NULL
4	4	NULL
delete from test1 where c2 * 2 + 1 > 3;
select * from test1;
c1	c2	c3	c4
1	1	1	1
select  * from __3001__idx__idx1;
c1	ob_virtual_col
1	NULL
select  * from __3001__idx__idx2;
c1	c2	ob_virtual_col
1	1	NULL
select  * from __3001__idx__idx3;
c1	c3	ob_virtual_col
1	1	NULL
select  * from __3001__idx__idx4;
c1	c4	ob_virtual_col
1	1	NULL
replace into test1 values(1,1,1,1),(2,2,2,2),(3,3,3,3),(4,4,4,4);
select * from test1;
c1	c2	c3	c4
1	1	1	1
2	2	2	2
3	3	3	3
4	4	4	4
select  * from __3001__idx__idx1;
c1	ob_virtual_col
1	NULL
2	NULL
3	NULL
4	NULL
select  * from __3001__idx__idx2;
c1	c2	ob_virtual_col
1	1	NULL
2	2	NULL
3	3	NULL
4	4	NULL
select  * from __3001__idx__idx3;
c1	c3	ob_virtual_col
1	1	NULL
2	2	NULL
3	3	NULL
4	4	NULL
select  * from __3001__idx__idx4;
c1	c4	ob_virtual_col
1	1	NULL
2	2	NULL
3	3	NULL
4	4	NULL
delete from test1 where c2 / 2 - 1 > 0;
select * from test1;
c1	c2	c3	c4
1	1	1	1
2	2	2	2
3	3	3	3
select  * from __3001__idx__idx1;
c1	ob_virtual_col
1	NULL
2	NULL
3	NULL
select  * from __3001__idx__idx2;
c1	c2	ob_virtual_col
1	1	NULL
2	2	NULL
3	3	NULL
select  * from __3001__idx__idx3;
c1	c3	ob_virtual_col
1	1	NULL
2	2	NULL
3	3	NULL
select  * from __3001__idx__idx4;
c1	c4	ob_virtual_col
1	1	NULL
2	2	NULL
3	3	NULL
replace into test1 values(1,1,1,1),(2,2,2,2),(3,3,3,3),(4,4,4,4);
select * from test1;
c1	c2	c3	c4
1	1	1	1
2	2	2	2
3	3	3	3
4	4	4	4
select  * from __3001__idx__idx1;
c1	ob_virtual_col
1	NULL
2	NULL
3	NULL
4	NULL
select  * from __3001__idx__idx2;
c1	c2	ob_virtual_col
1	1	NULL
2	2	NULL
3	3	NULL
4	4	NULL
select  * from __3001__idx__idx3;
c1	c3	ob_virtual_col
1	1	NULL
2	2	NULL
3	3	NULL
4	4	NULL
select  * from __3001__idx__idx4;
c1	c4	ob_virtual_col
1	1	NULL
2	2	NULL
3	3	NULL
4	4	NULL
delete from test1 where c2 * 2 / 3 * 5 % 4 + 1 > 1;
select * from test1;
c1	c2	c3	c4
1	1	1	1
select  * from __3001__idx__idx1;
c1	ob_virtual_col
1	NULL
select  * from __3001__idx__idx2;
c1	c2	ob_virtual_col
1	1	NULL
select  * from __3001__idx__idx3;
c1	c3	ob_virtual_col
1	1	NULL
select  * from __3001__idx__idx4;
c1	c4	ob_virtual_col
1	1	NULL
replace into test1 values(1,1,1,1),(2,2,2,2),(3,3,3,3),(4,4,4,4);
select * from test1;
c1	c2	c3	c4
1	1	1	1
2	2	2	2
3	3	3	3
4	4	4	4
select  * from __3001__idx__idx1;
c1	ob_virtual_col
1	NULL
2	NULL
3	NULL
4	NULL
select  * from __3001__idx__idx2;
c1	c2	ob_virtual_col
1	1	NULL
2	2	NULL
3	3	NULL
4	4	NULL
select  * from __3001__idx__idx3;
c1	c3	ob_virtual_col
1	1	NULL
2	2	NULL
3	3	NULL
4	4	NULL
select  * from __3001__idx__idx4;
c1	c4	ob_virtual_col
1	1	NULL
2	2	NULL
3	3	NULL
4	4	NULL
delete from test1 where (c2 * 2 / 3 * 5) MOD 3 + 1 > 2;
select * from test1;
c1	c2	c3	c4
1	1	1	1
3	3	3	3
4	4	4	4
select  * from __3001__idx__idx1;
c1	ob_virtual_col
1	NULL
3	NULL
4	NULL
select  * from __3001__idx__idx2;
c1	c2	ob_virtual_col
1	1	NULL
3	3	NULL
4	4	NULL
select  * from __3001__idx__idx3;
c1	c3	ob_virtual_col
1	1	NULL
3	3	NULL
4	4	NULL
select  * from __3001__idx__idx4;
c1	c4	ob_virtual_col
1	1	NULL
3	3	NULL
4	4	NULL
replace into test1 values(1,1,1,1),(2,2,2,2),(3,3,3,3),(4,4,4,4);
select * from test1;
c1	c2	c3	c4
1	1	1	1
2	2	2	2
3	3	3	3
4	4	4	4
select  * from __3001__idx__idx1;
c1	ob_virtual_col
1	NULL
2	NULL
3	NULL
4	NULL
select  * from __3001__idx__idx2;
c1	c2	ob_virtual_col
1	1	NULL
2	2	NULL
3	3	NULL
4	4	NULL
select  * from __3001__idx__idx3;
c1	c3	ob_virtual_col
1	1	NULL
2	2	NULL
3	3	NULL
4	4	NULL
select  * from __3001__idx__idx4;
c1	c4	ob_virtual_col
1	1	NULL
2	2	NULL
3	3	NULL
4	4	NULL
delete from test1 where c1 = 1 OR c2 = 2 OR c3 = 3 OR c4 = 4 OR c2 = 5;
select * from test1;
c1	c2	c3	c4
select  * from __3001__idx__idx1;
c1	ob_virtual_col
select  * from __3001__idx__idx2;
c1	c2	ob_virtual_col
select  * from __3001__idx__idx3;
c1	c3	ob_virtual_col
select  * from __3001__idx__idx4;
c1	c4	ob_virtual_col
replace into test1 values(1,1,1,1),(2,2,2,2),(3,3,3,3),(4,4,4,4);
select * from test1;
c1	c2	c3	c4
1	1	1	1
2	2	2	2
3	3	3	3
4	4	4	4
select  * from __3001__idx__idx1;
c1	ob_virtual_col
1	NULL
2	NULL
3	NULL
4	NULL
select  * from __3001__idx__idx2;
c1	c2	ob_virtual_col
1	1	NULL
2	2	NULL
3	3	NULL
4	4	NULL
select  * from __3001__idx__idx3;
c1	c3	ob_virtual_col
1	1	NULL
2	2	NULL
3	3	NULL
4	4	NULL
select  * from __3001__idx__idx4;
c1	c4	ob_virtual_col
1	1	NULL
2	2	NULL
3	3	NULL
4	4	NULL
delete from test1 where c1 = 1 and c2 = 2 and c3 = 3 and c4 = 1;
select * from test1;
c1	c2	c3	c4
1	1	1	1
2	2	2	2
3	3	3	3
4	4	4	4
select  * from __3001__idx__idx1;
c1	ob_virtual_col
1	NULL
2	NULL
3	NULL
4	NULL
select  * from __3001__idx__idx2;
c1	c2	ob_virtual_col
1	1	NULL
2	2	NULL
3	3	NULL
4	4	NULL
select  * from __3001__idx__idx3;
c1	c3	ob_virtual_col
1	1	NULL
2	2	NULL
3	3	NULL
4	4	NULL
select  * from __3001__idx__idx4;
c1	c4	ob_virtual_col
1	1	NULL
2	2	NULL
3	3	NULL
4	4	NULL
delete from test1 where c1 = 1 and c2 = 1 and c3 = 1 and c4 = 1;
select * from test1;
c1	c2	c3	c4
2	2	2	2
3	3	3	3
4	4	4	4
select  * from __3001__idx__idx1;
c1	ob_virtual_col
2	NULL
3	NULL
4	NULL
select  * from __3001__idx__idx2;
c1	c2	ob_virtual_col
2	2	NULL
3	3	NULL
4	4	NULL
select  * from __3001__idx__idx3;
c1	c3	ob_virtual_col
2	2	NULL
3	3	NULL
4	4	NULL
select  * from __3001__idx__idx4;
c1	c4	ob_virtual_col
2	2	NULL
3	3	NULL
4	4	NULL
replace into test1 values(1,1,1,1),(2,2,2,2),(3,3,3,3),(4,4,4,4);
select * from test1;
c1	c2	c3	c4
1	1	1	1
2	2	2	2
3	3	3	3
4	4	4	4
select  * from __3001__idx__idx1;
c1	ob_virtual_col
1	NULL
2	NULL
3	NULL
4	NULL
select  * from __3001__idx__idx2;
c1	c2	ob_virtual_col
1	1	NULL
2	2	NULL
3	3	NULL
4	4	NULL
select  * from __3001__idx__idx3;
c1	c3	ob_virtual_col
1	1	NULL
2	2	NULL
3	3	NULL
4	4	NULL
select  * from __3001__idx__idx4;
c1	c4	ob_virtual_col
1	1	NULL
2	2	NULL
3	3	NULL
4	4	NULL
delete from test1 where c2 = 1 and c3 = 1 and c4 = 1;
select * from test1;
c1	c2	c3	c4
2	2	2	2
3	3	3	3
4	4	4	4
select  * from __3001__idx__idx1;
c1	ob_virtual_col
2	NULL
3	NULL
4	NULL
select  * from __3001__idx__idx2;
c1	c2	ob_virtual_col
2	2	NULL
3	3	NULL
4	4	NULL
select  * from __3001__idx__idx3;
c1	c3	ob_virtual_col
2	2	NULL
3	3	NULL
4	4	NULL
select  * from __3001__idx__idx4;
c1	c4	ob_virtual_col
2	2	NULL
3	3	NULL
4	4	NULL
replace into test1 values(1,1,1,1),(2,2,2,2),(3,3,3,3),(4,4,4,4);
select * from test1;
c1	c2	c3	c4
1	1	1	1
2	2	2	2
3	3	3	3
4	4	4	4
select  * from __3001__idx__idx1;
c1	ob_virtual_col
1	NULL
2	NULL
3	NULL
4	NULL
select  * from __3001__idx__idx2;
c1	c2	ob_virtual_col
1	1	NULL
2	2	NULL
3	3	NULL
4	4	NULL
select  * from __3001__idx__idx3;
c1	c3	ob_virtual_col
1	1	NULL
2	2	NULL
3	3	NULL
4	4	NULL
select  * from __3001__idx__idx4;
c1	c4	ob_virtual_col
1	1	NULL
2	2	NULL
3	3	NULL
4	4	NULL
delete from test1 where c1 = 1 or c2 = 2 and c4 = 3 or c2 = 4 and c2 = 5;
select * from test1;
c1	c2	c3	c4
2	2	2	2
3	3	3	3
4	4	4	4
select  * from __3001__idx__idx1;
c1	ob_virtual_col
2	NULL
3	NULL
4	NULL
select  * from __3001__idx__idx2;
c1	c2	ob_virtual_col
2	2	NULL
3	3	NULL
4	4	NULL
select  * from __3001__idx__idx3;
c1	c3	ob_virtual_col
2	2	NULL
3	3	NULL
4	4	NULL
select  * from __3001__idx__idx4;
c1	c4	ob_virtual_col
2	2	NULL
3	3	NULL
4	4	NULL
replace into test1 values(1,1,1,1),(2,2,2,2),(3,3,3,3),(4,4,4,4);
select * from test1;
c1	c2	c3	c4
1	1	1	1
2	2	2	2
3	3	3	3
4	4	4	4
select  * from __3001__idx__idx1;
c1	ob_virtual_col
1	NULL
2	NULL
3	NULL
4	NULL
select  * from __3001__idx__idx2;
c1	c2	ob_virtual_col
1	1	NULL
2	2	NULL
3	3	NULL
4	4	NULL
select  * from __3001__idx__idx3;
c1	c3	ob_virtual_col
1	1	NULL
2	2	NULL
3	3	NULL
4	4	NULL
select  * from __3001__idx__idx4;
c1	c4	ob_virtual_col
1	1	NULL
2	2	NULL
3	3	NULL
4	4	NULL
delete from test1 where c3 between 1 and 4 and c4 between 3 and 4;
select * from test1;
c1	c2	c3	c4
1	1	1	1
2	2	2	2
select  * from __3001__idx__idx1;
c1	ob_virtual_col
1	NULL
2	NULL
select  * from __3001__idx__idx2;
c1	c2	ob_virtual_col
1	1	NULL
2	2	NULL
select  * from __3001__idx__idx3;
c1	c3	ob_virtual_col
1	1	NULL
2	2	NULL
select  * from __3001__idx__idx4;
c1	c4	ob_virtual_col
1	1	NULL
2	2	NULL
replace into test1 values(1,1,1,1),(2,2,2,2),(3,3,3,3),(4,4,4,4);
select * from test1;
c1	c2	c3	c4
1	1	1	1
2	2	2	2
3	3	3	3
4	4	4	4
select  * from __3001__idx__idx1;
c1	ob_virtual_col
1	NULL
2	NULL
3	NULL
4	NULL
select  * from __3001__idx__idx2;
c1	c2	ob_virtual_col
1	1	NULL
2	2	NULL
3	3	NULL
4	4	NULL
select  * from __3001__idx__idx3;
c1	c3	ob_virtual_col
1	1	NULL
2	2	NULL
3	3	NULL
4	4	NULL
select  * from __3001__idx__idx4;
c1	c4	ob_virtual_col
1	1	NULL
2	2	NULL
3	3	NULL
4	4	NULL
delete from test1 where c2 * 2 + c3 > 3;
select * from test1;
c1	c2	c3	c4
1	1	1	1
select  * from __3001__idx__idx1;
c1	ob_virtual_col
1	NULL
select  * from __3001__idx__idx2;
c1	c2	ob_virtual_col
1	1	NULL
select  * from __3001__idx__idx3;
c1	c3	ob_virtual_col
1	1	NULL
select  * from __3001__idx__idx4;
c1	c4	ob_virtual_col
1	1	NULL
replace into test1 values(1,1,1,1),(2,2,2,2),(3,3,3,3),(4,4,4,4);
select * from test1;
c1	c2	c3	c4
1	1	1	1
2	2	2	2
3	3	3	3
4	4	4	4
select  * from __3001__idx__idx1;
c1	ob_virtual_col
1	NULL
2	NULL
3	NULL
4	NULL
select  * from __3001__idx__idx2;
c1	c2	ob_virtual_col
1	1	NULL
2	2	NULL
3	3	NULL
4	4	NULL
select  * from __3001__idx__idx3;
c1	c3	ob_virtual_col
1	1	NULL
2	2	NULL
3	3	NULL
4	4	NULL
select  * from __3001__idx__idx4;
c1	c4	ob_virtual_col
1	1	NULL
2	2	NULL
3	3	NULL
4	4	NULL
delete from test1 where c2 * c3 - 1 > 1;
select * from test1;
c1	c2	c3	c4
1	1	1	1
select  * from __3001__idx__idx1;
c1	ob_virtual_col
1	NULL
select  * from __3001__idx__idx2;
c1	c2	ob_virtual_col
1	1	NULL
select  * from __3001__idx__idx3;
c1	c3	ob_virtual_col
1	1	NULL
select  * from __3001__idx__idx4;
c1	c4	ob_virtual_col
1	1	NULL
replace into test1 values(1,1,1,1),(2,2,2,2),(3,3,3,3),(4,4,4,4);
select * from test1;
c1	c2	c3	c4
1	1	1	1
2	2	2	2
3	3	3	3
4	4	4	4
select  * from __3001__idx__idx1;
c1	ob_virtual_col
1	NULL
2	NULL
3	NULL
4	NULL
select  * from __3001__idx__idx2;
c1	c2	ob_virtual_col
1	1	NULL
2	2	NULL
3	3	NULL
4	4	NULL
select  * from __3001__idx__idx3;
c1	c3	ob_virtual_col
1	1	NULL
2	2	NULL
3	3	NULL
4	4	NULL
select  * from __3001__idx__idx4;
c1	c4	ob_virtual_col
1	1	NULL
2	2	NULL
3	3	NULL
4	4	NULL
delete from test1 where c2 * 2 / c3 * 5 % c3 + 1 > 1;
select * from test1;
c1	c2	c3	c4
1	1	1	1
2	2	2	2
select  * from __3001__idx__idx1;
c1	ob_virtual_col
1	NULL
2	NULL
select  * from __3001__idx__idx2;
c1	c2	ob_virtual_col
1	1	NULL
2	2	NULL
select  * from __3001__idx__idx3;
c1	c3	ob_virtual_col
1	1	NULL
2	2	NULL
select  * from __3001__idx__idx4;
c1	c4	ob_virtual_col
1	1	NULL
2	2	NULL
replace into test1 values(1,1,1,1),(2,2,2,2),(3,3,3,3),(4,4,4,4);
select * from test1;
c1	c2	c3	c4
1	1	1	1
2	2	2	2
3	3	3	3
4	4	4	4
select  * from __3001__idx__idx1;
c1	ob_virtual_col
1	NULL
2	NULL
3	NULL
4	NULL
select  * from __3001__idx__idx2;
c1	c2	ob_virtual_col
1	1	NULL
2	2	NULL
3	3	NULL
4	4	NULL
select  * from __3001__idx__idx3;
c1	c3	ob_virtual_col
1	1	NULL
2	2	NULL
3	3	NULL
4	4	NULL
select  * from __3001__idx__idx4;
c1	c4	ob_virtual_col
1	1	NULL
2	2	NULL
3	3	NULL
4	4	NULL
delete from test1 where (c2 * 2 / 3 * 5) MOD c1 + 1 > 1;
select * from test1;
c1	c2	c3	c4
1	1	1	1
select  * from __3001__idx__idx1;
c1	ob_virtual_col
1	NULL
select  * from __3001__idx__idx2;
c1	c2	ob_virtual_col
1	1	NULL
select  * from __3001__idx__idx3;
c1	c3	ob_virtual_col
1	1	NULL
select  * from __3001__idx__idx4;
c1	c4	ob_virtual_col
1	1	NULL
replace into test1 values(1,1,1,1),(2,2,2,2),(3,3,3,3),(4,4,4,4);
select * from test1;
c1	c2	c3	c4
1	1	1	1
2	2	2	2
3	3	3	3
4	4	4	4
select  * from __3001__idx__idx1;
c1	ob_virtual_col
1	NULL
2	NULL
3	NULL
4	NULL
select  * from __3001__idx__idx2;
c1	c2	ob_virtual_col
1	1	NULL
2	2	NULL
3	3	NULL
4	4	NULL
select  * from __3001__idx__idx3;
c1	c3	ob_virtual_col
1	1	NULL
2	2	NULL
3	3	NULL
4	4	NULL
select  * from __3001__idx__idx4;
c1	c4	ob_virtual_col
1	1	NULL
2	2	NULL
3	3	NULL
4	4	NULL
delete from test2 where c1 = 1 and c2 = 1 and c3 = 1;
select * from test2;
c1	c2	c3	c4	c5	c6	c7	c8
2	2	2	2	2	2	2	2
3	3	3	3	3	3	3	3
4	4	4	4	4	4	4	4
select  * from __3006__idx__idx1;
c1	c2	c3	ob_virtual_col
2	2	2	NULL
3	3	3	NULL
4	4	4	NULL
select  * from __3006__idx__idx2;
c1	c2	c3	c4	c5	c6
2	2	2	2	2	2
3	3	3	3	3	3
4	4	4	4	4	4
select  * from __3006__idx__idx3;
c1	c2	c3	c4	c6	c7
2	2	2	2	2	2
3	3	3	3	3	3
4	4	4	4	4	4
select  * from __3006__idx__idx4;
c1	c2	c3	c4	c5	c6	c7	c8
2	2	2	2	2	2	2	2
3	3	3	3	3	3	3	3
4	4	4	4	4	4	4	4
select  * from __3006__idx__idx5;
c1	c2	c3	c4	c5	c6	c7	c8
2	2	2	2	2	2	2	2
3	3	3	3	3	3	3	3
4	4	4	4	4	4	4	4
select  * from __3006__idx__idx1;
c1	c2	c3	ob_virtual_col
2	2	2	NULL
3	3	3	NULL
4	4	4	NULL
select  * from __3006__idx__idx2;
c1	c2	c3	c4	c5	c6
2	2	2	2	2	2
3	3	3	3	3	3
4	4	4	4	4	4
select  * from __3006__idx__idx3;
c1	c2	c3	c4	c6	c7
2	2	2	2	2	2
3	3	3	3	3	3
4	4	4	4	4	4
select  * from __3006__idx__idx4;
c1	c2	c3	c4	c5	c6	c7	c8
2	2	2	2	2	2	2	2
3	3	3	3	3	3	3	3
4	4	4	4	4	4	4	4
select  * from __3006__idx__idx5;
c1	c2	c3	c4	c5	c6	c7	c8
2	2	2	2	2	2	2	2
3	3	3	3	3	3	3	3
4	4	4	4	4	4	4	4
replace into test2 values(1,1,1,1,1,1,1,1),(2,2,2,2,2,2,2,2),(3,3,3,3,3,3,3,3),(4,4,4,4,4,4,4,4);
select * from test2;
c1	c2	c3	c4	c5	c6	c7	c8
1	1	1	1	1	1	1	1
2	2	2	2	2	2	2	2
3	3	3	3	3	3	3	3
4	4	4	4	4	4	4	4
select  * from __3006__idx__idx1;
c1	c2	c3	ob_virtual_col
1	1	1	NULL
2	2	2	NULL
3	3	3	NULL
4	4	4	NULL
select  * from __3006__idx__idx2;
c1	c2	c3	c4	c5	c6
1	1	1	1	1	1
2	2	2	2	2	2
3	3	3	3	3	3
4	4	4	4	4	4
select  * from __3006__idx__idx3;
c1	c2	c3	c4	c6	c7
1	1	1	1	1	1
2	2	2	2	2	2
3	3	3	3	3	3
4	4	4	4	4	4
select  * from __3006__idx__idx4;
c1	c2	c3	c4	c5	c6	c7	c8
1	1	1	1	1	1	1	1
2	2	2	2	2	2	2	2
3	3	3	3	3	3	3	3
4	4	4	4	4	4	4	4
select  * from __3006__idx__idx5;
c1	c2	c3	c4	c5	c6	c7	c8
1	1	1	1	1	1	1	1
2	2	2	2	2	2	2	2
3	3	3	3	3	3	3	3
4	4	4	4	4	4	4	4
delete from test2 where c1 > 1 and c2 > 1 and c3 > 1;
select * from test2;
c1	c2	c3	c4	c5	c6	c7	c8
1	1	1	1	1	1	1	1
select  * from __3006__idx__idx1;
c1	c2	c3	ob_virtual_col
1	1	1	NULL
select  * from __3006__idx__idx2;
c1	c2	c3	c4	c5	c6
1	1	1	1	1	1
select  * from __3006__idx__idx3;
c1	c2	c3	c4	c6	c7
1	1	1	1	1	1
select  * from __3006__idx__idx4;
c1	c2	c3	c4	c5	c6	c7	c8
1	1	1	1	1	1	1	1
select  * from __3006__idx__idx5;
c1	c2	c3	c4	c5	c6	c7	c8
1	1	1	1	1	1	1	1
replace into test2 values(1,1,1,1,1,1,1,1),(2,2,2,2,2,2,2,2),(3,3,3,3,3,3,3,3),(4,4,4,4,4,4,4,4);
select * from test2;
c1	c2	c3	c4	c5	c6	c7	c8
1	1	1	1	1	1	1	1
2	2	2	2	2	2	2	2
3	3	3	3	3	3	3	3
4	4	4	4	4	4	4	4
select  * from __3006__idx__idx1;
c1	c2	c3	ob_virtual_col
1	1	1	NULL
2	2	2	NULL
3	3	3	NULL
4	4	4	NULL
select  * from __3006__idx__idx2;
c1	c2	c3	c4	c5	c6
1	1	1	1	1	1
2	2	2	2	2	2
3	3	3	3	3	3
4	4	4	4	4	4
select  * from __3006__idx__idx3;
c1	c2	c3	c4	c6	c7
1	1	1	1	1	1
2	2	2	2	2	2
3	3	3	3	3	3
4	4	4	4	4	4
select  * from __3006__idx__idx4;
c1	c2	c3	c4	c5	c6	c7	c8
1	1	1	1	1	1	1	1
2	2	2	2	2	2	2	2
3	3	3	3	3	3	3	3
4	4	4	4	4	4	4	4
select  * from __3006__idx__idx5;
c1	c2	c3	c4	c5	c6	c7	c8
1	1	1	1	1	1	1	1
2	2	2	2	2	2	2	2
3	3	3	3	3	3	3	3
4	4	4	4	4	4	4	4
delete from test2 where c1 > 1;
select * from test2;
c1	c2	c3	c4	c5	c6	c7	c8
1	1	1	1	1	1	1	1
select  * from __3006__idx__idx1;
c1	c2	c3	ob_virtual_col
1	1	1	NULL
select  * from __3006__idx__idx2;
c1	c2	c3	c4	c5	c6
1	1	1	1	1	1
select  * from __3006__idx__idx3;
c1	c2	c3	c4	c6	c7
1	1	1	1	1	1
select  * from __3006__idx__idx4;
c1	c2	c3	c4	c5	c6	c7	c8
1	1	1	1	1	1	1	1
select  * from __3006__idx__idx5;
c1	c2	c3	c4	c5	c6	c7	c8
1	1	1	1	1	1	1	1
replace into test2 values(1,1,1,1,1,1,1,1),(2,2,2,2,2,2,2,2),(3,3,3,3,3,3,3,3),(4,4,4,4,4,4,4,4);
select * from test2;
c1	c2	c3	c4	c5	c6	c7	c8
1	1	1	1	1	1	1	1
2	2	2	2	2	2	2	2
3	3	3	3	3	3	3	3
4	4	4	4	4	4	4	4
select  * from __3006__idx__idx1;
c1	c2	c3	ob_virtual_col
1	1	1	NULL
2	2	2	NULL
3	3	3	NULL
4	4	4	NULL
select  * from __3006__idx__idx2;
c1	c2	c3	c4	c5	c6
1	1	1	1	1	1
2	2	2	2	2	2
3	3	3	3	3	3
4	4	4	4	4	4
select  * from __3006__idx__idx3;
c1	c2	c3	c4	c6	c7
1	1	1	1	1	1
2	2	2	2	2	2
3	3	3	3	3	3
4	4	4	4	4	4
select  * from __3006__idx__idx4;
c1	c2	c3	c4	c5	c6	c7	c8
1	1	1	1	1	1	1	1
2	2	2	2	2	2	2	2
3	3	3	3	3	3	3	3
4	4	4	4	4	4	4	4
select  * from __3006__idx__idx5;
c1	c2	c3	c4	c5	c6	c7	c8
1	1	1	1	1	1	1	1
2	2	2	2	2	2	2	2
3	3	3	3	3	3	3	3
4	4	4	4	4	4	4	4
delete from test2 where c2 > 1;
select * from test2;
c1	c2	c3	c4	c5	c6	c7	c8
1	1	1	1	1	1	1	1
select  * from __3006__idx__idx1;
c1	c2	c3	ob_virtual_col
1	1	1	NULL
select  * from __3006__idx__idx2;
c1	c2	c3	c4	c5	c6
1	1	1	1	1	1
select  * from __3006__idx__idx3;
c1	c2	c3	c4	c6	c7
1	1	1	1	1	1
select  * from __3006__idx__idx4;
c1	c2	c3	c4	c5	c6	c7	c8
1	1	1	1	1	1	1	1
select  * from __3006__idx__idx5;
c1	c2	c3	c4	c5	c6	c7	c8
1	1	1	1	1	1	1	1
replace into test2 values(1,1,1,1,1,1,1,1),(2,2,2,2,2,2,2,2),(3,3,3,3,3,3,3,3),(4,4,4,4,4,4,4,4);
select * from test2;
c1	c2	c3	c4	c5	c6	c7	c8
1	1	1	1	1	1	1	1
2	2	2	2	2	2	2	2
3	3	3	3	3	3	3	3
4	4	4	4	4	4	4	4
select  * from __3006__idx__idx1;
c1	c2	c3	ob_virtual_col
1	1	1	NULL
2	2	2	NULL
3	3	3	NULL
4	4	4	NULL
select  * from __3006__idx__idx2;
c1	c2	c3	c4	c5	c6
1	1	1	1	1	1
2	2	2	2	2	2
3	3	3	3	3	3
4	4	4	4	4	4
select  * from __3006__idx__idx3;
c1	c2	c3	c4	c6	c7
1	1	1	1	1	1
2	2	2	2	2	2
3	3	3	3	3	3
4	4	4	4	4	4
select  * from __3006__idx__idx4;
c1	c2	c3	c4	c5	c6	c7	c8
1	1	1	1	1	1	1	1
2	2	2	2	2	2	2	2
3	3	3	3	3	3	3	3
4	4	4	4	4	4	4	4
select  * from __3006__idx__idx5;
c1	c2	c3	c4	c5	c6	c7	c8
1	1	1	1	1	1	1	1
2	2	2	2	2	2	2	2
3	3	3	3	3	3	3	3
4	4	4	4	4	4	4	4
delete from test2 where c3 > 1;
select * from test2;
c1	c2	c3	c4	c5	c6	c7	c8
1	1	1	1	1	1	1	1
select  * from __3006__idx__idx1;
c1	c2	c3	ob_virtual_col
1	1	1	NULL
select  * from __3006__idx__idx2;
c1	c2	c3	c4	c5	c6
1	1	1	1	1	1
select  * from __3006__idx__idx3;
c1	c2	c3	c4	c6	c7
1	1	1	1	1	1
select  * from __3006__idx__idx4;
c1	c2	c3	c4	c5	c6	c7	c8
1	1	1	1	1	1	1	1
select  * from __3006__idx__idx5;
c1	c2	c3	c4	c5	c6	c7	c8
1	1	1	1	1	1	1	1
replace into test2 values(1,1,1,1,1,1,1,1),(2,2,2,2,2,2,2,2),(3,3,3,3,3,3,3,3),(4,4,4,4,4,4,4,4);
select * from test2;
c1	c2	c3	c4	c5	c6	c7	c8
1	1	1	1	1	1	1	1
2	2	2	2	2	2	2	2
3	3	3	3	3	3	3	3
4	4	4	4	4	4	4	4
select  * from __3006__idx__idx1;
c1	c2	c3	ob_virtual_col
1	1	1	NULL
2	2	2	NULL
3	3	3	NULL
4	4	4	NULL
select  * from __3006__idx__idx2;
c1	c2	c3	c4	c5	c6
1	1	1	1	1	1
2	2	2	2	2	2
3	3	3	3	3	3
4	4	4	4	4	4
select  * from __3006__idx__idx3;
c1	c2	c3	c4	c6	c7
1	1	1	1	1	1
2	2	2	2	2	2
3	3	3	3	3	3
4	4	4	4	4	4
select  * from __3006__idx__idx4;
c1	c2	c3	c4	c5	c6	c7	c8
1	1	1	1	1	1	1	1
2	2	2	2	2	2	2	2
3	3	3	3	3	3	3	3
4	4	4	4	4	4	4	4
select  * from __3006__idx__idx5;
c1	c2	c3	c4	c5	c6	c7	c8
1	1	1	1	1	1	1	1
2	2	2	2	2	2	2	2
3	3	3	3	3	3	3	3
4	4	4	4	4	4	4	4
delete from test2 where c1 = 1 OR c2 = 2 OR c3 = 3;
select * from test2;
c1	c2	c3	c4	c5	c6	c7	c8
4	4	4	4	4	4	4	4
select  * from __3006__idx__idx1;
c1	c2	c3	ob_virtual_col
4	4	4	NULL
select  * from __3006__idx__idx2;
c1	c2	c3	c4	c5	c6
4	4	4	4	4	4
select  * from __3006__idx__idx3;
c1	c2	c3	c4	c6	c7
4	4	4	4	4	4
select  * from __3006__idx__idx4;
c1	c2	c3	c4	c5	c6	c7	c8
4	4	4	4	4	4	4	4
select  * from __3006__idx__idx5;
c1	c2	c3	c4	c5	c6	c7	c8
4	4	4	4	4	4	4	4
replace into test2 values(1,1,1,1,1,1,1,1),(2,2,2,2,2,2,2,2),(3,3,3,3,3,3,3,3),(4,4,4,4,4,4,4,4);
select * from test2;
c1	c2	c3	c4	c5	c6	c7	c8
1	1	1	1	1	1	1	1
2	2	2	2	2	2	2	2
3	3	3	3	3	3	3	3
4	4	4	4	4	4	4	4
select  * from __3006__idx__idx1;
c1	c2	c3	ob_virtual_col
1	1	1	NULL
2	2	2	NULL
3	3	3	NULL
4	4	4	NULL
select  * from __3006__idx__idx2;
c1	c2	c3	c4	c5	c6
1	1	1	1	1	1
2	2	2	2	2	2
3	3	3	3	3	3
4	4	4	4	4	4
select  * from __3006__idx__idx3;
c1	c2	c3	c4	c6	c7
1	1	1	1	1	1
2	2	2	2	2	2
3	3	3	3	3	3
4	4	4	4	4	4
select  * from __3006__idx__idx4;
c1	c2	c3	c4	c5	c6	c7	c8
1	1	1	1	1	1	1	1
2	2	2	2	2	2	2	2
3	3	3	3	3	3	3	3
4	4	4	4	4	4	4	4
select  * from __3006__idx__idx5;
c1	c2	c3	c4	c5	c6	c7	c8
1	1	1	1	1	1	1	1
2	2	2	2	2	2	2	2
3	3	3	3	3	3	3	3
4	4	4	4	4	4	4	4
delete from test2 where c1 = 1 and c2 = 1 and c3 = 1;
select * from test2;
c1	c2	c3	c4	c5	c6	c7	c8
2	2	2	2	2	2	2	2
3	3	3	3	3	3	3	3
4	4	4	4	4	4	4	4
select  * from __3006__idx__idx1;
c1	c2	c3	ob_virtual_col
2	2	2	NULL
3	3	3	NULL
4	4	4	NULL
select  * from __3006__idx__idx2;
c1	c2	c3	c4	c5	c6
2	2	2	2	2	2
3	3	3	3	3	3
4	4	4	4	4	4
select  * from __3006__idx__idx3;
c1	c2	c3	c4	c6	c7
2	2	2	2	2	2
3	3	3	3	3	3
4	4	4	4	4	4
select  * from __3006__idx__idx4;
c1	c2	c3	c4	c5	c6	c7	c8
2	2	2	2	2	2	2	2
3	3	3	3	3	3	3	3
4	4	4	4	4	4	4	4
select  * from __3006__idx__idx5;
c1	c2	c3	c4	c5	c6	c7	c8
2	2	2	2	2	2	2	2
3	3	3	3	3	3	3	3
4	4	4	4	4	4	4	4
replace into test2 values(1,1,1,1,1,1,1,1),(2,2,2,2,2,2,2,2),(3,3,3,3,3,3,3,3),(4,4,4,4,4,4,4,4);
select * from test2;
c1	c2	c3	c4	c5	c6	c7	c8
1	1	1	1	1	1	1	1
2	2	2	2	2	2	2	2
3	3	3	3	3	3	3	3
4	4	4	4	4	4	4	4
select  * from __3006__idx__idx1;
c1	c2	c3	ob_virtual_col
1	1	1	NULL
2	2	2	NULL
3	3	3	NULL
4	4	4	NULL
select  * from __3006__idx__idx2;
c1	c2	c3	c4	c5	c6
1	1	1	1	1	1
2	2	2	2	2	2
3	3	3	3	3	3
4	4	4	4	4	4
select  * from __3006__idx__idx3;
c1	c2	c3	c4	c6	c7
1	1	1	1	1	1
2	2	2	2	2	2
3	3	3	3	3	3
4	4	4	4	4	4
select  * from __3006__idx__idx4;
c1	c2	c3	c4	c5	c6	c7	c8
1	1	1	1	1	1	1	1
2	2	2	2	2	2	2	2
3	3	3	3	3	3	3	3
4	4	4	4	4	4	4	4
select  * from __3006__idx__idx5;
c1	c2	c3	c4	c5	c6	c7	c8
1	1	1	1	1	1	1	1
2	2	2	2	2	2	2	2
3	3	3	3	3	3	3	3
4	4	4	4	4	4	4	4
delete from test2 where c1 = 1 and c2 = 2 and c3 = 3;
select * from test2;
c1	c2	c3	c4	c5	c6	c7	c8
1	1	1	1	1	1	1	1
2	2	2	2	2	2	2	2
3	3	3	3	3	3	3	3
4	4	4	4	4	4	4	4
select  * from __3006__idx__idx1;
c1	c2	c3	ob_virtual_col
1	1	1	NULL
2	2	2	NULL
3	3	3	NULL
4	4	4	NULL
select  * from __3006__idx__idx2;
c1	c2	c3	c4	c5	c6
1	1	1	1	1	1
2	2	2	2	2	2
3	3	3	3	3	3
4	4	4	4	4	4
select  * from __3006__idx__idx3;
c1	c2	c3	c4	c6	c7
1	1	1	1	1	1
2	2	2	2	2	2
3	3	3	3	3	3
4	4	4	4	4	4
select  * from __3006__idx__idx4;
c1	c2	c3	c4	c5	c6	c7	c8
1	1	1	1	1	1	1	1
2	2	2	2	2	2	2	2
3	3	3	3	3	3	3	3
4	4	4	4	4	4	4	4
select  * from __3006__idx__idx5;
c1	c2	c3	c4	c5	c6	c7	c8
1	1	1	1	1	1	1	1
2	2	2	2	2	2	2	2
3	3	3	3	3	3	3	3
4	4	4	4	4	4	4	4
replace into test2 values(1,1,1,1,1,1,1,1),(2,2,2,2,2,2,2,2),(3,3,3,3,3,3,3,3),(4,4,4,4,4,4,4,4);
select * from test2;
c1	c2	c3	c4	c5	c6	c7	c8
1	1	1	1	1	1	1	1
2	2	2	2	2	2	2	2
3	3	3	3	3	3	3	3
4	4	4	4	4	4	4	4
select  * from __3006__idx__idx1;
c1	c2	c3	ob_virtual_col
1	1	1	NULL
2	2	2	NULL
3	3	3	NULL
4	4	4	NULL
select  * from __3006__idx__idx2;
c1	c2	c3	c4	c5	c6
1	1	1	1	1	1
2	2	2	2	2	2
3	3	3	3	3	3
4	4	4	4	4	4
select  * from __3006__idx__idx3;
c1	c2	c3	c4	c6	c7
1	1	1	1	1	1
2	2	2	2	2	2
3	3	3	3	3	3
4	4	4	4	4	4
select  * from __3006__idx__idx4;
c1	c2	c3	c4	c5	c6	c7	c8
1	1	1	1	1	1	1	1
2	2	2	2	2	2	2	2
3	3	3	3	3	3	3	3
4	4	4	4	4	4	4	4
select  * from __3006__idx__idx5;
c1	c2	c3	c4	c5	c6	c7	c8
1	1	1	1	1	1	1	1
2	2	2	2	2	2	2	2
3	3	3	3	3	3	3	3
4	4	4	4	4	4	4	4
delete from test2 where c1 = 1 or c2 = 2 and c3 = 3;
select * from test2;
c1	c2	c3	c4	c5	c6	c7	c8
2	2	2	2	2	2	2	2
3	3	3	3	3	3	3	3
4	4	4	4	4	4	4	4
select  * from __3006__idx__idx1;
c1	c2	c3	ob_virtual_col
2	2	2	NULL
3	3	3	NULL
4	4	4	NULL
select  * from __3006__idx__idx2;
c1	c2	c3	c4	c5	c6
2	2	2	2	2	2
3	3	3	3	3	3
4	4	4	4	4	4
select  * from __3006__idx__idx3;
c1	c2	c3	c4	c6	c7
2	2	2	2	2	2
3	3	3	3	3	3
4	4	4	4	4	4
select  * from __3006__idx__idx4;
c1	c2	c3	c4	c5	c6	c7	c8
2	2	2	2	2	2	2	2
3	3	3	3	3	3	3	3
4	4	4	4	4	4	4	4
select  * from __3006__idx__idx5;
c1	c2	c3	c4	c5	c6	c7	c8
2	2	2	2	2	2	2	2
3	3	3	3	3	3	3	3
4	4	4	4	4	4	4	4
replace into test2 values(1,1,1,1,1,1,1,1),(2,2,2,2,2,2,2,2),(3,3,3,3,3,3,3,3),(4,4,4,4,4,4,4,4);
select * from test2;
c1	c2	c3	c4	c5	c6	c7	c8
1	1	1	1	1	1	1	1
2	2	2	2	2	2	2	2
3	3	3	3	3	3	3	3
4	4	4	4	4	4	4	4
select  * from __3006__idx__idx1;
c1	c2	c3	ob_virtual_col
1	1	1	NULL
2	2	2	NULL
3	3	3	NULL
4	4	4	NULL
select  * from __3006__idx__idx2;
c1	c2	c3	c4	c5	c6
1	1	1	1	1	1
2	2	2	2	2	2
3	3	3	3	3	3
4	4	4	4	4	4
select  * from __3006__idx__idx3;
c1	c2	c3	c4	c6	c7
1	1	1	1	1	1
2	2	2	2	2	2
3	3	3	3	3	3
4	4	4	4	4	4
select  * from __3006__idx__idx4;
c1	c2	c3	c4	c5	c6	c7	c8
1	1	1	1	1	1	1	1
2	2	2	2	2	2	2	2
3	3	3	3	3	3	3	3
4	4	4	4	4	4	4	4
select  * from __3006__idx__idx5;
c1	c2	c3	c4	c5	c6	c7	c8
1	1	1	1	1	1	1	1
2	2	2	2	2	2	2	2
3	3	3	3	3	3	3	3
4	4	4	4	4	4	4	4
delete from test2 where c1 between 1 and 1;
select * from test2;
c1	c2	c3	c4	c5	c6	c7	c8
2	2	2	2	2	2	2	2
3	3	3	3	3	3	3	3
4	4	4	4	4	4	4	4
select  * from __3006__idx__idx1;
c1	c2	c3	ob_virtual_col
2	2	2	NULL
3	3	3	NULL
4	4	4	NULL
select  * from __3006__idx__idx2;
c1	c2	c3	c4	c5	c6
2	2	2	2	2	2
3	3	3	3	3	3
4	4	4	4	4	4
select  * from __3006__idx__idx3;
c1	c2	c3	c4	c6	c7
2	2	2	2	2	2
3	3	3	3	3	3
4	4	4	4	4	4
select  * from __3006__idx__idx4;
c1	c2	c3	c4	c5	c6	c7	c8
2	2	2	2	2	2	2	2
3	3	3	3	3	3	3	3
4	4	4	4	4	4	4	4
select  * from __3006__idx__idx5;
c1	c2	c3	c4	c5	c6	c7	c8
2	2	2	2	2	2	2	2
3	3	3	3	3	3	3	3
4	4	4	4	4	4	4	4
replace into test2 values(1,1,1,1,1,1,1,1),(2,2,2,2,2,2,2,2),(3,3,3,3,3,3,3,3),(4,4,4,4,4,4,4,4);
select * from test2;
c1	c2	c3	c4	c5	c6	c7	c8
1	1	1	1	1	1	1	1
2	2	2	2	2	2	2	2
3	3	3	3	3	3	3	3
4	4	4	4	4	4	4	4
select  * from __3006__idx__idx1;
c1	c2	c3	ob_virtual_col
1	1	1	NULL
2	2	2	NULL
3	3	3	NULL
4	4	4	NULL
select  * from __3006__idx__idx2;
c1	c2	c3	c4	c5	c6
1	1	1	1	1	1
2	2	2	2	2	2
3	3	3	3	3	3
4	4	4	4	4	4
select  * from __3006__idx__idx3;
c1	c2	c3	c4	c6	c7
1	1	1	1	1	1
2	2	2	2	2	2
3	3	3	3	3	3
4	4	4	4	4	4
select  * from __3006__idx__idx4;
c1	c2	c3	c4	c5	c6	c7	c8
1	1	1	1	1	1	1	1
2	2	2	2	2	2	2	2
3	3	3	3	3	3	3	3
4	4	4	4	4	4	4	4
select  * from __3006__idx__idx5;
c1	c2	c3	c4	c5	c6	c7	c8
1	1	1	1	1	1	1	1
2	2	2	2	2	2	2	2
3	3	3	3	3	3	3	3
4	4	4	4	4	4	4	4
delete from test2 where c2 between 3 and 4;
select * from test2;
c1	c2	c3	c4	c5	c6	c7	c8
1	1	1	1	1	1	1	1
2	2	2	2	2	2	2	2
select  * from __3006__idx__idx1;
c1	c2	c3	ob_virtual_col
1	1	1	NULL
2	2	2	NULL
select  * from __3006__idx__idx2;
c1	c2	c3	c4	c5	c6
1	1	1	1	1	1
2	2	2	2	2	2
select  * from __3006__idx__idx3;
c1	c2	c3	c4	c6	c7
1	1	1	1	1	1
2	2	2	2	2	2
select  * from __3006__idx__idx4;
c1	c2	c3	c4	c5	c6	c7	c8
1	1	1	1	1	1	1	1
2	2	2	2	2	2	2	2
select  * from __3006__idx__idx5;
c1	c2	c3	c4	c5	c6	c7	c8
1	1	1	1	1	1	1	1
2	2	2	2	2	2	2	2
replace into test2 values(1,1,1,1,1,1,1,1),(2,2,2,2,2,2,2,2),(3,3,3,3,3,3,3,3),(4,4,4,4,4,4,4,4);
select * from test2;
c1	c2	c3	c4	c5	c6	c7	c8
1	1	1	1	1	1	1	1
2	2	2	2	2	2	2	2
3	3	3	3	3	3	3	3
4	4	4	4	4	4	4	4
select  * from __3006__idx__idx1;
c1	c2	c3	ob_virtual_col
1	1	1	NULL
2	2	2	NULL
3	3	3	NULL
4	4	4	NULL
select  * from __3006__idx__idx2;
c1	c2	c3	c4	c5	c6
1	1	1	1	1	1
2	2	2	2	2	2
3	3	3	3	3	3
4	4	4	4	4	4
select  * from __3006__idx__idx3;
c1	c2	c3	c4	c6	c7
1	1	1	1	1	1
2	2	2	2	2	2
3	3	3	3	3	3
4	4	4	4	4	4
select  * from __3006__idx__idx4;
c1	c2	c3	c4	c5	c6	c7	c8
1	1	1	1	1	1	1	1
2	2	2	2	2	2	2	2
3	3	3	3	3	3	3	3
4	4	4	4	4	4	4	4
select  * from __3006__idx__idx5;
c1	c2	c3	c4	c5	c6	c7	c8
1	1	1	1	1	1	1	1
2	2	2	2	2	2	2	2
3	3	3	3	3	3	3	3
4	4	4	4	4	4	4	4
delete from test2 where c3 between 4 and 7;
select * from test2;
c1	c2	c3	c4	c5	c6	c7	c8
1	1	1	1	1	1	1	1
2	2	2	2	2	2	2	2
3	3	3	3	3	3	3	3
select  * from __3006__idx__idx1;
c1	c2	c3	ob_virtual_col
1	1	1	NULL
2	2	2	NULL
3	3	3	NULL
select  * from __3006__idx__idx2;
c1	c2	c3	c4	c5	c6
1	1	1	1	1	1
2	2	2	2	2	2
3	3	3	3	3	3
select  * from __3006__idx__idx3;
c1	c2	c3	c4	c6	c7
1	1	1	1	1	1
2	2	2	2	2	2
3	3	3	3	3	3
select  * from __3006__idx__idx4;
c1	c2	c3	c4	c5	c6	c7	c8
1	1	1	1	1	1	1	1
2	2	2	2	2	2	2	2
3	3	3	3	3	3	3	3
select  * from __3006__idx__idx5;
c1	c2	c3	c4	c5	c6	c7	c8
1	1	1	1	1	1	1	1
2	2	2	2	2	2	2	2
3	3	3	3	3	3	3	3
replace into test2 values(1,1,1,1,1,1,1,1),(2,2,2,2,2,2,2,2),(3,3,3,3,3,3,3,3),(4,4,4,4,4,4,4,4);
select * from test2;
c1	c2	c3	c4	c5	c6	c7	c8
1	1	1	1	1	1	1	1
2	2	2	2	2	2	2	2
3	3	3	3	3	3	3	3
4	4	4	4	4	4	4	4
select  * from __3006__idx__idx1;
c1	c2	c3	ob_virtual_col
1	1	1	NULL
2	2	2	NULL
3	3	3	NULL
4	4	4	NULL
select  * from __3006__idx__idx2;
c1	c2	c3	c4	c5	c6
1	1	1	1	1	1
2	2	2	2	2	2
3	3	3	3	3	3
4	4	4	4	4	4
select  * from __3006__idx__idx3;
c1	c2	c3	c4	c6	c7
1	1	1	1	1	1
2	2	2	2	2	2
3	3	3	3	3	3
4	4	4	4	4	4
select  * from __3006__idx__idx4;
c1	c2	c3	c4	c5	c6	c7	c8
1	1	1	1	1	1	1	1
2	2	2	2	2	2	2	2
3	3	3	3	3	3	3	3
4	4	4	4	4	4	4	4
select  * from __3006__idx__idx5;
c1	c2	c3	c4	c5	c6	c7	c8
1	1	1	1	1	1	1	1
2	2	2	2	2	2	2	2
3	3	3	3	3	3	3	3
4	4	4	4	4	4	4	4
delete from test2 where c1 IN (10,11,12,13,14,15);
select * from test2;
c1	c2	c3	c4	c5	c6	c7	c8
1	1	1	1	1	1	1	1
2	2	2	2	2	2	2	2
3	3	3	3	3	3	3	3
4	4	4	4	4	4	4	4
select  * from __3006__idx__idx1;
c1	c2	c3	ob_virtual_col
1	1	1	NULL
2	2	2	NULL
3	3	3	NULL
4	4	4	NULL
select  * from __3006__idx__idx2;
c1	c2	c3	c4	c5	c6
1	1	1	1	1	1
2	2	2	2	2	2
3	3	3	3	3	3
4	4	4	4	4	4
select  * from __3006__idx__idx3;
c1	c2	c3	c4	c6	c7
1	1	1	1	1	1
2	2	2	2	2	2
3	3	3	3	3	3
4	4	4	4	4	4
select  * from __3006__idx__idx4;
c1	c2	c3	c4	c5	c6	c7	c8
1	1	1	1	1	1	1	1
2	2	2	2	2	2	2	2
3	3	3	3	3	3	3	3
4	4	4	4	4	4	4	4
select  * from __3006__idx__idx5;
c1	c2	c3	c4	c5	c6	c7	c8
1	1	1	1	1	1	1	1
2	2	2	2	2	2	2	2
3	3	3	3	3	3	3	3
4	4	4	4	4	4	4	4
replace into test2 values(1,1,1,1,1,1,1,1),(2,2,2,2,2,2,2,2),(3,3,3,3,3,3,3,3),(4,4,4,4,4,4,4,4);
select * from test2;
c1	c2	c3	c4	c5	c6	c7	c8
1	1	1	1	1	1	1	1
2	2	2	2	2	2	2	2
3	3	3	3	3	3	3	3
4	4	4	4	4	4	4	4
select  * from __3006__idx__idx1;
c1	c2	c3	ob_virtual_col
1	1	1	NULL
2	2	2	NULL
3	3	3	NULL
4	4	4	NULL
select  * from __3006__idx__idx2;
c1	c2	c3	c4	c5	c6
1	1	1	1	1	1
2	2	2	2	2	2
3	3	3	3	3	3
4	4	4	4	4	4
select  * from __3006__idx__idx3;
c1	c2	c3	c4	c6	c7
1	1	1	1	1	1
2	2	2	2	2	2
3	3	3	3	3	3
4	4	4	4	4	4
select  * from __3006__idx__idx4;
c1	c2	c3	c4	c5	c6	c7	c8
1	1	1	1	1	1	1	1
2	2	2	2	2	2	2	2
3	3	3	3	3	3	3	3
4	4	4	4	4	4	4	4
select  * from __3006__idx__idx5;
c1	c2	c3	c4	c5	c6	c7	c8
1	1	1	1	1	1	1	1
2	2	2	2	2	2	2	2
3	3	3	3	3	3	3	3
4	4	4	4	4	4	4	4
delete from test2 where c2 IN (1);
select * from test2;
c1	c2	c3	c4	c5	c6	c7	c8
2	2	2	2	2	2	2	2
3	3	3	3	3	3	3	3
4	4	4	4	4	4	4	4
select  * from __3006__idx__idx1;
c1	c2	c3	ob_virtual_col
2	2	2	NULL
3	3	3	NULL
4	4	4	NULL
select  * from __3006__idx__idx2;
c1	c2	c3	c4	c5	c6
2	2	2	2	2	2
3	3	3	3	3	3
4	4	4	4	4	4
select  * from __3006__idx__idx3;
c1	c2	c3	c4	c6	c7
2	2	2	2	2	2
3	3	3	3	3	3
4	4	4	4	4	4
select  * from __3006__idx__idx4;
c1	c2	c3	c4	c5	c6	c7	c8
2	2	2	2	2	2	2	2
3	3	3	3	3	3	3	3
4	4	4	4	4	4	4	4
select  * from __3006__idx__idx5;
c1	c2	c3	c4	c5	c6	c7	c8
2	2	2	2	2	2	2	2
3	3	3	3	3	3	3	3
4	4	4	4	4	4	4	4
replace into test2 values(1,1,1,1,1,1,1,1),(2,2,2,2,2,2,2,2),(3,3,3,3,3,3,3,3),(4,4,4,4,4,4,4,4);
select * from test2;
c1	c2	c3	c4	c5	c6	c7	c8
1	1	1	1	1	1	1	1
2	2	2	2	2	2	2	2
3	3	3	3	3	3	3	3
4	4	4	4	4	4	4	4
select  * from __3006__idx__idx1;
c1	c2	c3	ob_virtual_col
1	1	1	NULL
2	2	2	NULL
3	3	3	NULL
4	4	4	NULL
select  * from __3006__idx__idx2;
c1	c2	c3	c4	c5	c6
1	1	1	1	1	1
2	2	2	2	2	2
3	3	3	3	3	3
4	4	4	4	4	4
select  * from __3006__idx__idx3;
c1	c2	c3	c4	c6	c7
1	1	1	1	1	1
2	2	2	2	2	2
3	3	3	3	3	3
4	4	4	4	4	4
select  * from __3006__idx__idx4;
c1	c2	c3	c4	c5	c6	c7	c8
1	1	1	1	1	1	1	1
2	2	2	2	2	2	2	2
3	3	3	3	3	3	3	3
4	4	4	4	4	4	4	4
select  * from __3006__idx__idx5;
c1	c2	c3	c4	c5	c6	c7	c8
1	1	1	1	1	1	1	1
2	2	2	2	2	2	2	2
3	3	3	3	3	3	3	3
4	4	4	4	4	4	4	4
delete from test2 where c3 IN (2);
select * from test2;
c1	c2	c3	c4	c5	c6	c7	c8
1	1	1	1	1	1	1	1
3	3	3	3	3	3	3	3
4	4	4	4	4	4	4	4
select  * from __3006__idx__idx1;
c1	c2	c3	ob_virtual_col
1	1	1	NULL
3	3	3	NULL
4	4	4	NULL
select  * from __3006__idx__idx2;
c1	c2	c3	c4	c5	c6
1	1	1	1	1	1
3	3	3	3	3	3
4	4	4	4	4	4
select  * from __3006__idx__idx3;
c1	c2	c3	c4	c6	c7
1	1	1	1	1	1
3	3	3	3	3	3
4	4	4	4	4	4
select  * from __3006__idx__idx4;
c1	c2	c3	c4	c5	c6	c7	c8
1	1	1	1	1	1	1	1
3	3	3	3	3	3	3	3
4	4	4	4	4	4	4	4
select  * from __3006__idx__idx5;
c1	c2	c3	c4	c5	c6	c7	c8
1	1	1	1	1	1	1	1
3	3	3	3	3	3	3	3
4	4	4	4	4	4	4	4
replace into test2 values(1,1,1,1,1,1,1,1),(2,2,2,2,2,2,2,2),(3,3,3,3,3,3,3,3),(4,4,4,4,4,4,4,4);
select * from test2;
c1	c2	c3	c4	c5	c6	c7	c8
1	1	1	1	1	1	1	1
2	2	2	2	2	2	2	2
3	3	3	3	3	3	3	3
4	4	4	4	4	4	4	4
select  * from __3006__idx__idx1;
c1	c2	c3	ob_virtual_col
1	1	1	NULL
2	2	2	NULL
3	3	3	NULL
4	4	4	NULL
select  * from __3006__idx__idx2;
c1	c2	c3	c4	c5	c6
1	1	1	1	1	1
2	2	2	2	2	2
3	3	3	3	3	3
4	4	4	4	4	4
select  * from __3006__idx__idx3;
c1	c2	c3	c4	c6	c7
1	1	1	1	1	1
2	2	2	2	2	2
3	3	3	3	3	3
4	4	4	4	4	4
select  * from __3006__idx__idx4;
c1	c2	c3	c4	c5	c6	c7	c8
1	1	1	1	1	1	1	1
2	2	2	2	2	2	2	2
3	3	3	3	3	3	3	3
4	4	4	4	4	4	4	4
select  * from __3006__idx__idx5;
c1	c2	c3	c4	c5	c6	c7	c8
1	1	1	1	1	1	1	1
2	2	2	2	2	2	2	2
3	3	3	3	3	3	3	3
4	4	4	4	4	4	4	4
delete from test2 where c1 IN (1,2,3,4,5,6,7,8,9,10);
select * from test2;
c1	c2	c3	c4	c5	c6	c7	c8
select  * from __3006__idx__idx1;
c1	c2	c3	ob_virtual_col
select  * from __3006__idx__idx2;
c1	c2	c3	c4	c5	c6
select  * from __3006__idx__idx3;
c1	c2	c3	c4	c6	c7
select  * from __3006__idx__idx4;
c1	c2	c3	c4	c5	c6	c7	c8
select  * from __3006__idx__idx5;
c1	c2	c3	c4	c5	c6	c7	c8
replace into test2 values(1,1,1,1,1,1,1,1),(2,2,2,2,2,2,2,2),(3,3,3,3,3,3,3,3),(4,4,4,4,4,4,4,4);
select * from test2;
c1	c2	c3	c4	c5	c6	c7	c8
1	1	1	1	1	1	1	1
2	2	2	2	2	2	2	2
3	3	3	3	3	3	3	3
4	4	4	4	4	4	4	4
select  * from __3006__idx__idx1;
c1	c2	c3	ob_virtual_col
1	1	1	NULL
2	2	2	NULL
3	3	3	NULL
4	4	4	NULL
select  * from __3006__idx__idx2;
c1	c2	c3	c4	c5	c6
1	1	1	1	1	1
2	2	2	2	2	2
3	3	3	3	3	3
4	4	4	4	4	4
select  * from __3006__idx__idx3;
c1	c2	c3	c4	c6	c7
1	1	1	1	1	1
2	2	2	2	2	2
3	3	3	3	3	3
4	4	4	4	4	4
select  * from __3006__idx__idx4;
c1	c2	c3	c4	c5	c6	c7	c8
1	1	1	1	1	1	1	1
2	2	2	2	2	2	2	2
3	3	3	3	3	3	3	3
4	4	4	4	4	4	4	4
select  * from __3006__idx__idx5;
c1	c2	c3	c4	c5	c6	c7	c8
1	1	1	1	1	1	1	1
2	2	2	2	2	2	2	2
3	3	3	3	3	3	3	3
4	4	4	4	4	4	4	4
delete from test2 where c1 * c2 + 1 > 3;
select * from test2;
c1	c2	c3	c4	c5	c6	c7	c8
1	1	1	1	1	1	1	1
select  * from __3006__idx__idx1;
c1	c2	c3	ob_virtual_col
1	1	1	NULL
select  * from __3006__idx__idx2;
c1	c2	c3	c4	c5	c6
1	1	1	1	1	1
select  * from __3006__idx__idx3;
c1	c2	c3	c4	c6	c7
1	1	1	1	1	1
select  * from __3006__idx__idx4;
c1	c2	c3	c4	c5	c6	c7	c8
1	1	1	1	1	1	1	1
select  * from __3006__idx__idx5;
c1	c2	c3	c4	c5	c6	c7	c8
1	1	1	1	1	1	1	1
replace into test2 values(1,1,1,1,1,1,1,1),(2,2,2,2,2,2,2,2),(3,3,3,3,3,3,3,3),(4,4,4,4,4,4,4,4);
select * from test2;
c1	c2	c3	c4	c5	c6	c7	c8
1	1	1	1	1	1	1	1
2	2	2	2	2	2	2	2
3	3	3	3	3	3	3	3
4	4	4	4	4	4	4	4
select  * from __3006__idx__idx1;
c1	c2	c3	ob_virtual_col
1	1	1	NULL
2	2	2	NULL
3	3	3	NULL
4	4	4	NULL
select  * from __3006__idx__idx2;
c1	c2	c3	c4	c5	c6
1	1	1	1	1	1
2	2	2	2	2	2
3	3	3	3	3	3
4	4	4	4	4	4
select  * from __3006__idx__idx3;
c1	c2	c3	c4	c6	c7
1	1	1	1	1	1
2	2	2	2	2	2
3	3	3	3	3	3
4	4	4	4	4	4
select  * from __3006__idx__idx4;
c1	c2	c3	c4	c5	c6	c7	c8
1	1	1	1	1	1	1	1
2	2	2	2	2	2	2	2
3	3	3	3	3	3	3	3
4	4	4	4	4	4	4	4
select  * from __3006__idx__idx5;
c1	c2	c3	c4	c5	c6	c7	c8
1	1	1	1	1	1	1	1
2	2	2	2	2	2	2	2
3	3	3	3	3	3	3	3
4	4	4	4	4	4	4	4
delete from test2 where c1 / c3 - 1 > 1;
select * from test2;
c1	c2	c3	c4	c5	c6	c7	c8
1	1	1	1	1	1	1	1
2	2	2	2	2	2	2	2
3	3	3	3	3	3	3	3
4	4	4	4	4	4	4	4
select  * from __3006__idx__idx1;
c1	c2	c3	ob_virtual_col
1	1	1	NULL
2	2	2	NULL
3	3	3	NULL
4	4	4	NULL
select  * from __3006__idx__idx2;
c1	c2	c3	c4	c5	c6
1	1	1	1	1	1
2	2	2	2	2	2
3	3	3	3	3	3
4	4	4	4	4	4
select  * from __3006__idx__idx3;
c1	c2	c3	c4	c6	c7
1	1	1	1	1	1
2	2	2	2	2	2
3	3	3	3	3	3
4	4	4	4	4	4
select  * from __3006__idx__idx4;
c1	c2	c3	c4	c5	c6	c7	c8
1	1	1	1	1	1	1	1
2	2	2	2	2	2	2	2
3	3	3	3	3	3	3	3
4	4	4	4	4	4	4	4
select  * from __3006__idx__idx5;
c1	c2	c3	c4	c5	c6	c7	c8
1	1	1	1	1	1	1	1
2	2	2	2	2	2	2	2
3	3	3	3	3	3	3	3
4	4	4	4	4	4	4	4
replace into test2 values(1,1,1,1,1,1,1,1),(2,2,2,2,2,2,2,2),(3,3,3,3,3,3,3,3),(4,4,4,4,4,4,4,4);
select * from test2;
c1	c2	c3	c4	c5	c6	c7	c8
1	1	1	1	1	1	1	1
2	2	2	2	2	2	2	2
3	3	3	3	3	3	3	3
4	4	4	4	4	4	4	4
select  * from __3006__idx__idx1;
c1	c2	c3	ob_virtual_col
1	1	1	NULL
2	2	2	NULL
3	3	3	NULL
4	4	4	NULL
select  * from __3006__idx__idx2;
c1	c2	c3	c4	c5	c6
1	1	1	1	1	1
2	2	2	2	2	2
3	3	3	3	3	3
4	4	4	4	4	4
select  * from __3006__idx__idx3;
c1	c2	c3	c4	c6	c7
1	1	1	1	1	1
2	2	2	2	2	2
3	3	3	3	3	3
4	4	4	4	4	4
select  * from __3006__idx__idx4;
c1	c2	c3	c4	c5	c6	c7	c8
1	1	1	1	1	1	1	1
2	2	2	2	2	2	2	2
3	3	3	3	3	3	3	3
4	4	4	4	4	4	4	4
select  * from __3006__idx__idx5;
c1	c2	c3	c4	c5	c6	c7	c8
1	1	1	1	1	1	1	1
2	2	2	2	2	2	2	2
3	3	3	3	3	3	3	3
4	4	4	4	4	4	4	4
delete from test2 where c1 * 2 / c2 * 5 % 4 + 1 > 1;
select * from test2;
c1	c2	c3	c4	c5	c6	c7	c8
select  * from __3006__idx__idx1;
c1	c2	c3	ob_virtual_col
select  * from __3006__idx__idx2;
c1	c2	c3	c4	c5	c6
select  * from __3006__idx__idx3;
c1	c2	c3	c4	c6	c7
select  * from __3006__idx__idx4;
c1	c2	c3	c4	c5	c6	c7	c8
select  * from __3006__idx__idx5;
c1	c2	c3	c4	c5	c6	c7	c8
replace into test2 values(1,1,1,1,1,1,1,1),(2,2,2,2,2,2,2,2),(3,3,3,3,3,3,3,3),(4,4,4,4,4,4,4,4);
select * from test2;
c1	c2	c3	c4	c5	c6	c7	c8
1	1	1	1	1	1	1	1
2	2	2	2	2	2	2	2
3	3	3	3	3	3	3	3
4	4	4	4	4	4	4	4
select  * from __3006__idx__idx1;
c1	c2	c3	ob_virtual_col
1	1	1	NULL
2	2	2	NULL
3	3	3	NULL
4	4	4	NULL
select  * from __3006__idx__idx2;
c1	c2	c3	c4	c5	c6
1	1	1	1	1	1
2	2	2	2	2	2
3	3	3	3	3	3
4	4	4	4	4	4
select  * from __3006__idx__idx3;
c1	c2	c3	c4	c6	c7
1	1	1	1	1	1
2	2	2	2	2	2
3	3	3	3	3	3
4	4	4	4	4	4
select  * from __3006__idx__idx4;
c1	c2	c3	c4	c5	c6	c7	c8
1	1	1	1	1	1	1	1
2	2	2	2	2	2	2	2
3	3	3	3	3	3	3	3
4	4	4	4	4	4	4	4
select  * from __3006__idx__idx5;
c1	c2	c3	c4	c5	c6	c7	c8
1	1	1	1	1	1	1	1
2	2	2	2	2	2	2	2
3	3	3	3	3	3	3	3
4	4	4	4	4	4	4	4
delete from test2 where (c1 * 2 / 3 * 5) MOD 3 + 1 > 2;
select * from test2;
c1	c2	c3	c4	c5	c6	c7	c8
1	1	1	1	1	1	1	1
3	3	3	3	3	3	3	3
4	4	4	4	4	4	4	4
select  * from __3006__idx__idx1;
c1	c2	c3	ob_virtual_col
1	1	1	NULL
3	3	3	NULL
4	4	4	NULL
select  * from __3006__idx__idx2;
c1	c2	c3	c4	c5	c6
1	1	1	1	1	1
3	3	3	3	3	3
4	4	4	4	4	4
select  * from __3006__idx__idx3;
c1	c2	c3	c4	c6	c7
1	1	1	1	1	1
3	3	3	3	3	3
4	4	4	4	4	4
select  * from __3006__idx__idx4;
c1	c2	c3	c4	c5	c6	c7	c8
1	1	1	1	1	1	1	1
3	3	3	3	3	3	3	3
4	4	4	4	4	4	4	4
select  * from __3006__idx__idx5;
c1	c2	c3	c4	c5	c6	c7	c8
1	1	1	1	1	1	1	1
3	3	3	3	3	3	3	3
4	4	4	4	4	4	4	4
replace into test2 values(1,1,1,1,1,1,1,1),(2,2,2,2,2,2,2,2),(3,3,3,3,3,3,3,3),(4,4,4,4,4,4,4,4);
select * from test2;
c1	c2	c3	c4	c5	c6	c7	c8
1	1	1	1	1	1	1	1
2	2	2	2	2	2	2	2
3	3	3	3	3	3	3	3
4	4	4	4	4	4	4	4
select  * from __3006__idx__idx1;
c1	c2	c3	ob_virtual_col
1	1	1	NULL
2	2	2	NULL
3	3	3	NULL
4	4	4	NULL
select  * from __3006__idx__idx2;
c1	c2	c3	c4	c5	c6
1	1	1	1	1	1
2	2	2	2	2	2
3	3	3	3	3	3
4	4	4	4	4	4
select  * from __3006__idx__idx3;
c1	c2	c3	c4	c6	c7
1	1	1	1	1	1
2	2	2	2	2	2
3	3	3	3	3	3
4	4	4	4	4	4
select  * from __3006__idx__idx4;
c1	c2	c3	c4	c5	c6	c7	c8
1	1	1	1	1	1	1	1
2	2	2	2	2	2	2	2
3	3	3	3	3	3	3	3
4	4	4	4	4	4	4	4
select  * from __3006__idx__idx5;
c1	c2	c3	c4	c5	c6	c7	c8
1	1	1	1	1	1	1	1
2	2	2	2	2	2	2	2
3	3	3	3	3	3	3	3
4	4	4	4	4	4	4	4
delete from test2 where c4 > 100;
select * from test2;
c1	c2	c3	c4	c5	c6	c7	c8
1	1	1	1	1	1	1	1
2	2	2	2	2	2	2	2
3	3	3	3	3	3	3	3
4	4	4	4	4	4	4	4
select  * from __3006__idx__idx1;
c1	c2	c3	ob_virtual_col
1	1	1	NULL
2	2	2	NULL
3	3	3	NULL
4	4	4	NULL
select  * from __3006__idx__idx2;
c1	c2	c3	c4	c5	c6
1	1	1	1	1	1
2	2	2	2	2	2
3	3	3	3	3	3
4	4	4	4	4	4
select  * from __3006__idx__idx3;
c1	c2	c3	c4	c6	c7
1	1	1	1	1	1
2	2	2	2	2	2
3	3	3	3	3	3
4	4	4	4	4	4
select  * from __3006__idx__idx4;
c1	c2	c3	c4	c5	c6	c7	c8
1	1	1	1	1	1	1	1
2	2	2	2	2	2	2	2
3	3	3	3	3	3	3	3
4	4	4	4	4	4	4	4
select  * from __3006__idx__idx5;
c1	c2	c3	c4	c5	c6	c7	c8
1	1	1	1	1	1	1	1
2	2	2	2	2	2	2	2
3	3	3	3	3	3	3	3
4	4	4	4	4	4	4	4
delete from test2 where c5 = 1;
select * from test2;
c1	c2	c3	c4	c5	c6	c7	c8
2	2	2	2	2	2	2	2
3	3	3	3	3	3	3	3
4	4	4	4	4	4	4	4
select  * from __3006__idx__idx1;
c1	c2	c3	ob_virtual_col
2	2	2	NULL
3	3	3	NULL
4	4	4	NULL
select  * from __3006__idx__idx2;
c1	c2	c3	c4	c5	c6
2	2	2	2	2	2
3	3	3	3	3	3
4	4	4	4	4	4
select  * from __3006__idx__idx3;
c1	c2	c3	c4	c6	c7
2	2	2	2	2	2
3	3	3	3	3	3
4	4	4	4	4	4
select  * from __3006__idx__idx4;
c1	c2	c3	c4	c5	c6	c7	c8
2	2	2	2	2	2	2	2
3	3	3	3	3	3	3	3
4	4	4	4	4	4	4	4
select  * from __3006__idx__idx5;
c1	c2	c3	c4	c5	c6	c7	c8
2	2	2	2	2	2	2	2
3	3	3	3	3	3	3	3
4	4	4	4	4	4	4	4
replace into test2 values(1,1,1,1,1,1,1,1),(2,2,2,2,2,2,2,2),(3,3,3,3,3,3,3,3),(4,4,4,4,4,4,4,4);
select * from test2;
c1	c2	c3	c4	c5	c6	c7	c8
1	1	1	1	1	1	1	1
2	2	2	2	2	2	2	2
3	3	3	3	3	3	3	3
4	4	4	4	4	4	4	4
select  * from __3006__idx__idx1;
c1	c2	c3	ob_virtual_col
1	1	1	NULL
2	2	2	NULL
3	3	3	NULL
4	4	4	NULL
select  * from __3006__idx__idx2;
c1	c2	c3	c4	c5	c6
1	1	1	1	1	1
2	2	2	2	2	2
3	3	3	3	3	3
4	4	4	4	4	4
select  * from __3006__idx__idx3;
c1	c2	c3	c4	c6	c7
1	1	1	1	1	1
2	2	2	2	2	2
3	3	3	3	3	3
4	4	4	4	4	4
select  * from __3006__idx__idx4;
c1	c2	c3	c4	c5	c6	c7	c8
1	1	1	1	1	1	1	1
2	2	2	2	2	2	2	2
3	3	3	3	3	3	3	3
4	4	4	4	4	4	4	4
select  * from __3006__idx__idx5;
c1	c2	c3	c4	c5	c6	c7	c8
1	1	1	1	1	1	1	1
2	2	2	2	2	2	2	2
3	3	3	3	3	3	3	3
4	4	4	4	4	4	4	4
delete from test2 where c6 > 1;
select * from test2;
c1	c2	c3	c4	c5	c6	c7	c8
1	1	1	1	1	1	1	1
select  * from __3006__idx__idx1;
c1	c2	c3	ob_virtual_col
1	1	1	NULL
select  * from __3006__idx__idx2;
c1	c2	c3	c4	c5	c6
1	1	1	1	1	1
select  * from __3006__idx__idx3;
c1	c2	c3	c4	c6	c7
1	1	1	1	1	1
select  * from __3006__idx__idx4;
c1	c2	c3	c4	c5	c6	c7	c8
1	1	1	1	1	1	1	1
select  * from __3006__idx__idx5;
c1	c2	c3	c4	c5	c6	c7	c8
1	1	1	1	1	1	1	1
replace into test2 values(1,1,1,1,1,1,1,1),(2,2,2,2,2,2,2,2),(3,3,3,3,3,3,3,3),(4,4,4,4,4,4,4,4);
select * from test2;
c1	c2	c3	c4	c5	c6	c7	c8
1	1	1	1	1	1	1	1
2	2	2	2	2	2	2	2
3	3	3	3	3	3	3	3
4	4	4	4	4	4	4	4
select  * from __3006__idx__idx1;
c1	c2	c3	ob_virtual_col
1	1	1	NULL
2	2	2	NULL
3	3	3	NULL
4	4	4	NULL
select  * from __3006__idx__idx2;
c1	c2	c3	c4	c5	c6
1	1	1	1	1	1
2	2	2	2	2	2
3	3	3	3	3	3
4	4	4	4	4	4
select  * from __3006__idx__idx3;
c1	c2	c3	c4	c6	c7
1	1	1	1	1	1
2	2	2	2	2	2
3	3	3	3	3	3
4	4	4	4	4	4
select  * from __3006__idx__idx4;
c1	c2	c3	c4	c5	c6	c7	c8
1	1	1	1	1	1	1	1
2	2	2	2	2	2	2	2
3	3	3	3	3	3	3	3
4	4	4	4	4	4	4	4
select  * from __3006__idx__idx5;
c1	c2	c3	c4	c5	c6	c7	c8
1	1	1	1	1	1	1	1
2	2	2	2	2	2	2	2
3	3	3	3	3	3	3	3
4	4	4	4	4	4	4	4
delete from test2 where c1 = 1 OR c2 = 2 OR c4 = 3 OR c5 = 4 OR c6 = 5;
select * from test2;
c1	c2	c3	c4	c5	c6	c7	c8
select  * from __3006__idx__idx1;
c1	c2	c3	ob_virtual_col
select  * from __3006__idx__idx2;
c1	c2	c3	c4	c5	c6
select  * from __3006__idx__idx3;
c1	c2	c3	c4	c6	c7
select  * from __3006__idx__idx4;
c1	c2	c3	c4	c5	c6	c7	c8
select  * from __3006__idx__idx5;
c1	c2	c3	c4	c5	c6	c7	c8
replace into test2 values(1,1,1,1,1,1,1,1),(2,2,2,2,2,2,2,2),(3,3,3,3,3,3,3,3),(4,4,4,4,4,4,4,4);
select * from test2;
c1	c2	c3	c4	c5	c6	c7	c8
1	1	1	1	1	1	1	1
2	2	2	2	2	2	2	2
3	3	3	3	3	3	3	3
4	4	4	4	4	4	4	4
select  * from __3006__idx__idx1;
c1	c2	c3	ob_virtual_col
1	1	1	NULL
2	2	2	NULL
3	3	3	NULL
4	4	4	NULL
select  * from __3006__idx__idx2;
c1	c2	c3	c4	c5	c6
1	1	1	1	1	1
2	2	2	2	2	2
3	3	3	3	3	3
4	4	4	4	4	4
select  * from __3006__idx__idx3;
c1	c2	c3	c4	c6	c7
1	1	1	1	1	1
2	2	2	2	2	2
3	3	3	3	3	3
4	4	4	4	4	4
select  * from __3006__idx__idx4;
c1	c2	c3	c4	c5	c6	c7	c8
1	1	1	1	1	1	1	1
2	2	2	2	2	2	2	2
3	3	3	3	3	3	3	3
4	4	4	4	4	4	4	4
select  * from __3006__idx__idx5;
c1	c2	c3	c4	c5	c6	c7	c8
1	1	1	1	1	1	1	1
2	2	2	2	2	2	2	2
3	3	3	3	3	3	3	3
4	4	4	4	4	4	4	4
delete from test2 where c2 = 1 and c3 = 1 and c4 = 1 and c5 = 1 and c6 = 1;
select * from test2;
c1	c2	c3	c4	c5	c6	c7	c8
2	2	2	2	2	2	2	2
3	3	3	3	3	3	3	3
4	4	4	4	4	4	4	4
select  * from __3006__idx__idx1;
c1	c2	c3	ob_virtual_col
2	2	2	NULL
3	3	3	NULL
4	4	4	NULL
select  * from __3006__idx__idx2;
c1	c2	c3	c4	c5	c6
2	2	2	2	2	2
3	3	3	3	3	3
4	4	4	4	4	4
select  * from __3006__idx__idx3;
c1	c2	c3	c4	c6	c7
2	2	2	2	2	2
3	3	3	3	3	3
4	4	4	4	4	4
select  * from __3006__idx__idx4;
c1	c2	c3	c4	c5	c6	c7	c8
2	2	2	2	2	2	2	2
3	3	3	3	3	3	3	3
4	4	4	4	4	4	4	4
select  * from __3006__idx__idx5;
c1	c2	c3	c4	c5	c6	c7	c8
2	2	2	2	2	2	2	2
3	3	3	3	3	3	3	3
4	4	4	4	4	4	4	4
replace into test2 values(1,1,1,1,1,1,1,1),(2,2,2,2,2,2,2,2),(3,3,3,3,3,3,3,3),(4,4,4,4,4,4,4,4);
select * from test2;
c1	c2	c3	c4	c5	c6	c7	c8
1	1	1	1	1	1	1	1
2	2	2	2	2	2	2	2
3	3	3	3	3	3	3	3
4	4	4	4	4	4	4	4
select  * from __3006__idx__idx1;
c1	c2	c3	ob_virtual_col
1	1	1	NULL
2	2	2	NULL
3	3	3	NULL
4	4	4	NULL
select  * from __3006__idx__idx2;
c1	c2	c3	c4	c5	c6
1	1	1	1	1	1
2	2	2	2	2	2
3	3	3	3	3	3
4	4	4	4	4	4
select  * from __3006__idx__idx3;
c1	c2	c3	c4	c6	c7
1	1	1	1	1	1
2	2	2	2	2	2
3	3	3	3	3	3
4	4	4	4	4	4
select  * from __3006__idx__idx4;
c1	c2	c3	c4	c5	c6	c7	c8
1	1	1	1	1	1	1	1
2	2	2	2	2	2	2	2
3	3	3	3	3	3	3	3
4	4	4	4	4	4	4	4
select  * from __3006__idx__idx5;
c1	c2	c3	c4	c5	c6	c7	c8
1	1	1	1	1	1	1	1
2	2	2	2	2	2	2	2
3	3	3	3	3	3	3	3
4	4	4	4	4	4	4	4
delete from test2 where c1 = 1 and c2 = 2 and c3 = 3 and c4 = 4 and c6 = 5;
select * from test2;
c1	c2	c3	c4	c5	c6	c7	c8
1	1	1	1	1	1	1	1
2	2	2	2	2	2	2	2
3	3	3	3	3	3	3	3
4	4	4	4	4	4	4	4
select  * from __3006__idx__idx1;
c1	c2	c3	ob_virtual_col
1	1	1	NULL
2	2	2	NULL
3	3	3	NULL
4	4	4	NULL
select  * from __3006__idx__idx2;
c1	c2	c3	c4	c5	c6
1	1	1	1	1	1
2	2	2	2	2	2
3	3	3	3	3	3
4	4	4	4	4	4
select  * from __3006__idx__idx3;
c1	c2	c3	c4	c6	c7
1	1	1	1	1	1
2	2	2	2	2	2
3	3	3	3	3	3
4	4	4	4	4	4
select  * from __3006__idx__idx4;
c1	c2	c3	c4	c5	c6	c7	c8
1	1	1	1	1	1	1	1
2	2	2	2	2	2	2	2
3	3	3	3	3	3	3	3
4	4	4	4	4	4	4	4
select  * from __3006__idx__idx5;
c1	c2	c3	c4	c5	c6	c7	c8
1	1	1	1	1	1	1	1
2	2	2	2	2	2	2	2
3	3	3	3	3	3	3	3
4	4	4	4	4	4	4	4
replace into test2 values(1,1,1,1,1,1,1,1),(2,2,2,2,2,2,2,2),(3,3,3,3,3,3,3,3),(4,4,4,4,4,4,4,4);
select * from test2;
c1	c2	c3	c4	c5	c6	c7	c8
1	1	1	1	1	1	1	1
2	2	2	2	2	2	2	2
3	3	3	3	3	3	3	3
4	4	4	4	4	4	4	4
select  * from __3006__idx__idx1;
c1	c2	c3	ob_virtual_col
1	1	1	NULL
2	2	2	NULL
3	3	3	NULL
4	4	4	NULL
select  * from __3006__idx__idx2;
c1	c2	c3	c4	c5	c6
1	1	1	1	1	1
2	2	2	2	2	2
3	3	3	3	3	3
4	4	4	4	4	4
select  * from __3006__idx__idx3;
c1	c2	c3	c4	c6	c7
1	1	1	1	1	1
2	2	2	2	2	2
3	3	3	3	3	3
4	4	4	4	4	4
select  * from __3006__idx__idx4;
c1	c2	c3	c4	c5	c6	c7	c8
1	1	1	1	1	1	1	1
2	2	2	2	2	2	2	2
3	3	3	3	3	3	3	3
4	4	4	4	4	4	4	4
select  * from __3006__idx__idx5;
c1	c2	c3	c4	c5	c6	c7	c8
1	1	1	1	1	1	1	1
2	2	2	2	2	2	2	2
3	3	3	3	3	3	3	3
4	4	4	4	4	4	4	4
delete from test2 where c2 = 1 or c4 = 2 and c5 = 3 or c7 = 4 and c6 = 5;
select * from test2;
c1	c2	c3	c4	c5	c6	c7	c8
2	2	2	2	2	2	2	2
3	3	3	3	3	3	3	3
4	4	4	4	4	4	4	4
select  * from __3006__idx__idx1;
c1	c2	c3	ob_virtual_col
2	2	2	NULL
3	3	3	NULL
4	4	4	NULL
select  * from __3006__idx__idx2;
c1	c2	c3	c4	c5	c6
2	2	2	2	2	2
3	3	3	3	3	3
4	4	4	4	4	4
select  * from __3006__idx__idx3;
c1	c2	c3	c4	c6	c7
2	2	2	2	2	2
3	3	3	3	3	3
4	4	4	4	4	4
select  * from __3006__idx__idx4;
c1	c2	c3	c4	c5	c6	c7	c8
2	2	2	2	2	2	2	2
3	3	3	3	3	3	3	3
4	4	4	4	4	4	4	4
select  * from __3006__idx__idx5;
c1	c2	c3	c4	c5	c6	c7	c8
2	2	2	2	2	2	2	2
3	3	3	3	3	3	3	3
4	4	4	4	4	4	4	4
replace into test2 values(1,1,1,1,1,1,1,1),(2,2,2,2,2,2,2,2),(3,3,3,3,3,3,3,3),(4,4,4,4,4,4,4,4);
select * from test2;
c1	c2	c3	c4	c5	c6	c7	c8
1	1	1	1	1	1	1	1
2	2	2	2	2	2	2	2
3	3	3	3	3	3	3	3
4	4	4	4	4	4	4	4
select  * from __3006__idx__idx1;
c1	c2	c3	ob_virtual_col
1	1	1	NULL
2	2	2	NULL
3	3	3	NULL
4	4	4	NULL
select  * from __3006__idx__idx2;
c1	c2	c3	c4	c5	c6
1	1	1	1	1	1
2	2	2	2	2	2
3	3	3	3	3	3
4	4	4	4	4	4
select  * from __3006__idx__idx3;
c1	c2	c3	c4	c6	c7
1	1	1	1	1	1
2	2	2	2	2	2
3	3	3	3	3	3
4	4	4	4	4	4
select  * from __3006__idx__idx4;
c1	c2	c3	c4	c5	c6	c7	c8
1	1	1	1	1	1	1	1
2	2	2	2	2	2	2	2
3	3	3	3	3	3	3	3
4	4	4	4	4	4	4	4
select  * from __3006__idx__idx5;
c1	c2	c3	c4	c5	c6	c7	c8
1	1	1	1	1	1	1	1
2	2	2	2	2	2	2	2
3	3	3	3	3	3	3	3
4	4	4	4	4	4	4	4
delete from test2 where c4 between 1 and 1;
select * from test2;
c1	c2	c3	c4	c5	c6	c7	c8
2	2	2	2	2	2	2	2
3	3	3	3	3	3	3	3
4	4	4	4	4	4	4	4
select  * from __3006__idx__idx1;
c1	c2	c3	ob_virtual_col
2	2	2	NULL
3	3	3	NULL
4	4	4	NULL
select  * from __3006__idx__idx2;
c1	c2	c3	c4	c5	c6
2	2	2	2	2	2
3	3	3	3	3	3
4	4	4	4	4	4
select  * from __3006__idx__idx3;
c1	c2	c3	c4	c6	c7
2	2	2	2	2	2
3	3	3	3	3	3
4	4	4	4	4	4
select  * from __3006__idx__idx4;
c1	c2	c3	c4	c5	c6	c7	c8
2	2	2	2	2	2	2	2
3	3	3	3	3	3	3	3
4	4	4	4	4	4	4	4
select  * from __3006__idx__idx5;
c1	c2	c3	c4	c5	c6	c7	c8
2	2	2	2	2	2	2	2
3	3	3	3	3	3	3	3
4	4	4	4	4	4	4	4
replace into test2 values(1,1,1,1,1,1,1,1),(2,2,2,2,2,2,2,2),(3,3,3,3,3,3,3,3),(4,4,4,4,4,4,4,4);
select * from test2;
c1	c2	c3	c4	c5	c6	c7	c8
1	1	1	1	1	1	1	1
2	2	2	2	2	2	2	2
3	3	3	3	3	3	3	3
4	4	4	4	4	4	4	4
select  * from __3006__idx__idx1;
c1	c2	c3	ob_virtual_col
1	1	1	NULL
2	2	2	NULL
3	3	3	NULL
4	4	4	NULL
select  * from __3006__idx__idx2;
c1	c2	c3	c4	c5	c6
1	1	1	1	1	1
2	2	2	2	2	2
3	3	3	3	3	3
4	4	4	4	4	4
select  * from __3006__idx__idx3;
c1	c2	c3	c4	c6	c7
1	1	1	1	1	1
2	2	2	2	2	2
3	3	3	3	3	3
4	4	4	4	4	4
select  * from __3006__idx__idx4;
c1	c2	c3	c4	c5	c6	c7	c8
1	1	1	1	1	1	1	1
2	2	2	2	2	2	2	2
3	3	3	3	3	3	3	3
4	4	4	4	4	4	4	4
select  * from __3006__idx__idx5;
c1	c2	c3	c4	c5	c6	c7	c8
1	1	1	1	1	1	1	1
2	2	2	2	2	2	2	2
3	3	3	3	3	3	3	3
4	4	4	4	4	4	4	4
delete from test2 where c5 between 3 and 4;
select * from test2;
c1	c2	c3	c4	c5	c6	c7	c8
1	1	1	1	1	1	1	1
2	2	2	2	2	2	2	2
select  * from __3006__idx__idx1;
c1	c2	c3	ob_virtual_col
1	1	1	NULL
2	2	2	NULL
select  * from __3006__idx__idx2;
c1	c2	c3	c4	c5	c6
1	1	1	1	1	1
2	2	2	2	2	2
select  * from __3006__idx__idx3;
c1	c2	c3	c4	c6	c7
1	1	1	1	1	1
2	2	2	2	2	2
select  * from __3006__idx__idx4;
c1	c2	c3	c4	c5	c6	c7	c8
1	1	1	1	1	1	1	1
2	2	2	2	2	2	2	2
select  * from __3006__idx__idx5;
c1	c2	c3	c4	c5	c6	c7	c8
1	1	1	1	1	1	1	1
2	2	2	2	2	2	2	2
replace into test2 values(1,1,1,1,1,1,1,1),(2,2,2,2,2,2,2,2),(3,3,3,3,3,3,3,3),(4,4,4,4,4,4,4,4);
select * from test2;
c1	c2	c3	c4	c5	c6	c7	c8
1	1	1	1	1	1	1	1
2	2	2	2	2	2	2	2
3	3	3	3	3	3	3	3
4	4	4	4	4	4	4	4
select  * from __3006__idx__idx1;
c1	c2	c3	ob_virtual_col
1	1	1	NULL
2	2	2	NULL
3	3	3	NULL
4	4	4	NULL
select  * from __3006__idx__idx2;
c1	c2	c3	c4	c5	c6
1	1	1	1	1	1
2	2	2	2	2	2
3	3	3	3	3	3
4	4	4	4	4	4
select  * from __3006__idx__idx3;
c1	c2	c3	c4	c6	c7
1	1	1	1	1	1
2	2	2	2	2	2
3	3	3	3	3	3
4	4	4	4	4	4
select  * from __3006__idx__idx4;
c1	c2	c3	c4	c5	c6	c7	c8
1	1	1	1	1	1	1	1
2	2	2	2	2	2	2	2
3	3	3	3	3	3	3	3
4	4	4	4	4	4	4	4
select  * from __3006__idx__idx5;
c1	c2	c3	c4	c5	c6	c7	c8
1	1	1	1	1	1	1	1
2	2	2	2	2	2	2	2
3	3	3	3	3	3	3	3
4	4	4	4	4	4	4	4
delete from test2 where c6 IN (10,11,12,13,14,15);
select * from test2;
c1	c2	c3	c4	c5	c6	c7	c8
1	1	1	1	1	1	1	1
2	2	2	2	2	2	2	2
3	3	3	3	3	3	3	3
4	4	4	4	4	4	4	4
select  * from __3006__idx__idx1;
c1	c2	c3	ob_virtual_col
1	1	1	NULL
2	2	2	NULL
3	3	3	NULL
4	4	4	NULL
select  * from __3006__idx__idx2;
c1	c2	c3	c4	c5	c6
1	1	1	1	1	1
2	2	2	2	2	2
3	3	3	3	3	3
4	4	4	4	4	4
select  * from __3006__idx__idx3;
c1	c2	c3	c4	c6	c7
1	1	1	1	1	1
2	2	2	2	2	2
3	3	3	3	3	3
4	4	4	4	4	4
select  * from __3006__idx__idx4;
c1	c2	c3	c4	c5	c6	c7	c8
1	1	1	1	1	1	1	1
2	2	2	2	2	2	2	2
3	3	3	3	3	3	3	3
4	4	4	4	4	4	4	4
select  * from __3006__idx__idx5;
c1	c2	c3	c4	c5	c6	c7	c8
1	1	1	1	1	1	1	1
2	2	2	2	2	2	2	2
3	3	3	3	3	3	3	3
4	4	4	4	4	4	4	4
replace into test2 values(1,1,1,1,1,1,1,1),(2,2,2,2,2,2,2,2),(3,3,3,3,3,3,3,3),(4,4,4,4,4,4,4,4);
select * from test2;
c1	c2	c3	c4	c5	c6	c7	c8
1	1	1	1	1	1	1	1
2	2	2	2	2	2	2	2
3	3	3	3	3	3	3	3
4	4	4	4	4	4	4	4
select  * from __3006__idx__idx1;
c1	c2	c3	ob_virtual_col
1	1	1	NULL
2	2	2	NULL
3	3	3	NULL
4	4	4	NULL
select  * from __3006__idx__idx2;
c1	c2	c3	c4	c5	c6
1	1	1	1	1	1
2	2	2	2	2	2
3	3	3	3	3	3
4	4	4	4	4	4
select  * from __3006__idx__idx3;
c1	c2	c3	c4	c6	c7
1	1	1	1	1	1
2	2	2	2	2	2
3	3	3	3	3	3
4	4	4	4	4	4
select  * from __3006__idx__idx4;
c1	c2	c3	c4	c5	c6	c7	c8
1	1	1	1	1	1	1	1
2	2	2	2	2	2	2	2
3	3	3	3	3	3	3	3
4	4	4	4	4	4	4	4
select  * from __3006__idx__idx5;
c1	c2	c3	c4	c5	c6	c7	c8
1	1	1	1	1	1	1	1
2	2	2	2	2	2	2	2
3	3	3	3	3	3	3	3
4	4	4	4	4	4	4	4
delete from test2 where c7 IN (1);
select * from test2;
c1	c2	c3	c4	c5	c6	c7	c8
2	2	2	2	2	2	2	2
3	3	3	3	3	3	3	3
4	4	4	4	4	4	4	4
select  * from __3006__idx__idx1;
c1	c2	c3	ob_virtual_col
2	2	2	NULL
3	3	3	NULL
4	4	4	NULL
select  * from __3006__idx__idx2;
c1	c2	c3	c4	c5	c6
2	2	2	2	2	2
3	3	3	3	3	3
4	4	4	4	4	4
select  * from __3006__idx__idx3;
c1	c2	c3	c4	c6	c7
2	2	2	2	2	2
3	3	3	3	3	3
4	4	4	4	4	4
select  * from __3006__idx__idx4;
c1	c2	c3	c4	c5	c6	c7	c8
2	2	2	2	2	2	2	2
3	3	3	3	3	3	3	3
4	4	4	4	4	4	4	4
select  * from __3006__idx__idx5;
c1	c2	c3	c4	c5	c6	c7	c8
2	2	2	2	2	2	2	2
3	3	3	3	3	3	3	3
4	4	4	4	4	4	4	4
replace into test2 values(1,1,1,1,1,1,1,1),(2,2,2,2,2,2,2,2),(3,3,3,3,3,3,3,3),(4,4,4,4,4,4,4,4);
select * from test2;
c1	c2	c3	c4	c5	c6	c7	c8
1	1	1	1	1	1	1	1
2	2	2	2	2	2	2	2
3	3	3	3	3	3	3	3
4	4	4	4	4	4	4	4
select  * from __3006__idx__idx1;
c1	c2	c3	ob_virtual_col
1	1	1	NULL
2	2	2	NULL
3	3	3	NULL
4	4	4	NULL
select  * from __3006__idx__idx2;
c1	c2	c3	c4	c5	c6
1	1	1	1	1	1
2	2	2	2	2	2
3	3	3	3	3	3
4	4	4	4	4	4
select  * from __3006__idx__idx3;
c1	c2	c3	c4	c6	c7
1	1	1	1	1	1
2	2	2	2	2	2
3	3	3	3	3	3
4	4	4	4	4	4
select  * from __3006__idx__idx4;
c1	c2	c3	c4	c5	c6	c7	c8
1	1	1	1	1	1	1	1
2	2	2	2	2	2	2	2
3	3	3	3	3	3	3	3
4	4	4	4	4	4	4	4
select  * from __3006__idx__idx5;
c1	c2	c3	c4	c5	c6	c7	c8
1	1	1	1	1	1	1	1
2	2	2	2	2	2	2	2
3	3	3	3	3	3	3	3
4	4	4	4	4	4	4	4
delete from test2 where c8 IN (2);
select * from test2;
c1	c2	c3	c4	c5	c6	c7	c8
1	1	1	1	1	1	1	1
3	3	3	3	3	3	3	3
4	4	4	4	4	4	4	4
select  * from __3006__idx__idx1;
c1	c2	c3	ob_virtual_col
1	1	1	NULL
3	3	3	NULL
4	4	4	NULL
select  * from __3006__idx__idx2;
c1	c2	c3	c4	c5	c6
1	1	1	1	1	1
3	3	3	3	3	3
4	4	4	4	4	4
select  * from __3006__idx__idx3;
c1	c2	c3	c4	c6	c7
1	1	1	1	1	1
3	3	3	3	3	3
4	4	4	4	4	4
select  * from __3006__idx__idx4;
c1	c2	c3	c4	c5	c6	c7	c8
1	1	1	1	1	1	1	1
3	3	3	3	3	3	3	3
4	4	4	4	4	4	4	4
select  * from __3006__idx__idx5;
c1	c2	c3	c4	c5	c6	c7	c8
1	1	1	1	1	1	1	1
3	3	3	3	3	3	3	3
4	4	4	4	4	4	4	4
replace into test2 values(1,1,1,1,1,1,1,1),(2,2,2,2,2,2,2,2),(3,3,3,3,3,3,3,3),(4,4,4,4,4,4,4,4);
select * from test2;
c1	c2	c3	c4	c5	c6	c7	c8
1	1	1	1	1	1	1	1
2	2	2	2	2	2	2	2
3	3	3	3	3	3	3	3
4	4	4	4	4	4	4	4
select  * from __3006__idx__idx1;
c1	c2	c3	ob_virtual_col
1	1	1	NULL
2	2	2	NULL
3	3	3	NULL
4	4	4	NULL
select  * from __3006__idx__idx2;
c1	c2	c3	c4	c5	c6
1	1	1	1	1	1
2	2	2	2	2	2
3	3	3	3	3	3
4	4	4	4	4	4
select  * from __3006__idx__idx3;
c1	c2	c3	c4	c6	c7
1	1	1	1	1	1
2	2	2	2	2	2
3	3	3	3	3	3
4	4	4	4	4	4
select  * from __3006__idx__idx4;
c1	c2	c3	c4	c5	c6	c7	c8
1	1	1	1	1	1	1	1
2	2	2	2	2	2	2	2
3	3	3	3	3	3	3	3
4	4	4	4	4	4	4	4
select  * from __3006__idx__idx5;
c1	c2	c3	c4	c5	c6	c7	c8
1	1	1	1	1	1	1	1
2	2	2	2	2	2	2	2
3	3	3	3	3	3	3	3
4	4	4	4	4	4	4	4
delete from test2 where c5 IN (1,2,3,4,5,6,7,8,9,10);
select * from test2;
c1	c2	c3	c4	c5	c6	c7	c8
select  * from __3006__idx__idx1;
c1	c2	c3	ob_virtual_col
select  * from __3006__idx__idx2;
c1	c2	c3	c4	c5	c6
select  * from __3006__idx__idx3;
c1	c2	c3	c4	c6	c7
select  * from __3006__idx__idx4;
c1	c2	c3	c4	c5	c6	c7	c8
select  * from __3006__idx__idx5;
c1	c2	c3	c4	c5	c6	c7	c8
replace into test2 values(1,1,1,1,1,1,1,1),(2,2,2,2,2,2,2,2),(3,3,3,3,3,3,3,3),(4,4,4,4,4,4,4,4);
select * from test2;
c1	c2	c3	c4	c5	c6	c7	c8
1	1	1	1	1	1	1	1
2	2	2	2	2	2	2	2
3	3	3	3	3	3	3	3
4	4	4	4	4	4	4	4
select  * from __3006__idx__idx1;
c1	c2	c3	ob_virtual_col
1	1	1	NULL
2	2	2	NULL
3	3	3	NULL
4	4	4	NULL
select  * from __3006__idx__idx2;
c1	c2	c3	c4	c5	c6
1	1	1	1	1	1
2	2	2	2	2	2
3	3	3	3	3	3
4	4	4	4	4	4
select  * from __3006__idx__idx3;
c1	c2	c3	c4	c6	c7
1	1	1	1	1	1
2	2	2	2	2	2
3	3	3	3	3	3
4	4	4	4	4	4
select  * from __3006__idx__idx4;
c1	c2	c3	c4	c5	c6	c7	c8
1	1	1	1	1	1	1	1
2	2	2	2	2	2	2	2
3	3	3	3	3	3	3	3
4	4	4	4	4	4	4	4
select  * from __3006__idx__idx5;
c1	c2	c3	c4	c5	c6	c7	c8
1	1	1	1	1	1	1	1
2	2	2	2	2	2	2	2
3	3	3	3	3	3	3	3
4	4	4	4	4	4	4	4
delete from test2 where c4 * 2 + 1 > 3;
select * from test2;
c1	c2	c3	c4	c5	c6	c7	c8
1	1	1	1	1	1	1	1
select  * from __3006__idx__idx1;
c1	c2	c3	ob_virtual_col
1	1	1	NULL
select  * from __3006__idx__idx2;
c1	c2	c3	c4	c5	c6
1	1	1	1	1	1
select  * from __3006__idx__idx3;
c1	c2	c3	c4	c6	c7
1	1	1	1	1	1
select  * from __3006__idx__idx4;
c1	c2	c3	c4	c5	c6	c7	c8
1	1	1	1	1	1	1	1
select  * from __3006__idx__idx5;
c1	c2	c3	c4	c5	c6	c7	c8
1	1	1	1	1	1	1	1
replace into test2 values(1,1,1,1,1,1,1,1),(2,2,2,2,2,2,2,2),(3,3,3,3,3,3,3,3),(4,4,4,4,4,4,4,4);
select * from test2;
c1	c2	c3	c4	c5	c6	c7	c8
1	1	1	1	1	1	1	1
2	2	2	2	2	2	2	2
3	3	3	3	3	3	3	3
4	4	4	4	4	4	4	4
select  * from __3006__idx__idx1;
c1	c2	c3	ob_virtual_col
1	1	1	NULL
2	2	2	NULL
3	3	3	NULL
4	4	4	NULL
select  * from __3006__idx__idx2;
c1	c2	c3	c4	c5	c6
1	1	1	1	1	1
2	2	2	2	2	2
3	3	3	3	3	3
4	4	4	4	4	4
select  * from __3006__idx__idx3;
c1	c2	c3	c4	c6	c7
1	1	1	1	1	1
2	2	2	2	2	2
3	3	3	3	3	3
4	4	4	4	4	4
select  * from __3006__idx__idx4;
c1	c2	c3	c4	c5	c6	c7	c8
1	1	1	1	1	1	1	1
2	2	2	2	2	2	2	2
3	3	3	3	3	3	3	3
4	4	4	4	4	4	4	4
select  * from __3006__idx__idx5;
c1	c2	c3	c4	c5	c6	c7	c8
1	1	1	1	1	1	1	1
2	2	2	2	2	2	2	2
3	3	3	3	3	3	3	3
4	4	4	4	4	4	4	4
delete from test2 where c5 / 2 - 1 > 1;
select * from test2;
c1	c2	c3	c4	c5	c6	c7	c8
1	1	1	1	1	1	1	1
2	2	2	2	2	2	2	2
3	3	3	3	3	3	3	3
4	4	4	4	4	4	4	4
select  * from __3006__idx__idx1;
c1	c2	c3	ob_virtual_col
1	1	1	NULL
2	2	2	NULL
3	3	3	NULL
4	4	4	NULL
select  * from __3006__idx__idx2;
c1	c2	c3	c4	c5	c6
1	1	1	1	1	1
2	2	2	2	2	2
3	3	3	3	3	3
4	4	4	4	4	4
select  * from __3006__idx__idx3;
c1	c2	c3	c4	c6	c7
1	1	1	1	1	1
2	2	2	2	2	2
3	3	3	3	3	3
4	4	4	4	4	4
select  * from __3006__idx__idx4;
c1	c2	c3	c4	c5	c6	c7	c8
1	1	1	1	1	1	1	1
2	2	2	2	2	2	2	2
3	3	3	3	3	3	3	3
4	4	4	4	4	4	4	4
select  * from __3006__idx__idx5;
c1	c2	c3	c4	c5	c6	c7	c8
1	1	1	1	1	1	1	1
2	2	2	2	2	2	2	2
3	3	3	3	3	3	3	3
4	4	4	4	4	4	4	4
replace into test2 values(1,1,1,1,1,1,1,1),(2,2,2,2,2,2,2,2),(3,3,3,3,3,3,3,3),(4,4,4,4,4,4,4,4);
select * from test2;
c1	c2	c3	c4	c5	c6	c7	c8
1	1	1	1	1	1	1	1
2	2	2	2	2	2	2	2
3	3	3	3	3	3	3	3
4	4	4	4	4	4	4	4
select  * from __3006__idx__idx1;
c1	c2	c3	ob_virtual_col
1	1	1	NULL
2	2	2	NULL
3	3	3	NULL
4	4	4	NULL
select  * from __3006__idx__idx2;
c1	c2	c3	c4	c5	c6
1	1	1	1	1	1
2	2	2	2	2	2
3	3	3	3	3	3
4	4	4	4	4	4
select  * from __3006__idx__idx3;
c1	c2	c3	c4	c6	c7
1	1	1	1	1	1
2	2	2	2	2	2
3	3	3	3	3	3
4	4	4	4	4	4
select  * from __3006__idx__idx4;
c1	c2	c3	c4	c5	c6	c7	c8
1	1	1	1	1	1	1	1
2	2	2	2	2	2	2	2
3	3	3	3	3	3	3	3
4	4	4	4	4	4	4	4
select  * from __3006__idx__idx5;
c1	c2	c3	c4	c5	c6	c7	c8
1	1	1	1	1	1	1	1
2	2	2	2	2	2	2	2
3	3	3	3	3	3	3	3
4	4	4	4	4	4	4	4
delete from test2 where c7 * 2 / 3 * c6 % 4 + 1 > 2;
select * from test2;
c1	c2	c3	c4	c5	c6	c7	c8
1	1	1	1	1	1	1	1
4	4	4	4	4	4	4	4
select  * from __3006__idx__idx1;
c1	c2	c3	ob_virtual_col
1	1	1	NULL
4	4	4	NULL
select  * from __3006__idx__idx2;
c1	c2	c3	c4	c5	c6
1	1	1	1	1	1
4	4	4	4	4	4
select  * from __3006__idx__idx3;
c1	c2	c3	c4	c6	c7
1	1	1	1	1	1
4	4	4	4	4	4
select  * from __3006__idx__idx4;
c1	c2	c3	c4	c5	c6	c7	c8
1	1	1	1	1	1	1	1
4	4	4	4	4	4	4	4
select  * from __3006__idx__idx5;
c1	c2	c3	c4	c5	c6	c7	c8
1	1	1	1	1	1	1	1
4	4	4	4	4	4	4	4
replace into test2 values(1,1,1,1,1,1,1,1),(2,2,2,2,2,2,2,2),(3,3,3,3,3,3,3,3),(4,4,4,4,4,4,4,4);
select * from test2;
c1	c2	c3	c4	c5	c6	c7	c8
1	1	1	1	1	1	1	1
2	2	2	2	2	2	2	2
3	3	3	3	3	3	3	3
4	4	4	4	4	4	4	4
select  * from __3006__idx__idx1;
c1	c2	c3	ob_virtual_col
1	1	1	NULL
2	2	2	NULL
3	3	3	NULL
4	4	4	NULL
select  * from __3006__idx__idx2;
c1	c2	c3	c4	c5	c6
1	1	1	1	1	1
2	2	2	2	2	2
3	3	3	3	3	3
4	4	4	4	4	4
select  * from __3006__idx__idx3;
c1	c2	c3	c4	c6	c7
1	1	1	1	1	1
2	2	2	2	2	2
3	3	3	3	3	3
4	4	4	4	4	4
select  * from __3006__idx__idx4;
c1	c2	c3	c4	c5	c6	c7	c8
1	1	1	1	1	1	1	1
2	2	2	2	2	2	2	2
3	3	3	3	3	3	3	3
4	4	4	4	4	4	4	4
select  * from __3006__idx__idx5;
c1	c2	c3	c4	c5	c6	c7	c8
1	1	1	1	1	1	1	1
2	2	2	2	2	2	2	2
3	3	3	3	3	3	3	3
4	4	4	4	4	4	4	4
delete from test2 where (c8 * c4 / 3 * 5) MOD 3 + 1 > 2;
select * from test2;
c1	c2	c3	c4	c5	c6	c7	c8
1	1	1	1	1	1	1	1
3	3	3	3	3	3	3	3
4	4	4	4	4	4	4	4
select  * from __3006__idx__idx1;
c1	c2	c3	ob_virtual_col
1	1	1	NULL
3	3	3	NULL
4	4	4	NULL
select  * from __3006__idx__idx2;
c1	c2	c3	c4	c5	c6
1	1	1	1	1	1
3	3	3	3	3	3
4	4	4	4	4	4
select  * from __3006__idx__idx3;
c1	c2	c3	c4	c6	c7
1	1	1	1	1	1
3	3	3	3	3	3
4	4	4	4	4	4
select  * from __3006__idx__idx4;
c1	c2	c3	c4	c5	c6	c7	c8
1	1	1	1	1	1	1	1
3	3	3	3	3	3	3	3
4	4	4	4	4	4	4	4
select  * from __3006__idx__idx5;
c1	c2	c3	c4	c5	c6	c7	c8
1	1	1	1	1	1	1	1
3	3	3	3	3	3	3	3
4	4	4	4	4	4	4	4
replace into test2 values(1,1,1,1,1,1,1,1),(2,2,2,2,2,2,2,2),(3,3,3,3,3,3,3,3),(4,4,4,4,4,4,4,4);
select * from test2;
c1	c2	c3	c4	c5	c6	c7	c8
1	1	1	1	1	1	1	1
2	2	2	2	2	2	2	2
3	3	3	3	3	3	3	3
4	4	4	4	4	4	4	4
select  * from __3006__idx__idx1;
c1	c2	c3	ob_virtual_col
1	1	1	NULL
2	2	2	NULL
3	3	3	NULL
4	4	4	NULL
select  * from __3006__idx__idx2;
c1	c2	c3	c4	c5	c6
1	1	1	1	1	1
2	2	2	2	2	2
3	3	3	3	3	3
4	4	4	4	4	4
select  * from __3006__idx__idx3;
c1	c2	c3	c4	c6	c7
1	1	1	1	1	1
2	2	2	2	2	2
3	3	3	3	3	3
4	4	4	4	4	4
select  * from __3006__idx__idx4;
c1	c2	c3	c4	c5	c6	c7	c8
1	1	1	1	1	1	1	1
2	2	2	2	2	2	2	2
3	3	3	3	3	3	3	3
4	4	4	4	4	4	4	4
select  * from __3006__idx__idx5;
c1	c2	c3	c4	c5	c6	c7	c8
1	1	1	1	1	1	1	1
2	2	2	2	2	2	2	2
3	3	3	3	3	3	3	3
4	4	4	4	4	4	4	4
