select user_nick, is_shared, note, collect_time, stat,  tag, category, title, picurl, owner_id, owner_nick, price, ends, proper_xml, comment_count, collector_count, collect_count, total_money, collect_time_precise, user_id, item_type, item_id from collect_info where user_id=3472328296227682613 and item_type=53 and item_id=3472328296228010293;
user_nick	is_shared	note	collect_time	stat	tag	category	title	picurl	owner_id	owner_nick	price	ends	proper_xml	comment_count	collector_count	collect_count	total_money	collect_time_precise	user_id	item_type	item_id
00000095500000595-32	2491533	00000095500000595-34	2010-11-16 14:56:53	2491536	00000095500000595-39	2491540	00000595-32	00000595-33	59534	00000595-35	59536	2010-11-16 21:42:11	00000595-38	59539	59540	59541	59542	2010-11-16 14:56:36	3472328296227682613	53	3472328296228010293
select user_nick, is_shared, note, collect_time, stat,  tag, category, title, picurl, owner_id, owner_nick, price, ends, proper_xml, comment_count, collector_count, collect_count, total_money, collect_time_precise, user_id, item_type, item_id from collect_info where user_id=3472328296227682614 and item_type=53 and item_id=3472328296228010294;
user_nick	is_shared	note	collect_time	stat	tag	category	title	picurl	owner_id	owner_nick	price	ends	proper_xml	comment_count	collector_count	collect_count	total_money	collect_time_precise	user_id	item_type	item_id
00000096500000596-32	2517233	00000096500000596-34	2010-11-16 14:52:36	2517236	00000096500000596-39	2517240	00000596-32	00000596-33	59634	00000596-35	59636	2010-11-16 21:42:10	00000596-38	59639	59640	59641	59642	2010-11-16 14:52:19	3472328296227682614	53	3472328296228010294
select user_nick, is_shared, note, collect_time, stat,  tag, category, title, picurl, owner_id, owner_nick, price, ends, proper_xml, comment_count, collector_count, collect_count, total_money, collect_time_precise, user_id, item_type, item_id from collect_info where user_id=3472328296227682615 and item_type=53 and item_id=3472328296228010295;
user_nick	is_shared	note	collect_time	stat	tag	category	title	picurl	owner_id	owner_nick	price	ends	proper_xml	comment_count	collector_count	collect_count	total_money	collect_time_precise	user_id	item_type	item_id
00000097500000597-32	2542933	00000097500000597-34	2010-11-16 14:48:19	2542936	00000097500000597-39	2542940	00000597-32	00000597-33	59734	00000597-35	59736	2010-11-16 21:42:09	00000597-38	59739	59740	59741	59742	2010-11-16 14:48:02	3472328296227682615	53	3472328296228010295
select user_nick, is_shared, note, collect_time, stat,  tag, category, title, picurl, owner_id, owner_nick, price, ends, proper_xml, comment_count, collector_count, collect_count, total_money, collect_time_precise, user_id, item_type, item_id from collect_info where user_id=3472328296227682616 and item_type=53 and item_id=3472328296228010296;
user_nick	is_shared	note	collect_time	stat	tag	category	title	picurl	owner_id	owner_nick	price	ends	proper_xml	comment_count	collector_count	collect_count	total_money	collect_time_precise	user_id	item_type	item_id
00000098500000598-32	2568633	00000098500000598-34	2010-11-16 14:44:02	2568636	00000098500000598-39	2568640	00000598-32	00000598-33	59834	00000598-35	59836	2010-11-16 21:42:08	00000598-38	59839	59840	59841	59842	2010-11-16 14:43:45	3472328296227682616	53	3472328296228010296
select user_nick, is_shared, note, collect_time, stat,  tag, category, title, picurl, owner_id, owner_nick, price, ends, proper_xml, comment_count, collector_count, collect_count, total_money, collect_time_precise, user_id, item_type, item_id from collect_info where user_id=3472328296227682617 and item_type=53 and item_id=3472328296228010297;
user_nick	is_shared	note	collect_time	stat	tag	category	title	picurl	owner_id	owner_nick	price	ends	proper_xml	comment_count	collector_count	collect_count	total_money	collect_time_precise	user_id	item_type	item_id
00000099500000599-32	2594333	00000099500000599-34	2010-11-16 14:39:45	2594336	00000099500000599-39	2594340	00000599-32	00000599-33	59934	00000599-35	59936	2010-11-16 21:42:07	00000599-38	59939	59940	59941	59942	2010-11-16 14:39:28	3472328296227682617	53	3472328296228010297
select title, picurl, owner_id, owner_nick, price, ends, proper_xml, comment_count, collector_count, collect_count, money,  item_id, item_type from item_info where item_type = 53 and item_id = 3472328296228009777;
title	picurl	owner_id	owner_nick	price	ends	proper_xml	comment_count	collector_count	collect_count	money	item_id	item_type
00000571-32	00000571-33	57134	00000571-35	57136	2010-11-16 21:42:35	00000571-38	57139	57140	57141	57142	3472328296228009777	53
select title, picurl, owner_id, owner_nick, price, ends, proper_xml, comment_count, collector_count, collect_count, money,  item_id, item_type from item_info where item_type = 53 and item_id = 3472328296228009778;
title	picurl	owner_id	owner_nick	price	ends	proper_xml	comment_count	collector_count	collect_count	money	item_id	item_type
00000572-32	00000572-33	57234	00000572-35	57236	2010-11-16 21:42:34	00000572-38	57239	57240	57241	57242	3472328296228009778	53
select title, picurl, owner_id, owner_nick, price, ends, proper_xml, comment_count, collector_count, collect_count, money,  item_id, item_type from item_info where item_type = 53 and item_id = 3472328296228009779;
title	picurl	owner_id	owner_nick	price	ends	proper_xml	comment_count	collector_count	collect_count	money	item_id	item_type
00000573-32	00000573-33	57334	00000573-35	57336	2010-11-16 21:42:33	00000573-38	57339	57340	57341	57342	3472328296228009779	53
select title, picurl, owner_id, owner_nick, price, ends, proper_xml, comment_count, collector_count, collect_count, money,  item_id, item_type from item_info where item_type = 53 and item_id = 3472328296228009780;
title	picurl	owner_id	owner_nick	price	ends	proper_xml	comment_count	collector_count	collect_count	money	item_id	item_type
00000574-32	00000574-33	57434	00000574-35	57436	2010-11-16 21:42:32	00000574-38	57439	57440	57441	57442	3472328296228009780	53
insert into collect_info(category,collect_time_precise,item_id,tag,user_id,user_nick,is_shared,stat,note,item_type,collect_time) values(85740,'1289914654000000',1,'00000001600000601-39',1,'00000001600000601-32',85733,85736,'00000001600000601-34',54,'1289914671');
insert into item_info(title, picurl, owner_id, price, ends, proper_xml, comment_count, collector_count, collect_count, money, item_id, item_type) values('junyue', '', '', 11, 11,' ', ' ',10,10,100,1,54);
select user_nick, is_shared, note, collect_time, stat,  tag, category, title, picurl, owner_id, owner_nick, price, ends, proper_xml, comment_count, collector_count, collect_count, total_money, collect_time_precise, user_id, item_type, item_id from collect_info where user_id=1 and item_type=54 and item_id=1;
user_nick	is_shared	note	collect_time	stat	tag	category	title	picurl	owner_id	owner_nick	price	ends	proper_xml	comment_count	collector_count	collect_count	total_money	collect_time_precise	user_id	item_type	item_id
00000001600000601-32	85733	00000001600000601-34	1970-01-01 08:00:00	85736	00000001600000601-39	85740	junyue		0	NULL	11	1970-01-01 08:00:11	 	0	10	10	100	1970-01-01 08:00:00	1	54	1
insert into collect_info(category,collect_time_precise,item_id,tag,user_id,user_nick,is_shared,stat,note,item_type,collect_time) values(85740,'1289914654000000',3472328296228010293,'00000001600000601-39',3472328296227682613,'00000001600000601-32',85733,85736,'00000001600000601-34',53,'1289914671');
ERROR 23000: Duplicate entry ' <1001.53>=int:3472328296227682613 <1001.54>=int:53 <1001.55>=int:3472328296228010293' for key 'PRIMARY'
insert into collect_info(category,collect_time_precise,item_id,tag,user_id,user_nick,is_shared,stat,note,item_type,collect_time) values(85740,'1289914654000000',1,'00000001600000601-39',1,'00000001600000601-32',85733,85736,'00000001600000601-34',54,'1289914671');
ERROR 23000: Duplicate entry ' <1001.53>=int:1 <1001.54>=int:54 <1001.55>=int:1' for key 'PRIMARY'
update collect_info set  category = 808, collect_time_precise = '820', tag = '807', user_nick = '800', is_shared = 801, stat = 804, note = '802', collect_time = '803' where user_id = 3472328296227681076 and item_type = 55 and item_id = 3472328296228139828;
select user_nick, is_shared, note, collect_time, stat,  tag, category, title, picurl, owner_id, owner_nick, price, ends, proper_xml, comment_count, collector_count, collect_count, total_money, collect_time_precise, user_id, item_type, item_id from collect_info where user_id = 3472328296227681076 and item_type = 55 and item_id = 3472328296228139828;
user_nick	is_shared	note	collect_time	stat	tag	category	title	picurl	owner_id	owner_nick	price	ends	proper_xml	comment_count	collector_count	collect_count	total_money	collect_time_precise	user_id	item_type	item_id
800	801	802	1970-01-01 08:00:00	804	807	808	00000734-32	00000734-33	73434	00000734-35	73436	2010-11-16 21:39:52	00000734-38	73439	73440	73441	73442	1970-01-01 08:00:00	3472328296227681076	55	3472328296228139828
update item_info set  comment_count = 806, title = '799', ends = '804', price = 803, proper_xml = '805', owner_nick = '802', money = 809, owner_id = 801, picurl = '800', collector_count = 807, collect_count = 808 where item_type = 55 and item_id = 3472328296228140599;
select title, picurl, owner_id, owner_nick, price, ends, proper_xml, comment_count, collector_count, collect_count, money,  item_id, item_type from item_info where  item_type = 55 and item_id = 3472328296228140599;
title	picurl	owner_id	owner_nick	price	ends	proper_xml	comment_count	collector_count	collect_count	money	item_id	item_type
799	800	801	802	803	1970-01-01 08:00:00	805	806	807	808	809	3472328296228140599	55
update collect_info set  category = 808, collect_time_precise = '820', tag = '807', user_nick = '800', is_shared = 801, stat = 804, note = '802', collect_time = '803' where user_id=1 and item_type=54 and item_id=1;
select user_nick, is_shared, note, collect_time, stat,  tag, category, title, picurl, owner_id, owner_nick, price, ends, proper_xml, comment_count, collector_count, collect_count, total_money, collect_time_precise, user_id, item_type, item_id from collect_info where user_id=1 and item_type=54 and item_id=1;
user_nick	is_shared	note	collect_time	stat	tag	category	title	picurl	owner_id	owner_nick	price	ends	proper_xml	comment_count	collector_count	collect_count	total_money	collect_time_precise	user_id	item_type	item_id
800	801	802	1970-01-01 08:00:00	804	807	808	junyue		0	NULL	11	1970-01-01 08:00:11	 	0	10	10	100	1970-01-01 08:00:00	1	54	1
delete from collect_info where user_id=3472328296227682617 and item_type=53 and item_id=3472328296228010297;
select user_nick, is_shared, note, collect_time, stat,  tag, category, title, picurl, owner_id, owner_nick, price, ends, proper_xml, comment_count, collector_count, collect_count, total_money, collect_time_precise, user_id, item_type, item_id from collect_info where  user_id=3472328296227682617 and item_type=53 and item_id=3472328296228010297;
user_nick	is_shared	note	collect_time	stat	tag	category	title	picurl	owner_id	owner_nick	price	ends	proper_xml	comment_count	collector_count	collect_count	total_money	collect_time_precise	user_id	item_type	item_id
delete from collect_info where user_id=1 and item_type=54 and item_id=1;
select user_nick, is_shared, note, collect_time, stat,  tag, category, title, picurl, owner_id, owner_nick, price, ends, proper_xml, comment_count, collector_count, collect_count, total_money, collect_time_precise, user_id, item_type, item_id from collect_info where user_id=3472328296227680305 and item_type=54 and item_id=3472328296228073521;
user_nick	is_shared	note	collect_time	stat	tag	category	title	picurl	owner_id	owner_nick	price	ends	proper_xml	comment_count	collector_count	collect_count	total_money	collect_time_precise	user_id	item_type	item_id
00000001600000601-32	85733	00000001600000601-34	2010-11-16 21:37:51	85736	00000001600000601-39	85740	00000601-32	00000601-33	60134	00000601-35	60136	2010-11-16 21:42:05	00000601-38	60139	60140	60141	60142	2010-11-16 21:37:34	3472328296227680305	54	3472328296228073521
drop table collect_info;
drop table item_info;
