drop table if exists t1,t2,t3,t11,t12;
CREATE TABLE t1 (a int, b int, c int, primary key(a,b));
INSERT INTO t1 VALUES (1,1,0);
INSERT INTO t1 VALUES (1,2,0);
INSERT INTO t1 VALUES (1,3,0);
DELETE from t1 where a=1 and b =1;
INSERT INTO t1 VALUES (1,1,0);
DELETE from t1 where a=1 and b=1;
DELETE from t1 where a=1 and b=2;
DELETE from t1 where a=1 and b=3;
INSERT INTO t1 VALUES (1,2,0);
DELETE from t1 where a=1 and b=2;
INSERT INTO t1 VALUES (1,2,0);
DELETE from t1 where a=1 and b=2;
drop table t1;
create table t1 (
a bigint not null,
b bigint not null default 0,
c bigint not null default 0,
d bigint not null default 0,
e bigint not null default 0,
f bigint not null default 0,
g bigint not null default 0,
h bigint not null default 0,
i bigint not null default 0,
j bigint not null default 0,
primary key (a));
insert into t1 (a) values (2),(4),(6),(8),(10),(12),(14),(16),(18),(20),(22),(24),(26),(23);
delete from t1 where a=26;
drop table t1;
create table t1 (
a bigint not null,
b bigint not null default 0,
c bigint not null default 0,
d bigint not null default 0,
e bigint not null default 0,
f bigint not null default 0,
g bigint not null default 0,
h bigint not null default 0,
i bigint not null default 0,
j bigint not null default 0,
primary key (a));
insert into t1 (a) values (2),(4),(6),(8),(10),(12),(14),(16),(18),(20),(22),(24),(26),(23),(27);
delete from t1 where a=27;
drop table t1;
CREATE TABLE t1 (
bool1     char(0) default NULL,
not_null varchar(20)  NOT NULL default '',
misc     integer not null,
PRIMARY KEY  (not_null)
) ;
INSERT INTO t1 VALUES (NULL,'a',4), (NULL,'b',5), (NULL,'c',6), (NULL,'d',7);
select * from t1 where misc > 5 and bool1 is null;
bool1	not_null	misc
NULL	c	6
NULL	d	7
delete   from t1 where not_null='c';
delete   from t1 where not_null='d';
select * from t1 where misc > 5 and bool1 is null;
bool1	not_null	misc
select count(*) from t1;
count(*)
2
select count(*) from t1;
count(*)
2
select count(*) from t1;
count(*)
2
drop table t1;
create table t1(a datetime not null primary key, b int);
insert into t1 values (0,1);
select * from t1 where a is null;
a	b
delete from t1 where a = null;
delete from t1 where a = 0;
select count(*) from t1;
count(*)
0
drop table t1;
