case 1: int + 1 row
alter system set merge_delay_interval='1s' server_type=chunkserver,min_major_freeze_interval='1s' server_type=updateserver;
alter system set merge_delay_for_lsync='1s' server_type=chunkserver;
alter system set min_drop_cache_wait_time='10s' server_type=chunkserver;
alter system set safe_copy_count_in_init = 1 server_type=chunkserver;
alter system set merge_thread_per_disk=10 server_type=chunkserver;
alter system set each_tablet_sync_meta=False server_type=chunkserver;
case 3: varchar 
drop table if exists t1;
create table  t1(c0 int primary key,c1 varchar) EXPIRE_INFO='c1 = ''d''';
insert into t1 values(1,'i'),(2,'s'),(3,'D');
select c0,c1 from t1;
c0	c1
1	i
2	s
3	D
update t1 set c1='d' where c0=1;
update t1 set c1='d' where c0=2;
select c0,c1 from t1;
c0	c1
1	d
2	d
3	D
merge happens
[major_freeze] err=0
select c0,c1 from t1;
c0	c1
3	D
drop table t1;
drop table if exists t1;
create table  t1(c0 int primary key,c1 int) EXPIRE_INFO='c1 < 0';
insert into t1 values(1,1),(2,1),(3,1);
select c0,c1 from t1;
c0	c1
1	1
2	1
3	1
update t1 set c1=-1 where c0=1;
select c0,c1 from t1;
c0	c1
1	-1
2	1
3	1
merge happens
[major_freeze] err=0
select c0,c1 from t1;
c0	c1
2	1
3	1
drop table t1;
case 2: int + rows
drop table if exists t1;
create table  t1(c0 int primary key,c1 int) EXPIRE_INFO='c1 < 0';
insert into t1 values(1,1),(2,1),(3,1);
select c0,c1 from t1;
c0	c1
1	1
2	1
3	1
update t1 set c1=-1 where c0=1;
update t1 set c1=-1 where c0=2;
update t1 set c1=-1 where c0=3;
select c0,c1 from t1;
c0	c1
1	-1
2	-1
3	-1
merge happens
[major_freeze] err=0
select c0,c1 from t1;
c0	c1
drop table t1;
case 4: all expire
drop table if exists t1;
create table  t1(c0 int primary key,c1 modifytime) EXPIRE_INFO='c1>0';
insert into t1(c0) values(1),(2),(3);
select c0,c1 from t1;
c0	c1
1	time
2	time
3	time
merge happens
[major_freeze] err=0
select c0,c1 from t1;
c0	c1
drop table t1;
case 5: no expire
drop table if exists t1;
create table  t1(c0 int primary key,c1 modifytime) EXPIRE_INFO='c1<0';
insert into t1(c0) values(1),(2),(3);
select c0,c1 from t1;
c0	c1
1	time
2	time
3	time
merge happens
[major_freeze] err=0
select c0,c1 from t1;
c0	c1
1	time
2	time
3	time
drop table t1;
case 6: expression test
drop table if exists t1,t2,t3,t4,t5,t6,t7,t8,t9,t10,t11,t12,t13,t14,t15;
create table  t1(c0 int primary key,c1 int) EXPIRE_INFO='c0 > c1';
insert into t1 values(1,1),(100,0),(0,1);
create table  t2(c0 int primary key,c1 int) EXPIRE_INFO='c0 = c1';
insert into t2 values(1,1),(100,0),(0,1);
create table  t3(c0 int primary key,c1 int) EXPIRE_INFO='c0 != c1';
insert into t3 values(1,1),(100,0),(0,1);
create table  t4(c0 int primary key,c1 int) EXPIRE_INFO='c0 < c1';
insert into t4 values(1,1),(100,0),(0,1);
create table  t5(c0 int primary key,c1 int) EXPIRE_INFO='c0 >= c1';
insert into t5 values(1,1),(100,0),(0,1);
create table  t6(c0 int primary key,c1 int) EXPIRE_INFO='c0 <= c1';
insert into t6 values(1,1),(100,0),(0,1);
create table  t7(c0 int primary key,c1 int) EXPIRE_INFO='c0 + c1 > 100';
insert into t7 values(100,1),(1,100),(0,1);
create table  t8(c0 int primary key,c1 int) EXPIRE_INFO='c0 - c1 > 0';
insert into t8 values(100,1),(1,100),(0,1);
create table  t9(c0 int primary key,c1 int) EXPIRE_INFO='c0 + c1 = 100';
insert into t9 values(100,0),(0,100),(10,1);
create table  t10(c0 int primary key,c1 int, c2 int) EXPIRE_INFO='c0 + c1 + c2 = 100';
insert into t10 values(100,0,0),(10,100,0),(0,1,101);
create table  t11(c0 int primary key,c1 int, c2 int) EXPIRE_INFO='c0 + c1  > c2';
insert into t11 values(100,0,0),(10,100,100),(0,1,100);
create table  t12(c0 int primary key,c1 datetime) EXPIRE_INFO='c1 > ''2012-10-01 23:00:00''';
insert into t12 values(1,'2012-10-01 24:00:00'),(2,'2012-10-01 23:00:00'),(3,'2012-11-01 23:00:00');
create table  t13(c0 int primary key,c1 createtime) EXPIRE_INFO='c1 > ''2012-10-01 23:00:00'' and c1 != 0';
insert into t13(c0) values(1),(2),(3);
create table  t14(c0 int primary key,c1 modifytime) EXPIRE_INFO='c1 > ''2012-10-01 23:00:00''';
insert into t14(c0) values(1),(2),(3);
create table  t15(c0 int primary key,c1 double) EXPIRE_INFO='c1 > 1.5';
insert into t15 values(1,1),(2,2),(3,2.6);
select c0,c1 from t1;
c0	c1
0	1
1	1
100	0
merge happens
[major_freeze] err=0
select c0,c1 from t11;
c0	c1
0	1
select c0,c1 from t10;
c0	c1
0	1
10	100
select c0,c1 from t9;
c0	c1
10	1
select c0,c1 from t8;
c0	c1
0	1
1	100
select c0,c1 from t7;
c0	c1
0	1
select c0,c1 from t6;
c0	c1
100	0
select c0,c1 from t5;
c0	c1
0	1
select c0,c1 from t4;
c0	c1
1	1
100	0
select c0,c1 from t3;
c0	c1
1	1
select c0,c1 from t2;
c0	c1
0	1
100	0
select c0,c1 from t1;
c0	c1
0	1
1	1
select c0,c1 from t12;
c0	c1
2	time
select c0,c1 from t13;
c0	c1
select c0,c1 from t14;
c0	c1
select c0,c1 from t15;
c0	c1
1	time
drop table t1,t2,t3,t4,t5;
drop table t6,t7,t8,t9,t10;
drop table t11,t12,t13,t14,t15;
