using database test;
drop table if exists ie_charset;
create table ie_charset
(
it0 int,
it1 int,
it2 int,
bg0 bigint,
bg1 bigint,
bg2 bigint,
dc0 decimal(20,4),
dc1 decimal(20,4),
dc2 decimal(20,4),
vc0 varchar(256),
vc1 varchar(256),
vc2 varchar(256),
primary key(it0, bg0, dc0, vc0)
);
ERROR code_convert
Conversion error 
select * from ie_charset;
it0	it1	it2	bg0	bg1	bg2	dc0	dc1	dc2	vc0	vc1	vc2
0	65	2848	95501	50	1	1333.3300	50144.9600	1061.0000	åˆ‡ä½ å¥½ä½ å¥½	FACT20141	3199
1	68	2411	95502	15	10	1054.6200	100000.0000	4606.0000	å•Šä½ å¥½ä½ å¥½	FACT201	3185
2	0	2412	95506	512	1000	3000.0000	2463072.6400	4610.0000	ç¬¦ä½ å¥½ä½ å¥½	FACT201	3185
3	75	2413	95507	15	1001	14.1300	71293.6300	1062.0000	æƒ³ä½ å¥½ä½ å¥½	FACT	314785
4	77	2380	95510	5	1002	34.4500	12700.0000	1063.0000	äººä½ å¥½ä½ å¥½	FACT20141	310
ERROR format_column
Code conversion error. 
delete from ie_charset;
select * from ie_charset;
it0	it1	it2	bg0	bg1	bg2	dc0	dc1	dc2	vc0	vc1	vc2
0	65	2848	95501	50	1	1333.3300	50144.9600	1061.0000	ÇÐÄãºÃÄãºÃ	FACT20141	3199
1	68	2411	95502	15	10	1054.6200	100000.0000	4606.0000	°¡ÄãºÃÄãºÃ	FACT201	3185
2	0	2412	95506	512	1000	3000.0000	2463072.6400	4610.0000	·ûÄãºÃÄãºÃ	FACT201	3185
3	75	2413	95507	15	1001	14.1300	71293.6300	1062.0000	ÏëÄãºÃÄãºÃ	FACT	314785
4	77	2380	95510	5	1002	34.4500	12700.0000	1063.0000	ÈËÄãºÃÄãºÃ	FACT20141	310
ERROR format_column
Code conversion error. 
