drop table if exists t1,t2,t3,t4;
create table t1(pk1 int, pk2 int, pk3 int default 0, primary key(pk1,pk2), extra int);
insert into t1(pk1,pk2) values(0,1),(-1,0);
insert into t1(pk1,pk2) values(1,2),(2,3);
insert into t1(pk2,pk1) values(4,3),(5,4);
select * from t1;
pk1	pk2	pk3	extra
-1	0	NULL	NULL
0	1	NULL	NULL
1	2	NULL	NULL
2	3	NULL	NULL
3	4	NULL	NULL
4	5	NULL	NULL
select pk2,pk1 from t1;
pk2	pk1
0	-1
1	0
2	1
3	2
4	3
5	4
drop table t1;
create table t1(pk1 int primary key, a int);
insert into t1 values(0,1),(-1,0);
insert into t1(pk1,a) values(1,2),(2,3);
insert into t1(a,pk1) values(4,3),(5,4);
select * from t1;
pk1	a
-1	0
0	1
1	2
2	3
3	4
4	5
select a,pk1 from t1;
a	pk1
0	-1
1	0
2	1
3	2
4	3
5	4
drop table t1;
create table t1(pk1 int, pk2 int, primary key(pk1,pk2), extra int);
insert into t1(pk1,pk2) values(0,1),(-1,0);
insert into t1(pk1,pk2) values(1,2),(2,3);
delete from t1 where pk2=3 and pk1=2;
select * from t1;
pk1	pk2	extra
-1	0	NULL
0	1	NULL
1	2	NULL
drop table t1;
