rest test:3
drop table if exists t3,t4;
create table t3 (c1 int primary key, c2 int);
create table t4 (p1 int, p2 int, c2 int, c3 int, primary key(p2)) JOIN_INFO='[p2$c1]%t3:c2$c2';
drop table if exists t1,t2;
create table t1 (c1 int primary key, c2 varchar, c3 datetime, c4 float,c5 int);
create table t2 (p1 int, c1 int, c2 varchar, c3 datetime, c4 float,c5 int,c6 int, primary key(p1, c1)) JOIN_INFO='[c1$c1]%t1:c2$c2,c3$c3,c4$c4,c5$c5';
insert into t1 values(1,'s1','2013-07-15 12:00:00', 1.5, 1000);
insert into t1 values(2,'s2','2013-07-15 12:00:00', 2.5, 1000);
insert into t1 values(3,'s3','2013-07-15 12:00:00', 3.5, 1000);
replace into t1 values(4,'s4','2013-07-15 12:00:00', 4.5, 1000);
replace into t1 values(5,'s5','2013-07-15 12:00:00', 5.5, 1000);
insert into t2 (p1,c1,c5) values(1,1,1),(2,1,2),(3,1,3),(4,2,1),(5,3,1);
ERROR 07000: Cannot insert inner join column: c5
replace into t2 (p1,c1,c5) values(1,1,1),(2,1,2),(3,1,3),(4,2,1),(5,3,1);
ERROR 07000: Cannot insert inner join column: c5
insert into t2 (p1,c1,c6) values(1,1,1),(2,1,2),(3,1,3),(4,2,4),(5,3,5);
replace into t2 (p1,c1,c6) values(6,1,6),(7,4,7);
select * from t2;
p1	c1	c2	c3	c4	c5	c6
1	1	s1	2013-07-15 12:00:00	1.5	1000	1
2	1	s1	2013-07-15 12:00:00	1.5	1000	2
3	1	s1	2013-07-15 12:00:00	1.5	1000	3
4	2	s2	2013-07-15 12:00:00	2.5	1000	4
5	3	s3	2013-07-15 12:00:00	3.5	1000	5
6	1	s1	2013-07-15 12:00:00	1.5	1000	6
7	4	s4	2013-07-15 12:00:00	4.5	1000	7
select * from t2 where p1=1 and c1 =1;
p1	c1	c2	c3	c4	c5	c6
1	1	s1	2013-07-15 12:00:00	1.5	1000	1
select * from t2 where p1=2 and c1 =1;
p1	c1	c2	c3	c4	c5	c6
2	1	s1	2013-07-15 12:00:00	1.5	1000	2
select * from t2 where p1=3 and c1 =1;
p1	c1	c2	c3	c4	c5	c6
3	1	s1	2013-07-15 12:00:00	1.5	1000	3
select * from t2 where p1=4 and c1 =2;
p1	c1	c2	c3	c4	c5	c6
4	2	s2	2013-07-15 12:00:00	2.5	1000	4
select * from t2 where p1=5 and c1 =3;
p1	c1	c2	c3	c4	c5	c6
5	3	s3	2013-07-15 12:00:00	3.5	1000	5
select * from t2 where p1=6 and c1 =1;
p1	c1	c2	c3	c4	c5	c6
6	1	s1	2013-07-15 12:00:00	1.5	1000	6
select * from t2 where p1=7 and c1 =4;
p1	c1	c2	c3	c4	c5	c6
7	4	s4	2013-07-15 12:00:00	4.5	1000	7
select * from t2 where (p1,c1) in ((1,1),(2,1),(7,4),(1,1),(2,2));
p1	c1	c2	c3	c4	c5	c6
1	1	s1	2013-07-15 12:00:00	1.5	1000	1
2	1	s1	2013-07-15 12:00:00	1.5	1000	2
7	4	s4	2013-07-15 12:00:00	4.5	1000	7
update t1 set c5=2000 where c1=1;
update t2 set c5=3000 where c1=1;
ERROR HY000: join column 'c5' can not be updated
select * from t2;
p1	c1	c2	c3	c4	c5	c6
1	1	s1	2013-07-15 12:00:00	1.5	2000	1
2	1	s1	2013-07-15 12:00:00	1.5	2000	2
3	1	s1	2013-07-15 12:00:00	1.5	2000	3
4	2	s2	2013-07-15 12:00:00	2.5	1000	4
5	3	s3	2013-07-15 12:00:00	3.5	1000	5
6	1	s1	2013-07-15 12:00:00	1.5	2000	6
7	4	s4	2013-07-15 12:00:00	4.5	1000	7
select * from t1;
c1	c2	c3	c4	c5
1	s1	2013-07-15 12:00:00	1.5	2000
2	s2	2013-07-15 12:00:00	2.5	1000
3	s3	2013-07-15 12:00:00	3.5	1000
4	s4	2013-07-15 12:00:00	4.5	1000
5	s5	2013-07-15 12:00:00	5.5	1000
select * from t2 where p1=1 and c1 =1;
p1	c1	c2	c3	c4	c5	c6
1	1	s1	2013-07-15 12:00:00	1.5	2000	1
select * from t2 where p1=2 and c1 =1;
p1	c1	c2	c3	c4	c5	c6
2	1	s1	2013-07-15 12:00:00	1.5	2000	2
select * from t2 where p1=3 and c1 =1;
p1	c1	c2	c3	c4	c5	c6
3	1	s1	2013-07-15 12:00:00	1.5	2000	3
delete  from t1 where c1=1;
select * from t2;
p1	c1	c2	c3	c4	c5	c6
1	1	NULL	NULL	NULL	NULL	1
2	1	NULL	NULL	NULL	NULL	2
3	1	NULL	NULL	NULL	NULL	3
4	2	s2	2013-07-15 12:00:00	2.5	1000	4
5	3	s3	2013-07-15 12:00:00	3.5	1000	5
6	1	NULL	NULL	NULL	NULL	6
7	4	s4	2013-07-15 12:00:00	4.5	1000	7
select * from t1;
c1	c2	c3	c4	c5
2	s2	2013-07-15 12:00:00	2.5	1000
3	s3	2013-07-15 12:00:00	3.5	1000
4	s4	2013-07-15 12:00:00	4.5	1000
5	s5	2013-07-15 12:00:00	5.5	1000
select * from t2 where p1=1 and c1 =1;
p1	c1	c2	c3	c4	c5	c6
1	1	NULL	NULL	NULL	NULL	1
select * from t2 where p1=2 and c1 =1;
p1	c1	c2	c3	c4	c5	c6
2	1	NULL	NULL	NULL	NULL	2
select * from t2 where p1=3 and c1 =1;
p1	c1	c2	c3	c4	c5	c6
3	1	NULL	NULL	NULL	NULL	3
delete  from t2 where p1=3 and c1 =1;
select * from t2;
p1	c1	c2	c3	c4	c5	c6
1	1	NULL	NULL	NULL	NULL	1
2	1	NULL	NULL	NULL	NULL	2
4	2	s2	2013-07-15 12:00:00	2.5	1000	4
5	3	s3	2013-07-15 12:00:00	3.5	1000	5
6	1	NULL	NULL	NULL	NULL	6
7	4	s4	2013-07-15 12:00:00	4.5	1000	7
select * from t2 where p1=3 and c1 =1;
p1	c1	c2	c3	c4	c5	c6
rest test:2
drop table if exists t3,t4;
create table t3 (c1 int primary key, c2 int);
create table t4 (p1 int, p2 int, c2 int, c3 int, primary key(p2)) JOIN_INFO='[p2$c1]%t3:c2$c2';
drop table if exists t1,t2;
create table t1 (c1 int primary key, c2 varchar, c3 datetime, c4 float,c5 int);
create table t2 (p1 int, c1 int, c2 varchar, c3 datetime, c4 float,c5 int,c6 int, primary key(p1, c1)) JOIN_INFO='[c1$c1]%t1:c2$c2,c3$c3,c4$c4,c5$c5';
insert into t1 values(1,'s1','2013-07-15 12:00:00', 1.5, 1000);
insert into t1 values(2,'s2','2013-07-15 12:00:00', 2.5, 1000);
insert into t1 values(3,'s3','2013-07-15 12:00:00', 3.5, 1000);
replace into t1 values(4,'s4','2013-07-15 12:00:00', 4.5, 1000);
replace into t1 values(5,'s5','2013-07-15 12:00:00', 5.5, 1000);
insert into t2 (p1,c1,c5) values(1,1,1),(2,1,2),(3,1,3),(4,2,1),(5,3,1);
ERROR 07000: Cannot insert inner join column: c5
replace into t2 (p1,c1,c5) values(1,1,1),(2,1,2),(3,1,3),(4,2,1),(5,3,1);
ERROR 07000: Cannot insert inner join column: c5
insert into t2 (p1,c1,c6) values(1,1,1),(2,1,2),(3,1,3),(4,2,4),(5,3,5);
replace into t2 (p1,c1,c6) values(6,1,6),(7,4,7);
select * from t2;
p1	c1	c2	c3	c4	c5	c6
1	1	s1	2013-07-15 12:00:00	1.5	1000	1
2	1	s1	2013-07-15 12:00:00	1.5	1000	2
3	1	s1	2013-07-15 12:00:00	1.5	1000	3
4	2	s2	2013-07-15 12:00:00	2.5	1000	4
5	3	s3	2013-07-15 12:00:00	3.5	1000	5
6	1	s1	2013-07-15 12:00:00	1.5	1000	6
7	4	s4	2013-07-15 12:00:00	4.5	1000	7
select * from t2 where p1=1 and c1 =1;
p1	c1	c2	c3	c4	c5	c6
1	1	s1	2013-07-15 12:00:00	1.5	1000	1
select * from t2 where p1=2 and c1 =1;
p1	c1	c2	c3	c4	c5	c6
2	1	s1	2013-07-15 12:00:00	1.5	1000	2
select * from t2 where p1=3 and c1 =1;
p1	c1	c2	c3	c4	c5	c6
3	1	s1	2013-07-15 12:00:00	1.5	1000	3
select * from t2 where p1=4 and c1 =2;
p1	c1	c2	c3	c4	c5	c6
4	2	s2	2013-07-15 12:00:00	2.5	1000	4
select * from t2 where p1=5 and c1 =3;
p1	c1	c2	c3	c4	c5	c6
5	3	s3	2013-07-15 12:00:00	3.5	1000	5
select * from t2 where p1=6 and c1 =1;
p1	c1	c2	c3	c4	c5	c6
6	1	s1	2013-07-15 12:00:00	1.5	1000	6
select * from t2 where p1=7 and c1 =4;
p1	c1	c2	c3	c4	c5	c6
7	4	s4	2013-07-15 12:00:00	4.5	1000	7
select * from t2 where (p1,c1) in ((1,1),(2,1),(7,4),(1,1),(2,2));
p1	c1	c2	c3	c4	c5	c6
1	1	s1	2013-07-15 12:00:00	1.5	1000	1
2	1	s1	2013-07-15 12:00:00	1.5	1000	2
7	4	s4	2013-07-15 12:00:00	4.5	1000	7
update t1 set c5=2000 where c1=1;
update t2 set c5=3000 where c1=1;
ERROR HY000: join column 'c5' can not be updated
select * from t2;
p1	c1	c2	c3	c4	c5	c6
1	1	s1	2013-07-15 12:00:00	1.5	2000	1
2	1	s1	2013-07-15 12:00:00	1.5	2000	2
3	1	s1	2013-07-15 12:00:00	1.5	2000	3
4	2	s2	2013-07-15 12:00:00	2.5	1000	4
5	3	s3	2013-07-15 12:00:00	3.5	1000	5
6	1	s1	2013-07-15 12:00:00	1.5	2000	6
7	4	s4	2013-07-15 12:00:00	4.5	1000	7
select * from t1;
c1	c2	c3	c4	c5
1	s1	2013-07-15 12:00:00	1.5	2000
2	s2	2013-07-15 12:00:00	2.5	1000
3	s3	2013-07-15 12:00:00	3.5	1000
4	s4	2013-07-15 12:00:00	4.5	1000
5	s5	2013-07-15 12:00:00	5.5	1000
select * from t2 where p1=1 and c1 =1;
p1	c1	c2	c3	c4	c5	c6
1	1	s1	2013-07-15 12:00:00	1.5	2000	1
select * from t2 where p1=2 and c1 =1;
p1	c1	c2	c3	c4	c5	c6
2	1	s1	2013-07-15 12:00:00	1.5	2000	2
select * from t2 where p1=3 and c1 =1;
p1	c1	c2	c3	c4	c5	c6
3	1	s1	2013-07-15 12:00:00	1.5	2000	3
delete  from t1 where c1=1;
select * from t2;
p1	c1	c2	c3	c4	c5	c6
1	1	NULL	NULL	NULL	NULL	1
2	1	NULL	NULL	NULL	NULL	2
3	1	NULL	NULL	NULL	NULL	3
4	2	s2	2013-07-15 12:00:00	2.5	1000	4
5	3	s3	2013-07-15 12:00:00	3.5	1000	5
6	1	NULL	NULL	NULL	NULL	6
7	4	s4	2013-07-15 12:00:00	4.5	1000	7
select * from t1;
c1	c2	c3	c4	c5
2	s2	2013-07-15 12:00:00	2.5	1000
3	s3	2013-07-15 12:00:00	3.5	1000
4	s4	2013-07-15 12:00:00	4.5	1000
5	s5	2013-07-15 12:00:00	5.5	1000
select * from t2 where p1=1 and c1 =1;
p1	c1	c2	c3	c4	c5	c6
1	1	NULL	NULL	NULL	NULL	1
select * from t2 where p1=2 and c1 =1;
p1	c1	c2	c3	c4	c5	c6
2	1	NULL	NULL	NULL	NULL	2
select * from t2 where p1=3 and c1 =1;
p1	c1	c2	c3	c4	c5	c6
3	1	NULL	NULL	NULL	NULL	3
delete  from t2 where p1=3 and c1 =1;
select * from t2;
p1	c1	c2	c3	c4	c5	c6
1	1	NULL	NULL	NULL	NULL	1
2	1	NULL	NULL	NULL	NULL	2
4	2	s2	2013-07-15 12:00:00	2.5	1000	4
5	3	s3	2013-07-15 12:00:00	3.5	1000	5
6	1	NULL	NULL	NULL	NULL	6
7	4	s4	2013-07-15 12:00:00	4.5	1000	7
select * from t2 where p1=3 and c1 =1;
p1	c1	c2	c3	c4	c5	c6
rest test:1
drop table if exists t3,t4;
create table t3 (c1 int primary key, c2 int);
create table t4 (p1 int, p2 int, c2 int, c3 int, primary key(p2)) JOIN_INFO='[p2$c1]%t3:c2$c2';
drop table if exists t1,t2;
create table t1 (c1 int primary key, c2 varchar, c3 datetime, c4 float,c5 int);
create table t2 (p1 int, c1 int, c2 varchar, c3 datetime, c4 float,c5 int,c6 int, primary key(p1, c1)) JOIN_INFO='[c1$c1]%t1:c2$c2,c3$c3,c4$c4,c5$c5';
insert into t1 values(1,'s1','2013-07-15 12:00:00', 1.5, 1000);
insert into t1 values(2,'s2','2013-07-15 12:00:00', 2.5, 1000);
insert into t1 values(3,'s3','2013-07-15 12:00:00', 3.5, 1000);
replace into t1 values(4,'s4','2013-07-15 12:00:00', 4.5, 1000);
replace into t1 values(5,'s5','2013-07-15 12:00:00', 5.5, 1000);
insert into t2 (p1,c1,c5) values(1,1,1),(2,1,2),(3,1,3),(4,2,1),(5,3,1);
ERROR 07000: Cannot insert inner join column: c5
replace into t2 (p1,c1,c5) values(1,1,1),(2,1,2),(3,1,3),(4,2,1),(5,3,1);
ERROR 07000: Cannot insert inner join column: c5
insert into t2 (p1,c1,c6) values(1,1,1),(2,1,2),(3,1,3),(4,2,4),(5,3,5);
replace into t2 (p1,c1,c6) values(6,1,6),(7,4,7);
select * from t2;
p1	c1	c2	c3	c4	c5	c6
1	1	s1	2013-07-15 12:00:00	1.5	1000	1
2	1	s1	2013-07-15 12:00:00	1.5	1000	2
3	1	s1	2013-07-15 12:00:00	1.5	1000	3
4	2	s2	2013-07-15 12:00:00	2.5	1000	4
5	3	s3	2013-07-15 12:00:00	3.5	1000	5
6	1	s1	2013-07-15 12:00:00	1.5	1000	6
7	4	s4	2013-07-15 12:00:00	4.5	1000	7
select * from t2 where p1=1 and c1 =1;
p1	c1	c2	c3	c4	c5	c6
1	1	s1	2013-07-15 12:00:00	1.5	1000	1
select * from t2 where p1=2 and c1 =1;
p1	c1	c2	c3	c4	c5	c6
2	1	s1	2013-07-15 12:00:00	1.5	1000	2
select * from t2 where p1=3 and c1 =1;
p1	c1	c2	c3	c4	c5	c6
3	1	s1	2013-07-15 12:00:00	1.5	1000	3
select * from t2 where p1=4 and c1 =2;
p1	c1	c2	c3	c4	c5	c6
4	2	s2	2013-07-15 12:00:00	2.5	1000	4
select * from t2 where p1=5 and c1 =3;
p1	c1	c2	c3	c4	c5	c6
5	3	s3	2013-07-15 12:00:00	3.5	1000	5
select * from t2 where p1=6 and c1 =1;
p1	c1	c2	c3	c4	c5	c6
6	1	s1	2013-07-15 12:00:00	1.5	1000	6
select * from t2 where p1=7 and c1 =4;
p1	c1	c2	c3	c4	c5	c6
7	4	s4	2013-07-15 12:00:00	4.5	1000	7
select * from t2 where (p1,c1) in ((1,1),(2,1),(7,4),(1,1),(2,2));
p1	c1	c2	c3	c4	c5	c6
1	1	s1	2013-07-15 12:00:00	1.5	1000	1
2	1	s1	2013-07-15 12:00:00	1.5	1000	2
7	4	s4	2013-07-15 12:00:00	4.5	1000	7
update t1 set c5=2000 where c1=1;
update t2 set c5=3000 where c1=1;
ERROR HY000: join column 'c5' can not be updated
select * from t2;
p1	c1	c2	c3	c4	c5	c6
1	1	s1	2013-07-15 12:00:00	1.5	2000	1
2	1	s1	2013-07-15 12:00:00	1.5	2000	2
3	1	s1	2013-07-15 12:00:00	1.5	2000	3
4	2	s2	2013-07-15 12:00:00	2.5	1000	4
5	3	s3	2013-07-15 12:00:00	3.5	1000	5
6	1	s1	2013-07-15 12:00:00	1.5	2000	6
7	4	s4	2013-07-15 12:00:00	4.5	1000	7
select * from t1;
c1	c2	c3	c4	c5
1	s1	2013-07-15 12:00:00	1.5	2000
2	s2	2013-07-15 12:00:00	2.5	1000
3	s3	2013-07-15 12:00:00	3.5	1000
4	s4	2013-07-15 12:00:00	4.5	1000
5	s5	2013-07-15 12:00:00	5.5	1000
select * from t2 where p1=1 and c1 =1;
p1	c1	c2	c3	c4	c5	c6
1	1	s1	2013-07-15 12:00:00	1.5	2000	1
select * from t2 where p1=2 and c1 =1;
p1	c1	c2	c3	c4	c5	c6
2	1	s1	2013-07-15 12:00:00	1.5	2000	2
select * from t2 where p1=3 and c1 =1;
p1	c1	c2	c3	c4	c5	c6
3	1	s1	2013-07-15 12:00:00	1.5	2000	3
delete  from t1 where c1=1;
select * from t2;
p1	c1	c2	c3	c4	c5	c6
1	1	NULL	NULL	NULL	NULL	1
2	1	NULL	NULL	NULL	NULL	2
3	1	NULL	NULL	NULL	NULL	3
4	2	s2	2013-07-15 12:00:00	2.5	1000	4
5	3	s3	2013-07-15 12:00:00	3.5	1000	5
6	1	NULL	NULL	NULL	NULL	6
7	4	s4	2013-07-15 12:00:00	4.5	1000	7
select * from t1;
c1	c2	c3	c4	c5
2	s2	2013-07-15 12:00:00	2.5	1000
3	s3	2013-07-15 12:00:00	3.5	1000
4	s4	2013-07-15 12:00:00	4.5	1000
5	s5	2013-07-15 12:00:00	5.5	1000
select * from t2 where p1=1 and c1 =1;
p1	c1	c2	c3	c4	c5	c6
1	1	NULL	NULL	NULL	NULL	1
select * from t2 where p1=2 and c1 =1;
p1	c1	c2	c3	c4	c5	c6
2	1	NULL	NULL	NULL	NULL	2
select * from t2 where p1=3 and c1 =1;
p1	c1	c2	c3	c4	c5	c6
3	1	NULL	NULL	NULL	NULL	3
delete  from t2 where p1=3 and c1 =1;
select * from t2;
p1	c1	c2	c3	c4	c5	c6
1	1	NULL	NULL	NULL	NULL	1
2	1	NULL	NULL	NULL	NULL	2
4	2	s2	2013-07-15 12:00:00	2.5	1000	4
5	3	s3	2013-07-15 12:00:00	3.5	1000	5
6	1	NULL	NULL	NULL	NULL	6
7	4	s4	2013-07-15 12:00:00	4.5	1000	7
select * from t2 where p1=3 and c1 =1;
p1	c1	c2	c3	c4	c5	c6
