drop table if exists t1;
create table t1 (c1 int, c2 int, primary key(c1, c2), c3 int);
insert into t1 values (1, 2, 3);
set ob_query_timeout=15000;
select * from t1;
ERROR HY000: request timeout
drop table if exists t1;
create table t1(c1 int primary key, c2 int);
set ob_query_timeout=50000;
replace into t1 values(1,1);
set query timeout to 500ms
set ob_query_timeout=500000;
select * from t1 where c1=1;
c1	c2
1	1
select count(*) from t1;
count(*)
1
select * from t1 union select * from t1;
c1	c2
1	1
update t1 set c2=2 where c1=1;
set query timeout to 100ms
set ob_query_timeout=100000;
select * from t1 where c1=1;
c1	c2
1	2
select count(*) from t1;
count(*)
1
select * from t1 union select * from t1;
c1	c2
1	2
update t1 set c2=2 where c1=1;
set query timeout to 25ms
set ob_query_timeout=25000;
select * from t1 where c1=1;
ERROR HY000: OB-12: Timeout
select count(*) from t1;
ERROR HY000: request timeout
select * from t1 union select * from t1;
ERROR HY000: OB-12: Timeout
set ob_query_timeout=30000;
update t1 set c2=2 where c1=1;
set query timeout to 10ms
set ob_query_timeout=10000;
select count(*) from t1;
ERROR HY000: request timeout
select * from t1 union select * from t1;
ERROR HY000: OB-12: Timeout
select * from t1 where c1=1;
ERROR HY000: OB-12: Timeout
drop table t1;
