drop table if exists t1;
alter system set merge_delay_interval='5s' server_type=chunkserver;
alter system set min_major_freeze_interval='5s' server_type=updateserver;
create table t1(id int primary key ,c1 decimal(5,4) ,c2 int ,c3 varchar(8), c4 datetime ,c5 bool ,c6 double );
insert into t1 values (1,1.2345,3,'maos','2901-12-22 12:00:00',1,23.345),(2,2.3545,4,'dfdff','2301-02-13 12:00:00',0,3434),(3,1.3445,34,'fcf','1234-01-12 21:00:00',0,12.43);
select * from t1;
id	c1	c2	c3	c4	c5	c6
1	1.2345	3	maos	2901-12-22 12:00:00	1	23.345
2	2.3545	4	dfdff	2301-02-13 12:00:00	0	3434
3	1.3445	34	fcf	1234-01-12 21:00:00	0	12.43
create index il0 on t1(c1,c3) storing(c5,c6);
"merge"
[major_freeze] err=0
__3001__idx__il0
select * from __3001__idx__il0;
id	c1	c3	c5	c6
1	1.2345	maos	1	23.345
3	1.3445	fcf	0	12.43
2	2.3545	dfdff	0	3434
update t1 set c1=2.2412 where id=1;
select * from __3001__idx__il0;
id	c1	c3	c5	c6
3	1.3445	fcf	0	12.43
1	2.2412	maos	1	23.345
2	2.3545	dfdff	0	3434
update t1 set c3='dk123'where id=2;
select * from __3001__idx__il0;
id	c1	c3	c5	c6
3	1.3445	fcf	0	12.43
1	2.2412	maos	1	23.345
2	2.3545	dk123	0	3434
update t1 set c3='efdaefmjmoetvdydfd' where id=3;
select * from __3001__idx__il0;
id	c1	c3	c5	c6
3	1.3445	efdaefmjmoetvdydfd	0	12.43
1	2.2412	maos	1	23.345
2	2.3545	dk123	0	3434
drop index il0 on t1;
create index il0 on t1(c2,c4) storing (c5,c6);
"merge"
[major_freeze] err=0
select * from __3001__idx__il0;
id	c2	c4	c5	c6
1	3	2901-12-22 12:00:00	1	23.345
2	4	2301-02-13 12:00:00	0	3434
3	34	1234-01-12 21:00:00	0	12.43
update t1 set c4='2103-08-09 12:09:09' where id=1;
select * from __3001__idx__il0;
id	c2	c4	c5	c6
1	3	2103-08-09 12:09:09	1	23.345
2	4	2301-02-13 12:00:00	0	3434
3	34	1234-01-12 21:00:00	0	12.43
update t1 set c4='9-90-90 28:90:90' where id=2;
ERROR HY000: Value of TIME part is incorrect.
select * from __3001__idx__il0;
id	c2	c4	c5	c6
1	3	2103-08-09 12:09:09	1	23.345
2	4	2301-02-13 12:00:00	0	3434
3	34	1234-01-12 21:00:00	0	12.43
update t1 set c5=true where id =3;
select * from __3001__idx__il0;
id	c2	c4	c5	c6
1	3	2103-08-09 12:09:09	1	23.345
2	4	2301-02-13 12:00:00	0	3434
3	34	1234-01-12 21:00:00	1	12.43
drop index il0 on t1;
create index il0 on t1(c5,c6) storing(c1,c4);
"merge"
[major_freeze] err=0
select * from __3001__idx__il0;
id	c1	c4	c5	c6
2	2.3545	2301-02-13 12:00:00	0	3434
3	1.3445	1234-01-12 21:00:00	1	12.43
1	2.2412	2103-08-09 12:09:09	1	23.345
update t1 set c6=2443.099929889 where id=1;
select * from __3001__idx__il0;
id	c1	c4	c5	c6
2	2.3545	2301-02-13 12:00:00	0	3434
3	1.3445	1234-01-12 21:00:00	1	12.43
1	2.2412	2103-08-09 12:09:09	1	2443.099929889
update t1 set c6=0.000000000000000000000000000000000001 where id=2;
select * from __3001__idx__il0;
id	c1	c4	c5	c6
2	2.3545	2301-02-13 12:00:00	0	1e-36
3	1.3445	1234-01-12 21:00:00	1	12.43
1	2.2412	2103-08-09 12:09:09	1	2443.099929889
update t1 set c1=2.909909 where id=3;
