drop table if exists seq_insert;
create table seq_insert(id int primary key,c1 int,c2 decimal(25,0));
create index seq_insert_index1 on seq_insert (c1) storing (c2);
create index seq_insert_index2 on seq_insert (c2) storing (c1);
create or replace sequence seq;
insert into seq_insert values(nextval for seq,nextval for seq+nextval for seq,0);
insert into seq_insert values(nextval for seq,nextval for seq+nextval for seq,prevval for seq),(nextval for seq,nextval for seq+nextval for seq,prevval for seq),(nextval for seq,nextval for seq+nextval for seq,prevval for seq),(nextval for seq,nextval for seq+nextval for seq,prevval for seq),(nextval for seq,nextval for seq+nextval for seq,prevval for seq),(nextval for seq,nextval for seq+nextval for seq,prevval for seq),(nextval for seq,nextval for seq+nextval for seq,prevval for seq),(nextval for seq,nextval for seq+nextval for seq,prevval for seq),(nextval for seq,nextval for seq+nextval for seq,prevval for seq),(nextval for seq,nextval for seq+nextval for seq,prevval for seq),(nextval for seq,nextval for seq+nextval for seq,prevval for seq),(nextval for seq,nextval for seq+nextval for seq,prevval for seq),(nextval for seq,nextval for seq+nextval for seq,prevval for seq);
"merge"
[major_freeze] err=0
__3001__idx__seq_insert_index1
__3001__idx__seq_insert_index2
select * from __3001__idx__seq_insert_index1;
id	c1	c2
1	2	0
2	4	1
3	6	1
4	8	1
5	10	1
6	12	1
7	14	1
8	16	1
9	18	1
10	20	1
11	22	1
12	24	1
13	26	1
14	28	1
select * from __3001__idx__seq_insert_index2;
id	c1	c2
1	2	0
2	4	1
3	6	1
4	8	1
5	10	1
6	12	1
7	14	1
8	16	1
9	18	1
10	20	1
11	22	1
12	24	1
13	26	1
14	28	1
select * from seq_insert;
id	c1	c2
1	2	0
2	4	1
3	6	1
4	8	1
5	10	1
6	12	1
7	14	1
8	16	1
9	18	1
10	20	1
11	22	1
12	24	1
13	26	1
14	28	1
select * from __3001__idx__seq_insert_index1;
id	c1	c2
1	2	0
2	4	1
3	6	1
4	8	1
5	10	1
6	12	1
7	14	1
8	16	1
9	18	1
10	20	1
11	22	1
12	24	1
13	26	1
14	28	1
select * from __3001__idx__seq_insert_index2;
id	c1	c2
1	2	0
2	4	1
3	6	1
4	8	1
5	10	1
6	12	1
7	14	1
8	16	1
9	18	1
10	20	1
11	22	1
12	24	1
13	26	1
14	28	1
update seq_insert set c1 =3  where id < prevval for seq;
select * from seq_insert;
id	c1	c2
1	3	0
2	3	1
3	3	1
4	3	1
5	3	1
6	3	1
7	3	1
8	3	1
9	3	1
10	3	1
11	3	1
12	3	1
13	3	1
14	28	1
select * from __3001__idx__seq_insert_index1;
id	c1	c2
1	3	0
2	3	1
3	3	1
4	3	1
5	3	1
6	3	1
7	3	1
8	3	1
9	3	1
10	3	1
11	3	1
12	3	1
13	3	1
14	28	1
select * from __3001__idx__seq_insert_index2;
id	c1	c2
1	3	0
2	3	1
3	3	1
4	3	1
5	3	1
6	3	1
7	3	1
8	3	1
9	3	1
10	3	1
11	3	1
12	3	1
13	3	1
14	28	1
update seq_insert set c1 =3  where id = prevval for seq;
select * from seq_insert;
id	c1	c2
1	3	0
2	3	1
3	3	1
4	3	1
5	3	1
6	3	1
7	3	1
8	3	1
9	3	1
10	3	1
11	3	1
12	3	1
13	3	1
14	3	1
select * from __3001__idx__seq_insert_index1;
id	c1	c2
1	3	0
2	3	1
3	3	1
4	3	1
5	3	1
6	3	1
7	3	1
8	3	1
9	3	1
10	3	1
11	3	1
12	3	1
13	3	1
14	3	1
select * from __3001__idx__seq_insert_index2;
id	c1	c2
1	3	0
2	3	1
3	3	1
4	3	1
5	3	1
6	3	1
7	3	1
8	3	1
9	3	1
10	3	1
11	3	1
12	3	1
13	3	1
14	3	1
update seq_insert set c1 = nextval for seq where id >=1;
select * from seq_insert;
id	c1	c2
1	15	0
2	16	1
3	17	1
4	18	1
5	19	1
6	20	1
7	21	1
8	22	1
9	23	1
10	24	1
11	25	1
12	26	1
13	27	1
14	28	1
select * from __3001__idx__seq_insert_index1;
id	c1	c2
1	15	0
2	16	1
3	17	1
4	18	1
5	19	1
6	20	1
7	21	1
8	22	1
9	23	1
10	24	1
11	25	1
12	26	1
13	27	1
14	28	1
select * from __3001__idx__seq_insert_index2;
id	c1	c2
1	15	0
2	16	1
3	17	1
4	18	1
5	19	1
6	20	1
7	21	1
8	22	1
9	23	1
10	24	1
11	25	1
12	26	1
13	27	1
14	28	1
create or replace sequence seq;
update seq_insert set c1 = nextval for seq where id >=1;
select * from seq_insert;
id	c1	c2
1	1	0
2	2	1
3	3	1
4	4	1
5	5	1
6	6	1
7	7	1
8	8	1
9	9	1
10	10	1
11	11	1
12	12	1
13	13	1
14	14	1
select * from __3001__idx__seq_insert_index1;
id	c1	c2
1	1	0
2	2	1
3	3	1
4	4	1
5	5	1
6	6	1
7	7	1
8	8	1
9	9	1
10	10	1
11	11	1
12	12	1
13	13	1
14	14	1
select * from __3001__idx__seq_insert_index2;
id	c1	c2
1	1	0
2	2	1
3	3	1
4	4	1
5	5	1
6	6	1
7	7	1
8	8	1
9	9	1
10	10	1
11	11	1
12	12	1
13	13	1
14	14	1
create or replace sequence seq;
update seq_insert set c2 = nextval for seq where id >=1;
select * from seq_insert;
id	c1	c2
1	1	1
2	2	2
3	3	3
4	4	4
5	5	5
6	6	6
7	7	7
8	8	8
9	9	9
10	10	10
11	11	11
12	12	12
13	13	13
14	14	14
select * from __3001__idx__seq_insert_index1;
id	c1	c2
1	1	1
2	2	2
3	3	3
4	4	4
5	5	5
6	6	6
7	7	7
8	8	8
9	9	9
10	10	10
11	11	11
12	12	12
13	13	13
14	14	14
select * from __3001__idx__seq_insert_index2;
id	c1	c2
1	1	1
2	2	2
3	3	3
4	4	4
5	5	5
6	6	6
7	7	7
8	8	8
9	9	9
10	10	10
11	11	11
12	12	12
13	13	13
14	14	14
create or replace sequence seq;
update seq_insert set c1 = nextval for seq + nextval for seq where id >=1;
select * from seq_insert;
id	c1	c2
1	2	1
2	4	2
3	6	3
4	8	4
5	10	5
6	12	6
7	14	7
8	16	8
9	18	9
10	20	10
11	22	11
12	24	12
13	26	13
14	28	14
select * from __3001__idx__seq_insert_index1;
id	c1	c2
1	2	1
2	4	2
3	6	3
4	8	4
5	10	5
6	12	6
7	14	7
8	16	8
9	18	9
10	20	10
11	22	11
12	24	12
13	26	13
14	28	14
select * from __3001__idx__seq_insert_index2;
id	c1	c2
1	2	1
2	4	2
3	6	3
4	8	4
5	10	5
6	12	6
7	14	7
8	16	8
9	18	9
10	20	10
11	22	11
12	24	12
13	26	13
14	28	14
create or replace sequence seq;
update seq_insert set c2 = nextval for seq + nextval for seq where id >=1;
select * from seq_insert;
id	c1	c2
1	2	2
2	4	4
3	6	6
4	8	8
5	10	10
6	12	12
7	14	14
8	16	16
9	18	18
10	20	20
11	22	22
12	24	24
13	26	26
14	28	28
select * from __3001__idx__seq_insert_index1;
id	c1	c2
1	2	2
2	4	4
3	6	6
4	8	8
5	10	10
6	12	12
7	14	14
8	16	16
9	18	18
10	20	20
11	22	22
12	24	24
13	26	26
14	28	28
select * from __3001__idx__seq_insert_index2;
id	c1	c2
1	2	2
2	4	4
3	6	6
4	8	8
5	10	10
6	12	12
7	14	14
8	16	16
9	18	18
10	20	20
11	22	22
12	24	24
13	26	26
14	28	28
create or replace sequence seq;
update seq_insert set c1 = nextval for seq + prevval for seq where id >=1;
ERROR HY000: THE PREVVAL expression of  sequence [seq] can't be used before using NEXTVAL
select * from seq_insert;
id	c1	c2
1	2	2
2	4	4
3	6	6
4	8	8
5	10	10
6	12	12
7	14	14
8	16	16
9	18	18
10	20	20
11	22	22
12	24	24
13	26	26
14	28	28
select * from __3001__idx__seq_insert_index1;
id	c1	c2
1	2	2
2	4	4
3	6	6
4	8	8
5	10	10
6	12	12
7	14	14
8	16	16
9	18	18
10	20	20
11	22	22
12	24	24
13	26	26
14	28	28
select * from __3001__idx__seq_insert_index2;
id	c1	c2
1	2	2
2	4	4
3	6	6
4	8	8
5	10	10
6	12	12
7	14	14
8	16	16
9	18	18
10	20	20
11	22	22
12	24	24
13	26	26
14	28	28
create or replace sequence seq;
update seq_insert set c2 = nextval for seq + prevval for seq where id >=1;
ERROR HY000: THE PREVVAL expression of  sequence [seq] can't be used before using NEXTVAL
select * from seq_insert;
id	c1	c2
1	2	2
2	4	4
3	6	6
4	8	8
5	10	10
6	12	12
7	14	14
8	16	16
9	18	18
10	20	20
11	22	22
12	24	24
13	26	26
14	28	28
select * from __3001__idx__seq_insert_index1;
id	c1	c2
1	2	2
2	4	4
3	6	6
4	8	8
5	10	10
6	12	12
7	14	14
8	16	16
9	18	18
10	20	20
11	22	22
12	24	24
13	26	26
14	28	28
select * from __3001__idx__seq_insert_index2;
id	c1	c2
1	2	2
2	4	4
3	6	6
4	8	8
5	10	10
6	12	12
7	14	14
8	16	16
9	18	18
10	20	20
11	22	22
12	24	24
13	26	26
14	28	28
create or replace sequence seq;
select nextval for seq from seq_insert;
nextval for seq
1
2
3
4
5
6
7
8
9
10
11
12
13
14
update seq_insert set c1 = prevval for seq + prevval for seq where id >=1;
select * from seq_insert;
id	c1	c2
1	28	2
2	28	4
3	28	6
4	28	8
5	28	10
6	28	12
7	28	14
8	28	16
9	28	18
10	28	20
11	28	22
12	28	24
13	28	26
14	28	28
select * from __3001__idx__seq_insert_index1;
id	c1	c2
1	28	2
2	28	4
3	28	6
4	28	8
5	28	10
6	28	12
7	28	14
8	28	16
9	28	18
10	28	20
11	28	22
12	28	24
13	28	26
14	28	28
select * from __3001__idx__seq_insert_index2;
id	c1	c2
1	28	2
2	28	4
3	28	6
4	28	8
5	28	10
6	28	12
7	28	14
8	28	16
9	28	18
10	28	20
11	28	22
12	28	24
13	28	26
14	28	28
create or replace sequence seq;
select nextval for seq from seq_insert;
nextval for seq
1
2
3
4
5
6
7
8
9
10
11
12
13
14
update seq_insert set c2 = prevval for seq + prevval for seq where id >=1;
select * from seq_insert;
id	c1	c2
1	28	28
2	28	28
3	28	28
4	28	28
5	28	28
6	28	28
7	28	28
8	28	28
9	28	28
10	28	28
11	28	28
12	28	28
13	28	28
14	28	28
select * from __3001__idx__seq_insert_index1;
id	c1	c2
1	28	28
2	28	28
3	28	28
4	28	28
5	28	28
6	28	28
7	28	28
8	28	28
9	28	28
10	28	28
11	28	28
12	28	28
13	28	28
14	28	28
select * from __3001__idx__seq_insert_index2;
id	c1	c2
1	28	28
2	28	28
3	28	28
4	28	28
5	28	28
6	28	28
7	28	28
8	28	28
9	28	28
10	28	28
11	28	28
12	28	28
13	28	28
14	28	28
create or replace sequence seq minvalue 1 maxvalue 3 cycle;
update seq_insert set c1 = nextval for seq where id >=1;
select * from seq_insert;
id	c1	c2
1	1	28
2	2	28
3	3	28
4	1	28
5	2	28
6	3	28
7	1	28
8	2	28
9	3	28
10	1	28
11	2	28
12	3	28
13	1	28
14	2	28
select * from __3001__idx__seq_insert_index1;
id	c1	c2
1	1	28
4	1	28
7	1	28
10	1	28
13	1	28
2	2	28
5	2	28
8	2	28
11	2	28
14	2	28
3	3	28
6	3	28
9	3	28
12	3	28
select * from __3001__idx__seq_insert_index2;
id	c1	c2
1	1	28
2	2	28
3	3	28
4	1	28
5	2	28
6	3	28
7	1	28
8	2	28
9	3	28
10	1	28
11	2	28
12	3	28
13	1	28
14	2	28
create or replace sequence seq minvalue 1 maxvalue 3 cycle;
update seq_insert set c2 = nextval for seq where id >=1;
select * from seq_insert;
id	c1	c2
1	1	1
2	2	2
3	3	3
4	1	1
5	2	2
6	3	3
7	1	1
8	2	2
9	3	3
10	1	1
11	2	2
12	3	3
13	1	1
14	2	2
select * from __3001__idx__seq_insert_index1;
id	c1	c2
1	1	1
4	1	1
7	1	1
10	1	1
13	1	1
2	2	2
5	2	2
8	2	2
11	2	2
14	2	2
3	3	3
6	3	3
9	3	3
12	3	3
select * from __3001__idx__seq_insert_index2;
id	c1	c2
1	1	1
4	1	1
7	1	1
10	1	1
13	1	1
2	2	2
5	2	2
8	2	2
11	2	2
14	2	2
3	3	3
6	3	3
9	3	3
12	3	3
create or replace sequence seq as decimal(3,0) minvalue 20;
update seq_insert set c1 = nextval for seq where id >=1;
select * from seq_insert;
id	c1	c2
1	20	1
2	21	2
3	22	3
4	23	1
5	24	2
6	25	3
7	26	1
8	27	2
9	28	3
10	29	1
11	30	2
12	31	3
13	32	1
14	33	2
select * from __3001__idx__seq_insert_index1;
id	c1	c2
1	20	1
2	21	2
3	22	3
4	23	1
5	24	2
6	25	3
7	26	1
8	27	2
9	28	3
10	29	1
11	30	2
12	31	3
13	32	1
14	33	2
select * from __3001__idx__seq_insert_index2;
id	c1	c2
1	20	1
4	23	1
7	26	1
10	29	1
13	32	1
2	21	2
5	24	2
8	27	2
11	30	2
14	33	2
3	22	3
6	25	3
9	28	3
12	31	3
create or replace sequence seq as decimal(3,0) minvalue 20;
update seq_insert set c2 = nextval for seq where id >=1;
select * from seq_insert;
id	c1	c2
1	20	20
2	21	21
3	22	22
4	23	23
5	24	24
6	25	25
7	26	26
8	27	27
9	28	28
10	29	29
11	30	30
12	31	31
13	32	32
14	33	33
select * from __3001__idx__seq_insert_index1;
id	c1	c2
1	20	20
2	21	21
3	22	22
4	23	23
5	24	24
6	25	25
7	26	26
8	27	27
9	28	28
10	29	29
11	30	30
12	31	31
13	32	32
14	33	33
select * from __3001__idx__seq_insert_index2;
id	c1	c2
1	20	20
2	21	21
3	22	22
4	23	23
5	24	24
6	25	25
7	26	26
8	27	27
9	28	28
10	29	29
11	30	30
12	31	31
13	32	32
14	33	33
create or replace sequence seq as decimal(3,0) minvalue 20 maxvalue 23 cycle;
update seq_insert set c1 = nextval for seq where id >=1;
select * from seq_insert;
id	c1	c2
1	20	20
2	21	21
3	22	22
4	23	23
5	20	24
6	21	25
7	22	26
8	23	27
9	20	28
10	21	29
11	22	30
12	23	31
13	20	32
14	21	33
select * from __3001__idx__seq_insert_index1;
id	c1	c2
1	20	20
5	20	24
9	20	28
13	20	32
2	21	21
6	21	25
10	21	29
14	21	33
3	22	22
7	22	26
11	22	30
4	23	23
8	23	27
12	23	31
select * from __3001__idx__seq_insert_index2;
id	c1	c2
1	20	20
2	21	21
3	22	22
4	23	23
5	20	24
6	21	25
7	22	26
8	23	27
9	20	28
10	21	29
11	22	30
12	23	31
13	20	32
14	21	33
create or replace sequence seq as decimal(3,0) minvalue 20 maxvalue 23 cycle;
update seq_insert set c2 = nextval for seq where id >=1;
select * from seq_insert;
id	c1	c2
1	20	20
2	21	21
3	22	22
4	23	23
5	20	20
6	21	21
7	22	22
8	23	23
9	20	20
10	21	21
11	22	22
12	23	23
13	20	20
14	21	21
select * from __3001__idx__seq_insert_index1;
id	c1	c2
1	20	20
5	20	20
9	20	20
13	20	20
2	21	21
6	21	21
10	21	21
14	21	21
3	22	22
7	22	22
11	22	22
4	23	23
8	23	23
12	23	23
select * from __3001__idx__seq_insert_index2;
id	c1	c2
1	20	20
5	20	20
9	20	20
13	20	20
2	21	21
6	21	21
10	21	21
14	21	21
3	22	22
7	22	22
11	22	22
4	23	23
8	23	23
12	23	23
update seq_insert set c1 = prevval for seq where id >=1;
select * from seq_insert;
id	c1	c2
1	21	20
2	21	21
3	21	22
4	21	23
5	21	20
6	21	21
7	21	22
8	21	23
9	21	20
10	21	21
11	21	22
12	21	23
13	21	20
14	21	21
select * from __3001__idx__seq_insert_index1;
id	c1	c2
1	21	20
2	21	21
3	21	22
4	21	23
5	21	20
6	21	21
7	21	22
8	21	23
9	21	20
10	21	21
11	21	22
12	21	23
13	21	20
14	21	21
select * from __3001__idx__seq_insert_index2;
id	c1	c2
1	21	20
5	21	20
9	21	20
13	21	20
2	21	21
6	21	21
10	21	21
14	21	21
3	21	22
7	21	22
11	21	22
4	21	23
8	21	23
12	21	23
update seq_insert set c2 = prevval for seq where id >=1;
select * from seq_insert;
id	c1	c2
1	21	21
2	21	21
3	21	21
4	21	21
5	21	21
6	21	21
7	21	21
8	21	21
9	21	21
10	21	21
11	21	21
12	21	21
13	21	21
14	21	21
select * from __3001__idx__seq_insert_index1;
id	c1	c2
1	21	21
2	21	21
3	21	21
4	21	21
5	21	21
6	21	21
7	21	21
8	21	21
9	21	21
10	21	21
11	21	21
12	21	21
13	21	21
14	21	21
select * from __3001__idx__seq_insert_index2;
id	c1	c2
1	21	21
2	21	21
3	21	21
4	21	21
5	21	21
6	21	21
7	21	21
8	21	21
9	21	21
10	21	21
11	21	21
12	21	21
13	21	21
14	21	21
create or replace sequence seq quick;
update seq_insert set c1 = prevval for seq where id >=1;
ERROR HY000: THE PREVVAL expression of  sequence [seq] can't be used before using NEXTVAL
select * from seq_insert;
id	c1	c2
1	21	21
2	21	21
3	21	21
4	21	21
5	21	21
6	21	21
7	21	21
8	21	21
9	21	21
10	21	21
11	21	21
12	21	21
13	21	21
14	21	21
select * from __3001__idx__seq_insert_index1;
id	c1	c2
1	21	21
2	21	21
3	21	21
4	21	21
5	21	21
6	21	21
7	21	21
8	21	21
9	21	21
10	21	21
11	21	21
12	21	21
13	21	21
14	21	21
select * from __3001__idx__seq_insert_index2;
id	c1	c2
1	21	21
2	21	21
3	21	21
4	21	21
5	21	21
6	21	21
7	21	21
8	21	21
9	21	21
10	21	21
11	21	21
12	21	21
13	21	21
14	21	21
create or replace sequence seq quick;
update seq_insert set c2 = prevval for seq where id >=1;
ERROR HY000: THE PREVVAL expression of  sequence [seq] can't be used before using NEXTVAL
select * from seq_insert;
id	c1	c2
1	21	21
2	21	21
3	21	21
4	21	21
5	21	21
6	21	21
7	21	21
8	21	21
9	21	21
10	21	21
11	21	21
12	21	21
13	21	21
14	21	21
select * from __3001__idx__seq_insert_index1;
id	c1	c2
1	21	21
2	21	21
3	21	21
4	21	21
5	21	21
6	21	21
7	21	21
8	21	21
9	21	21
10	21	21
11	21	21
12	21	21
13	21	21
14	21	21
select * from __3001__idx__seq_insert_index2;
id	c1	c2
1	21	21
2	21	21
3	21	21
4	21	21
5	21	21
6	21	21
7	21	21
8	21	21
9	21	21
10	21	21
11	21	21
12	21	21
13	21	21
14	21	21
create or replace sequence seq quick;
update seq_insert set c1 = nextval for seq where id >=1;
select * from seq_insert;
id	c1	c2
1	1	21
2	2	21
3	3	21
4	4	21
5	5	21
6	6	21
7	7	21
8	8	21
9	9	21
10	10	21
11	11	21
12	12	21
13	13	21
14	14	21
select * from __3001__idx__seq_insert_index1;
id	c1	c2
1	1	21
2	2	21
3	3	21
4	4	21
5	5	21
6	6	21
7	7	21
8	8	21
9	9	21
10	10	21
11	11	21
12	12	21
13	13	21
14	14	21
select * from __3001__idx__seq_insert_index2;
id	c1	c2
1	1	21
2	2	21
3	3	21
4	4	21
5	5	21
6	6	21
7	7	21
8	8	21
9	9	21
10	10	21
11	11	21
12	12	21
13	13	21
14	14	21
create or replace sequence seq quick;
update seq_insert set c2 = nextval for seq where id >=1;
select * from seq_insert;
id	c1	c2
1	1	1
2	2	2
3	3	3
4	4	4
5	5	5
6	6	6
7	7	7
8	8	8
9	9	9
10	10	10
11	11	11
12	12	12
13	13	13
14	14	14
select * from __3001__idx__seq_insert_index1;
id	c1	c2
1	1	1
2	2	2
3	3	3
4	4	4
5	5	5
6	6	6
7	7	7
8	8	8
9	9	9
10	10	10
11	11	11
12	12	12
13	13	13
14	14	14
select * from __3001__idx__seq_insert_index2;
id	c1	c2
1	1	1
2	2	2
3	3	3
4	4	4
5	5	5
6	6	6
7	7	7
8	8	8
9	9	9
10	10	10
11	11	11
12	12	12
13	13	13
14	14	14
create or replace sequence seq quick;
update seq_insert set c1 = nextval for seq+nextval for seq where id >=1;
select * from seq_insert;
id	c1	c2
1	2	1
2	4	2
3	6	3
4	8	4
5	10	5
6	12	6
7	14	7
8	16	8
9	18	9
10	20	10
11	22	11
12	24	12
13	26	13
14	28	14
select * from __3001__idx__seq_insert_index1;
id	c1	c2
1	2	1
2	4	2
3	6	3
4	8	4
5	10	5
6	12	6
7	14	7
8	16	8
9	18	9
10	20	10
11	22	11
12	24	12
13	26	13
14	28	14
select * from __3001__idx__seq_insert_index2;
id	c1	c2
1	2	1
2	4	2
3	6	3
4	8	4
5	10	5
6	12	6
7	14	7
8	16	8
9	18	9
10	20	10
11	22	11
12	24	12
13	26	13
14	28	14
create or replace sequence seq quick;
update seq_insert set c2 = nextval for seq + nextval for seq where id >=1;
select * from seq_insert;
id	c1	c2
1	2	2
2	4	4
3	6	6
4	8	8
5	10	10
6	12	12
7	14	14
8	16	16
9	18	18
10	20	20
11	22	22
12	24	24
13	26	26
14	28	28
select * from __3001__idx__seq_insert_index1;
id	c1	c2
1	2	2
2	4	4
3	6	6
4	8	8
5	10	10
6	12	12
7	14	14
8	16	16
9	18	18
10	20	20
11	22	22
12	24	24
13	26	26
14	28	28
select * from __3001__idx__seq_insert_index2;
id	c1	c2
1	2	2
2	4	4
3	6	6
4	8	8
5	10	10
6	12	12
7	14	14
8	16	16
9	18	18
10	20	20
11	22	22
12	24	24
13	26	26
14	28	28
update seq_insert set c1 = nextval for seq+prevval for seq where id >=1;
select * from seq_insert;
id	c1	c2
1	29	2
2	30	4
3	31	6
4	32	8
5	33	10
6	34	12
7	35	14
8	36	16
9	37	18
10	38	20
11	39	22
12	40	24
13	41	26
14	42	28
select * from __3001__idx__seq_insert_index1;
id	c1	c2
1	29	2
2	30	4
3	31	6
4	32	8
5	33	10
6	34	12
7	35	14
8	36	16
9	37	18
10	38	20
11	39	22
12	40	24
13	41	26
14	42	28
select * from __3001__idx__seq_insert_index2;
id	c1	c2
1	29	2
2	30	4
3	31	6
4	32	8
5	33	10
6	34	12
7	35	14
8	36	16
9	37	18
10	38	20
11	39	22
12	40	24
13	41	26
14	42	28
update seq_insert set c2 = nextval for seq +prevval for seq where id >=1;
select * from seq_insert;
id	c1	c2
1	29	57
2	30	58
3	31	59
4	32	60
5	33	61
6	34	62
7	35	63
8	36	64
9	37	65
10	38	66
11	39	67
12	40	68
13	41	69
14	42	70
select * from __3001__idx__seq_insert_index1;
id	c1	c2
1	29	57
2	30	58
3	31	59
4	32	60
5	33	61
6	34	62
7	35	63
8	36	64
9	37	65
10	38	66
11	39	67
12	40	68
13	41	69
14	42	70
select * from __3001__idx__seq_insert_index2;
id	c1	c2
1	29	57
2	30	58
3	31	59
4	32	60
5	33	61
6	34	62
7	35	63
8	36	64
9	37	65
10	38	66
11	39	67
12	40	68
13	41	69
14	42	70
update seq_insert set c1 = prevval for seq+prevval for seq where id >=1;
select * from seq_insert;
id	c1	c2
1	84	57
2	84	58
3	84	59
4	84	60
5	84	61
6	84	62
7	84	63
8	84	64
9	84	65
10	84	66
11	84	67
12	84	68
13	84	69
14	84	70
select * from __3001__idx__seq_insert_index1;
id	c1	c2
1	84	57
2	84	58
3	84	59
4	84	60
5	84	61
6	84	62
7	84	63
8	84	64
9	84	65
10	84	66
11	84	67
12	84	68
13	84	69
14	84	70
select * from __3001__idx__seq_insert_index2;
id	c1	c2
1	84	57
2	84	58
3	84	59
4	84	60
5	84	61
6	84	62
7	84	63
8	84	64
9	84	65
10	84	66
11	84	67
12	84	68
13	84	69
14	84	70
update seq_insert set c2 = prevval  for seq +prevval for seq where id >=1;
select * from seq_insert;
id	c1	c2
1	84	84
2	84	84
3	84	84
4	84	84
5	84	84
6	84	84
7	84	84
8	84	84
9	84	84
10	84	84
11	84	84
12	84	84
13	84	84
14	84	84
select * from __3001__idx__seq_insert_index1;
id	c1	c2
1	84	84
2	84	84
3	84	84
4	84	84
5	84	84
6	84	84
7	84	84
8	84	84
9	84	84
10	84	84
11	84	84
12	84	84
13	84	84
14	84	84
select * from __3001__idx__seq_insert_index2;
id	c1	c2
1	84	84
2	84	84
3	84	84
4	84	84
5	84	84
6	84	84
7	84	84
8	84	84
9	84	84
10	84	84
11	84	84
12	84	84
13	84	84
14	84	84
create or replace sequence seq quick minvalue 3 maxvalue 4 cycle;
update seq_insert set c1 = nextval for seq where id >=1;
select * from seq_insert;
id	c1	c2
1	3	84
2	4	84
3	3	84
4	4	84
5	3	84
6	4	84
7	3	84
8	4	84
9	3	84
10	4	84
11	3	84
12	4	84
13	3	84
14	4	84
select * from __3001__idx__seq_insert_index1;
id	c1	c2
1	3	84
3	3	84
5	3	84
7	3	84
9	3	84
11	3	84
13	3	84
2	4	84
4	4	84
6	4	84
8	4	84
10	4	84
12	4	84
14	4	84
select * from __3001__idx__seq_insert_index2;
id	c1	c2
1	3	84
2	4	84
3	3	84
4	4	84
5	3	84
6	4	84
7	3	84
8	4	84
9	3	84
10	4	84
11	3	84
12	4	84
13	3	84
14	4	84
create or replace sequence seq quick minvalue 3 maxvalue 4 cycle;
update seq_insert set c2 = nextval for seq where id >=1;
select * from seq_insert;
id	c1	c2
1	3	3
2	4	4
3	3	3
4	4	4
5	3	3
6	4	4
7	3	3
8	4	4
9	3	3
10	4	4
11	3	3
12	4	4
13	3	3
14	4	4
select * from __3001__idx__seq_insert_index1;
id	c1	c2
1	3	3
3	3	3
5	3	3
7	3	3
9	3	3
11	3	3
13	3	3
2	4	4
4	4	4
6	4	4
8	4	4
10	4	4
12	4	4
14	4	4
select * from __3001__idx__seq_insert_index2;
id	c1	c2
1	3	3
3	3	3
5	3	3
7	3	3
9	3	3
11	3	3
13	3	3
2	4	4
4	4	4
6	4	4
8	4	4
10	4	4
12	4	4
14	4	4
create or replace sequence seq quick minvalue 3 maxvalue 5 cycle;
update seq_insert set c1 = nextval for seq where id >=1;
select * from seq_insert;
id	c1	c2
1	3	3
2	4	4
3	5	3
4	3	4
5	4	3
6	5	4
7	3	3
8	4	4
9	5	3
10	3	4
11	4	3
12	5	4
13	3	3
14	4	4
select * from __3001__idx__seq_insert_index1;
id	c1	c2
1	3	3
4	3	4
7	3	3
10	3	4
13	3	3
2	4	4
5	4	3
8	4	4
11	4	3
14	4	4
3	5	3
6	5	4
9	5	3
12	5	4
select * from __3001__idx__seq_insert_index2;
id	c1	c2
1	3	3
3	5	3
5	4	3
7	3	3
9	5	3
11	4	3
13	3	3
2	4	4
4	3	4
6	5	4
8	4	4
10	3	4
12	5	4
14	4	4
create or replace sequence seq quick minvalue 3 maxvalue 5 cycle;
update seq_insert set c2 = nextval for seq where id >=1;
select * from seq_insert;
id	c1	c2
1	3	3
2	4	4
3	5	5
4	3	3
5	4	4
6	5	5
7	3	3
8	4	4
9	5	5
10	3	3
11	4	4
12	5	5
13	3	3
14	4	4
select * from __3001__idx__seq_insert_index1;
id	c1	c2
1	3	3
4	3	3
7	3	3
10	3	3
13	3	3
2	4	4
5	4	4
8	4	4
11	4	4
14	4	4
3	5	5
6	5	5
9	5	5
12	5	5
select * from __3001__idx__seq_insert_index2;
id	c1	c2
1	3	3
4	3	3
7	3	3
10	3	3
13	3	3
2	4	4
5	4	4
8	4	4
11	4	4
14	4	4
3	5	5
6	5	5
9	5	5
12	5	5
create or replace sequence seq;
update seq_insert set c1 = nextval for seq where id >=10;
update seq_insert set c1 = 88 where id between 1 and prevval for seq;
select * from seq_insert;
id	c1	c2
1	88	3
2	88	4
3	88	5
4	88	3
5	88	4
6	5	5
7	3	3
8	4	4
9	5	5
10	1	3
11	2	4
12	3	5
13	4	3
14	5	4
select * from __3001__idx__seq_insert_index1;
id	c1	c2
10	1	3
11	2	4
7	3	3
12	3	5
8	4	4
13	4	3
6	5	5
9	5	5
14	5	4
1	88	3
2	88	4
3	88	5
4	88	3
5	88	4
select * from __3001__idx__seq_insert_index2;
id	c1	c2
1	88	3
4	88	3
7	3	3
10	1	3
13	4	3
2	88	4
5	88	4
8	4	4
11	2	4
14	5	4
3	88	5
6	5	5
9	5	5
12	3	5
create or replace sequence seq;
update seq_insert set c2 = nextval for seq where id >=10;
update seq_insert set c2 = 88 where id between 1 and prevval for seq;
select * from seq_insert;
id	c1	c2
1	88	88
2	88	88
3	88	88
4	88	88
5	88	88
6	5	5
7	3	3
8	4	4
9	5	5
10	1	1
11	2	2
12	3	3
13	4	4
14	5	5
select * from __3001__idx__seq_insert_index1;
id	c1	c2
10	1	1
11	2	2
7	3	3
12	3	3
8	4	4
13	4	4
6	5	5
9	5	5
14	5	5
1	88	88
2	88	88
3	88	88
4	88	88
5	88	88
select * from __3001__idx__seq_insert_index2;
id	c1	c2
10	1	1
11	2	2
7	3	3
12	3	3
8	4	4
13	4	4
6	5	5
9	5	5
14	5	5
1	88	88
2	88	88
3	88	88
4	88	88
5	88	88
create or replace sequence seq;
update seq_insert set c1 = nextval for seq where id >=10;
update seq_insert set c1 =nextval for seq where id between 1 and prevval for seq;
select * from seq_insert;
id	c1	c2
1	6	88
2	7	88
3	8	88
4	9	88
5	10	88
6	5	5
7	3	3
8	4	4
9	5	5
10	1	1
11	2	2
12	3	3
13	4	4
14	5	5
select * from __3001__idx__seq_insert_index1;
id	c1	c2
10	1	1
11	2	2
7	3	3
12	3	3
8	4	4
13	4	4
6	5	5
9	5	5
14	5	5
1	6	88
2	7	88
3	8	88
4	9	88
5	10	88
select * from __3001__idx__seq_insert_index2;
id	c1	c2
10	1	1
11	2	2
7	3	3
12	3	3
8	4	4
13	4	4
6	5	5
9	5	5
14	5	5
1	6	88
2	7	88
3	8	88
4	9	88
5	10	88
create or replace sequence seq;
update seq_insert set c2 = nextval for seq where id >=10;
update seq_insert set c2 = nextval for seq where id between 1 and prevval for seq;
select * from seq_insert;
id	c1	c2
1	6	6
2	7	7
3	8	8
4	9	9
5	10	10
6	5	5
7	3	3
8	4	4
9	5	5
10	1	1
11	2	2
12	3	3
13	4	4
14	5	5
select * from __3001__idx__seq_insert_index1;
id	c1	c2
10	1	1
11	2	2
7	3	3
12	3	3
8	4	4
13	4	4
6	5	5
9	5	5
14	5	5
1	6	6
2	7	7
3	8	8
4	9	9
5	10	10
select * from __3001__idx__seq_insert_index2;
id	c1	c2
10	1	1
11	2	2
7	3	3
12	3	3
8	4	4
13	4	4
6	5	5
9	5	5
14	5	5
1	6	6
2	7	7
3	8	8
4	9	9
5	10	10
create or replace sequence seq;
update seq_insert set c1= nextval for seq where id =0;
select current_value from __all_sequence where sequence_name='seq';
current_value
1
select * from seq_insert;
id	c1	c2
1	6	6
2	7	7
3	8	8
4	9	9
5	10	10
6	5	5
7	3	3
8	4	4
9	5	5
10	1	1
11	2	2
12	3	3
13	4	4
14	5	5
select * from __3001__idx__seq_insert_index1;
id	c1	c2
10	1	1
11	2	2
7	3	3
12	3	3
8	4	4
13	4	4
6	5	5
9	5	5
14	5	5
1	6	6
2	7	7
3	8	8
4	9	9
5	10	10
select * from __3001__idx__seq_insert_index2;
id	c1	c2
10	1	1
11	2	2
7	3	3
12	3	3
8	4	4
13	4	4
6	5	5
9	5	5
14	5	5
1	6	6
2	7	7
3	8	8
4	9	9
5	10	10
create or replace sequence seq;
update seq_insert set c2= nextval for seq where id =0;
select current_value from __all_sequence where sequence_name='seq';
current_value
1
select * from seq_insert;
id	c1	c2
1	6	6
2	7	7
3	8	8
4	9	9
5	10	10
6	5	5
7	3	3
8	4	4
9	5	5
10	1	1
11	2	2
12	3	3
13	4	4
14	5	5
select * from __3001__idx__seq_insert_index1;
id	c1	c2
10	1	1
11	2	2
7	3	3
12	3	3
8	4	4
13	4	4
6	5	5
9	5	5
14	5	5
1	6	6
2	7	7
3	8	8
4	9	9
5	10	10
select * from __3001__idx__seq_insert_index2;
id	c1	c2
10	1	1
11	2	2
7	3	3
12	3	3
8	4	4
13	4	4
6	5	5
9	5	5
14	5	5
1	6	6
2	7	7
3	8	8
4	9	9
5	10	10
create or replace sequence seq as  decimal(25,0) minvalue 11111111111111111111111.0;
update seq_insert set c1 = nextval for seq where id >=1;
ERROR HY000: value out of range
select * from seq_insert;
id	c1	c2
1	6	6
2	7	7
3	8	8
4	9	9
5	10	10
6	5	5
7	3	3
8	4	4
9	5	5
10	1	1
11	2	2
12	3	3
13	4	4
14	5	5
select * from __3001__idx__seq_insert_index1;
id	c1	c2
10	1	1
11	2	2
7	3	3
12	3	3
8	4	4
13	4	4
6	5	5
9	5	5
14	5	5
1	6	6
2	7	7
3	8	8
4	9	9
5	10	10
select * from __3001__idx__seq_insert_index2;
id	c1	c2
10	1	1
11	2	2
7	3	3
12	3	3
8	4	4
13	4	4
6	5	5
9	5	5
14	5	5
1	6	6
2	7	7
3	8	8
4	9	9
5	10	10
create or replace sequence seq as decimal(25,0) minvalue 11111111111111111111111.0;
update seq_insert set c2 = nextval for seq where id >=1;
select * from seq_insert;
id	c1	c2
1	6	11111111111111111111111
2	7	11111111111111111111112
3	8	11111111111111111111113
4	9	11111111111111111111114
5	10	11111111111111111111115
6	5	11111111111111111111116
7	3	11111111111111111111117
8	4	11111111111111111111118
9	5	11111111111111111111119
10	1	11111111111111111111120
11	2	11111111111111111111121
12	3	11111111111111111111122
13	4	11111111111111111111123
14	5	11111111111111111111124
select * from __3001__idx__seq_insert_index1;
id	c1	c2
10	1	11111111111111111111120
11	2	11111111111111111111121
7	3	11111111111111111111117
12	3	11111111111111111111122
8	4	11111111111111111111118
13	4	11111111111111111111123
6	5	11111111111111111111116
9	5	11111111111111111111119
14	5	11111111111111111111124
1	6	11111111111111111111111
2	7	11111111111111111111112
3	8	11111111111111111111113
4	9	11111111111111111111114
5	10	11111111111111111111115
select * from __3001__idx__seq_insert_index2;
id	c1	c2
1	6	11111111111111111111111
2	7	11111111111111111111112
3	8	11111111111111111111113
4	9	11111111111111111111114
5	10	11111111111111111111115
6	5	11111111111111111111116
7	3	11111111111111111111117
8	4	11111111111111111111118
9	5	11111111111111111111119
10	1	11111111111111111111120
11	2	11111111111111111111121
12	3	11111111111111111111122
13	4	11111111111111111111123
14	5	11111111111111111111124
create or replace sequence seq as  decimal(25,0) minvalue 11111111111111111111111.0  maxvalue 11111111111111111111113.0;
update seq_insert set c1 = nextval for seq where id >=1;
ERROR HY000: value out of range
select * from seq_insert;
id	c1	c2
1	6	11111111111111111111111
2	7	11111111111111111111112
3	8	11111111111111111111113
4	9	11111111111111111111114
5	10	11111111111111111111115
6	5	11111111111111111111116
7	3	11111111111111111111117
8	4	11111111111111111111118
9	5	11111111111111111111119
10	1	11111111111111111111120
11	2	11111111111111111111121
12	3	11111111111111111111122
13	4	11111111111111111111123
14	5	11111111111111111111124
select * from __3001__idx__seq_insert_index1;
id	c1	c2
10	1	11111111111111111111120
11	2	11111111111111111111121
7	3	11111111111111111111117
12	3	11111111111111111111122
8	4	11111111111111111111118
13	4	11111111111111111111123
6	5	11111111111111111111116
9	5	11111111111111111111119
14	5	11111111111111111111124
1	6	11111111111111111111111
2	7	11111111111111111111112
3	8	11111111111111111111113
4	9	11111111111111111111114
5	10	11111111111111111111115
select * from __3001__idx__seq_insert_index2;
id	c1	c2
1	6	11111111111111111111111
2	7	11111111111111111111112
3	8	11111111111111111111113
4	9	11111111111111111111114
5	10	11111111111111111111115
6	5	11111111111111111111116
7	3	11111111111111111111117
8	4	11111111111111111111118
9	5	11111111111111111111119
10	1	11111111111111111111120
11	2	11111111111111111111121
12	3	11111111111111111111122
13	4	11111111111111111111123
14	5	11111111111111111111124
create or replace sequence seq as decimal(25,0) minvalue 11111111111111111111111.0  maxvalue 11111111111111111111113.0;
update seq_insert set c2 = nextval for seq where id >=1;
ERROR HY000: the sequence is out of range
select * from seq_insert;
id	c1	c2
1	6	11111111111111111111111
2	7	11111111111111111111112
3	8	11111111111111111111113
4	9	11111111111111111111114
5	10	11111111111111111111115
6	5	11111111111111111111116
7	3	11111111111111111111117
8	4	11111111111111111111118
9	5	11111111111111111111119
10	1	11111111111111111111120
11	2	11111111111111111111121
12	3	11111111111111111111122
13	4	11111111111111111111123
14	5	11111111111111111111124
select * from __3001__idx__seq_insert_index1;
id	c1	c2
10	1	11111111111111111111120
11	2	11111111111111111111121
7	3	11111111111111111111117
12	3	11111111111111111111122
8	4	11111111111111111111118
13	4	11111111111111111111123
6	5	11111111111111111111116
9	5	11111111111111111111119
14	5	11111111111111111111124
1	6	11111111111111111111111
2	7	11111111111111111111112
3	8	11111111111111111111113
4	9	11111111111111111111114
5	10	11111111111111111111115
select * from __3001__idx__seq_insert_index2;
id	c1	c2
1	6	11111111111111111111111
2	7	11111111111111111111112
3	8	11111111111111111111113
4	9	11111111111111111111114
5	10	11111111111111111111115
6	5	11111111111111111111116
7	3	11111111111111111111117
8	4	11111111111111111111118
9	5	11111111111111111111119
10	1	11111111111111111111120
11	2	11111111111111111111121
12	3	11111111111111111111122
13	4	11111111111111111111123
14	5	11111111111111111111124
create or replace sequence seq as  decimal(25,0)  quick  minvalue 11111111111111111111111.0;
update seq_insert set c1 = nextval for seq where id >=1;
ERROR HY000: value out of range
select prevval for seq from seq_insert;
ERROR HY000: THE PREVVAL expression of  sequence [seq] can't be used before using NEXTVAL
select * from seq_insert;
id	c1	c2
1	6	11111111111111111111111
2	7	11111111111111111111112
3	8	11111111111111111111113
4	9	11111111111111111111114
5	10	11111111111111111111115
6	5	11111111111111111111116
7	3	11111111111111111111117
8	4	11111111111111111111118
9	5	11111111111111111111119
10	1	11111111111111111111120
11	2	11111111111111111111121
12	3	11111111111111111111122
13	4	11111111111111111111123
14	5	11111111111111111111124
select * from __3001__idx__seq_insert_index1;
id	c1	c2
10	1	11111111111111111111120
11	2	11111111111111111111121
7	3	11111111111111111111117
12	3	11111111111111111111122
8	4	11111111111111111111118
13	4	11111111111111111111123
6	5	11111111111111111111116
9	5	11111111111111111111119
14	5	11111111111111111111124
1	6	11111111111111111111111
2	7	11111111111111111111112
3	8	11111111111111111111113
4	9	11111111111111111111114
5	10	11111111111111111111115
select * from __3001__idx__seq_insert_index2;
id	c1	c2
1	6	11111111111111111111111
2	7	11111111111111111111112
3	8	11111111111111111111113
4	9	11111111111111111111114
5	10	11111111111111111111115
6	5	11111111111111111111116
7	3	11111111111111111111117
8	4	11111111111111111111118
9	5	11111111111111111111119
10	1	11111111111111111111120
11	2	11111111111111111111121
12	3	11111111111111111111122
13	4	11111111111111111111123
14	5	11111111111111111111124
create or replace sequence seq as decimal(25,0)  quick minvalue 11111111111111111111111.0;
update seq_insert set c2 = nextval for seq where id >=1;
select prevval for seq from seq_insert;
prevval for seq
11111111111111111111124
11111111111111111111124
11111111111111111111124
11111111111111111111124
11111111111111111111124
11111111111111111111124
11111111111111111111124
11111111111111111111124
11111111111111111111124
11111111111111111111124
11111111111111111111124
11111111111111111111124
11111111111111111111124
11111111111111111111124
select * from seq_insert;
id	c1	c2
1	6	11111111111111111111111
2	7	11111111111111111111112
3	8	11111111111111111111113
4	9	11111111111111111111114
5	10	11111111111111111111115
6	5	11111111111111111111116
7	3	11111111111111111111117
8	4	11111111111111111111118
9	5	11111111111111111111119
10	1	11111111111111111111120
11	2	11111111111111111111121
12	3	11111111111111111111122
13	4	11111111111111111111123
14	5	11111111111111111111124
select * from __3001__idx__seq_insert_index1;
id	c1	c2
10	1	11111111111111111111120
11	2	11111111111111111111121
7	3	11111111111111111111117
12	3	11111111111111111111122
8	4	11111111111111111111118
13	4	11111111111111111111123
6	5	11111111111111111111116
9	5	11111111111111111111119
14	5	11111111111111111111124
1	6	11111111111111111111111
2	7	11111111111111111111112
3	8	11111111111111111111113
4	9	11111111111111111111114
5	10	11111111111111111111115
select * from __3001__idx__seq_insert_index2;
id	c1	c2
1	6	11111111111111111111111
2	7	11111111111111111111112
3	8	11111111111111111111113
4	9	11111111111111111111114
5	10	11111111111111111111115
6	5	11111111111111111111116
7	3	11111111111111111111117
8	4	11111111111111111111118
9	5	11111111111111111111119
10	1	11111111111111111111120
11	2	11111111111111111111121
12	3	11111111111111111111122
13	4	11111111111111111111123
14	5	11111111111111111111124
create or replace sequence seq as  decimal(25,0)  quick minvalue 11111111111111111111111.0  maxvalue 11111111111111111111113.0 ;
update seq_insert set c1 = nextval for seq where id >=1;
ERROR HY000: value out of range
select prevval for seq from seq_insert;
ERROR HY000: THE PREVVAL expression of  sequence [seq] can't be used before using NEXTVAL
select * from seq_insert;
id	c1	c2
1	6	11111111111111111111111
2	7	11111111111111111111112
3	8	11111111111111111111113
4	9	11111111111111111111114
5	10	11111111111111111111115
6	5	11111111111111111111116
7	3	11111111111111111111117
8	4	11111111111111111111118
9	5	11111111111111111111119
10	1	11111111111111111111120
11	2	11111111111111111111121
12	3	11111111111111111111122
13	4	11111111111111111111123
14	5	11111111111111111111124
select * from __3001__idx__seq_insert_index1;
id	c1	c2
10	1	11111111111111111111120
11	2	11111111111111111111121
7	3	11111111111111111111117
12	3	11111111111111111111122
8	4	11111111111111111111118
13	4	11111111111111111111123
6	5	11111111111111111111116
9	5	11111111111111111111119
14	5	11111111111111111111124
1	6	11111111111111111111111
2	7	11111111111111111111112
3	8	11111111111111111111113
4	9	11111111111111111111114
5	10	11111111111111111111115
select * from __3001__idx__seq_insert_index2;
id	c1	c2
1	6	11111111111111111111111
2	7	11111111111111111111112
3	8	11111111111111111111113
4	9	11111111111111111111114
5	10	11111111111111111111115
6	5	11111111111111111111116
7	3	11111111111111111111117
8	4	11111111111111111111118
9	5	11111111111111111111119
10	1	11111111111111111111120
11	2	11111111111111111111121
12	3	11111111111111111111122
13	4	11111111111111111111123
14	5	11111111111111111111124
create or replace sequence seq as decimal(25,0)  quick minvalue 11111111111111111111111.0  maxvalue 11111111111111111111113.0 ;
update seq_insert set c2 = nextval for seq where id >=1;
ERROR HY000: the sequence is out of range
select prevval for seq from seq_insert;
ERROR HY000: THE PREVVAL expression of  sequence [seq] can't be used before using NEXTVAL
select * from seq_insert;
id	c1	c2
1	6	11111111111111111111111
2	7	11111111111111111111112
3	8	11111111111111111111113
4	9	11111111111111111111114
5	10	11111111111111111111115
6	5	11111111111111111111116
7	3	11111111111111111111117
8	4	11111111111111111111118
9	5	11111111111111111111119
10	1	11111111111111111111120
11	2	11111111111111111111121
12	3	11111111111111111111122
13	4	11111111111111111111123
14	5	11111111111111111111124
select * from __3001__idx__seq_insert_index1;
id	c1	c2
10	1	11111111111111111111120
11	2	11111111111111111111121
7	3	11111111111111111111117
12	3	11111111111111111111122
8	4	11111111111111111111118
13	4	11111111111111111111123
6	5	11111111111111111111116
9	5	11111111111111111111119
14	5	11111111111111111111124
1	6	11111111111111111111111
2	7	11111111111111111111112
3	8	11111111111111111111113
4	9	11111111111111111111114
5	10	11111111111111111111115
select * from __3001__idx__seq_insert_index2;
id	c1	c2
1	6	11111111111111111111111
2	7	11111111111111111111112
3	8	11111111111111111111113
4	9	11111111111111111111114
5	10	11111111111111111111115
6	5	11111111111111111111116
7	3	11111111111111111111117
8	4	11111111111111111111118
9	5	11111111111111111111119
10	1	11111111111111111111120
11	2	11111111111111111111121
12	3	11111111111111111111122
13	4	11111111111111111111123
14	5	11111111111111111111124
create or replace sequence seq as  decimal(25,0)  quick minvalue 11111111111111111111111.0  maxvalue 11111111111111111111113.0   increment by 2 ;
update seq_insert set c1 = nextval for seq where id >=1;
ERROR HY000: value out of range
select prevval for seq from seq_insert;
ERROR HY000: THE PREVVAL expression of  sequence [seq] can't be used before using NEXTVAL
select * from seq_insert;
id	c1	c2
1	6	11111111111111111111111
2	7	11111111111111111111112
3	8	11111111111111111111113
4	9	11111111111111111111114
5	10	11111111111111111111115
6	5	11111111111111111111116
7	3	11111111111111111111117
8	4	11111111111111111111118
9	5	11111111111111111111119
10	1	11111111111111111111120
11	2	11111111111111111111121
12	3	11111111111111111111122
13	4	11111111111111111111123
14	5	11111111111111111111124
select * from __3001__idx__seq_insert_index1;
id	c1	c2
10	1	11111111111111111111120
11	2	11111111111111111111121
7	3	11111111111111111111117
12	3	11111111111111111111122
8	4	11111111111111111111118
13	4	11111111111111111111123
6	5	11111111111111111111116
9	5	11111111111111111111119
14	5	11111111111111111111124
1	6	11111111111111111111111
2	7	11111111111111111111112
3	8	11111111111111111111113
4	9	11111111111111111111114
5	10	11111111111111111111115
select * from __3001__idx__seq_insert_index2;
id	c1	c2
1	6	11111111111111111111111
2	7	11111111111111111111112
3	8	11111111111111111111113
4	9	11111111111111111111114
5	10	11111111111111111111115
6	5	11111111111111111111116
7	3	11111111111111111111117
8	4	11111111111111111111118
9	5	11111111111111111111119
10	1	11111111111111111111120
11	2	11111111111111111111121
12	3	11111111111111111111122
13	4	11111111111111111111123
14	5	11111111111111111111124
create or replace sequence seq as decimal(25,0)  quick minvalue 11111111111111111111111.0  maxvalue 11111111111111111111113.0   increment by 2 ;
update seq_insert set c2 = nextval for seq where id >=1;
ERROR HY000: the sequence is out of range
select prevval for seq from seq_insert;
ERROR HY000: THE PREVVAL expression of  sequence [seq] can't be used before using NEXTVAL
select * from seq_insert;
id	c1	c2
1	6	11111111111111111111111
2	7	11111111111111111111112
3	8	11111111111111111111113
4	9	11111111111111111111114
5	10	11111111111111111111115
6	5	11111111111111111111116
7	3	11111111111111111111117
8	4	11111111111111111111118
9	5	11111111111111111111119
10	1	11111111111111111111120
11	2	11111111111111111111121
12	3	11111111111111111111122
13	4	11111111111111111111123
14	5	11111111111111111111124
select * from __3001__idx__seq_insert_index1;
id	c1	c2
10	1	11111111111111111111120
11	2	11111111111111111111121
7	3	11111111111111111111117
12	3	11111111111111111111122
8	4	11111111111111111111118
13	4	11111111111111111111123
6	5	11111111111111111111116
9	5	11111111111111111111119
14	5	11111111111111111111124
1	6	11111111111111111111111
2	7	11111111111111111111112
3	8	11111111111111111111113
4	9	11111111111111111111114
5	10	11111111111111111111115
select * from __3001__idx__seq_insert_index2;
id	c1	c2
1	6	11111111111111111111111
2	7	11111111111111111111112
3	8	11111111111111111111113
4	9	11111111111111111111114
5	10	11111111111111111111115
6	5	11111111111111111111116
7	3	11111111111111111111117
8	4	11111111111111111111118
9	5	11111111111111111111119
10	1	11111111111111111111120
11	2	11111111111111111111121
12	3	11111111111111111111122
13	4	11111111111111111111123
14	5	11111111111111111111124
create or replace sequence seq as decimal(25,0)    quick minvalue 11111111111111111111111.0 maxvalue 11111111111111111111333.0 increment by 2 ;
update seq_insert set c1 = nextval for seq where id >=1;
ERROR HY000: value out of range
select prevval for seq from seq_insert;
ERROR HY000: THE PREVVAL expression of  sequence [seq] can't be used before using NEXTVAL
select * from seq_insert;
id	c1	c2
1	6	11111111111111111111111
2	7	11111111111111111111112
3	8	11111111111111111111113
4	9	11111111111111111111114
5	10	11111111111111111111115
6	5	11111111111111111111116
7	3	11111111111111111111117
8	4	11111111111111111111118
9	5	11111111111111111111119
10	1	11111111111111111111120
11	2	11111111111111111111121
12	3	11111111111111111111122
13	4	11111111111111111111123
14	5	11111111111111111111124
select * from __3001__idx__seq_insert_index1;
id	c1	c2
10	1	11111111111111111111120
11	2	11111111111111111111121
7	3	11111111111111111111117
12	3	11111111111111111111122
8	4	11111111111111111111118
13	4	11111111111111111111123
6	5	11111111111111111111116
9	5	11111111111111111111119
14	5	11111111111111111111124
1	6	11111111111111111111111
2	7	11111111111111111111112
3	8	11111111111111111111113
4	9	11111111111111111111114
5	10	11111111111111111111115
select * from __3001__idx__seq_insert_index2;
id	c1	c2
1	6	11111111111111111111111
2	7	11111111111111111111112
3	8	11111111111111111111113
4	9	11111111111111111111114
5	10	11111111111111111111115
6	5	11111111111111111111116
7	3	11111111111111111111117
8	4	11111111111111111111118
9	5	11111111111111111111119
10	1	11111111111111111111120
11	2	11111111111111111111121
12	3	11111111111111111111122
13	4	11111111111111111111123
14	5	11111111111111111111124
create or replace sequence seq as decimal(25,0)    quick minvalue 11111111111111111111111.0 maxvalue 11111111111111111111333.0 increment by 2 ;
update seq_insert set c2 = nextval for seq where id >=1;
select prevval for seq from seq_insert;
prevval for seq
11111111111111111111137
11111111111111111111137
11111111111111111111137
11111111111111111111137
11111111111111111111137
11111111111111111111137
11111111111111111111137
11111111111111111111137
11111111111111111111137
11111111111111111111137
11111111111111111111137
11111111111111111111137
11111111111111111111137
11111111111111111111137
select * from seq_insert;
id	c1	c2
1	6	11111111111111111111111
2	7	11111111111111111111113
3	8	11111111111111111111115
4	9	11111111111111111111117
5	10	11111111111111111111119
6	5	11111111111111111111121
7	3	11111111111111111111123
8	4	11111111111111111111125
9	5	11111111111111111111127
10	1	11111111111111111111129
11	2	11111111111111111111131
12	3	11111111111111111111133
13	4	11111111111111111111135
14	5	11111111111111111111137
select * from __3001__idx__seq_insert_index1;
id	c1	c2
10	1	11111111111111111111129
11	2	11111111111111111111131
7	3	11111111111111111111123
12	3	11111111111111111111133
8	4	11111111111111111111125
13	4	11111111111111111111135
6	5	11111111111111111111121
9	5	11111111111111111111127
14	5	11111111111111111111137
1	6	11111111111111111111111
2	7	11111111111111111111113
3	8	11111111111111111111115
4	9	11111111111111111111117
5	10	11111111111111111111119
select * from __3001__idx__seq_insert_index2;
id	c1	c2
1	6	11111111111111111111111
2	7	11111111111111111111113
3	8	11111111111111111111115
4	9	11111111111111111111117
5	10	11111111111111111111119
6	5	11111111111111111111121
7	3	11111111111111111111123
8	4	11111111111111111111125
9	5	11111111111111111111127
10	1	11111111111111111111129
11	2	11111111111111111111131
12	3	11111111111111111111133
13	4	11111111111111111111135
14	5	11111111111111111111137
create or replace sequence seq as decimal(25,0)    quick minvalue 11111111111111111111111.0 maxvalue 11111111111111111111333.0 increment by 2 ;
update seq_insert set c1 = nextval for seq where id <prevval for seq;
ERROR HY000: THE PREVVAL expression of  sequence [seq] can't be used before using NEXTVAL
select prevval for seq from seq_insert;
ERROR HY000: THE PREVVAL expression of  sequence [seq] can't be used before using NEXTVAL
select * from seq_insert;
id	c1	c2
1	6	11111111111111111111111
2	7	11111111111111111111113
3	8	11111111111111111111115
4	9	11111111111111111111117
5	10	11111111111111111111119
6	5	11111111111111111111121
7	3	11111111111111111111123
8	4	11111111111111111111125
9	5	11111111111111111111127
10	1	11111111111111111111129
11	2	11111111111111111111131
12	3	11111111111111111111133
13	4	11111111111111111111135
14	5	11111111111111111111137
select * from __3001__idx__seq_insert_index1;
id	c1	c2
10	1	11111111111111111111129
11	2	11111111111111111111131
7	3	11111111111111111111123
12	3	11111111111111111111133
8	4	11111111111111111111125
13	4	11111111111111111111135
6	5	11111111111111111111121
9	5	11111111111111111111127
14	5	11111111111111111111137
1	6	11111111111111111111111
2	7	11111111111111111111113
3	8	11111111111111111111115
4	9	11111111111111111111117
5	10	11111111111111111111119
select * from __3001__idx__seq_insert_index2;
id	c1	c2
1	6	11111111111111111111111
2	7	11111111111111111111113
3	8	11111111111111111111115
4	9	11111111111111111111117
5	10	11111111111111111111119
6	5	11111111111111111111121
7	3	11111111111111111111123
8	4	11111111111111111111125
9	5	11111111111111111111127
10	1	11111111111111111111129
11	2	11111111111111111111131
12	3	11111111111111111111133
13	4	11111111111111111111135
14	5	11111111111111111111137
create or replace sequence seq as decimal(25,0)    quick minvalue 11111111111111111111111.0 maxvalue 11111111111111111111333.0 increment by 2 ;
update seq_insert set c2 = nextval for seq where id <prevval for seq;
ERROR HY000: THE PREVVAL expression of  sequence [seq] can't be used before using NEXTVAL
select prevval for seq from seq_insert;
ERROR HY000: THE PREVVAL expression of  sequence [seq] can't be used before using NEXTVAL
select * from seq_insert;
id	c1	c2
1	6	11111111111111111111111
2	7	11111111111111111111113
3	8	11111111111111111111115
4	9	11111111111111111111117
5	10	11111111111111111111119
6	5	11111111111111111111121
7	3	11111111111111111111123
8	4	11111111111111111111125
9	5	11111111111111111111127
10	1	11111111111111111111129
11	2	11111111111111111111131
12	3	11111111111111111111133
13	4	11111111111111111111135
14	5	11111111111111111111137
select * from __3001__idx__seq_insert_index1;
id	c1	c2
10	1	11111111111111111111129
11	2	11111111111111111111131
7	3	11111111111111111111123
12	3	11111111111111111111133
8	4	11111111111111111111125
13	4	11111111111111111111135
6	5	11111111111111111111121
9	5	11111111111111111111127
14	5	11111111111111111111137
1	6	11111111111111111111111
2	7	11111111111111111111113
3	8	11111111111111111111115
4	9	11111111111111111111117
5	10	11111111111111111111119
select * from __3001__idx__seq_insert_index2;
id	c1	c2
1	6	11111111111111111111111
2	7	11111111111111111111113
3	8	11111111111111111111115
4	9	11111111111111111111117
5	10	11111111111111111111119
6	5	11111111111111111111121
7	3	11111111111111111111123
8	4	11111111111111111111125
9	5	11111111111111111111127
10	1	11111111111111111111129
11	2	11111111111111111111131
12	3	11111111111111111111133
13	4	11111111111111111111135
14	5	11111111111111111111137
create or replace sequence seq as decimal(25,0)    quick minvalue 11111111111111111111111.0 maxvalue 11111111111111111111333.0 increment by 2 ;
select nextval for seq from seq_insert;
nextval for seq
11111111111111111111111
11111111111111111111113
11111111111111111111115
11111111111111111111117
11111111111111111111119
11111111111111111111121
11111111111111111111123
11111111111111111111125
11111111111111111111127
11111111111111111111129
11111111111111111111131
11111111111111111111133
11111111111111111111135
11111111111111111111137
update seq_insert set c1 = nextval for seq where id <prevval for seq;
ERROR 65535 (HY000): THE PREVVAL expression of  sequence [seq] can't be used before using NEXTVAL
select prevval for seq from seq_insert;
ERROR 65535 (HY000): THE PREVVAL expression of  sequence [seq] can't be used before using NEXTVAL
11111111111111111111137
11111111111111111111137
11111111111111111111137
11111111111111111111137
11111111111111111111137
11111111111111111111137
11111111111111111111137
11111111111111111111137
11111111111111111111137
11111111111111111111137
11111111111111111111137
11111111111111111111137
11111111111111111111137
11111111111111111111137
select * from seq_insert;
id	c1	c2
1	6	11111111111111111111111
2	7	11111111111111111111113
3	8	11111111111111111111115
4	9	11111111111111111111117
5	10	11111111111111111111119
6	5	11111111111111111111121
7	3	11111111111111111111123
8	4	11111111111111111111125
9	5	11111111111111111111127
10	1	11111111111111111111129
11	2	11111111111111111111131
12	3	11111111111111111111133
13	4	11111111111111111111135
14	5	11111111111111111111137
select * from __3001__idx__seq_insert_index1;
id	c1	c2
10	1	11111111111111111111129
11	2	11111111111111111111131
7	3	11111111111111111111123
12	3	11111111111111111111133
8	4	11111111111111111111125
13	4	11111111111111111111135
6	5	11111111111111111111121
9	5	11111111111111111111127
14	5	11111111111111111111137
1	6	11111111111111111111111
2	7	11111111111111111111113
3	8	11111111111111111111115
4	9	11111111111111111111117
5	10	11111111111111111111119
select * from __3001__idx__seq_insert_index2;
id	c1	c2
1	6	11111111111111111111111
2	7	11111111111111111111113
3	8	11111111111111111111115
4	9	11111111111111111111117
5	10	11111111111111111111119
6	5	11111111111111111111121
7	3	11111111111111111111123
8	4	11111111111111111111125
9	5	11111111111111111111127
10	1	11111111111111111111129
11	2	11111111111111111111131
12	3	11111111111111111111133
13	4	11111111111111111111135
14	5	11111111111111111111137
create or replace sequence seq as decimal(25,0)    quick minvalue 11111111111111111111111.0 maxvalue 11111111111111111111333.0 increment by 2 ;
select nextval for seq from seq_insert;
nextval for seq
11111111111111111111111
11111111111111111111113
11111111111111111111115
11111111111111111111117
11111111111111111111119
11111111111111111111121
11111111111111111111123
11111111111111111111125
11111111111111111111127
11111111111111111111129
11111111111111111111131
11111111111111111111133
11111111111111111111135
11111111111111111111137
update seq_insert set c2 = nextval for seq where id <prevval for seq;
ERROR 65535 (HY000): THE PREVVAL expression of  sequence [seq] can't be used before using NEXTVAL
select prevval for seq from seq_insert;
ERROR 65535 (HY000): THE PREVVAL expression of  sequence [seq] can't be used before using NEXTVAL
11111111111111111111137
11111111111111111111137
11111111111111111111137
11111111111111111111137
11111111111111111111137
11111111111111111111137
11111111111111111111137
11111111111111111111137
11111111111111111111137
11111111111111111111137
11111111111111111111137
11111111111111111111137
11111111111111111111137
11111111111111111111137
select * from seq_insert;
id	c1	c2
1	6	11111111111111111111111
2	7	11111111111111111111113
3	8	11111111111111111111115
4	9	11111111111111111111117
5	10	11111111111111111111119
6	5	11111111111111111111121
7	3	11111111111111111111123
8	4	11111111111111111111125
9	5	11111111111111111111127
10	1	11111111111111111111129
11	2	11111111111111111111131
12	3	11111111111111111111133
13	4	11111111111111111111135
14	5	11111111111111111111137
select * from __3001__idx__seq_insert_index1;
id	c1	c2
10	1	11111111111111111111129
11	2	11111111111111111111131
7	3	11111111111111111111123
12	3	11111111111111111111133
8	4	11111111111111111111125
13	4	11111111111111111111135
6	5	11111111111111111111121
9	5	11111111111111111111127
14	5	11111111111111111111137
1	6	11111111111111111111111
2	7	11111111111111111111113
3	8	11111111111111111111115
4	9	11111111111111111111117
5	10	11111111111111111111119
select * from __3001__idx__seq_insert_index2;
id	c1	c2
1	6	11111111111111111111111
2	7	11111111111111111111113
3	8	11111111111111111111115
4	9	11111111111111111111117
5	10	11111111111111111111119
6	5	11111111111111111111121
7	3	11111111111111111111123
8	4	11111111111111111111125
9	5	11111111111111111111127
10	1	11111111111111111111129
11	2	11111111111111111111131
12	3	11111111111111111111133
13	4	11111111111111111111135
14	5	11111111111111111111137
