drop table if exists SEQ_SELECT,SEQ_NO_CYCLE,SEQ_CYCLE,SEQ_QUICK;
DROP SEQUENCE SEQ_SELECT;
DROP SEQUENCE SEQ_NO_CYCLE;
DROP SEQUENCE SEQ_CYCLE;
DROP SEQUENCE SEQ_QUICK;
CREATE TABLE SEQ_SELECT (ID INT PRIMARY KEY, C1 INT, C2 INT);
CREATE TABLE SEQ_NO_CYCLE (ID INT PRIMARY KEY,C1 INT, C2 INT);
CREATE TABLE SEQ_CYCLE (ID INT PRIMARY KEY,C1 INT, C2 INT);
CREATE TABLE SEQ_QUICK(ID INT PRIMARY KEY, C1 INT, C2 INT);
CREATE OR REPLACE SEQUENCE SEQ_SELECT;
CREATE OR REPLACE SEQUENCE SEQ_NO_CYCLE NO CYCLE;
CREATE OR REPLACE SEQUENCE SEQ_CYCLE CYCLE MINVALUE 1 MAXVALUE 20;
CREATE OR REPLACE SEQUENCE SEQ_QUICK QUICK;
INSERT INTO SEQ_NO_CYCLE VALUES(NEXTVAL FOR SEQ_NO_CYCLE,NEXTVAL FOR SEQ_NO_CYCLE,123),(NEXTVAL FOR SEQ_NO_CYCLE,NEXTVAL FOR SEQ_NO_CYCLE,123),(NEXTVAL FOR SEQ_NO_CYCLE,NEXTVAL FOR SEQ_NO_CYCLE,123),(NEXTVAL FOR SEQ_NO_CYCLE,NEXTVAL FOR SEQ_NO_CYCLE,123),(NEXTVAL FOR SEQ_NO_CYCLE,NEXTVAL FOR SEQ_NO_CYCLE,123),(NEXTVAL FOR SEQ_NO_CYCLE,NEXTVAL FOR SEQ_NO_CYCLE,123),(NEXTVAL FOR SEQ_NO_CYCLE,NEXTVAL FOR SEQ_NO_CYCLE,123),(NEXTVAL FOR SEQ_NO_CYCLE,NEXTVAL FOR SEQ_NO_CYCLE,123),(NEXTVAL FOR SEQ_NO_CYCLE,NEXTVAL FOR SEQ_NO_CYCLE,123),(NEXTVAL FOR SEQ_NO_CYCLE,NEXTVAL FOR SEQ_NO_CYCLE,123),(NEXTVAL FOR SEQ_NO_CYCLE,NEXTVAL FOR SEQ_NO_CYCLE,123),(NEXTVAL FOR SEQ_NO_CYCLE,NEXTVAL FOR SEQ_NO_CYCLE,123),(NEXTVAL FOR SEQ_NO_CYCLE,NEXTVAL FOR SEQ_NO_CYCLE,123),(NEXTVAL FOR SEQ_NO_CYCLE,NEXTVAL FOR SEQ_NO_CYCLE,123),(NEXTVAL FOR SEQ_NO_CYCLE,NEXTVAL FOR SEQ_NO_CYCLE,123),(NEXTVAL FOR SEQ_NO_CYCLE,NEXTVAL FOR SEQ_NO_CYCLE,123),(NEXTVAL FOR SEQ_NO_CYCLE,NEXTVAL FOR SEQ_NO_CYCLE,123),(NEXTVAL FOR SEQ_NO_CYCLE,NEXTVAL FOR SEQ_NO_CYCLE,123),(NEXTVAL FOR SEQ_NO_CYCLE,NEXTVAL FOR SEQ_NO_CYCLE,123),(NEXTVAL FOR SEQ_NO_CYCLE,NEXTVAL FOR SEQ_NO_CYCLE,123),(NEXTVAL FOR SEQ_NO_CYCLE,NEXTVAL FOR SEQ_NO_CYCLE,123),(NEXTVAL FOR SEQ_NO_CYCLE,NEXTVAL FOR SEQ_NO_CYCLE,123),(NEXTVAL FOR SEQ_NO_CYCLE,NEXTVAL FOR SEQ_NO_CYCLE,123),(NEXTVAL FOR SEQ_NO_CYCLE,NEXTVAL FOR SEQ_NO_CYCLE,123),(NEXTVAL FOR SEQ_NO_CYCLE,NEXTVAL FOR SEQ_NO_CYCLE,123),(NEXTVAL FOR SEQ_NO_CYCLE,NEXTVAL FOR SEQ_NO_CYCLE,123),(NEXTVAL FOR SEQ_NO_CYCLE,NEXTVAL FOR SEQ_NO_CYCLE,123),(NEXTVAL FOR SEQ_NO_CYCLE,NEXTVAL FOR SEQ_NO_CYCLE,123),(NEXTVAL FOR SEQ_NO_CYCLE,NEXTVAL FOR SEQ_NO_CYCLE,123),(NEXTVAL FOR SEQ_NO_CYCLE,NEXTVAL FOR SEQ_NO_CYCLE,123),(NEXTVAL FOR SEQ_NO_CYCLE,NEXTVAL FOR SEQ_NO_CYCLE,123),(NEXTVAL FOR SEQ_NO_CYCLE,NEXTVAL FOR SEQ_NO_CYCLE,123),(NEXTVAL FOR SEQ_NO_CYCLE,NEXTVAL FOR SEQ_NO_CYCLE,123),(NEXTVAL FOR SEQ_NO_CYCLE,NEXTVAL FOR SEQ_NO_CYCLE,123),(NEXTVAL FOR SEQ_NO_CYCLE,NEXTVAL FOR SEQ_NO_CYCLE,123),(NEXTVAL FOR SEQ_NO_CYCLE,NEXTVAL FOR SEQ_NO_CYCLE,123),(NEXTVAL FOR SEQ_NO_CYCLE,NEXTVAL FOR SEQ_NO_CYCLE,123),(NEXTVAL FOR SEQ_NO_CYCLE,NEXTVAL FOR SEQ_NO_CYCLE,123),(NEXTVAL FOR SEQ_NO_CYCLE,NEXTVAL FOR SEQ_NO_CYCLE,123),(NEXTVAL FOR SEQ_NO_CYCLE,NEXTVAL FOR SEQ_NO_CYCLE,123),(NEXTVAL FOR SEQ_NO_CYCLE,NEXTVAL FOR SEQ_NO_CYCLE,123),(NEXTVAL FOR SEQ_NO_CYCLE,NEXTVAL FOR SEQ_NO_CYCLE,123),(NEXTVAL FOR SEQ_NO_CYCLE,NEXTVAL FOR SEQ_NO_CYCLE,123),(NEXTVAL FOR SEQ_NO_CYCLE,NEXTVAL FOR SEQ_NO_CYCLE,123),(NEXTVAL FOR SEQ_NO_CYCLE,NEXTVAL FOR SEQ_NO_CYCLE,123),(NEXTVAL FOR SEQ_NO_CYCLE,NEXTVAL FOR SEQ_NO_CYCLE,123),(NEXTVAL FOR SEQ_NO_CYCLE,NEXTVAL FOR SEQ_NO_CYCLE,123),(NEXTVAL FOR SEQ_NO_CYCLE,NEXTVAL FOR SEQ_NO_CYCLE,123),(NEXTVAL FOR SEQ_NO_CYCLE,NEXTVAL FOR SEQ_NO_CYCLE,123),(NEXTVAL FOR SEQ_NO_CYCLE,NEXTVAL FOR SEQ_NO_CYCLE,123),(NEXTVAL FOR SEQ_NO_CYCLE,NEXTVAL FOR SEQ_NO_CYCLE,123),(NEXTVAL FOR SEQ_NO_CYCLE,NEXTVAL FOR SEQ_NO_CYCLE,123),(NEXTVAL FOR SEQ_NO_CYCLE,NEXTVAL FOR SEQ_NO_CYCLE,123),(NEXTVAL FOR SEQ_NO_CYCLE,NEXTVAL FOR SEQ_NO_CYCLE,123),(NEXTVAL FOR SEQ_NO_CYCLE,NEXTVAL FOR SEQ_NO_CYCLE,123),(NEXTVAL FOR SEQ_NO_CYCLE,NEXTVAL FOR SEQ_NO_CYCLE,123),(NEXTVAL FOR SEQ_NO_CYCLE,NEXTVAL FOR SEQ_NO_CYCLE,123),(NEXTVAL FOR SEQ_NO_CYCLE,NEXTVAL FOR SEQ_NO_CYCLE,123),(NEXTVAL FOR SEQ_NO_CYCLE,NEXTVAL FOR SEQ_NO_CYCLE,123),(NEXTVAL FOR SEQ_NO_CYCLE,NEXTVAL FOR SEQ_NO_CYCLE,123),(NEXTVAL FOR SEQ_NO_CYCLE,NEXTVAL FOR SEQ_NO_CYCLE,123),(NEXTVAL FOR SEQ_NO_CYCLE,NEXTVAL FOR SEQ_NO_CYCLE,123),(NEXTVAL FOR SEQ_NO_CYCLE,NEXTVAL FOR SEQ_NO_CYCLE,123),(NEXTVAL FOR SEQ_NO_CYCLE,NEXTVAL FOR SEQ_NO_CYCLE,123),(NEXTVAL FOR SEQ_NO_CYCLE,NEXTVAL FOR SEQ_NO_CYCLE,123),(NEXTVAL FOR SEQ_NO_CYCLE,NEXTVAL FOR SEQ_NO_CYCLE,123),(NEXTVAL FOR SEQ_NO_CYCLE,NEXTVAL FOR SEQ_NO_CYCLE,123),(NEXTVAL FOR SEQ_NO_CYCLE,NEXTVAL FOR SEQ_NO_CYCLE,123),(NEXTVAL FOR SEQ_NO_CYCLE,NEXTVAL FOR SEQ_NO_CYCLE,123),(NEXTVAL FOR SEQ_NO_CYCLE,NEXTVAL FOR SEQ_NO_CYCLE,123),(NEXTVAL FOR SEQ_NO_CYCLE,NEXTVAL FOR SEQ_NO_CYCLE,123),(NEXTVAL FOR SEQ_NO_CYCLE,NEXTVAL FOR SEQ_NO_CYCLE,123),(NEXTVAL FOR SEQ_NO_CYCLE,NEXTVAL FOR SEQ_NO_CYCLE,123),(NEXTVAL FOR SEQ_NO_CYCLE,NEXTVAL FOR SEQ_NO_CYCLE,123),(NEXTVAL FOR SEQ_NO_CYCLE,NEXTVAL FOR SEQ_NO_CYCLE,123),(NEXTVAL FOR SEQ_NO_CYCLE,NEXTVAL FOR SEQ_NO_CYCLE,123),(NEXTVAL FOR SEQ_NO_CYCLE,NEXTVAL FOR SEQ_NO_CYCLE,123),(NEXTVAL FOR SEQ_NO_CYCLE,NEXTVAL FOR SEQ_NO_CYCLE,123),(NEXTVAL FOR SEQ_NO_CYCLE,NEXTVAL FOR SEQ_NO_CYCLE,123),(NEXTVAL FOR SEQ_NO_CYCLE,NEXTVAL FOR SEQ_NO_CYCLE,123),(NEXTVAL FOR SEQ_NO_CYCLE,NEXTVAL FOR SEQ_NO_CYCLE,123),(NEXTVAL FOR SEQ_NO_CYCLE,NEXTVAL FOR SEQ_NO_CYCLE,123),(NEXTVAL FOR SEQ_NO_CYCLE,NEXTVAL FOR SEQ_NO_CYCLE,123),(NEXTVAL FOR SEQ_NO_CYCLE,NEXTVAL FOR SEQ_NO_CYCLE,123),(NEXTVAL FOR SEQ_NO_CYCLE,NEXTVAL FOR SEQ_NO_CYCLE,123),(NEXTVAL FOR SEQ_NO_CYCLE,NEXTVAL FOR SEQ_NO_CYCLE,123),(NEXTVAL FOR SEQ_NO_CYCLE,NEXTVAL FOR SEQ_NO_CYCLE,123),(NEXTVAL FOR SEQ_NO_CYCLE,NEXTVAL FOR SEQ_NO_CYCLE,123),(NEXTVAL FOR SEQ_NO_CYCLE,NEXTVAL FOR SEQ_NO_CYCLE,123),(NEXTVAL FOR SEQ_NO_CYCLE,NEXTVAL FOR SEQ_NO_CYCLE,123),(NEXTVAL FOR SEQ_NO_CYCLE,NEXTVAL FOR SEQ_NO_CYCLE,123),(NEXTVAL FOR SEQ_NO_CYCLE,NEXTVAL FOR SEQ_NO_CYCLE,123),(NEXTVAL FOR SEQ_NO_CYCLE,NEXTVAL FOR SEQ_NO_CYCLE,123),(NEXTVAL FOR SEQ_NO_CYCLE,NEXTVAL FOR SEQ_NO_CYCLE,123),(NEXTVAL FOR SEQ_NO_CYCLE,NEXTVAL FOR SEQ_NO_CYCLE,123),(NEXTVAL FOR SEQ_NO_CYCLE,NEXTVAL FOR SEQ_NO_CYCLE,123),(NEXTVAL FOR SEQ_NO_CYCLE,NEXTVAL FOR SEQ_NO_CYCLE,123),(NEXTVAL FOR SEQ_NO_CYCLE,NEXTVAL FOR SEQ_NO_CYCLE,123),(NEXTVAL FOR SEQ_NO_CYCLE,NEXTVAL FOR SEQ_NO_CYCLE,123),(NEXTVAL FOR SEQ_NO_CYCLE,NEXTVAL FOR SEQ_NO_CYCLE,123),(NEXTVAL FOR SEQ_NO_CYCLE,NEXTVAL FOR SEQ_NO_CYCLE,123),(NEXTVAL FOR SEQ_NO_CYCLE,NEXTVAL FOR SEQ_NO_CYCLE,123),(NEXTVAL FOR SEQ_NO_CYCLE,NEXTVAL FOR SEQ_NO_CYCLE,123),(NEXTVAL FOR SEQ_NO_CYCLE,NEXTVAL FOR SEQ_NO_CYCLE,123),(NEXTVAL FOR SEQ_NO_CYCLE,NEXTVAL FOR SEQ_NO_CYCLE,123),(NEXTVAL FOR SEQ_NO_CYCLE,NEXTVAL FOR SEQ_NO_CYCLE,123),(NEXTVAL FOR SEQ_NO_CYCLE,NEXTVAL FOR SEQ_NO_CYCLE,123),(NEXTVAL FOR SEQ_NO_CYCLE,NEXTVAL FOR SEQ_NO_CYCLE,123),(NEXTVAL FOR SEQ_NO_CYCLE,NEXTVAL FOR SEQ_NO_CYCLE,123),(NEXTVAL FOR SEQ_NO_CYCLE,NEXTVAL FOR SEQ_NO_CYCLE,123),(NEXTVAL FOR SEQ_NO_CYCLE,NEXTVAL FOR SEQ_NO_CYCLE,123),(NEXTVAL FOR SEQ_NO_CYCLE,NEXTVAL FOR SEQ_NO_CYCLE,123),(NEXTVAL FOR SEQ_NO_CYCLE,NEXTVAL FOR SEQ_NO_CYCLE,123),(NEXTVAL FOR SEQ_NO_CYCLE,NEXTVAL FOR SEQ_NO_CYCLE,123),(NEXTVAL FOR SEQ_NO_CYCLE,NEXTVAL FOR SEQ_NO_CYCLE,123),(NEXTVAL FOR SEQ_NO_CYCLE,NEXTVAL FOR SEQ_NO_CYCLE,123),(NEXTVAL FOR SEQ_NO_CYCLE,NEXTVAL FOR SEQ_NO_CYCLE,123),(NEXTVAL FOR SEQ_NO_CYCLE,NEXTVAL FOR SEQ_NO_CYCLE,123),(NEXTVAL FOR SEQ_NO_CYCLE,NEXTVAL FOR SEQ_NO_CYCLE,123),(NEXTVAL FOR SEQ_NO_CYCLE,NEXTVAL FOR SEQ_NO_CYCLE,123),(NEXTVAL FOR SEQ_NO_CYCLE,NEXTVAL FOR SEQ_NO_CYCLE,123),(NEXTVAL FOR SEQ_NO_CYCLE,NEXTVAL FOR SEQ_NO_CYCLE,123),(NEXTVAL FOR SEQ_NO_CYCLE,NEXTVAL FOR SEQ_NO_CYCLE,123),(NEXTVAL FOR SEQ_NO_CYCLE,NEXTVAL FOR SEQ_NO_CYCLE,123),(NEXTVAL FOR SEQ_NO_CYCLE,NEXTVAL FOR SEQ_NO_CYCLE,123),(NEXTVAL FOR SEQ_NO_CYCLE,NEXTVAL FOR SEQ_NO_CYCLE,123);
SELECT * FROM SEQ_NO_CYCLE;
id	c1	c2
1	1	123
2	2	123
3	3	123
4	4	123
5	5	123
6	6	123
7	7	123
8	8	123
9	9	123
10	10	123
11	11	123
12	12	123
13	13	123
14	14	123
15	15	123
16	16	123
17	17	123
18	18	123
19	19	123
20	20	123
21	21	123
22	22	123
23	23	123
24	24	123
25	25	123
26	26	123
27	27	123
28	28	123
29	29	123
30	30	123
31	31	123
32	32	123
33	33	123
34	34	123
35	35	123
36	36	123
37	37	123
38	38	123
39	39	123
40	40	123
41	41	123
42	42	123
43	43	123
44	44	123
45	45	123
46	46	123
47	47	123
48	48	123
49	49	123
50	50	123
51	51	123
52	52	123
53	53	123
54	54	123
55	55	123
56	56	123
57	57	123
58	58	123
59	59	123
60	60	123
61	61	123
62	62	123
63	63	123
64	64	123
65	65	123
66	66	123
67	67	123
68	68	123
69	69	123
70	70	123
71	71	123
72	72	123
73	73	123
74	74	123
75	75	123
76	76	123
77	77	123
78	78	123
79	79	123
80	80	123
81	81	123
82	82	123
83	83	123
84	84	123
85	85	123
86	86	123
87	87	123
88	88	123
89	89	123
90	90	123
91	91	123
92	92	123
93	93	123
94	94	123
95	95	123
96	96	123
97	97	123
98	98	123
99	99	123
100	100	123
101	101	123
102	102	123
103	103	123
104	104	123
105	105	123
106	106	123
107	107	123
108	108	123
109	109	123
110	110	123
111	111	123
112	112	123
113	113	123
114	114	123
115	115	123
116	116	123
117	117	123
118	118	123
119	119	123
120	120	123
121	121	123
122	122	123
123	123	123
124	124	123
125	125	123
126	126	123
INSERT INTO SEQ_QUICK VALUES(NEXTVAL FOR SEQ_QUICK,NEXTVAL FOR SEQ_QUICK,123),(NEXTVAL FOR SEQ_QUICK,NEXTVAL FOR SEQ_QUICK,123),(NEXTVAL FOR SEQ_QUICK,NEXTVAL FOR SEQ_QUICK,123),(NEXTVAL FOR SEQ_QUICK,NEXTVAL FOR SEQ_QUICK,123),(NEXTVAL FOR SEQ_QUICK,NEXTVAL FOR SEQ_QUICK,123),(NEXTVAL FOR SEQ_QUICK,NEXTVAL FOR SEQ_QUICK,123),(NEXTVAL FOR SEQ_QUICK,NEXTVAL FOR SEQ_QUICK,123),(NEXTVAL FOR SEQ_QUICK,NEXTVAL FOR SEQ_QUICK,123),(NEXTVAL FOR SEQ_QUICK,NEXTVAL FOR SEQ_QUICK,123),(NEXTVAL FOR SEQ_QUICK,NEXTVAL FOR SEQ_QUICK,123),(NEXTVAL FOR SEQ_QUICK,NEXTVAL FOR SEQ_QUICK,123),(NEXTVAL FOR SEQ_QUICK,NEXTVAL FOR SEQ_QUICK,123),(NEXTVAL FOR SEQ_QUICK,NEXTVAL FOR SEQ_QUICK,123),(NEXTVAL FOR SEQ_QUICK,NEXTVAL FOR SEQ_QUICK,123),(NEXTVAL FOR SEQ_QUICK,NEXTVAL FOR SEQ_QUICK,123),(NEXTVAL FOR SEQ_QUICK,NEXTVAL FOR SEQ_QUICK,123),(NEXTVAL FOR SEQ_QUICK,NEXTVAL FOR SEQ_QUICK,123),(NEXTVAL FOR SEQ_QUICK,NEXTVAL FOR SEQ_QUICK,123),(NEXTVAL FOR SEQ_QUICK,NEXTVAL FOR SEQ_QUICK,123),(NEXTVAL FOR SEQ_QUICK,NEXTVAL FOR SEQ_QUICK,123),(NEXTVAL FOR SEQ_QUICK,NEXTVAL FOR SEQ_QUICK,123),(NEXTVAL FOR SEQ_QUICK,NEXTVAL FOR SEQ_QUICK,123),(NEXTVAL FOR SEQ_QUICK,NEXTVAL FOR SEQ_QUICK,123),(NEXTVAL FOR SEQ_QUICK,NEXTVAL FOR SEQ_QUICK,123),(NEXTVAL FOR SEQ_QUICK,NEXTVAL FOR SEQ_QUICK,123),(NEXTVAL FOR SEQ_QUICK,NEXTVAL FOR SEQ_QUICK,123),(NEXTVAL FOR SEQ_QUICK,NEXTVAL FOR SEQ_QUICK,123),(NEXTVAL FOR SEQ_QUICK,NEXTVAL FOR SEQ_QUICK,123),(NEXTVAL FOR SEQ_QUICK,NEXTVAL FOR SEQ_QUICK,123),(NEXTVAL FOR SEQ_QUICK,NEXTVAL FOR SEQ_QUICK,123),(NEXTVAL FOR SEQ_QUICK,NEXTVAL FOR SEQ_QUICK,123),(NEXTVAL FOR SEQ_QUICK,NEXTVAL FOR SEQ_QUICK,123),(NEXTVAL FOR SEQ_QUICK,NEXTVAL FOR SEQ_QUICK,123),(NEXTVAL FOR SEQ_QUICK,NEXTVAL FOR SEQ_QUICK,123),(NEXTVAL FOR SEQ_QUICK,NEXTVAL FOR SEQ_QUICK,123),(NEXTVAL FOR SEQ_QUICK,NEXTVAL FOR SEQ_QUICK,123),(NEXTVAL FOR SEQ_QUICK,NEXTVAL FOR SEQ_QUICK,123),(NEXTVAL FOR SEQ_QUICK,NEXTVAL FOR SEQ_QUICK,123),(NEXTVAL FOR SEQ_QUICK,NEXTVAL FOR SEQ_QUICK,123),(NEXTVAL FOR SEQ_QUICK,NEXTVAL FOR SEQ_QUICK,123),(NEXTVAL FOR SEQ_QUICK,NEXTVAL FOR SEQ_QUICK,123),(NEXTVAL FOR SEQ_QUICK,NEXTVAL FOR SEQ_QUICK,123),(NEXTVAL FOR SEQ_QUICK,NEXTVAL FOR SEQ_QUICK,123),(NEXTVAL FOR SEQ_QUICK,NEXTVAL FOR SEQ_QUICK,123),(NEXTVAL FOR SEQ_QUICK,NEXTVAL FOR SEQ_QUICK,123),(NEXTVAL FOR SEQ_QUICK,NEXTVAL FOR SEQ_QUICK,123),(NEXTVAL FOR SEQ_QUICK,NEXTVAL FOR SEQ_QUICK,123),(NEXTVAL FOR SEQ_QUICK,NEXTVAL FOR SEQ_QUICK,123),(NEXTVAL FOR SEQ_QUICK,NEXTVAL FOR SEQ_QUICK,123),(NEXTVAL FOR SEQ_QUICK,NEXTVAL FOR SEQ_QUICK,123),(NEXTVAL FOR SEQ_QUICK,NEXTVAL FOR SEQ_QUICK,123),(NEXTVAL FOR SEQ_QUICK,NEXTVAL FOR SEQ_QUICK,123),(NEXTVAL FOR SEQ_QUICK,NEXTVAL FOR SEQ_QUICK,123),(NEXTVAL FOR SEQ_QUICK,NEXTVAL FOR SEQ_QUICK,123),(NEXTVAL FOR SEQ_QUICK,NEXTVAL FOR SEQ_QUICK,123),(NEXTVAL FOR SEQ_QUICK,NEXTVAL FOR SEQ_QUICK,123),(NEXTVAL FOR SEQ_QUICK,NEXTVAL FOR SEQ_QUICK,123),(NEXTVAL FOR SEQ_QUICK,NEXTVAL FOR SEQ_QUICK,123),(NEXTVAL FOR SEQ_QUICK,NEXTVAL FOR SEQ_QUICK,123),(NEXTVAL FOR SEQ_QUICK,NEXTVAL FOR SEQ_QUICK,123),(NEXTVAL FOR SEQ_QUICK,NEXTVAL FOR SEQ_QUICK,123),(NEXTVAL FOR SEQ_QUICK,NEXTVAL FOR SEQ_QUICK,123),(NEXTVAL FOR SEQ_QUICK,NEXTVAL FOR SEQ_QUICK,123),(NEXTVAL FOR SEQ_QUICK,NEXTVAL FOR SEQ_QUICK,123),(NEXTVAL FOR SEQ_QUICK,NEXTVAL FOR SEQ_QUICK,123),(NEXTVAL FOR SEQ_QUICK,NEXTVAL FOR SEQ_QUICK,123),(NEXTVAL FOR SEQ_QUICK,NEXTVAL FOR SEQ_QUICK,123),(NEXTVAL FOR SEQ_QUICK,NEXTVAL FOR SEQ_QUICK,123),(NEXTVAL FOR SEQ_QUICK,NEXTVAL FOR SEQ_QUICK,123),(NEXTVAL FOR SEQ_QUICK,NEXTVAL FOR SEQ_QUICK,123),(NEXTVAL FOR SEQ_QUICK,NEXTVAL FOR SEQ_QUICK,123),(NEXTVAL FOR SEQ_QUICK,NEXTVAL FOR SEQ_QUICK,123),(NEXTVAL FOR SEQ_QUICK,NEXTVAL FOR SEQ_QUICK,123),(NEXTVAL FOR SEQ_QUICK,NEXTVAL FOR SEQ_QUICK,123),(NEXTVAL FOR SEQ_QUICK,NEXTVAL FOR SEQ_QUICK,123),(NEXTVAL FOR SEQ_QUICK,NEXTVAL FOR SEQ_QUICK,123),(NEXTVAL FOR SEQ_QUICK,NEXTVAL FOR SEQ_QUICK,123),(NEXTVAL FOR SEQ_QUICK,NEXTVAL FOR SEQ_QUICK,123),(NEXTVAL FOR SEQ_QUICK,NEXTVAL FOR SEQ_QUICK,123),(NEXTVAL FOR SEQ_QUICK,NEXTVAL FOR SEQ_QUICK,123),(NEXTVAL FOR SEQ_QUICK,NEXTVAL FOR SEQ_QUICK,123),(NEXTVAL FOR SEQ_QUICK,NEXTVAL FOR SEQ_QUICK,123),(NEXTVAL FOR SEQ_QUICK,NEXTVAL FOR SEQ_QUICK,123),(NEXTVAL FOR SEQ_QUICK,NEXTVAL FOR SEQ_QUICK,123),(NEXTVAL FOR SEQ_QUICK,NEXTVAL FOR SEQ_QUICK,123),(NEXTVAL FOR SEQ_QUICK,NEXTVAL FOR SEQ_QUICK,123),(NEXTVAL FOR SEQ_QUICK,NEXTVAL FOR SEQ_QUICK,123),(NEXTVAL FOR SEQ_QUICK,NEXTVAL FOR SEQ_QUICK,123),(NEXTVAL FOR SEQ_QUICK,NEXTVAL FOR SEQ_QUICK,123),(NEXTVAL FOR SEQ_QUICK,NEXTVAL FOR SEQ_QUICK,123),(NEXTVAL FOR SEQ_QUICK,NEXTVAL FOR SEQ_QUICK,123),(NEXTVAL FOR SEQ_QUICK,NEXTVAL FOR SEQ_QUICK,123),(NEXTVAL FOR SEQ_QUICK,NEXTVAL FOR SEQ_QUICK,123),(NEXTVAL FOR SEQ_QUICK,NEXTVAL FOR SEQ_QUICK,123),(NEXTVAL FOR SEQ_QUICK,NEXTVAL FOR SEQ_QUICK,123),(NEXTVAL FOR SEQ_QUICK,NEXTVAL FOR SEQ_QUICK,123),(NEXTVAL FOR SEQ_QUICK,NEXTVAL FOR SEQ_QUICK,123),(NEXTVAL FOR SEQ_QUICK,NEXTVAL FOR SEQ_QUICK,123),(NEXTVAL FOR SEQ_QUICK,NEXTVAL FOR SEQ_QUICK,123),(NEXTVAL FOR SEQ_QUICK,NEXTVAL FOR SEQ_QUICK,123),(NEXTVAL FOR SEQ_QUICK,NEXTVAL FOR SEQ_QUICK,123),(NEXTVAL FOR SEQ_QUICK,NEXTVAL FOR SEQ_QUICK,123),(NEXTVAL FOR SEQ_QUICK,NEXTVAL FOR SEQ_QUICK,123),(NEXTVAL FOR SEQ_QUICK,NEXTVAL FOR SEQ_QUICK,123),(NEXTVAL FOR SEQ_QUICK,NEXTVAL FOR SEQ_QUICK,123),(NEXTVAL FOR SEQ_QUICK,NEXTVAL FOR SEQ_QUICK,123),(NEXTVAL FOR SEQ_QUICK,NEXTVAL FOR SEQ_QUICK,123),(NEXTVAL FOR SEQ_QUICK,NEXTVAL FOR SEQ_QUICK,123),(NEXTVAL FOR SEQ_QUICK,NEXTVAL FOR SEQ_QUICK,123),(NEXTVAL FOR SEQ_QUICK,NEXTVAL FOR SEQ_QUICK,123),(NEXTVAL FOR SEQ_QUICK,NEXTVAL FOR SEQ_QUICK,123),(NEXTVAL FOR SEQ_QUICK,NEXTVAL FOR SEQ_QUICK,123),(NEXTVAL FOR SEQ_QUICK,NEXTVAL FOR SEQ_QUICK,123),(NEXTVAL FOR SEQ_QUICK,NEXTVAL FOR SEQ_QUICK,123),(NEXTVAL FOR SEQ_QUICK,NEXTVAL FOR SEQ_QUICK,123),(NEXTVAL FOR SEQ_QUICK,NEXTVAL FOR SEQ_QUICK,123),(NEXTVAL FOR SEQ_QUICK,NEXTVAL FOR SEQ_QUICK,123),(NEXTVAL FOR SEQ_QUICK,NEXTVAL FOR SEQ_QUICK,123),(NEXTVAL FOR SEQ_QUICK,NEXTVAL FOR SEQ_QUICK,123),(NEXTVAL FOR SEQ_QUICK,NEXTVAL FOR SEQ_QUICK,123),(NEXTVAL FOR SEQ_QUICK,NEXTVAL FOR SEQ_QUICK,123),(NEXTVAL FOR SEQ_QUICK,NEXTVAL FOR SEQ_QUICK,123),(NEXTVAL FOR SEQ_QUICK,NEXTVAL FOR SEQ_QUICK,123),(NEXTVAL FOR SEQ_QUICK,NEXTVAL FOR SEQ_QUICK,123),(NEXTVAL FOR SEQ_QUICK,NEXTVAL FOR SEQ_QUICK,123),(NEXTVAL FOR SEQ_QUICK,NEXTVAL FOR SEQ_QUICK,123);
SELECT * FROM SEQ_QUICK;
id	c1	c2
1	1	123
2	2	123
3	3	123
4	4	123
5	5	123
6	6	123
7	7	123
8	8	123
9	9	123
10	10	123
11	11	123
12	12	123
13	13	123
14	14	123
15	15	123
16	16	123
17	17	123
18	18	123
19	19	123
20	20	123
21	21	123
22	22	123
23	23	123
24	24	123
25	25	123
26	26	123
27	27	123
28	28	123
29	29	123
30	30	123
31	31	123
32	32	123
33	33	123
34	34	123
35	35	123
36	36	123
37	37	123
38	38	123
39	39	123
40	40	123
41	41	123
42	42	123
43	43	123
44	44	123
45	45	123
46	46	123
47	47	123
48	48	123
49	49	123
50	50	123
51	51	123
52	52	123
53	53	123
54	54	123
55	55	123
56	56	123
57	57	123
58	58	123
59	59	123
60	60	123
61	61	123
62	62	123
63	63	123
64	64	123
65	65	123
66	66	123
67	67	123
68	68	123
69	69	123
70	70	123
71	71	123
72	72	123
73	73	123
74	74	123
75	75	123
76	76	123
77	77	123
78	78	123
79	79	123
80	80	123
81	81	123
82	82	123
83	83	123
84	84	123
85	85	123
86	86	123
87	87	123
88	88	123
89	89	123
90	90	123
91	91	123
92	92	123
93	93	123
94	94	123
95	95	123
96	96	123
97	97	123
98	98	123
99	99	123
100	100	123
101	101	123
102	102	123
103	103	123
104	104	123
105	105	123
106	106	123
107	107	123
108	108	123
109	109	123
110	110	123
111	111	123
112	112	123
113	113	123
114	114	123
115	115	123
116	116	123
117	117	123
118	118	123
119	119	123
120	120	123
121	121	123
122	122	123
123	123	123
124	124	123
125	125	123
126	126	123
INSERT INTO SEQ_CYCLE VALUES(NEXTVAL FOR SEQ_NO_CYCLE,NEXTVAL FOR SEQ_CYCLE,123),(NEXTVAL FOR SEQ_NO_CYCLE,NEXTVAL FOR SEQ_CYCLE,123),(NEXTVAL FOR SEQ_NO_CYCLE,NEXTVAL FOR SEQ_CYCLE,123),(NEXTVAL FOR SEQ_NO_CYCLE,NEXTVAL FOR SEQ_CYCLE,123),(NEXTVAL FOR SEQ_NO_CYCLE,NEXTVAL FOR SEQ_CYCLE,123),(NEXTVAL FOR SEQ_NO_CYCLE,NEXTVAL FOR SEQ_CYCLE,123),(NEXTVAL FOR SEQ_NO_CYCLE,NEXTVAL FOR SEQ_CYCLE,123),(NEXTVAL FOR SEQ_NO_CYCLE,NEXTVAL FOR SEQ_CYCLE,123),(NEXTVAL FOR SEQ_NO_CYCLE,NEXTVAL FOR SEQ_CYCLE,123),(NEXTVAL FOR SEQ_NO_CYCLE,NEXTVAL FOR SEQ_CYCLE,123),(NEXTVAL FOR SEQ_NO_CYCLE,NEXTVAL FOR SEQ_CYCLE,123),(NEXTVAL FOR SEQ_NO_CYCLE,NEXTVAL FOR SEQ_CYCLE,123),(NEXTVAL FOR SEQ_NO_CYCLE,NEXTVAL FOR SEQ_CYCLE,123),(NEXTVAL FOR SEQ_NO_CYCLE,NEXTVAL FOR SEQ_CYCLE,123),(NEXTVAL FOR SEQ_NO_CYCLE,NEXTVAL FOR SEQ_CYCLE,123),(NEXTVAL FOR SEQ_NO_CYCLE,NEXTVAL FOR SEQ_CYCLE,123),(NEXTVAL FOR SEQ_NO_CYCLE,NEXTVAL FOR SEQ_CYCLE,123),(NEXTVAL FOR SEQ_NO_CYCLE,NEXTVAL FOR SEQ_CYCLE,123),(NEXTVAL FOR SEQ_NO_CYCLE,NEXTVAL FOR SEQ_CYCLE,123),(NEXTVAL FOR SEQ_NO_CYCLE,NEXTVAL FOR SEQ_CYCLE,123),(NEXTVAL FOR SEQ_NO_CYCLE,NEXTVAL FOR SEQ_CYCLE,123),(NEXTVAL FOR SEQ_NO_CYCLE,NEXTVAL FOR SEQ_CYCLE,123),(NEXTVAL FOR SEQ_NO_CYCLE,NEXTVAL FOR SEQ_CYCLE,123),(NEXTVAL FOR SEQ_NO_CYCLE,NEXTVAL FOR SEQ_CYCLE,123),(NEXTVAL FOR SEQ_NO_CYCLE,NEXTVAL FOR SEQ_CYCLE,123),(NEXTVAL FOR SEQ_NO_CYCLE,NEXTVAL FOR SEQ_CYCLE,123),(NEXTVAL FOR SEQ_NO_CYCLE,NEXTVAL FOR SEQ_CYCLE,123),(NEXTVAL FOR SEQ_NO_CYCLE,NEXTVAL FOR SEQ_CYCLE,123),(NEXTVAL FOR SEQ_NO_CYCLE,NEXTVAL FOR SEQ_CYCLE,123),(NEXTVAL FOR SEQ_NO_CYCLE,NEXTVAL FOR SEQ_CYCLE,123),(NEXTVAL FOR SEQ_NO_CYCLE,NEXTVAL FOR SEQ_CYCLE,123),(NEXTVAL FOR SEQ_NO_CYCLE,NEXTVAL FOR SEQ_CYCLE,123),(NEXTVAL FOR SEQ_NO_CYCLE,NEXTVAL FOR SEQ_CYCLE,123),(NEXTVAL FOR SEQ_NO_CYCLE,NEXTVAL FOR SEQ_CYCLE,123),(NEXTVAL FOR SEQ_NO_CYCLE,NEXTVAL FOR SEQ_CYCLE,123),(NEXTVAL FOR SEQ_NO_CYCLE,NEXTVAL FOR SEQ_CYCLE,123),(NEXTVAL FOR SEQ_NO_CYCLE,NEXTVAL FOR SEQ_CYCLE,123),(NEXTVAL FOR SEQ_NO_CYCLE,NEXTVAL FOR SEQ_CYCLE,123),(NEXTVAL FOR SEQ_NO_CYCLE,NEXTVAL FOR SEQ_CYCLE,123),(NEXTVAL FOR SEQ_NO_CYCLE,NEXTVAL FOR SEQ_CYCLE,123),(NEXTVAL FOR SEQ_NO_CYCLE,NEXTVAL FOR SEQ_CYCLE,123),(NEXTVAL FOR SEQ_NO_CYCLE,NEXTVAL FOR SEQ_CYCLE,123),(NEXTVAL FOR SEQ_NO_CYCLE,NEXTVAL FOR SEQ_CYCLE,123),(NEXTVAL FOR SEQ_NO_CYCLE,NEXTVAL FOR SEQ_CYCLE,123),(NEXTVAL FOR SEQ_NO_CYCLE,NEXTVAL FOR SEQ_CYCLE,123),(NEXTVAL FOR SEQ_NO_CYCLE,NEXTVAL FOR SEQ_CYCLE,123),(NEXTVAL FOR SEQ_NO_CYCLE,NEXTVAL FOR SEQ_CYCLE,123),(NEXTVAL FOR SEQ_NO_CYCLE,NEXTVAL FOR SEQ_CYCLE,123),(NEXTVAL FOR SEQ_NO_CYCLE,NEXTVAL FOR SEQ_CYCLE,123),(NEXTVAL FOR SEQ_NO_CYCLE,NEXTVAL FOR SEQ_CYCLE,123),(NEXTVAL FOR SEQ_NO_CYCLE,NEXTVAL FOR SEQ_CYCLE,123),(NEXTVAL FOR SEQ_NO_CYCLE,NEXTVAL FOR SEQ_CYCLE,123),(NEXTVAL FOR SEQ_NO_CYCLE,NEXTVAL FOR SEQ_CYCLE,123),(NEXTVAL FOR SEQ_NO_CYCLE,NEXTVAL FOR SEQ_CYCLE,123),(NEXTVAL FOR SEQ_NO_CYCLE,NEXTVAL FOR SEQ_CYCLE,123),(NEXTVAL FOR SEQ_NO_CYCLE,NEXTVAL FOR SEQ_CYCLE,123),(NEXTVAL FOR SEQ_NO_CYCLE,NEXTVAL FOR SEQ_CYCLE,123),(NEXTVAL FOR SEQ_NO_CYCLE,NEXTVAL FOR SEQ_CYCLE,123),(NEXTVAL FOR SEQ_NO_CYCLE,NEXTVAL FOR SEQ_CYCLE,123),(NEXTVAL FOR SEQ_NO_CYCLE,NEXTVAL FOR SEQ_CYCLE,123),(NEXTVAL FOR SEQ_NO_CYCLE,NEXTVAL FOR SEQ_CYCLE,123),(NEXTVAL FOR SEQ_NO_CYCLE,NEXTVAL FOR SEQ_CYCLE,123),(NEXTVAL FOR SEQ_NO_CYCLE,NEXTVAL FOR SEQ_CYCLE,123),(NEXTVAL FOR SEQ_NO_CYCLE,NEXTVAL FOR SEQ_CYCLE,123),(NEXTVAL FOR SEQ_NO_CYCLE,NEXTVAL FOR SEQ_CYCLE,123),(NEXTVAL FOR SEQ_NO_CYCLE,NEXTVAL FOR SEQ_CYCLE,123),(NEXTVAL FOR SEQ_NO_CYCLE,NEXTVAL FOR SEQ_CYCLE,123),(NEXTVAL FOR SEQ_NO_CYCLE,NEXTVAL FOR SEQ_CYCLE,123),(NEXTVAL FOR SEQ_NO_CYCLE,NEXTVAL FOR SEQ_CYCLE,123),(NEXTVAL FOR SEQ_NO_CYCLE,NEXTVAL FOR SEQ_CYCLE,123),(NEXTVAL FOR SEQ_NO_CYCLE,NEXTVAL FOR SEQ_CYCLE,123),(NEXTVAL FOR SEQ_NO_CYCLE,NEXTVAL FOR SEQ_CYCLE,123),(NEXTVAL FOR SEQ_NO_CYCLE,NEXTVAL FOR SEQ_CYCLE,123),(NEXTVAL FOR SEQ_NO_CYCLE,NEXTVAL FOR SEQ_CYCLE,123),(NEXTVAL FOR SEQ_NO_CYCLE,NEXTVAL FOR SEQ_CYCLE,123),(NEXTVAL FOR SEQ_NO_CYCLE,NEXTVAL FOR SEQ_CYCLE,123);
SELECT * FROM SEQ_CYCLE;
id	c1	c2
127	1	123
128	2	123
129	3	123
130	4	123
131	5	123
132	6	123
133	7	123
134	8	123
135	9	123
136	10	123
137	11	123
138	12	123
139	13	123
140	14	123
141	15	123
142	16	123
143	17	123
144	18	123
145	19	123
146	20	123
147	1	123
148	2	123
149	3	123
150	4	123
151	5	123
152	6	123
153	7	123
154	8	123
155	9	123
156	10	123
157	11	123
158	12	123
159	13	123
160	14	123
161	15	123
162	16	123
163	17	123
164	18	123
165	19	123
166	20	123
167	1	123
168	2	123
169	3	123
170	4	123
171	5	123
172	6	123
173	7	123
174	8	123
175	9	123
176	10	123
177	11	123
178	12	123
179	13	123
180	14	123
181	15	123
182	16	123
183	17	123
184	18	123
185	19	123
186	20	123
187	1	123
188	2	123
189	3	123
190	4	123
191	5	123
192	6	123
193	7	123
194	8	123
195	9	123
196	10	123
197	11	123
198	12	123
199	13	123
200	14	123
201	15	123
202	16	123
INSERT INTO SEQ_SELECT VALUES(NEXTVAL FOR SEQ_SELECT,222,333),(NEXTVAL FOR SEQ_SELECT,222,333),(NEXTVAL FOR SEQ_SELECT,222,333),(NEXTVAL FOR SEQ_SELECT,222,333),(NEXTVAL FOR SEQ_SELECT,222,333),(NEXTVAL FOR SEQ_SELECT,222,333),(NEXTVAL FOR SEQ_SELECT,222,333),(NEXTVAL FOR SEQ_SELECT,222,333),(NEXTVAL FOR SEQ_SELECT,222,333),(NEXTVAL FOR SEQ_SELECT,222,333),(NEXTVAL FOR SEQ_SELECT,222,333),(NEXTVAL FOR SEQ_SELECT,222,333),(NEXTVAL FOR SEQ_SELECT,222,333);
SELECT NEXTVAL FOR SEQ_SELECT,PREVVAL FOR SEQ_SELECT,ID FROM SEQ_SELECT WHERE ID <= PREVVAL FOR SEQ_SELECT;
NEXTVAL FOR SEQ_SELECT	PREVVAL FOR SEQ_SELECT	ID
14	13	1
15	13	2
16	13	3
17	13	4
18	13	5
19	13	6
20	13	7
21	13	8
22	13	9
23	13	10
24	13	11
25	13	12
26	13	13
INSERT INTO SEQ_NO_CYCLE VALUES(NEXTVAL FOR SEQ_NO_CYCLE,NEXTVAL FOR SEQ_NO_CYCLE,123);
SELECT * FROM SEQ_NO_CYCLE;
id	c1	c2
1	1	123
2	2	123
3	3	123
4	4	123
5	5	123
6	6	123
7	7	123
8	8	123
9	9	123
10	10	123
11	11	123
12	12	123
13	13	123
14	14	123
15	15	123
16	16	123
17	17	123
18	18	123
19	19	123
20	20	123
21	21	123
22	22	123
23	23	123
24	24	123
25	25	123
26	26	123
27	27	123
28	28	123
29	29	123
30	30	123
31	31	123
32	32	123
33	33	123
34	34	123
35	35	123
36	36	123
37	37	123
38	38	123
39	39	123
40	40	123
41	41	123
42	42	123
43	43	123
44	44	123
45	45	123
46	46	123
47	47	123
48	48	123
49	49	123
50	50	123
51	51	123
52	52	123
53	53	123
54	54	123
55	55	123
56	56	123
57	57	123
58	58	123
59	59	123
60	60	123
61	61	123
62	62	123
63	63	123
64	64	123
65	65	123
66	66	123
67	67	123
68	68	123
69	69	123
70	70	123
71	71	123
72	72	123
73	73	123
74	74	123
75	75	123
76	76	123
77	77	123
78	78	123
79	79	123
80	80	123
81	81	123
82	82	123
83	83	123
84	84	123
85	85	123
86	86	123
87	87	123
88	88	123
89	89	123
90	90	123
91	91	123
92	92	123
93	93	123
94	94	123
95	95	123
96	96	123
97	97	123
98	98	123
99	99	123
100	100	123
101	101	123
102	102	123
103	103	123
104	104	123
105	105	123
106	106	123
107	107	123
108	108	123
109	109	123
110	110	123
111	111	123
112	112	123
113	113	123
114	114	123
115	115	123
116	116	123
117	117	123
118	118	123
119	119	123
120	120	123
121	121	123
122	122	123
123	123	123
124	124	123
125	125	123
126	126	123
203	203	123
DELETE FROM SEQ_NO_CYCLE WHERE ID = PREVVAL FOR SEQ_NO_CYCLE;
SELECT * FROM SEQ_NO_CYCLE;
id	c1	c2
1	1	123
2	2	123
3	3	123
4	4	123
5	5	123
6	6	123
7	7	123
8	8	123
9	9	123
10	10	123
11	11	123
12	12	123
13	13	123
14	14	123
15	15	123
16	16	123
17	17	123
18	18	123
19	19	123
20	20	123
21	21	123
22	22	123
23	23	123
24	24	123
25	25	123
26	26	123
27	27	123
28	28	123
29	29	123
30	30	123
31	31	123
32	32	123
33	33	123
34	34	123
35	35	123
36	36	123
37	37	123
38	38	123
39	39	123
40	40	123
41	41	123
42	42	123
43	43	123
44	44	123
45	45	123
46	46	123
47	47	123
48	48	123
49	49	123
50	50	123
51	51	123
52	52	123
53	53	123
54	54	123
55	55	123
56	56	123
57	57	123
58	58	123
59	59	123
60	60	123
61	61	123
62	62	123
63	63	123
64	64	123
65	65	123
66	66	123
67	67	123
68	68	123
69	69	123
70	70	123
71	71	123
72	72	123
73	73	123
74	74	123
75	75	123
76	76	123
77	77	123
78	78	123
79	79	123
80	80	123
81	81	123
82	82	123
83	83	123
84	84	123
85	85	123
86	86	123
87	87	123
88	88	123
89	89	123
90	90	123
91	91	123
92	92	123
93	93	123
94	94	123
95	95	123
96	96	123
97	97	123
98	98	123
99	99	123
100	100	123
101	101	123
102	102	123
103	103	123
104	104	123
105	105	123
106	106	123
107	107	123
108	108	123
109	109	123
110	110	123
111	111	123
112	112	123
113	113	123
114	114	123
115	115	123
116	116	123
117	117	123
118	118	123
119	119	123
120	120	123
121	121	123
122	122	123
123	123	123
124	124	123
125	125	123
126	126	123
CREATE OR REPLACE SEQUENCE ALTER_SEQUENCE;
SELECT * FROM __ALL_SEQUENCE WHERE SEQUENCE_NAME = 'alter_sequence';
sequence_name	data_type	current_value	increment_by	min_value	max_value	is_cycle	cache_num	is_order	is_valid	const_start_with	can_use_prevval	use_quick_path
alter_sequence	0	1	1	1	2147483647	0	20	0	1	1	0	0
ALTER SEQUENCE ALTER_SEQUENCE CYCLE QUICK MINVALUE 100 MAXVALUE 1000000000;
SELECT * FROM __ALL_SEQUENCE WHERE SEQUENCE_NAME = 'alter_sequence';
sequence_name	data_type	current_value	increment_by	min_value	max_value	is_cycle	cache_num	is_order	is_valid	const_start_with	can_use_prevval	use_quick_path
alter_sequence	0	1	1	100	1000000000	1	20	0	1	1	0	1
