show variables like 'ob_query_timeout';
variable_name	value
ob_query_timeout	3000000
drop table if exists t1,t2;
create table t1(pk1 int , pk2 varchar, pk3 datetime, a int, b varchar, c datetime, primary key(pk1,pk2,pk3));
insert into t1 values(1,'conn1','2012-12-12 12:00:00',100, 'r100','2013-12-12 12:00:00' );
insert into t1 values(2,'conn2','2012-12-12 12:00:00',200, 'r200','2013-12-12 12:00:00' );
begin;
select *  from t1 where pk1=1 and pk2='conn1' and pk3='2012-12-12 12:00:00' for update;
pk1	pk2	pk3	a	b	c
1	conn1	2012-12-12 12:00:00	100	r100	2013-12-12 12:00:00
update t1 set a=a+1 where pk1=1 and pk2='conn1' and pk3='2012-12-12 12:00:00';
begin;
select *  from t1 where pk1=1 and pk2='conn1' and pk3='2012-12-12 12:00:00' for update;
commit;
pk1	pk2	pk3	a	b	c
1	conn1	2012-12-12 12:00:00	101	r100	2013-12-12 12:00:00
update t1 set b='abc' where pk1 = 1 and pk2 = 'conn1' and pk3 = '2012-12-12 12:00:00';
commit;
select * from t1;
pk1	pk2	pk3	a	b	c
1	conn1	2012-12-12 12:00:00	101	abc	2013-12-12 12:00:00
2	conn2	2012-12-12 12:00:00	200	r200	2013-12-12 12:00:00
replace into t1 values(1,'conn1','2012-12-12 12:00:00',100, 'r100','2013-12-12 12:00:00' );
replace into t1 values(2,'conn2','2012-12-12 12:00:00',200, 'r200','2013-12-12 12:00:00' );
begin;
select *  from t1 where pk1=1 and pk2='conn1' and pk3='2012-12-12 12:00:00' for update;
pk1	pk2	pk3	a	b	c
1	conn1	2012-12-12 12:00:00	100	r100	2013-12-12 12:00:00
update t1 set b = 'r2000' where pk1 = 1 and pk2 = 'conn1' and pk3 = '2012-12-12 12:00:00';
begin;
update t1 set b = 'r2000' where pk1 = 2 and pk2 = 'conn2' and pk3 = '2012-12-12 12:00:00';
delete from t1 where pk1 = 2 and pk2 = 'conn2' and pk3 = '2012-12-12 12:00:00';
insert into t1 values(2,'conn2','2012-12-12 12:00:00',200, 'nr200','2013-12-12 12:00:00' );
update t1 set b = 'r20000' where pk1 = 1 and pk2 = 'conn1' and pk3 = '2012-12-12 12:00:00';
commit;
commit;
select * from t1;
pk1	pk2	pk3	a	b	c
1	conn1	2012-12-12 12:00:00	100	r20000	2013-12-12 12:00:00
2	conn2	2012-12-12 12:00:00	200	nr200	2013-12-12 12:00:00
replace into t1 values(1,'conn1','2012-12-12 12:00:00',100, 'r100','2013-12-12 12:00:00' );
replace into t1 values(2,'conn2','2012-12-12 12:00:00',200, 'r200','2013-12-12 12:00:00' );
begin;
select *  from t1 where pk1=1 and pk2='conn1' and pk3='2012-12-12 12:00:00' for update;
pk1	pk2	pk3	a	b	c
1	conn1	2012-12-12 12:00:00	100	r100	2013-12-12 12:00:00
delete from t1 where pk1=1 and pk2='conn1' and pk3='2012-12-12 12:00:00';
begin;
select *  from t1 where pk1=1 and pk2='conn1' and pk3='2012-12-12 12:00:00' for update;
rollback;
pk1	pk2	pk3	a	b	c
1	conn1	2012-12-12 12:00:00	100	r100	2013-12-12 12:00:00
update t1 set b='abc' where pk1 = 1 and pk2 = 'conn1' and pk3 = '2012-12-12 12:00:00';
commit;
select * from t1;
pk1	pk2	pk3	a	b	c
1	conn1	2012-12-12 12:00:00	100	abc	2013-12-12 12:00:00
2	conn2	2012-12-12 12:00:00	200	r200	2013-12-12 12:00:00
replace into t1 values(1,'conn1','2012-12-12 12:00:00',100, 'r100','2013-12-12 12:00:00' );
replace into t1 values(2,'conn2','2012-12-12 12:00:00',200, 'r200','2013-12-12 12:00:00' );
begin;
select *  from t1 where pk1=1 and pk2='conn1' and pk3='2012-12-12 12:00:00' for update;
pk1	pk2	pk3	a	b	c
1	conn1	2012-12-12 12:00:00	100	r100	2013-12-12 12:00:00
delete from t1 where pk1 = 1 and pk2 = 'conn1' and pk3 = '2012-12-12 12:00:00';
begin;
update t1 set b = 'r2000' where pk1 = 2 and pk2 = 'conn2' and pk3 = '2012-12-12 12:00:00';
delete from t1 where pk1 = 2 and pk2 = 'conn2' and pk3 = '2012-12-12 12:00:00';
insert into t1 values(2,'conn2','2012-12-12 12:00:00',200, 'nr200','2013-12-12 12:00:00' );
update t1 set b = 'r20000' where pk1 = 1 and pk2 = 'conn1' and pk3 = '2012-12-12 12:00:00';
rollback;
commit;
select * from t1;
pk1	pk2	pk3	a	b	c
1	conn1	2012-12-12 12:00:00	100	r20000	2013-12-12 12:00:00
2	conn2	2012-12-12 12:00:00	200	nr200	2013-12-12 12:00:00
replace into t1 values(1,'conn1','2012-12-12 12:00:00',100, 'r100','2013-12-12 12:00:00' );
replace into t1 values(2,'conn2','2012-12-12 12:00:00',200, 'r200','2013-12-12 12:00:00' );
begin;
select * from t1 where pk1 = 1 and pk2 = 'conn1' and pk3 = '2012-12-12 12:00:00' for update when row_count(update t1 set b='r1000' where pk1 = 1 and pk2 = 'conn1' and pk3 = '2012-12-12 12:00:00')=1;
pk1	pk2	pk3	a	b	c
1	conn1	2012-12-12 12:00:00	100	r1000	2013-12-12 12:00:00
update t1 set b='r1000_2' where pk1 = 1 and pk2 = 'conn1' and pk3 = '2012-12-12 12:00:00';
commit;
commit;
select * from t1;
pk1	pk2	pk3	a	b	c
1	conn1	2012-12-12 12:00:00	100	r1000_2	2013-12-12 12:00:00
2	conn2	2012-12-12 12:00:00	200	r200	2013-12-12 12:00:00
replace into t1 values(1,'conn1','2012-12-12 12:00:00',100, 'r100','2013-12-12 12:00:00' );
replace into t1 values(2,'conn2','2012-12-12 12:00:00',200, 'r200','2013-12-12 12:00:00' );
begin;
select * from t1 where pk1 = 1 and pk2 = 'conn1' and pk3 = '2012-12-12 12:00:00' for update when row_count(update t1 set b='r1000' where pk1 = 1 and pk2 = 'conn1' and pk3 = '2012-12-12 12:00:00')=1;
begin;
update t1 set b='r1000_2' where pk1 = 1 and pk2 = 'conn1' and pk3 = '2012-12-12 12:00:00';
pk1	pk2	pk3	a	b	c
1	conn1	2012-12-12 12:00:00	100	r1000	2013-12-12 12:00:00
commit;
commit;
select * from t1;
pk1	pk2	pk3	a	b	c
1	conn1	2012-12-12 12:00:00	100	r1000_2	2013-12-12 12:00:00
2	conn2	2012-12-12 12:00:00	200	r200	2013-12-12 12:00:00
replace into t1 values(1,'conn1','2012-12-12 12:00:00',100, 'r100','2013-12-12 12:00:00' );
replace into t1 values(2,'conn2','2012-12-12 12:00:00',200, 'r200','2013-12-12 12:00:00' );
begin;
delete from t1 where pk1 = 1 and pk2 = 'conn1' and pk3 = '2012-12-12 12:00:00';
begin;
select * from t1 where pk1 = 1 and pk2 = 'conn1' and pk3 = '2012-12-12 12:00:00' for update when row_count(update t1 set b='r1000' where pk1 = 1 and pk2 = 'conn1' and pk3 = '2012-12-12 12:00:00')=1;
commit;
ERROR HY000: Number 1 When filter failed, ret=-5064, func 1: ROW_COUNT()=0
commit;
select * from t1;
pk1	pk2	pk3	a	b	c
2	conn2	2012-12-12 12:00:00	200	r200	2013-12-12 12:00:00
replace into t1 values(1,'conn1','2012-12-12 12:00:00',100, 'r100','2013-12-12 12:00:00' );
replace into t1 values(2,'conn2','2012-12-12 12:00:00',200, 'r200','2013-12-12 12:00:00' );
begin;
delete from t1 where pk1 = 1 and pk2 = 'conn1' and pk3 = '2012-12-12 12:00:00';
begin;
select * from t1 where pk1 = 1 and pk2 = 'conn1' and pk3 = '2012-12-12 12:00:00' for update when row_count(update t1 set b='r1000' where pk1 = 1 and pk2 = 'conn1' and pk3 = '2012-12-12 12:00:00')=1;
rollback;
pk1	pk2	pk3	a	b	c
1	conn1	2012-12-12 12:00:00	100	r1000	2013-12-12 12:00:00
commit;
select * from t1;
pk1	pk2	pk3	a	b	c
1	conn1	2012-12-12 12:00:00	100	r1000	2013-12-12 12:00:00
2	conn2	2012-12-12 12:00:00	200	r200	2013-12-12 12:00:00
replace into t1 values(1,'conn1','2012-12-12 12:00:00',100, 'r100','2013-12-12 12:00:00' );
replace into t1 values(2,'conn2','2012-12-12 12:00:00',200, 'r200','2013-12-12 12:00:00' );
create table t2(pk1 int , pk2 varchar, pk3 datetime, a int, b varchar, c datetime, primary key(pk1,pk2,pk3));
begin;
select * from t1 where pk1 = 1 and pk2 = 'conn1' and pk3 = '2012-12-12 12:00:00' for update when row_count(update t1 set b='r1000' where pk1 = 1 and pk2 = 'conn1' and pk3 = '2012-12-12 12:00:00' when row_count(insert into t2 values(2,'conn2','2012-12-12 12:00:00',200, 'r200','2013-12-12 12:00:00')) =1) = 1;
begin;
select * from t1 where pk1 = 1 and pk2 = 'conn1' and pk3 = '2012-12-12 12:00:00' for update;
pk1	pk2	pk3	a	b	c
1	conn1	2012-12-12 12:00:00	100	r1000	2013-12-12 12:00:00
commit;
pk1	pk2	pk3	a	b	c
1	conn1	2012-12-12 12:00:00	100	r1000	2013-12-12 12:00:00
update t1 set b='r10000' where pk1 = 1 and pk2 = 'conn1' and pk3 = '2012-12-12 12:00:00';
commit;
select * from t1;
pk1	pk2	pk3	a	b	c
1	conn1	2012-12-12 12:00:00	100	r10000	2013-12-12 12:00:00
2	conn2	2012-12-12 12:00:00	200	r200	2013-12-12 12:00:00
select * from t2;
pk1	pk2	pk3	a	b	c
2	conn2	2012-12-12 12:00:00	200	r200	2013-12-12 12:00:00
