drop table if exists t1,t2,t3,t4;
create table t1(pk1 int , pk2 varchar, pk3 datetime, a int, b varchar, c datetime, primary key(pk1,pk2,pk3));
insert into t1 values(1,'s1','2012-12-12 12:00:00',100, 's100','2013-12-12 12:00:00' );
insert into t1 values(2,'s2','2012-12-12 12:00:00',200, 's200','2013-12-12 12:00:00' );
update t1 set b = 's2000' where pk1 = 1 and pk2 = 's1' and pk3= '2012-12-12 12:00:00' ;
select * from t1 where pk1 = 1 and pk2 = 's1' and pk3= '2012-12-12 12:00:00' for update;
pk1	pk2	pk3	a	b	c
1	s1	2012-12-12 12:00:00	100	s2000	2013-12-12 12:00:00
select * from t1 where pk1 = 1 and pk2 = 's1' and pk3= '2012-12-12 12:00:01' for update;
pk1	pk2	pk3	a	b	c
select * from t1 where pk1 =1 for update;
ERROR HY000: Primary key column 17 not specified in the WHERE clause
select * from t1 where a=1 for update;
ERROR HY000: Primary key column 16 not specified in the WHERE clause
select * from t1 for update;
ERROR HY000: Primary key column 16 not specified in the WHERE clause
select * from t1 where (pk1 = 1 and pk2 = 's1' and pk3= '2012-12-12 12:00:00' ) or (pk1 = 2 and pk2 = 's2' and pk3= '2012-12-12 12:00:00' ) for update;
ERROR HY000: Primary key column 16 not specified in the WHERE clause
select * from t1 where pk1 = 1 and pk2 = 's1' and pk3= '2012-12-12 12:00:00' for update;
pk1	pk2	pk3	a	b	c
1	s1	2012-12-12 12:00:00	100	s2000	2013-12-12 12:00:00
select * from t1 where pk1 = 1 and pk2 = 's1' and pk3= '2012-12-12 12:00:00' for update;
pk1	pk2	pk3	a	b	c
1	s1	2012-12-12 12:00:00	100	s2000	2013-12-12 12:00:00
drop table t1;
create table t1(pk1 int , pk2 varchar, pk3 datetime, a int, b varchar, c datetime, primary key(pk1,pk2,pk3));
insert into t1 values(1,'s1','2012-12-12 12:00:00',100, 's100','2013-12-12 12:00:00' );
insert into t1 values(2,'s2','2012-12-12 12:00:00',200, 's200','2013-12-12 12:00:00' );
begin;
select * from t1 where pk1 = 1 and pk2 = 's1' and pk3 = '2012-12-12 12:00:00' for update;
pk1	pk2	pk3	a	b	c
1	s1	2012-12-12 12:00:00	100	s100	2013-12-12 12:00:00
update t1 set b='abc' where pk1 = 1 and pk2 = 's1' and pk3 = '2012-12-12 12:00:00';
select * from t1 where pk1 = 1 and pk2 = 's1' and pk3 = '2012-12-12 12:00:00' for update;
pk1	pk2	pk3	a	b	c
1	s1	2012-12-12 12:00:00	100	abc	2013-12-12 12:00:00
delete from t1 where pk1 = 1 and pk2 = 's1' and pk3 = '2012-12-12 12:00:00';
insert into t1 values(1,'s1','2012-12-12 12:00:00',100, 's100','2013-12-12 12:00:00' );
begin;
select * from t1 where pk1 = 2 and pk2 = 's2' and pk3 = '2012-12-12 12:00:00' for update;
pk1	pk2	pk3	a	b	c
2	s2	2012-12-12 12:00:00	200	s200	2013-12-12 12:00:00
update t1 set b='abcd' where pk1 = 2 and pk2 = 's2' and pk3 = '2012-12-12 12:00:00';
select * from t1 where pk1 = 2 and pk2 = 's2' and pk3 = '2012-12-12 12:00:00' for update;
pk1	pk2	pk3	a	b	c
2	s2	2012-12-12 12:00:00	200	abcd	2013-12-12 12:00:00
delete from t1 where pk1 = 2 and pk2 = 's2' and pk3 = '2012-12-12 12:00:00';
insert into t1 values(2,'s2','2012-12-12 12:00:00',200, 's200','2013-12-12 12:00:00' );
select * from t1 where pk1 = 1 and pk2 = 's1' and pk3 = '2012-12-12 12:00:00' for update;
ERROR HY000: Exclusive lock conflict 'int32:1,varchar:s1,precisedatetime:1355284800000000' for key 'PRIMARY'
commit;
rollback;
select * from t1;
pk1	pk2	pk3	a	b	c
1	s1	2012-12-12 12:00:00	100	s100	2013-12-12 12:00:00
2	s2	2012-12-12 12:00:00	200	s200	2013-12-12 12:00:00
begin;
select * from t1 where pk1 = 1 and pk2 = 's1' and pk3 = '2012-12-12 12:00:00' for update;
pk1	pk2	pk3	a	b	c
1	s1	2012-12-12 12:00:00	100	s100	2013-12-12 12:00:00
update t1 set b='abc' where pk1 = 1 and pk2 = 's1' and pk3 = '2012-12-12 12:00:00';
select * from t1 where pk1 = 1 and pk2 = 's1' and pk3 = '2012-12-12 12:00:00' for update;
pk1	pk2	pk3	a	b	c
1	s1	2012-12-12 12:00:00	100	abc	2013-12-12 12:00:00
delete from t1 where pk1 = 1 and pk2 = 's1' and pk3 = '2012-12-12 12:00:00';
insert into t1 values(1,'s1','2012-12-12 12:00:00',100, 's100','2013-12-12 12:00:00' );
begin;
select * from t1 where pk1 = 2 and pk2 = 's2' and pk3 = '2012-12-12 12:00:00' for update;
pk1	pk2	pk3	a	b	c
2	s2	2012-12-12 12:00:00	200	s200	2013-12-12 12:00:00
update t1 set b='abcd' where pk1 = 2 and pk2 = 's2' and pk3 = '2012-12-12 12:00:00';
select * from t1 where pk1 = 2 and pk2 = 's2' and pk3 = '2012-12-12 12:00:00' for update;
pk1	pk2	pk3	a	b	c
2	s2	2012-12-12 12:00:00	200	abcd	2013-12-12 12:00:00
delete from t1 where pk1 = 2 and pk2 = 's2' and pk3 = '2012-12-12 12:00:00';
insert into t1 values(2,'s2','2012-12-12 12:00:00',200, 's200','2013-12-12 12:00:00' );
commit;
commit;
select * from t1;
pk1	pk2	pk3	a	b	c
1	s1	2012-12-12 12:00:00	100	s100	2013-12-12 12:00:00
2	s2	2012-12-12 12:00:00	200	s200	2013-12-12 12:00:00
begin;
select * from t1 where pk1 = 1 and pk2 = 's1' and pk3 = '2012-12-12 12:00:00' for update;
pk1	pk2	pk3	a	b	c
1	s1	2012-12-12 12:00:00	100	s100	2013-12-12 12:00:00
begin;
update t1 set b = 's2000' where pk1 = 2 and pk2 = 's2' and pk3 = '2012-12-12 12:00:00';
delete from t1 where pk1 = 2 and pk2 = 's2' and pk3 = '2012-12-12 12:00:00';
insert into t1 values(2,'s2','2012-12-12 12:00:00',200, 's200','2013-12-12 12:00:00' );
update t1 set b = 's2000' where pk1 = 1 and pk2 = 's1' and pk3 = '2012-12-12 12:00:00';
ERROR HY000: Exclusive lock conflict 'int32:1,varchar:s1,precisedatetime:1355284800000000' for key 'PRIMARY'
commit;
rollback;
select * from t1;
pk1	pk2	pk3	a	b	c
1	s1	2012-12-12 12:00:00	100	s100	2013-12-12 12:00:00
2	s2	2012-12-12 12:00:00	200	s200	2013-12-12 12:00:00
begin;
select * from t1 where pk1 = 1 and pk2 = 's1' and pk3 = '2012-12-12 12:00:00' for update;
pk1	pk2	pk3	a	b	c
1	s1	2012-12-12 12:00:00	100	s100	2013-12-12 12:00:00
select * from t1 where pk1 = 2 and pk2 = 's2' and pk3 = '2012-12-12 12:00:00' for update;
pk1	pk2	pk3	a	b	c
2	s2	2012-12-12 12:00:00	200	s200	2013-12-12 12:00:00
begin;
update t1 set b = 's2000' where pk1 = 2 and pk2 = 's2' and pk3 = '2012-12-12 12:00:00';
ERROR HY000: Exclusive lock conflict 'int32:2,varchar:s2,precisedatetime:1355284800000000' for key 'PRIMARY'
update t1 set b = 's2000' where pk1 = 1 and pk2 = 's1' and pk3 = '2012-12-12 12:00:00';
ERROR HY000: Exclusive lock conflict 'int32:1,varchar:s1,precisedatetime:1355284800000000' for key 'PRIMARY'
commit;
rollback;
begin;
select * from t1 where pk1 = 1 and pk2 = 's1' and pk3 = '2012-12-12 12:00:00' for update;
pk1	pk2	pk3	a	b	c
1	s1	2012-12-12 12:00:00	100	s100	2013-12-12 12:00:00
commit;
begin;
select * from t1 where pk1 = 1 and pk2 = 's1' and pk3 = '2012-12-12 12:00:00' for update;
pk1	pk2	pk3	a	b	c
1	s1	2012-12-12 12:00:00	100	s100	2013-12-12 12:00:00
update t1 set b = 's2000' where pk1 = 1 and pk2 = 's1' and pk3 = '2012-12-12 12:00:00' ;
select * from t1 where pk1 = 1 and pk2 = 's1' and pk3 = '2012-12-12 12:00:00' for update;
pk1	pk2	pk3	a	b	c
1	s1	2012-12-12 12:00:00	100	s2000	2013-12-12 12:00:00
commit;
begin;
select * from t1 where pk1 = 1 and pk2 = 's1' and pk3 = '2012-12-12 12:00:00' for update;
pk1	pk2	pk3	a	b	c
1	s1	2012-12-12 12:00:00	100	s2000	2013-12-12 12:00:00
commit;
begin;
select * from t1 where pk1 = 1 and pk2 = 's1' and pk3 = '2012-12-12 12:00:00' for update;
pk1	pk2	pk3	a	b	c
1	s1	2012-12-12 12:00:00	100	s2000	2013-12-12 12:00:00
update t1 set b = 's2000' where pk1 = 1 and pk2 = 's1' and pk3 = '2012-12-12 12:00:00' ;
select * from t1 where pk1 = 1 and pk2 = 's1' and pk3 = '2012-12-12 12:00:00' for update;
pk1	pk2	pk3	a	b	c
1	s1	2012-12-12 12:00:00	100	s2000	2013-12-12 12:00:00
commit;
drop table t1;
