drop table if exists t1;
set timeout to 10s
set global  ob_tx_timeout = 10000000;
set global  ob_tx_idle_timeout = 10000000;
create table t1(c1 int primary key, c2 int);
insert into t1 values(1,1);
insert into t1 values(2,2);
insert into t1 values(3,3);
create 2 sessions
trx timeout
begin;
insert into t1 values(4,4);
insert into t1 values(5,5);
insert into t1 values(6,6);
commit;
select * from t1;
c1	c2
1	1
2	2
3	3
4	4
5	5
6	6
begin;
insert into t1 values(7,7);
insert into t1 values(8,8);
insert into t1 values(9,9);
insert into t1 values(10,10);
commit;
ERROR 25S03: transaction is rolled back
select * from t1;
c1	c2
1	1
2	2
3	3
4	4
5	5
6	6
trx idle timeout
begin;
insert into t1 values(11,11);
insert into t1 values(12,12);
ERROR 25S03: transaction is rolled back
commit;
select * from t1;
c1	c2
1	1
2	2
3	3
4	4
5	5
6	6
test two users
begin;
select * from t1 where c1=1 for update;
c1	c2
1	1
begin;
select * from t1 where c1=1 for update;
c1	c2
1	1
update t1 set c2=1 where c1=1;
commit;
select * from t1;
c1	c2
1	1
2	2
3	3
4	4
5	5
6	6
commit;
ERROR 25S03: transaction is rolled back
begin;
update t1 set c2=1 where c1=2;
update t1 set c2=1 where c1=3;
update t1 set c2=1 where c1=4;
update t1 set c2=1 where c1=5;
begin;
update t1 set c2=c2+1 where c1=2;
update t1 set c2=c2+1 where c1=3;
update t1 set c2=c2+1 where c1=4;
update t1 set c2=c2+1 where c1=5;
commit;
select * from t1;
c1	c2
1	1
2	3
3	4
4	5
5	6
6	6
commit;
ERROR 25S03: transaction is rolled back
