drop table if exists t1,t2,t3,t4;
create table t1(pk int primary key, a int);
insert into t1 values(1,1);
begin;
use conn1, update t1
update t1 set a=2 where pk=1;
use conn1, select before conn1 commit, expect: (1,1)
select * from t1;
pk	a
1	2
use conn2, select before conn1 commit, expect: (1,1)
select * from t1;
pk	a
1	1
commit;
use conn2, select after conn1 commit, expect: (1,2)
select * from t1;
pk	a
1	2
drop table t1;
create table t1(pk int primary key, a int);
insert into t1 values(1,1);
conn2 begin
begin;
conn3 begin
begin;
conn2 set a to 2
select * from t1;
pk	a
1	1
update t1 set a=2 where pk=1;
conn3 set a to 3, have to rollback
select * from t1;
pk	a
1	1
update t1 set a=3 where pk=1;
ERROR HY000: Exclusive lock conflict 'int32:1' for key 'PRIMARY'
ROLLBACK;
conn2 select
select * from t1;
pk	a
1	2
conn3 select
select * from t1;
pk	a
1	1
conn2 commit and select
commit;
select * from t1;
pk	a
1	2
conn2 select
select * from t1;
pk	a
1	2
conn3 select
select * from t1;
pk	a
1	2
drop table t1;
create table t1(pk int primary key, a int);
insert into t1 values(1,1);
conn2 changes: 1->2->3
begin;
update t1 set a=a+1 where pk=1;
update t1 set a=a+1 where pk=1;
select * from t1;
pk	a
1	3
commit;
conn2 select after commit
select * from t1;
pk	a
1	3
conn3 select after commit
select * from t1;
pk	a
1	3
