set global  ob_query_timeout=30000000;
drop table if exists t1;
create table t1(c1 int primary key, c2 int);
begin;
select * from t1 where c1=1 when row_count(insert into t1 values(1,1))=1;
begin;
select * from t1 where c1=1 when row_count(insert into t1 values(1,1))=1;
c1	c2
1	1
rollback;
c1	c2
1	1
commit;
select * from t1;
c1	c2
1	1
drop table t1;
create table t1(c1 int primary key, c2 int);
begin;
select * from t1 where c1=1 when row_count(insert into t1 values(1,1))=1;
begin;
select * from t1 where c1=1 when row_count(insert into t1 values(1,1))=1;
c1	c2
1	1
commit;
ERROR 23000: Duplicate entry ' <3002.16>=int32:1' for key 'PRIMARY'
commit;
select * from t1;
c1	c2
1	1
drop table t1;
create table t1(c1 int primary key, c2 int);
begin;
select * from t1 where c1=1 when row_count(insert into t1 values(2,2))=1;
begin;
select * from t1 where c1=2 when row_count(insert into t1 values(1,1))=1;
c1	c2
commit;
c1	c2
2	2
commit;
select * from t1;
c1	c2
1	1
2	2
drop table t1;
create table t1(c1 int primary key, c2 int);
begin;
select * from t1 where c1=1 when row_count(insert into t1 values(2,2),(1,1))=2;
begin;
select * from t1 where c1=2 when row_count(insert into t1 values(1,1),(2,2))=2;
c1	c2
1	1
rollback;
c1	c2
2	2
commit;
select * from t1;
c1	c2
1	1
2	2
drop table t1;
create table t1(c1 int primary key, c2 int);
begin;
select * from t1 where c1=1 when row_count(insert into t1 values(2,2),(1,1))=2;
begin;
select * from t1 where c1=2 when row_count(insert into t1 values(1,1),(2,2))=2;
c1	c2
1	1
commit;
ERROR 23000: Duplicate entry ' <3005.16>=int32:1' for key 'PRIMARY'
commit;
select * from t1;
c1	c2
1	1
2	2
drop table t1;
create table t1(c1 int primary key, c2 int);
begin;
select * from t1 where c1=1 when row_count(insert into t1 values(2,2),(1,1))=2;
begin;
select * from t1 where c1=2 when row_count(insert into t1 values(3,3),(4,4))=2;
c1	c2
1	1
commit;
c1	c2
2	2
commit;
select * from t1;
c1	c2
1	1
2	2
3	3
4	4
drop table t1;
create table t1(c1 int primary key, c2 int);
insert into t1 values(1,0);
begin;
update t1 set c2=c2+1 where c1=1;
select * from t1 where c1=1 when row_count(update t1 set c2=c2+1 where c1=1)=1;
begin;
update t1 set c2=c2+1 where c1=1;
c1	c2
1	2
commit;
select * from t1 where c1=1 when row_count(update t1 set c2=c2+1 where c1=1)=1;
c1	c2
1	4
commit;
select * from t1;
c1	c2
1	4
drop table t1;
create table t1(c1 int primary key, c2 int);
insert into t1 values(1,0);
begin;
update t1 set c2=c2+1 where c1=1;
select * from t1 where c1=1 when row_count(update t1 set c2=c2+1 where c1=1)=1;
begin;
update t1 set c2=c2+1 where c1=1;
c1	c2
1	2
rollback;
select * from t1 where c1=1 when row_count(update t1 set c2=c2+1 where c1=1)=1;
c1	c2
1	2
commit;
select * from t1;
c1	c2
1	2
drop table t1;
